{
    "componentChunkName": "component---src-templates-kb-template-tsx",
    "path": "/v3/runtime/events-and-errors/",
    "result": {"data":{"mdx":{"frontmatter":{"slug":"/v3/runtime/events-and-errors","title":"Events","hideNav":null,"section":"docs","category":"runtime"},"body":"var _excluded = [\"components\"];\n\nfunction _extends() { _extends = Object.assign || function (target) { for (var i = 1; i < arguments.length; i++) { var source = arguments[i]; for (var key in source) { if (Object.prototype.hasOwnProperty.call(source, key)) { target[key] = source[key]; } } } return target; }; return _extends.apply(this, arguments); }\n\nfunction _objectWithoutProperties(source, excluded) { if (source == null) return {}; var target = _objectWithoutPropertiesLoose(source, excluded); var key, i; if (Object.getOwnPropertySymbols) { var sourceSymbolKeys = Object.getOwnPropertySymbols(source); for (i = 0; i < sourceSymbolKeys.length; i++) { key = sourceSymbolKeys[i]; if (excluded.indexOf(key) >= 0) continue; if (!Object.prototype.propertyIsEnumerable.call(source, key)) continue; target[key] = source[key]; } } return target; }\n\nfunction _objectWithoutPropertiesLoose(source, excluded) { if (source == null) return {}; var target = {}; var sourceKeys = Object.keys(source); var key, i; for (i = 0; i < sourceKeys.length; i++) { key = sourceKeys[i]; if (excluded.indexOf(key) >= 0) continue; target[key] = source[key]; } return target; }\n\n/* @jsxRuntime classic */\n\n/* @jsx mdx */\nvar _frontmatter = {\n  \"title\": \"Events\",\n  \"slug\": \"/v3/runtime/events-and-errors\",\n  \"version\": 3,\n  \"section\": \"docs\",\n  \"category\": \"runtime\",\n  \"keywords\": null\n};\n\nvar makeShortcode = function makeShortcode(name) {\n  return function MDXDefaultShortcode(props) {\n    console.warn(\"Component \" + name + \" was not imported, exported, or provided by MDXProvider as global scope\");\n    return mdx(\"div\", props);\n  };\n};\n\nvar Message = makeShortcode(\"Message\");\nvar layoutProps = {\n  _frontmatter: _frontmatter\n};\nvar MDXLayout = \"wrapper\";\nreturn function MDXContent(_ref) {\n  var components = _ref.components,\n      props = _objectWithoutProperties(_ref, _excluded);\n\n  return mdx(MDXLayout, _extends({}, layoutProps, props, {\n    components: components,\n    mdxType: \"MDXLayout\"\n  }), mdx(\"p\", null, \"A pallet can emit events when it wants to notify external entities about changes\\nor conditions in the runtime to external entities like users, chain explorers, or dApps.\"), mdx(\"p\", null, \"You can define what events your pallet emits, what information is contained within those events, and\\nwhen those events are emitted.\"), mdx(\"h2\", {\n    \"id\": \"declaring-an-event\",\n    \"style\": {\n      \"position\": \"relative\"\n    }\n  }, mdx(\"a\", {\n    parentName: \"h2\",\n    \"href\": \"#declaring-an-event\",\n    \"aria-label\": \"declaring an event permalink\",\n    \"className\": \"anchor before\"\n  }, mdx(\"svg\", {\n    parentName: \"a\",\n    \"className\": \"fill-current text-substrateDark dark:text-white\",\n    \"aria-hidden\": \"true\",\n    \"focusable\": \"false\",\n    \"height\": \"16\",\n    \"version\": \"1.1\",\n    \"viewBox\": \"0 0 16 16\",\n    \"width\": \"16\"\n  }, mdx(\"path\", {\n    parentName: \"svg\",\n    \"fillRule\": \"evenodd\",\n    \"d\": \"M4 9h1v1H4c-1.5 0-3-1.69-3-3.5S2.55 3 4 3h4c1.45 0 3 1.69 3 3.5 0 1.41-.91 2.72-2 3.25V8.59c.58-.45 1-1.27 1-2.09C10 5.22 8.98 4 8 4H4c-.98 0-2 1.22-2 2.5S3 9 4 9zm9-3h-1v1h1c1 0 2 1.22 2 2.5S13.98 12 13 12H9c-.98 0-2-1.22-2-2.5 0-.83.42-1.64 1-2.09V6.25c-1.09.53-2 1.84-2 3.25C6 11.31 7.55 13 9 13h4c1.45 0 3-1.69 3-3.5S14.5 6 13 6z\"\n  }))), \"Declaring an event\"), mdx(\"p\", null, \"Runtime events are created with the \", mdx(\"inlineCode\", {\n    parentName: \"p\"\n  }, \"#[pallet::event]\"), \" macro.\"), mdx(\"pre\", null, mdx(\"code\", {\n    parentName: \"pre\",\n    \"className\": \"language-rust\"\n  }, \"#[pallet::event]\\n#[pallet::metadata(u32 = \\\"Metadata\\\")]\\npub enum Event<T: Config> {\\n    /// Set a value.\\n    ValueSet(u32, T::AccountId),\\n}\\n\")), mdx(\"p\", null, \"The \", mdx(\"inlineCode\", {\n    parentName: \"p\"\n  }, \"Event\"), \" enum needs to be declared in your runtime's configuration trait.\"), mdx(\"pre\", null, mdx(\"code\", {\n    parentName: \"pre\",\n    \"className\": \"language-rust\"\n  }, \"#[pallet::config]\\n    pub trait Config: frame_system::Config {\\n        /// The overarching event type.\\n        type Event: From<Event<Self>> + IsType<<Self as frame_system::Config>::Event>;\\n    }\\n\")), mdx(\"h2\", {\n    \"id\": \"exposing-events-to-your-runtime\",\n    \"style\": {\n      \"position\": \"relative\"\n    }\n  }, mdx(\"a\", {\n    parentName: \"h2\",\n    \"href\": \"#exposing-events-to-your-runtime\",\n    \"aria-label\": \"exposing events to your runtime permalink\",\n    \"className\": \"anchor before\"\n  }, mdx(\"svg\", {\n    parentName: \"a\",\n    \"className\": \"fill-current text-substrateDark dark:text-white\",\n    \"aria-hidden\": \"true\",\n    \"focusable\": \"false\",\n    \"height\": \"16\",\n    \"version\": \"1.1\",\n    \"viewBox\": \"0 0 16 16\",\n    \"width\": \"16\"\n  }, mdx(\"path\", {\n    parentName: \"svg\",\n    \"fillRule\": \"evenodd\",\n    \"d\": \"M4 9h1v1H4c-1.5 0-3-1.69-3-3.5S2.55 3 4 3h4c1.45 0 3 1.69 3 3.5 0 1.41-.91 2.72-2 3.25V8.59c.58-.45 1-1.27 1-2.09C10 5.22 8.98 4 8 4H4c-.98 0-2 1.22-2 2.5S3 9 4 9zm9-3h-1v1h1c1 0 2 1.22 2 2.5S13.98 12 13 12H9c-.98 0-2-1.22-2-2.5 0-.83.42-1.64 1-2.09V6.25c-1.09.53-2 1.84-2 3.25C6 11.31 7.55 13 9 13h4c1.45 0 3-1.69 3-3.5S14.5 6 13 6z\"\n  }))), \"Exposing events to your runtime\"), mdx(\"p\", null, \"Your pallet's events need to be exposed to your node's runtime (\", mdx(\"inlineCode\", {\n    parentName: \"p\"\n  }, \"/runtime/src/lib.rs\"), \").\"), mdx(\"p\", null, \"First, you need to implement the \", mdx(\"inlineCode\", {\n    parentName: \"p\"\n  }, \"Event\"), \" type in your pallet's configuration trait:\"), mdx(\"pre\", null, mdx(\"code\", {\n    parentName: \"pre\",\n    \"className\": \"language-rust\"\n  }, \"// runtime/src/lib.rs\\nimpl template::Config for Runtime {\\n    type Event = Event;\\n}\\n\")), mdx(\"p\", null, \"Then you need to add the \", mdx(\"inlineCode\", {\n    parentName: \"p\"\n  }, \"Event\"), \" type to your \", mdx(\"inlineCode\", {\n    parentName: \"p\"\n  }, \"construct_runtime!\"), \" macro:\"), mdx(\"pre\", null, mdx(\"code\", {\n    parentName: \"pre\",\n    \"className\": \"language-rust\"\n  }, \"// runtime/src/lib.rs\\nconstruct_runtime!(\\n    pub enum Runtime where\\n        Block = Block,\\n        NodeBlock = opaque::Block,\\n        UncheckedExtrinsic = UncheckedExtrinsic\\n    {\\n        // --snip--\\n        TemplateModule: template::{Pallet, Call, Storage, Event<T>},\\n        //--add-this------------------------------------->^^^^^^^^\\n    }\\n);\\n\")), mdx(\"br\", null), mdx(Message, {\n    type: \"gray\",\n    title: \"Note\",\n    text: \"You may or may not need the `<T>` parameter depending on whether your events use generic\\n  types. In our example it does, and is included above.\",\n    mdxType: \"Message\"\n  }), mdx(\"h2\", {\n    \"id\": \"depositing-an-event\",\n    \"style\": {\n      \"position\": \"relative\"\n    }\n  }, mdx(\"a\", {\n    parentName: \"h2\",\n    \"href\": \"#depositing-an-event\",\n    \"aria-label\": \"depositing an event permalink\",\n    \"className\": \"anchor before\"\n  }, mdx(\"svg\", {\n    parentName: \"a\",\n    \"className\": \"fill-current text-substrateDark dark:text-white\",\n    \"aria-hidden\": \"true\",\n    \"focusable\": \"false\",\n    \"height\": \"16\",\n    \"version\": \"1.1\",\n    \"viewBox\": \"0 0 16 16\",\n    \"width\": \"16\"\n  }, mdx(\"path\", {\n    parentName: \"svg\",\n    \"fillRule\": \"evenodd\",\n    \"d\": \"M4 9h1v1H4c-1.5 0-3-1.69-3-3.5S2.55 3 4 3h4c1.45 0 3 1.69 3 3.5 0 1.41-.91 2.72-2 3.25V8.59c.58-.45 1-1.27 1-2.09C10 5.22 8.98 4 8 4H4c-.98 0-2 1.22-2 2.5S3 9 4 9zm9-3h-1v1h1c1 0 2 1.22 2 2.5S13.98 12 13 12H9c-.98 0-2-1.22-2-2.5 0-.83.42-1.64 1-2.09V6.25c-1.09.53-2 1.84-2 3.25C6 11.31 7.55 13 9 13h4c1.45 0 3-1.69 3-3.5S14.5 6 13 6z\"\n  }))), \"Depositing an event\"), mdx(\"p\", null, \"Substrate provides a default implementation of how to deposit an event using macros.\\nDepositing an event has the following structure:\"), mdx(\"pre\", null, mdx(\"code\", {\n    parentName: \"pre\",\n    \"className\": \"language-rust\"\n  }, \"// 1. Use the `generate_deposit` attribute when declaring the Events enum.\\n#[pallet::event]\\n    #[pallet::generate_deposit(pub(super) fn deposit_event)] // <------ here ----\\n    #[pallet::metadata(...)]\\n    pub enum Event<T: Config> {\\n        // --snip--\\n    }\\n\\n// 2. Use `deposit_event` inside the dispatchable function\\n#[pallet::call]\\n    impl<T: Config> Pallet<T> {\\n        #[pallet::weight(1_000)]\\n        pub(super) fn set_value(\\n            origin: OriginFor<T>,\\n            value: u64,\\n        ) -> DispatchResultWithPostInfo {\\n            let sender = ensure_signed(origin)?;\\n            // --snip--\\n            Self::deposit_event(RawEvent::ValueSet(value, sender));\\n        }\\n    }\\n\")), mdx(\"p\", null, \"The default behavior of this function is to call\\n\", mdx(\"a\", {\n    parentName: \"p\",\n    \"href\": \"/rustdocs/latest/frame_system/pallet/struct.Pallet.html#method.deposit_event\"\n  }, mdx(\"inlineCode\", {\n    parentName: \"a\"\n  }, \"deposit_event\")), \"\\nfrom the FRAME system, which writes the event to storage.\"), mdx(\"p\", null, \"This function places the event in the System pallet's runtime storage for that block. At the\\nbeginning of a new block, the System pallet automatically removes all events that were stored from\\nthe previous block.\"), mdx(\"p\", null, \"Events deposited using the default implementation will be directly supported by downstream libraries\\nlike the \", mdx(\"a\", {\n    parentName: \"p\",\n    \"href\": \"/v3/integration/polkadot-js\"\n  }, \"Polkadot-JS API\"), \", however you can implement your own\\n\", mdx(\"inlineCode\", {\n    parentName: \"p\"\n  }, \"deposit_event\"), \" function if you want to handle events differently.\"), mdx(\"h2\", {\n    \"id\": \"supported-types\",\n    \"style\": {\n      \"position\": \"relative\"\n    }\n  }, mdx(\"a\", {\n    parentName: \"h2\",\n    \"href\": \"#supported-types\",\n    \"aria-label\": \"supported types permalink\",\n    \"className\": \"anchor before\"\n  }, mdx(\"svg\", {\n    parentName: \"a\",\n    \"className\": \"fill-current text-substrateDark dark:text-white\",\n    \"aria-hidden\": \"true\",\n    \"focusable\": \"false\",\n    \"height\": \"16\",\n    \"version\": \"1.1\",\n    \"viewBox\": \"0 0 16 16\",\n    \"width\": \"16\"\n  }, mdx(\"path\", {\n    parentName: \"svg\",\n    \"fillRule\": \"evenodd\",\n    \"d\": \"M4 9h1v1H4c-1.5 0-3-1.69-3-3.5S2.55 3 4 3h4c1.45 0 3 1.69 3 3.5 0 1.41-.91 2.72-2 3.25V8.59c.58-.45 1-1.27 1-2.09C10 5.22 8.98 4 8 4H4c-.98 0-2 1.22-2 2.5S3 9 4 9zm9-3h-1v1h1c1 0 2 1.22 2 2.5S13.98 12 13 12H9c-.98 0-2-1.22-2-2.5 0-.83.42-1.64 1-2.09V6.25c-1.09.53-2 1.84-2 3.25C6 11.31 7.55 13 9 13h4c1.45 0 3-1.69 3-3.5S14.5 6 13 6z\"\n  }))), \"Supported types\"), mdx(\"p\", null, \"Events can emit any type which supports the \", mdx(\"a\", {\n    parentName: \"p\",\n    \"href\": \"/v3/advanced/scale-codec\"\n  }, \"Parity SCALE codec\"), \".\"), mdx(\"p\", null, \"In the case where you want to use Runtime generic types like \", mdx(\"inlineCode\", {\n    parentName: \"p\"\n  }, \"AccountId\"), \" or \", mdx(\"inlineCode\", {\n    parentName: \"p\"\n  }, \"Balances\"), \", you need to\\ninclude a \", mdx(\"a\", {\n    parentName: \"p\",\n    \"href\": \"https://doc.rust-lang.org/rust-by-example/generics/where.html\"\n  }, mdx(\"inlineCode\", {\n    parentName: \"a\"\n  }, \"where\"), \" clause\"), \" to define\\nthose types as shown in the example above.\"), mdx(\"h2\", {\n    \"id\": \"listening-to-events\",\n    \"style\": {\n      \"position\": \"relative\"\n    }\n  }, mdx(\"a\", {\n    parentName: \"h2\",\n    \"href\": \"#listening-to-events\",\n    \"aria-label\": \"listening to events permalink\",\n    \"className\": \"anchor before\"\n  }, mdx(\"svg\", {\n    parentName: \"a\",\n    \"className\": \"fill-current text-substrateDark dark:text-white\",\n    \"aria-hidden\": \"true\",\n    \"focusable\": \"false\",\n    \"height\": \"16\",\n    \"version\": \"1.1\",\n    \"viewBox\": \"0 0 16 16\",\n    \"width\": \"16\"\n  }, mdx(\"path\", {\n    parentName: \"svg\",\n    \"fillRule\": \"evenodd\",\n    \"d\": \"M4 9h1v1H4c-1.5 0-3-1.69-3-3.5S2.55 3 4 3h4c1.45 0 3 1.69 3 3.5 0 1.41-.91 2.72-2 3.25V8.59c.58-.45 1-1.27 1-2.09C10 5.22 8.98 4 8 4H4c-.98 0-2 1.22-2 2.5S3 9 4 9zm9-3h-1v1h1c1 0 2 1.22 2 2.5S13.98 12 13 12H9c-.98 0-2-1.22-2-2.5 0-.83.42-1.64 1-2.09V6.25c-1.09.53-2 1.84-2 3.25C6 11.31 7.55 13 9 13h4c1.45 0 3-1.69 3-3.5S14.5 6 13 6z\"\n  }))), \"Listening to events\"), mdx(\"p\", null, \"The Substrate RPC does not directly expose an endpoint for querying events. If you used the default\\nimplementation, you can see the list of events for the current block by querying the storage of the\\nSystem pallet. Otherwise, the \", mdx(\"a\", {\n    parentName: \"p\",\n    \"href\": \"/v3/integration/polkadot-js\"\n  }, \"Polkadot-JS API\"), \" supports a WebSocket\\nsubscription on runtime events.\"), mdx(\"h2\", {\n    \"id\": \"errors\",\n    \"style\": {\n      \"position\": \"relative\"\n    }\n  }, mdx(\"a\", {\n    parentName: \"h2\",\n    \"href\": \"#errors\",\n    \"aria-label\": \"errors permalink\",\n    \"className\": \"anchor before\"\n  }, mdx(\"svg\", {\n    parentName: \"a\",\n    \"className\": \"fill-current text-substrateDark dark:text-white\",\n    \"aria-hidden\": \"true\",\n    \"focusable\": \"false\",\n    \"height\": \"16\",\n    \"version\": \"1.1\",\n    \"viewBox\": \"0 0 16 16\",\n    \"width\": \"16\"\n  }, mdx(\"path\", {\n    parentName: \"svg\",\n    \"fillRule\": \"evenodd\",\n    \"d\": \"M4 9h1v1H4c-1.5 0-3-1.69-3-3.5S2.55 3 4 3h4c1.45 0 3 1.69 3 3.5 0 1.41-.91 2.72-2 3.25V8.59c.58-.45 1-1.27 1-2.09C10 5.22 8.98 4 8 4H4c-.98 0-2 1.22-2 2.5S3 9 4 9zm9-3h-1v1h1c1 0 2 1.22 2 2.5S13.98 12 13 12H9c-.98 0-2-1.22-2-2.5 0-.83.42-1.64 1-2.09V6.25c-1.09.53-2 1.84-2 3.25C6 11.31 7.55 13 9 13h4c1.45 0 3-1.69 3-3.5S14.5 6 13 6z\"\n  }))), \"Errors\"), mdx(\"p\", null, \"Runtime code should explicitly and gracefully handle all error cases, which is to say that runtime\\ncode \", mdx(\"strong\", {\n    parentName: \"p\"\n  }, \"must\"), \" be \\\"non-throwing\\\", or must never\\n\\\"\", mdx(\"a\", {\n    parentName: \"p\",\n    \"href\": \"https://doc.rust-lang.org/book/ch09-03-to-panic-or-not-to-panic.html\"\n  }, \"panic\"), \"\\\" to use Rust\\nterminology. A common idiom for writing non-throwing Rust code is to write functions that return\\n\", mdx(\"a\", {\n    parentName: \"p\",\n    \"href\": \"/rustdocs/latest/frame_support/dispatch/result/enum.Result.html\"\n  }, mdx(\"inlineCode\", {\n    parentName: \"a\"\n  }, \"Result\"), \" types\"), \".\\nThe \", mdx(\"inlineCode\", {\n    parentName: \"p\"\n  }, \"Result\"), \" enum type possesses an \", mdx(\"inlineCode\", {\n    parentName: \"p\"\n  }, \"Err\"), \" variant that allows a function to indicate that it failed\\nto execute successfully without needing to panic. Dispatchable calls in the FRAME system for runtime\\ndevelopment \", mdx(\"em\", {\n    parentName: \"p\"\n  }, \"must\"), \" return a\\n\", mdx(\"a\", {\n    parentName: \"p\",\n    \"href\": \"/rustdocs/latest/frame_support/dispatch/type.DispatchResult.html\"\n  }, mdx(\"inlineCode\", {\n    parentName: \"a\"\n  }, \"DispatchResult\"), \" type\"), \"\\nthat \", mdx(\"em\", {\n    parentName: \"p\"\n  }, \"could\"), \" be a\\n\", mdx(\"a\", {\n    parentName: \"p\",\n    \"href\": \"/rustdocs/latest/frame_support/dispatch/enum.DispatchError.html\"\n  }, mdx(\"inlineCode\", {\n    parentName: \"a\"\n  }, \"DispatchError\"), \" variant\"), \"\\nif the dispatchable function encountered an error.\"), mdx(\"p\", null, \"Each FRAME pallet may define a custom \", mdx(\"inlineCode\", {\n    parentName: \"p\"\n  }, \"DispatchError\"), \" by using the \", mdx(\"a\", {\n    parentName: \"p\",\n    \"href\": \"../macros#palleterror\"\n  }, mdx(\"inlineCode\", {\n    parentName: \"a\"\n  }, \"#[pallet::error]\"), \" macro\"), \".\\nFor example:\"), mdx(\"pre\", null, mdx(\"code\", {\n    parentName: \"pre\",\n    \"className\": \"language-rust\"\n  }, \"#[pallet::error]\\npub enum Error<T> {\\n        /// Error names should be descriptive.\\n        InvalidParameter,\\n        /// Errors should have helpful documentation associated with them.\\n        OutOfSpace,\\n    }\\n\")), mdx(\"p\", null, \"The\\n\", mdx(\"a\", {\n    parentName: \"p\",\n    \"href\": \"https://github.com/substrate-developer-hub/substrate-node-template/blob/master/pallets/template/src/lib.rs#L85-L103\"\n  }, \"Substrate Node Template\"), \"\\ndemonstrates some ways to correctly handle errors in dispatchable functions. The FRAME Support\\nmodule also includes a helpful\\n\", mdx(\"a\", {\n    parentName: \"p\",\n    \"href\": \"/rustdocs/latest/frame_support/macro.ensure.html\"\n  }, mdx(\"inlineCode\", {\n    parentName: \"a\"\n  }, \"ensure!\"), \" macro\"), \" that can be\\nused to check pre-conditions and emit an errors if they are not met.\"), mdx(\"pre\", null, mdx(\"code\", {\n    parentName: \"pre\",\n    \"className\": \"language-rust\"\n  }, \"frame_support::ensure!(param < T::MaxVal::get(), Error::<T>::InvalidParameter);\\n\")), mdx(\"h2\", {\n    \"id\": \"next-steps\",\n    \"style\": {\n      \"position\": \"relative\"\n    }\n  }, mdx(\"a\", {\n    parentName: \"h2\",\n    \"href\": \"#next-steps\",\n    \"aria-label\": \"next steps permalink\",\n    \"className\": \"anchor before\"\n  }, mdx(\"svg\", {\n    parentName: \"a\",\n    \"className\": \"fill-current text-substrateDark dark:text-white\",\n    \"aria-hidden\": \"true\",\n    \"focusable\": \"false\",\n    \"height\": \"16\",\n    \"version\": \"1.1\",\n    \"viewBox\": \"0 0 16 16\",\n    \"width\": \"16\"\n  }, mdx(\"path\", {\n    parentName: \"svg\",\n    \"fillRule\": \"evenodd\",\n    \"d\": \"M4 9h1v1H4c-1.5 0-3-1.69-3-3.5S2.55 3 4 3h4c1.45 0 3 1.69 3 3.5 0 1.41-.91 2.72-2 3.25V8.59c.58-.45 1-1.27 1-2.09C10 5.22 8.98 4 8 4H4c-.98 0-2 1.22-2 2.5S3 9 4 9zm9-3h-1v1h1c1 0 2 1.22 2 2.5S13.98 12 13 12H9c-.98 0-2-1.22-2-2.5 0-.83.42-1.64 1-2.09V6.25c-1.09.53-2 1.84-2 3.25C6 11.31 7.55 13 9 13h4c1.45 0 3-1.69 3-3.5S14.5 6 13 6z\"\n  }))), \"Next steps\"), mdx(\"h3\", {\n    \"id\": \"learn-more\",\n    \"style\": {\n      \"position\": \"relative\"\n    }\n  }, mdx(\"a\", {\n    parentName: \"h3\",\n    \"href\": \"#learn-more\",\n    \"aria-label\": \"learn more permalink\",\n    \"className\": \"anchor before\"\n  }, mdx(\"svg\", {\n    parentName: \"a\",\n    \"className\": \"fill-current text-substrateDark dark:text-white\",\n    \"aria-hidden\": \"true\",\n    \"focusable\": \"false\",\n    \"height\": \"16\",\n    \"version\": \"1.1\",\n    \"viewBox\": \"0 0 16 16\",\n    \"width\": \"16\"\n  }, mdx(\"path\", {\n    parentName: \"svg\",\n    \"fillRule\": \"evenodd\",\n    \"d\": \"M4 9h1v1H4c-1.5 0-3-1.69-3-3.5S2.55 3 4 3h4c1.45 0 3 1.69 3 3.5 0 1.41-.91 2.72-2 3.25V8.59c.58-.45 1-1.27 1-2.09C10 5.22 8.98 4 8 4H4c-.98 0-2 1.22-2 2.5S3 9 4 9zm9-3h-1v1h1c1 0 2 1.22 2 2.5S13.98 12 13 12H9c-.98 0-2-1.22-2-2.5 0-.83.42-1.64 1-2.09V6.25c-1.09.53-2 1.84-2 3.25C6 11.31 7.55 13 9 13h4c1.45 0 3-1.69 3-3.5S14.5 6 13 6z\"\n  }))), \"Learn more\"), mdx(\"ul\", null, mdx(\"li\", {\n    parentName: \"ul\"\n  }, \"Learn more about the \", mdx(\"a\", {\n    parentName: \"li\",\n    \"href\": \"/v3/runtime/macros\"\n  }, \"macros\"), \" used in Substrate runtime development.\"), mdx(\"li\", {\n    parentName: \"ul\"\n  }, \"Learn more about using the \", mdx(\"a\", {\n    parentName: \"li\",\n    \"href\": \"/v3/integration/polkadot-js\"\n  }, \"Polkadot-JS API\"), \".\")), mdx(\"h3\", {\n    \"id\": \"examples\",\n    \"style\": {\n      \"position\": \"relative\"\n    }\n  }, mdx(\"a\", {\n    parentName: \"h3\",\n    \"href\": \"#examples\",\n    \"aria-label\": \"examples permalink\",\n    \"className\": \"anchor before\"\n  }, mdx(\"svg\", {\n    parentName: \"a\",\n    \"className\": \"fill-current text-substrateDark dark:text-white\",\n    \"aria-hidden\": \"true\",\n    \"focusable\": \"false\",\n    \"height\": \"16\",\n    \"version\": \"1.1\",\n    \"viewBox\": \"0 0 16 16\",\n    \"width\": \"16\"\n  }, mdx(\"path\", {\n    parentName: \"svg\",\n    \"fillRule\": \"evenodd\",\n    \"d\": \"M4 9h1v1H4c-1.5 0-3-1.69-3-3.5S2.55 3 4 3h4c1.45 0 3 1.69 3 3.5 0 1.41-.91 2.72-2 3.25V8.59c.58-.45 1-1.27 1-2.09C10 5.22 8.98 4 8 4H4c-.98 0-2 1.22-2 2.5S3 9 4 9zm9-3h-1v1h1c1 0 2 1.22 2 2.5S13.98 12 13 12H9c-.98 0-2-1.22-2-2.5 0-.83.42-1.64 1-2.09V6.25c-1.09.53-2 1.84-2 3.25C6 11.31 7.55 13 9 13h4c1.45 0 3-1.69 3-3.5S14.5 6 13 6z\"\n  }))), \"Examples\"), mdx(\"ul\", null, mdx(\"li\", {\n    parentName: \"ul\"\n  }, \"Learn about Events and Errors by completing the \", mdx(\"a\", {\n    parentName: \"li\",\n    \"href\": \"/tutorials/v3/kitties/pt1#dispatchables-events-and-errors\"\n  }, \"Substrate Kitties tutorial\"))), mdx(\"h3\", {\n    \"id\": \"references\",\n    \"style\": {\n      \"position\": \"relative\"\n    }\n  }, mdx(\"a\", {\n    parentName: \"h3\",\n    \"href\": \"#references\",\n    \"aria-label\": \"references permalink\",\n    \"className\": \"anchor before\"\n  }, mdx(\"svg\", {\n    parentName: \"a\",\n    \"className\": \"fill-current text-substrateDark dark:text-white\",\n    \"aria-hidden\": \"true\",\n    \"focusable\": \"false\",\n    \"height\": \"16\",\n    \"version\": \"1.1\",\n    \"viewBox\": \"0 0 16 16\",\n    \"width\": \"16\"\n  }, mdx(\"path\", {\n    parentName: \"svg\",\n    \"fillRule\": \"evenodd\",\n    \"d\": \"M4 9h1v1H4c-1.5 0-3-1.69-3-3.5S2.55 3 4 3h4c1.45 0 3 1.69 3 3.5 0 1.41-.91 2.72-2 3.25V8.59c.58-.45 1-1.27 1-2.09C10 5.22 8.98 4 8 4H4c-.98 0-2 1.22-2 2.5S3 9 4 9zm9-3h-1v1h1c1 0 2 1.22 2 2.5S13.98 12 13 12H9c-.98 0-2-1.22-2-2.5 0-.83.42-1.64 1-2.09V6.25c-1.09.53-2 1.84-2 3.25C6 11.31 7.55 13 9 13h4c1.45 0 3-1.69 3-3.5S14.5 6 13 6z\"\n  }))), \"References\"), mdx(\"ul\", null, mdx(\"li\", {\n    parentName: \"ul\"\n  }, mdx(\"a\", {\n    parentName: \"li\",\n    \"href\": \"/rustdocs/latest/frame_support/macro.construct_runtime.html\"\n  }, mdx(\"inlineCode\", {\n    parentName: \"a\"\n  }, \"construct_runtime!\"), \" macro\")), mdx(\"li\", {\n    parentName: \"ul\"\n  }, mdx(\"a\", {\n    parentName: \"li\",\n    \"href\": \"/rustdocs/latest/frame_support/attr.pallet.html\"\n  }, mdx(\"inlineCode\", {\n    parentName: \"a\"\n  }, \"#[frame_support::pallet]\"), \" macro\")), mdx(\"li\", {\n    parentName: \"ul\"\n  }, mdx(\"a\", {\n    parentName: \"li\",\n    \"href\": \"/rustdocs/latest/frame_support/attr.pallet.html#error-palleterror-optional\"\n  }, mdx(\"inlineCode\", {\n    parentName: \"a\"\n  }, \"[pallet::error]\"), \" macro\"))));\n}\n;\nMDXContent.isMDXComponent = true;","tableOfContents":{"items":[{"url":"#declaring-an-event","title":"Declaring an event"},{"url":"#exposing-events-to-your-runtime","title":"Exposing events to your runtime"},{"url":"#depositing-an-event","title":"Depositing an event"},{"url":"#supported-types","title":"Supported types"},{"url":"#listening-to-events","title":"Listening to events"},{"url":"#errors","title":"Errors"},{"url":"#next-steps","title":"Next steps","items":[{"url":"#learn-more","title":"Learn more"},{"url":"#examples","title":"Examples"},{"url":"#references","title":"References"}]}]},"fileAbsolutePath":"/Users/a212/Desktop/substrate-docs/v3/docs/03-runtime/g-events-and-errors/index.mdx"}},"pageContext":{"slug":"/v3/runtime/events-and-errors","version":"3.0","locale":"en","hrefLang":"en-US","originalPath":"/v3/runtime/events-and-errors/","dateFormat":"MM/DD/YYYY"}},
    "staticQueryHashes": ["1239077767","1821483254","2966362950","3280999885"]}