{
    "componentChunkName": "component---src-templates-kb-template-tsx",
    "path": "/v3/concepts/execution/",
    "result": {"data":{"mdx":{"frontmatter":{"slug":"/v3/concepts/execution","title":"Execution","hideNav":null,"section":"docs","category":"runtime"},"body":"var _excluded = [\"components\"];\n\nfunction _extends() { _extends = Object.assign || function (target) { for (var i = 1; i < arguments.length; i++) { var source = arguments[i]; for (var key in source) { if (Object.prototype.hasOwnProperty.call(source, key)) { target[key] = source[key]; } } } return target; }; return _extends.apply(this, arguments); }\n\nfunction _objectWithoutProperties(source, excluded) { if (source == null) return {}; var target = _objectWithoutPropertiesLoose(source, excluded); var key, i; if (Object.getOwnPropertySymbols) { var sourceSymbolKeys = Object.getOwnPropertySymbols(source); for (i = 0; i < sourceSymbolKeys.length; i++) { key = sourceSymbolKeys[i]; if (excluded.indexOf(key) >= 0) continue; if (!Object.prototype.propertyIsEnumerable.call(source, key)) continue; target[key] = source[key]; } } return target; }\n\nfunction _objectWithoutPropertiesLoose(source, excluded) { if (source == null) return {}; var target = {}; var sourceKeys = Object.keys(source); var key, i; for (i = 0; i < sourceKeys.length; i++) { key = sourceKeys[i]; if (excluded.indexOf(key) >= 0) continue; target[key] = source[key]; } return target; }\n\n/* @jsxRuntime classic */\n\n/* @jsx mdx */\nvar _frontmatter = {\n  \"title\": \"Execution\",\n  \"slug\": \"/v3/concepts/execution\",\n  \"version\": 3,\n  \"section\": \"docs\",\n  \"category\": \"runtime\",\n  \"keywords\": null\n};\nvar layoutProps = {\n  _frontmatter: _frontmatter\n};\nvar MDXLayout = \"wrapper\";\nreturn function MDXContent(_ref) {\n  var components = _ref.components,\n      props = _objectWithoutProperties(_ref, _excluded);\n\n  return mdx(MDXLayout, _extends({}, layoutProps, props, {\n    components: components,\n    mdxType: \"MDXLayout\"\n  }), mdx(\"p\", null, \"The execution of the Substrate runtime is orchestrated by the \", mdx(\"a\", {\n    parentName: \"p\",\n    \"href\": \"/v3/runtime/frame#executive-module\"\n  }, \"Executive module\"), \".\"), mdx(\"p\", null, \"Unlike the other modules within FRAME, this is not a \", mdx(\"em\", {\n    parentName: \"p\"\n  }, \"runtime\"), \" module. Rather it is a normal Rust module\\nthat calls into the various runtime modules included in your blockchain.\"), mdx(\"p\", null, \"The Executive module exposes the \", mdx(\"inlineCode\", {\n    parentName: \"p\"\n  }, \"execute_block\"), \" function that:\"), mdx(\"ul\", null, mdx(\"li\", {\n    parentName: \"ul\"\n  }, mdx(\"a\", {\n    parentName: \"li\",\n    \"href\": \"#initializing-a-block\"\n  }, \"Initializes the block\")), mdx(\"li\", {\n    parentName: \"ul\"\n  }, mdx(\"a\", {\n    parentName: \"li\",\n    \"href\": \"#executing-extrinsics\"\n  }, \"Executes extrinsics\")), mdx(\"li\", {\n    parentName: \"ul\"\n  }, mdx(\"a\", {\n    parentName: \"li\",\n    \"href\": \"#finalizing-a-block\"\n  }, \"Finalizes the block\"))), mdx(\"h2\", {\n    \"id\": \"validating-transactions\",\n    \"style\": {\n      \"position\": \"relative\"\n    }\n  }, mdx(\"a\", {\n    parentName: \"h2\",\n    \"href\": \"#validating-transactions\",\n    \"aria-label\": \"validating transactions permalink\",\n    \"className\": \"anchor before\"\n  }, mdx(\"svg\", {\n    parentName: \"a\",\n    \"className\": \"fill-current text-substrateDark dark:text-white\",\n    \"aria-hidden\": \"true\",\n    \"focusable\": \"false\",\n    \"height\": \"16\",\n    \"version\": \"1.1\",\n    \"viewBox\": \"0 0 16 16\",\n    \"width\": \"16\"\n  }, mdx(\"path\", {\n    parentName: \"svg\",\n    \"fillRule\": \"evenodd\",\n    \"d\": \"M4 9h1v1H4c-1.5 0-3-1.69-3-3.5S2.55 3 4 3h4c1.45 0 3 1.69 3 3.5 0 1.41-.91 2.72-2 3.25V8.59c.58-.45 1-1.27 1-2.09C10 5.22 8.98 4 8 4H4c-.98 0-2 1.22-2 2.5S3 9 4 9zm9-3h-1v1h1c1 0 2 1.22 2 2.5S13.98 12 13 12H9c-.98 0-2-1.22-2-2.5 0-.83.42-1.64 1-2.09V6.25c-1.09.53-2 1.84-2 3.25C6 11.31 7.55 13 9 13h4c1.45 0 3-1.69 3-3.5S14.5 6 13 6z\"\n  }))), \"Validating transactions\"), mdx(\"p\", null, \"Before block execution begins, signed transactions are checked for validity. This doesn't execute any\\nside-effects; it merely checks whether the transaction would panic if it were included or not. Thus,\\nchanges made to storage are discarded.\"), mdx(\"h2\", {\n    \"id\": \"executing-a-block\",\n    \"style\": {\n      \"position\": \"relative\"\n    }\n  }, mdx(\"a\", {\n    parentName: \"h2\",\n    \"href\": \"#executing-a-block\",\n    \"aria-label\": \"executing a block permalink\",\n    \"className\": \"anchor before\"\n  }, mdx(\"svg\", {\n    parentName: \"a\",\n    \"className\": \"fill-current text-substrateDark dark:text-white\",\n    \"aria-hidden\": \"true\",\n    \"focusable\": \"false\",\n    \"height\": \"16\",\n    \"version\": \"1.1\",\n    \"viewBox\": \"0 0 16 16\",\n    \"width\": \"16\"\n  }, mdx(\"path\", {\n    parentName: \"svg\",\n    \"fillRule\": \"evenodd\",\n    \"d\": \"M4 9h1v1H4c-1.5 0-3-1.69-3-3.5S2.55 3 4 3h4c1.45 0 3 1.69 3 3.5 0 1.41-.91 2.72-2 3.25V8.59c.58-.45 1-1.27 1-2.09C10 5.22 8.98 4 8 4H4c-.98 0-2 1.22-2 2.5S3 9 4 9zm9-3h-1v1h1c1 0 2 1.22 2 2.5S13.98 12 13 12H9c-.98 0-2-1.22-2-2.5 0-.83.42-1.64 1-2.09V6.25c-1.09.53-2 1.84-2 3.25C6 11.31 7.55 13 9 13h4c1.45 0 3-1.69 3-3.5S14.5 6 13 6z\"\n  }))), \"Executing a block\"), mdx(\"p\", null, \"Once there is a queue of valid transactions, the Executive module begins to execute the block.\"), mdx(\"h3\", {\n    \"id\": \"initializing-a-block\",\n    \"style\": {\n      \"position\": \"relative\"\n    }\n  }, mdx(\"a\", {\n    parentName: \"h3\",\n    \"href\": \"#initializing-a-block\",\n    \"aria-label\": \"initializing a block permalink\",\n    \"className\": \"anchor before\"\n  }, mdx(\"svg\", {\n    parentName: \"a\",\n    \"className\": \"fill-current text-substrateDark dark:text-white\",\n    \"aria-hidden\": \"true\",\n    \"focusable\": \"false\",\n    \"height\": \"16\",\n    \"version\": \"1.1\",\n    \"viewBox\": \"0 0 16 16\",\n    \"width\": \"16\"\n  }, mdx(\"path\", {\n    parentName: \"svg\",\n    \"fillRule\": \"evenodd\",\n    \"d\": \"M4 9h1v1H4c-1.5 0-3-1.69-3-3.5S2.55 3 4 3h4c1.45 0 3 1.69 3 3.5 0 1.41-.91 2.72-2 3.25V8.59c.58-.45 1-1.27 1-2.09C10 5.22 8.98 4 8 4H4c-.98 0-2 1.22-2 2.5S3 9 4 9zm9-3h-1v1h1c1 0 2 1.22 2 2.5S13.98 12 13 12H9c-.98 0-2-1.22-2-2.5 0-.83.42-1.64 1-2.09V6.25c-1.09.53-2 1.84-2 3.25C6 11.31 7.55 13 9 13h4c1.45 0 3-1.69 3-3.5S14.5 6 13 6z\"\n  }))), \"Initializing a block\"), mdx(\"p\", null, \"To initialize a block, the System module and all other included runtime modules have their\\n\", mdx(\"inlineCode\", {\n    parentName: \"p\"\n  }, \"on_initialize\"), \" function called which executes any business logic defined by those modules to take\\nplace before transactions are executed. The modules are executed in the order which they are defined\\nin the \", mdx(\"inlineCode\", {\n    parentName: \"p\"\n  }, \"construct_runtime!\"), \" macro, but with the System module always executing first.\"), mdx(\"p\", null, \"Then, initial checks take place where the parent hash in the block header is verified to be correct\\nand the extrinsics trie root actually represents the extrinsics.\"), mdx(\"h3\", {\n    \"id\": \"executing-extrinsics\",\n    \"style\": {\n      \"position\": \"relative\"\n    }\n  }, mdx(\"a\", {\n    parentName: \"h3\",\n    \"href\": \"#executing-extrinsics\",\n    \"aria-label\": \"executing extrinsics permalink\",\n    \"className\": \"anchor before\"\n  }, mdx(\"svg\", {\n    parentName: \"a\",\n    \"className\": \"fill-current text-substrateDark dark:text-white\",\n    \"aria-hidden\": \"true\",\n    \"focusable\": \"false\",\n    \"height\": \"16\",\n    \"version\": \"1.1\",\n    \"viewBox\": \"0 0 16 16\",\n    \"width\": \"16\"\n  }, mdx(\"path\", {\n    parentName: \"svg\",\n    \"fillRule\": \"evenodd\",\n    \"d\": \"M4 9h1v1H4c-1.5 0-3-1.69-3-3.5S2.55 3 4 3h4c1.45 0 3 1.69 3 3.5 0 1.41-.91 2.72-2 3.25V8.59c.58-.45 1-1.27 1-2.09C10 5.22 8.98 4 8 4H4c-.98 0-2 1.22-2 2.5S3 9 4 9zm9-3h-1v1h1c1 0 2 1.22 2 2.5S13.98 12 13 12H9c-.98 0-2-1.22-2-2.5 0-.83.42-1.64 1-2.09V6.25c-1.09.53-2 1.84-2 3.25C6 11.31 7.55 13 9 13h4c1.45 0 3-1.69 3-3.5S14.5 6 13 6z\"\n  }))), \"Executing extrinsics\"), mdx(\"p\", null, \"After the block has been initialized, each valid extrinsic is executed in order of transaction\\npriority. Extrinsics must not cause a panic in the runtime logic or else the system becomes\\nvulnerable to attacks where users can trigger computational execution without any punishment.\"), mdx(\"p\", null, \"When an extrinsic executes, the state is not cached prior to execution and storage mutations operate\\ndirectly on storage. Therefore, runtime developers should perform all necessary checks that an\\nextrinsic will succeed before mutating storage. If an extrinsic fails mid-execution, previous\\nstorage mutations will not be reverted.\"), mdx(\"p\", null, mdx(\"a\", {\n    parentName: \"p\",\n    \"href\": \"/v3/runtime/events-and-errors\"\n  }, \"Events\"), \" that are emitted from an extrinsic are also written to storage. Therefore, you\\nshould not emit an event before performing the complementary actions. If an extrinsic fails after an\\nevent is emitted, the event will not be reverted.\"), mdx(\"h3\", {\n    \"id\": \"finalizing-a-block\",\n    \"style\": {\n      \"position\": \"relative\"\n    }\n  }, mdx(\"a\", {\n    parentName: \"h3\",\n    \"href\": \"#finalizing-a-block\",\n    \"aria-label\": \"finalizing a block permalink\",\n    \"className\": \"anchor before\"\n  }, mdx(\"svg\", {\n    parentName: \"a\",\n    \"className\": \"fill-current text-substrateDark dark:text-white\",\n    \"aria-hidden\": \"true\",\n    \"focusable\": \"false\",\n    \"height\": \"16\",\n    \"version\": \"1.1\",\n    \"viewBox\": \"0 0 16 16\",\n    \"width\": \"16\"\n  }, mdx(\"path\", {\n    parentName: \"svg\",\n    \"fillRule\": \"evenodd\",\n    \"d\": \"M4 9h1v1H4c-1.5 0-3-1.69-3-3.5S2.55 3 4 3h4c1.45 0 3 1.69 3 3.5 0 1.41-.91 2.72-2 3.25V8.59c.58-.45 1-1.27 1-2.09C10 5.22 8.98 4 8 4H4c-.98 0-2 1.22-2 2.5S3 9 4 9zm9-3h-1v1h1c1 0 2 1.22 2 2.5S13.98 12 13 12H9c-.98 0-2-1.22-2-2.5 0-.83.42-1.64 1-2.09V6.25c-1.09.53-2 1.84-2 3.25C6 11.31 7.55 13 9 13h4c1.45 0 3-1.69 3-3.5S14.5 6 13 6z\"\n  }))), \"Finalizing a block\"), mdx(\"p\", null, \"After all queued extrinsics have been executed, the Executive module calls into each module's\\n\", mdx(\"inlineCode\", {\n    parentName: \"p\"\n  }, \"on_idle\"), \" and \", mdx(\"inlineCode\", {\n    parentName: \"p\"\n  }, \"on_finalize\"), \" function to perform any final business logic which should take place at the end of the\\nblock. The modules are again executed in the order which they are defined in the\\n\", mdx(\"inlineCode\", {\n    parentName: \"p\"\n  }, \"construct_runtime!\"), \" macro, but in this case, the System module finalizes last.\"), mdx(\"p\", null, \"Then, final checks take place where the digest and storage root in the block header match what was\\ncalculated.\"), mdx(\"p\", null, mdx(\"inlineCode\", {\n    parentName: \"p\"\n  }, \"on_idle\"), \" will also pass through the remaining weight of the block to allow for execution based on the\\nusage of the blockchain.\"), mdx(\"h2\", {\n    \"id\": \"next-steps\",\n    \"style\": {\n      \"position\": \"relative\"\n    }\n  }, mdx(\"a\", {\n    parentName: \"h2\",\n    \"href\": \"#next-steps\",\n    \"aria-label\": \"next steps permalink\",\n    \"className\": \"anchor before\"\n  }, mdx(\"svg\", {\n    parentName: \"a\",\n    \"className\": \"fill-current text-substrateDark dark:text-white\",\n    \"aria-hidden\": \"true\",\n    \"focusable\": \"false\",\n    \"height\": \"16\",\n    \"version\": \"1.1\",\n    \"viewBox\": \"0 0 16 16\",\n    \"width\": \"16\"\n  }, mdx(\"path\", {\n    parentName: \"svg\",\n    \"fillRule\": \"evenodd\",\n    \"d\": \"M4 9h1v1H4c-1.5 0-3-1.69-3-3.5S2.55 3 4 3h4c1.45 0 3 1.69 3 3.5 0 1.41-.91 2.72-2 3.25V8.59c.58-.45 1-1.27 1-2.09C10 5.22 8.98 4 8 4H4c-.98 0-2 1.22-2 2.5S3 9 4 9zm9-3h-1v1h1c1 0 2 1.22 2 2.5S13.98 12 13 12H9c-.98 0-2-1.22-2-2.5 0-.83.42-1.64 1-2.09V6.25c-1.09.53-2 1.84-2 3.25C6 11.31 7.55 13 9 13h4c1.45 0 3-1.69 3-3.5S14.5 6 13 6z\"\n  }))), \"Next steps\"), mdx(\"h3\", {\n    \"id\": \"learn-more\",\n    \"style\": {\n      \"position\": \"relative\"\n    }\n  }, mdx(\"a\", {\n    parentName: \"h3\",\n    \"href\": \"#learn-more\",\n    \"aria-label\": \"learn more permalink\",\n    \"className\": \"anchor before\"\n  }, mdx(\"svg\", {\n    parentName: \"a\",\n    \"className\": \"fill-current text-substrateDark dark:text-white\",\n    \"aria-hidden\": \"true\",\n    \"focusable\": \"false\",\n    \"height\": \"16\",\n    \"version\": \"1.1\",\n    \"viewBox\": \"0 0 16 16\",\n    \"width\": \"16\"\n  }, mdx(\"path\", {\n    parentName: \"svg\",\n    \"fillRule\": \"evenodd\",\n    \"d\": \"M4 9h1v1H4c-1.5 0-3-1.69-3-3.5S2.55 3 4 3h4c1.45 0 3 1.69 3 3.5 0 1.41-.91 2.72-2 3.25V8.59c.58-.45 1-1.27 1-2.09C10 5.22 8.98 4 8 4H4c-.98 0-2 1.22-2 2.5S3 9 4 9zm9-3h-1v1h1c1 0 2 1.22 2 2.5S13.98 12 13 12H9c-.98 0-2-1.22-2-2.5 0-.83.42-1.64 1-2.09V6.25c-1.09.53-2 1.84-2 3.25C6 11.31 7.55 13 9 13h4c1.45 0 3-1.69 3-3.5S14.5 6 13 6z\"\n  }))), \"Learn more\"), mdx(\"ul\", null, mdx(\"li\", {\n    parentName: \"ul\"\n  }, \"Learn how you can simulate the orchestration of the Executive module in your\\n\", mdx(\"a\", {\n    parentName: \"li\",\n    \"href\": \"/v3/runtime/testing\"\n  }, \"runtime tests\"), \".\")), mdx(\"h3\", {\n    \"id\": \"references\",\n    \"style\": {\n      \"position\": \"relative\"\n    }\n  }, mdx(\"a\", {\n    parentName: \"h3\",\n    \"href\": \"#references\",\n    \"aria-label\": \"references permalink\",\n    \"className\": \"anchor before\"\n  }, mdx(\"svg\", {\n    parentName: \"a\",\n    \"className\": \"fill-current text-substrateDark dark:text-white\",\n    \"aria-hidden\": \"true\",\n    \"focusable\": \"false\",\n    \"height\": \"16\",\n    \"version\": \"1.1\",\n    \"viewBox\": \"0 0 16 16\",\n    \"width\": \"16\"\n  }, mdx(\"path\", {\n    parentName: \"svg\",\n    \"fillRule\": \"evenodd\",\n    \"d\": \"M4 9h1v1H4c-1.5 0-3-1.69-3-3.5S2.55 3 4 3h4c1.45 0 3 1.69 3 3.5 0 1.41-.91 2.72-2 3.25V8.59c.58-.45 1-1.27 1-2.09C10 5.22 8.98 4 8 4H4c-.98 0-2 1.22-2 2.5S3 9 4 9zm9-3h-1v1h1c1 0 2 1.22 2 2.5S13.98 12 13 12H9c-.98 0-2-1.22-2-2.5 0-.83.42-1.64 1-2.09V6.25c-1.09.53-2 1.84-2 3.25C6 11.31 7.55 13 9 13h4c1.45 0 3-1.69 3-3.5S14.5 6 13 6z\"\n  }))), \"References\"), mdx(\"ul\", null, mdx(\"li\", {\n    parentName: \"ul\"\n  }, mdx(\"a\", {\n    parentName: \"li\",\n    \"href\": \"/rustdocs/latest/frame_executive/index.html\"\n  }, \"FRAME executive\")), mdx(\"li\", {\n    parentName: \"ul\"\n  }, mdx(\"a\", {\n    parentName: \"li\",\n    \"href\": \"/rustdocs/latest/frame_support/attr.pallet.html#event-palletevent-optional\"\n  }, mdx(\"inlineCode\", {\n    parentName: \"a\"\n  }, \"#[pallet::event]\"), \" macro\")), mdx(\"li\", {\n    parentName: \"ul\"\n  }, mdx(\"a\", {\n    parentName: \"li\",\n    \"href\": \"/rustdocs/latest/frame_support/attr.pallet.html#storage-palletstorage-optional\"\n  }, mdx(\"inlineCode\", {\n    parentName: \"a\"\n  }, \"#[pallet::storage]\"), \" macro\")), mdx(\"li\", {\n    parentName: \"ul\"\n  }, mdx(\"a\", {\n    parentName: \"li\",\n    \"href\": \"/rustdocs/latest/frame_support/macro.construct_runtime.html\"\n  }, mdx(\"inlineCode\", {\n    parentName: \"a\"\n  }, \"construct_runtime!\"), \" macro\")), mdx(\"li\", {\n    parentName: \"ul\"\n  }, mdx(\"a\", {\n    parentName: \"li\",\n    \"href\": \"/rustdocs/latest/frame_support/traits/trait.OnInitialize.html\"\n  }, mdx(\"inlineCode\", {\n    parentName: \"a\"\n  }, \"OnInitialize\"), \" trait\"))));\n}\n;\nMDXContent.isMDXComponent = true;","tableOfContents":{"items":[{"url":"#validating-transactions","title":"Validating transactions"},{"url":"#executing-a-block","title":"Executing a block","items":[{"url":"#initializing-a-block","title":"Initializing a block"},{"url":"#executing-extrinsics","title":"Executing extrinsics"},{"url":"#finalizing-a-block","title":"Finalizing a block"}]},{"url":"#next-steps","title":"Next steps","items":[{"url":"#learn-more","title":"Learn more"},{"url":"#references","title":"References"}]}]},"fileAbsolutePath":"/Users/a212/Desktop/substrate-docs/v3/docs/02-concepts/g-execution/index.mdx"}},"pageContext":{"slug":"/v3/concepts/execution","version":"3.0","locale":"en","hrefLang":"en-US","originalPath":"/v3/concepts/execution/","dateFormat":"MM/DD/YYYY"}},
    "staticQueryHashes": ["1239077767","1821483254","2966362950","3280999885"]}