{
    "componentChunkName": "component---src-templates-kb-template-tsx",
    "path": "/v3/getting-started/installation/",
    "result": {"data":{"mdx":{"frontmatter":{"slug":"/v3/getting-started/installation","title":"Installation","hideNav":null,"section":"docs","category":"getting started"},"body":"var _excluded = [\"components\"];\n\nfunction _extends() { _extends = Object.assign || function (target) { for (var i = 1; i < arguments.length; i++) { var source = arguments[i]; for (var key in source) { if (Object.prototype.hasOwnProperty.call(source, key)) { target[key] = source[key]; } } } return target; }; return _extends.apply(this, arguments); }\n\nfunction _objectWithoutProperties(source, excluded) { if (source == null) return {}; var target = _objectWithoutPropertiesLoose(source, excluded); var key, i; if (Object.getOwnPropertySymbols) { var sourceSymbolKeys = Object.getOwnPropertySymbols(source); for (i = 0; i < sourceSymbolKeys.length; i++) { key = sourceSymbolKeys[i]; if (excluded.indexOf(key) >= 0) continue; if (!Object.prototype.propertyIsEnumerable.call(source, key)) continue; target[key] = source[key]; } } return target; }\n\nfunction _objectWithoutPropertiesLoose(source, excluded) { if (source == null) return {}; var target = {}; var sourceKeys = Object.keys(source); var key, i; for (i = 0; i < sourceKeys.length; i++) { key = sourceKeys[i]; if (excluded.indexOf(key) >= 0) continue; target[key] = source[key]; } return target; }\n\n/* @jsxRuntime classic */\n\n/* @jsx mdx */\nvar _frontmatter = {\n  \"title\": \"Installation\",\n  \"slug\": \"/v3/getting-started/installation\",\n  \"version\": 3,\n  \"section\": \"docs\",\n  \"category\": \"getting started\",\n  \"keywords\": null\n};\n\nvar makeShortcode = function makeShortcode(name) {\n  return function MDXDefaultShortcode(props) {\n    console.warn(\"Component \" + name + \" was not imported, exported, or provided by MDXProvider as global scope\");\n    return mdx(\"div\", props);\n  };\n};\n\nvar Message = makeShortcode(\"Message\");\nvar layoutProps = {\n  _frontmatter: _frontmatter\n};\nvar MDXLayout = \"wrapper\";\nreturn function MDXContent(_ref) {\n  var components = _ref.components,\n      props = _objectWithoutProperties(_ref, _excluded);\n\n  return mdx(MDXLayout, _extends({}, layoutProps, props, {\n    components: components,\n    mdxType: \"MDXLayout\"\n  }), mdx(\"p\", null, \"This page will guide you through the \", mdx(\"strong\", {\n    parentName: \"p\"\n  }, \"2 steps\"), \" needed to prepare a computer for \", mdx(\"strong\", {\n    parentName: \"p\"\n  }, \"Substrate\"), \" development.\\nSince Substrate is built with \", mdx(\"a\", {\n    parentName: \"p\",\n    \"href\": \"https://www.rust-lang.org/\"\n  }, \"the Rust programming language\"), \", the first\\nthing you will need to do is prepare the computer for Rust development - these steps will vary based\\non the computer's operating system. Once Rust is configured, you will use its toolchains to interact\\nwith Rust projects; the commands for Rust's toolchains will be the same for all supported,\\nUnix-based operating systems.\"), mdx(\"h2\", {\n    \"id\": \"1-build-dependencies\",\n    \"style\": {\n      \"position\": \"relative\"\n    }\n  }, mdx(\"a\", {\n    parentName: \"h2\",\n    \"href\": \"#1-build-dependencies\",\n    \"aria-label\": \"1 build dependencies permalink\",\n    \"className\": \"anchor before\"\n  }, mdx(\"svg\", {\n    parentName: \"a\",\n    \"className\": \"fill-current text-substrateDark dark:text-white\",\n    \"aria-hidden\": \"true\",\n    \"focusable\": \"false\",\n    \"height\": \"16\",\n    \"version\": \"1.1\",\n    \"viewBox\": \"0 0 16 16\",\n    \"width\": \"16\"\n  }, mdx(\"path\", {\n    parentName: \"svg\",\n    \"fillRule\": \"evenodd\",\n    \"d\": \"M4 9h1v1H4c-1.5 0-3-1.69-3-3.5S2.55 3 4 3h4c1.45 0 3 1.69 3 3.5 0 1.41-.91 2.72-2 3.25V8.59c.58-.45 1-1.27 1-2.09C10 5.22 8.98 4 8 4H4c-.98 0-2 1.22-2 2.5S3 9 4 9zm9-3h-1v1h1c1 0 2 1.22 2 2.5S13.98 12 13 12H9c-.98 0-2-1.22-2-2.5 0-.83.42-1.64 1-2.09V6.25c-1.09.53-2 1.84-2 3.25C6 11.31 7.55 13 9 13h4c1.45 0 3-1.69 3-3.5S14.5 6 13 6z\"\n  }))), \"1. Build dependencies\"), mdx(\"p\", null, \"Substrate development is easiest on Unix-based operating systems like macOS or Linux. The examples\\nin the Substrate \", mdx(\"a\", {\n    parentName: \"p\",\n    \"href\": \"/tutorials\"\n  }, \"Tutorials\"), \" and \", mdx(\"a\", {\n    parentName: \"p\",\n    \"href\": \"/how-to-guides\"\n  }, \"How-to Guides\"), \"\\nuse Unix-style terminals to demonstrate how to interact with Substrate from the command line.\"), mdx(\"h3\", {\n    \"id\": \"ubuntudebian\",\n    \"style\": {\n      \"position\": \"relative\"\n    }\n  }, mdx(\"a\", {\n    parentName: \"h3\",\n    \"href\": \"#ubuntudebian\",\n    \"aria-label\": \"ubuntudebian permalink\",\n    \"className\": \"anchor before\"\n  }, mdx(\"svg\", {\n    parentName: \"a\",\n    \"className\": \"fill-current text-substrateDark dark:text-white\",\n    \"aria-hidden\": \"true\",\n    \"focusable\": \"false\",\n    \"height\": \"16\",\n    \"version\": \"1.1\",\n    \"viewBox\": \"0 0 16 16\",\n    \"width\": \"16\"\n  }, mdx(\"path\", {\n    parentName: \"svg\",\n    \"fillRule\": \"evenodd\",\n    \"d\": \"M4 9h1v1H4c-1.5 0-3-1.69-3-3.5S2.55 3 4 3h4c1.45 0 3 1.69 3 3.5 0 1.41-.91 2.72-2 3.25V8.59c.58-.45 1-1.27 1-2.09C10 5.22 8.98 4 8 4H4c-.98 0-2 1.22-2 2.5S3 9 4 9zm9-3h-1v1h1c1 0 2 1.22 2 2.5S13.98 12 13 12H9c-.98 0-2-1.22-2-2.5 0-.83.42-1.64 1-2.09V6.25c-1.09.53-2 1.84-2 3.25C6 11.31 7.55 13 9 13h4c1.45 0 3-1.69 3-3.5S14.5 6 13 6z\"\n  }))), \"Ubuntu/Debian\"), mdx(\"p\", null, \"Use a terminal shell to execute the following commands:\"), mdx(\"pre\", null, mdx(\"code\", {\n    parentName: \"pre\",\n    \"className\": \"language-bash\"\n  }, \"sudo apt update\\n# May prompt for location information\\nsudo apt install -y git clang curl libssl-dev llvm libudev-dev\\n\")), mdx(\"h3\", {\n    \"id\": \"arch-linux\",\n    \"style\": {\n      \"position\": \"relative\"\n    }\n  }, mdx(\"a\", {\n    parentName: \"h3\",\n    \"href\": \"#arch-linux\",\n    \"aria-label\": \"arch linux permalink\",\n    \"className\": \"anchor before\"\n  }, mdx(\"svg\", {\n    parentName: \"a\",\n    \"className\": \"fill-current text-substrateDark dark:text-white\",\n    \"aria-hidden\": \"true\",\n    \"focusable\": \"false\",\n    \"height\": \"16\",\n    \"version\": \"1.1\",\n    \"viewBox\": \"0 0 16 16\",\n    \"width\": \"16\"\n  }, mdx(\"path\", {\n    parentName: \"svg\",\n    \"fillRule\": \"evenodd\",\n    \"d\": \"M4 9h1v1H4c-1.5 0-3-1.69-3-3.5S2.55 3 4 3h4c1.45 0 3 1.69 3 3.5 0 1.41-.91 2.72-2 3.25V8.59c.58-.45 1-1.27 1-2.09C10 5.22 8.98 4 8 4H4c-.98 0-2 1.22-2 2.5S3 9 4 9zm9-3h-1v1h1c1 0 2 1.22 2 2.5S13.98 12 13 12H9c-.98 0-2-1.22-2-2.5 0-.83.42-1.64 1-2.09V6.25c-1.09.53-2 1.84-2 3.25C6 11.31 7.55 13 9 13h4c1.45 0 3-1.69 3-3.5S14.5 6 13 6z\"\n  }))), \"Arch Linux\"), mdx(\"p\", null, \"Run these commands from a terminal:\"), mdx(\"pre\", null, mdx(\"code\", {\n    parentName: \"pre\",\n    \"className\": \"language-bash\"\n  }, \"pacman -Syu --needed --noconfirm curl git clang\\n\")), mdx(\"h3\", {\n    \"id\": \"fedora\",\n    \"style\": {\n      \"position\": \"relative\"\n    }\n  }, mdx(\"a\", {\n    parentName: \"h3\",\n    \"href\": \"#fedora\",\n    \"aria-label\": \"fedora permalink\",\n    \"className\": \"anchor before\"\n  }, mdx(\"svg\", {\n    parentName: \"a\",\n    \"className\": \"fill-current text-substrateDark dark:text-white\",\n    \"aria-hidden\": \"true\",\n    \"focusable\": \"false\",\n    \"height\": \"16\",\n    \"version\": \"1.1\",\n    \"viewBox\": \"0 0 16 16\",\n    \"width\": \"16\"\n  }, mdx(\"path\", {\n    parentName: \"svg\",\n    \"fillRule\": \"evenodd\",\n    \"d\": \"M4 9h1v1H4c-1.5 0-3-1.69-3-3.5S2.55 3 4 3h4c1.45 0 3 1.69 3 3.5 0 1.41-.91 2.72-2 3.25V8.59c.58-.45 1-1.27 1-2.09C10 5.22 8.98 4 8 4H4c-.98 0-2 1.22-2 2.5S3 9 4 9zm9-3h-1v1h1c1 0 2 1.22 2 2.5S13.98 12 13 12H9c-.98 0-2-1.22-2-2.5 0-.83.42-1.64 1-2.09V6.25c-1.09.53-2 1.84-2 3.25C6 11.31 7.55 13 9 13h4c1.45 0 3-1.69 3-3.5S14.5 6 13 6z\"\n  }))), \"Fedora\"), mdx(\"p\", null, \"Run these commands from a terminal:\"), mdx(\"pre\", null, mdx(\"code\", {\n    parentName: \"pre\",\n    \"className\": \"language-bash\"\n  }, \"sudo dnf update\\nsudo dnf install clang curl git openssl-devel\\n\")), mdx(\"h3\", {\n    \"id\": \"opensuse\",\n    \"style\": {\n      \"position\": \"relative\"\n    }\n  }, mdx(\"a\", {\n    parentName: \"h3\",\n    \"href\": \"#opensuse\",\n    \"aria-label\": \"opensuse permalink\",\n    \"className\": \"anchor before\"\n  }, mdx(\"svg\", {\n    parentName: \"a\",\n    \"className\": \"fill-current text-substrateDark dark:text-white\",\n    \"aria-hidden\": \"true\",\n    \"focusable\": \"false\",\n    \"height\": \"16\",\n    \"version\": \"1.1\",\n    \"viewBox\": \"0 0 16 16\",\n    \"width\": \"16\"\n  }, mdx(\"path\", {\n    parentName: \"svg\",\n    \"fillRule\": \"evenodd\",\n    \"d\": \"M4 9h1v1H4c-1.5 0-3-1.69-3-3.5S2.55 3 4 3h4c1.45 0 3 1.69 3 3.5 0 1.41-.91 2.72-2 3.25V8.59c.58-.45 1-1.27 1-2.09C10 5.22 8.98 4 8 4H4c-.98 0-2 1.22-2 2.5S3 9 4 9zm9-3h-1v1h1c1 0 2 1.22 2 2.5S13.98 12 13 12H9c-.98 0-2-1.22-2-2.5 0-.83.42-1.64 1-2.09V6.25c-1.09.53-2 1.84-2 3.25C6 11.31 7.55 13 9 13h4c1.45 0 3-1.69 3-3.5S14.5 6 13 6z\"\n  }))), \"OpenSUSE\"), mdx(\"p\", null, \"Run these commands from a terminal:\"), mdx(\"pre\", null, mdx(\"code\", {\n    parentName: \"pre\",\n    \"className\": \"language-bash\"\n  }, \"sudo zypper install clang curl git openssl-devel llvm-devel libudev-devel\\n\")), mdx(\"h3\", {\n    \"id\": \"macos\",\n    \"style\": {\n      \"position\": \"relative\"\n    }\n  }, mdx(\"a\", {\n    parentName: \"h3\",\n    \"href\": \"#macos\",\n    \"aria-label\": \"macos permalink\",\n    \"className\": \"anchor before\"\n  }, mdx(\"svg\", {\n    parentName: \"a\",\n    \"className\": \"fill-current text-substrateDark dark:text-white\",\n    \"aria-hidden\": \"true\",\n    \"focusable\": \"false\",\n    \"height\": \"16\",\n    \"version\": \"1.1\",\n    \"viewBox\": \"0 0 16 16\",\n    \"width\": \"16\"\n  }, mdx(\"path\", {\n    parentName: \"svg\",\n    \"fillRule\": \"evenodd\",\n    \"d\": \"M4 9h1v1H4c-1.5 0-3-1.69-3-3.5S2.55 3 4 3h4c1.45 0 3 1.69 3 3.5 0 1.41-.91 2.72-2 3.25V8.59c.58-.45 1-1.27 1-2.09C10 5.22 8.98 4 8 4H4c-.98 0-2 1.22-2 2.5S3 9 4 9zm9-3h-1v1h1c1 0 2 1.22 2 2.5S13.98 12 13 12H9c-.98 0-2-1.22-2-2.5 0-.83.42-1.64 1-2.09V6.25c-1.09.53-2 1.84-2 3.25C6 11.31 7.55 13 9 13h4c1.45 0 3-1.69 3-3.5S14.5 6 13 6z\"\n  }))), \"macOS\"), mdx(Message, {\n    type: \"yellow\",\n    title: \"Information\",\n    text: \"The Apple M1 ARM system on a chip is not very well supported yet by rust, and thus you very likely will run into build errors stemming from this. There are reports that using substrate dependancies newer than the June 2021 monthly release are able to work without issue. Here is the ', [node template `monthly-2021-05`](https://github.com/substrate-developer-hub/substrate-node-template/tree/v3.0.0%2Bmonthly-2021-05) 'that you should use as a base for building on M1s. If you decide not to use a monthly release, see  [this community contributed script](https://github.com/substrate-developer-hub/substrate-node-template/issues/179#issuecomment-843522331) (and discussion) for details on extra configuration steps to get things working on `v3.0.0` and below. \",\n    mdxType: \"Message\"\n  }), mdx(\"p\", null, \"Open the Terminal application and execute the following commands:\"), mdx(\"pre\", null, mdx(\"code\", {\n    parentName: \"pre\",\n    \"className\": \"language-bash\"\n  }, \"# Install Homebrew if necessary https://brew.sh/\\n/bin/bash -c \\\"$(curl -fsSL https://raw.githubusercontent.com/Homebrew/install/master/install.sh)\\\"\\n\\n# Make sure Homebrew is up-to-date, install openssl\\nbrew update\\nbrew install openssl\\n\")), mdx(\"h3\", {\n    \"id\": \"windows\",\n    \"style\": {\n      \"position\": \"relative\"\n    }\n  }, mdx(\"a\", {\n    parentName: \"h3\",\n    \"href\": \"#windows\",\n    \"aria-label\": \"windows permalink\",\n    \"className\": \"anchor before\"\n  }, mdx(\"svg\", {\n    parentName: \"a\",\n    \"className\": \"fill-current text-substrateDark dark:text-white\",\n    \"aria-hidden\": \"true\",\n    \"focusable\": \"false\",\n    \"height\": \"16\",\n    \"version\": \"1.1\",\n    \"viewBox\": \"0 0 16 16\",\n    \"width\": \"16\"\n  }, mdx(\"path\", {\n    parentName: \"svg\",\n    \"fillRule\": \"evenodd\",\n    \"d\": \"M4 9h1v1H4c-1.5 0-3-1.69-3-3.5S2.55 3 4 3h4c1.45 0 3 1.69 3 3.5 0 1.41-.91 2.72-2 3.25V8.59c.58-.45 1-1.27 1-2.09C10 5.22 8.98 4 8 4H4c-.98 0-2 1.22-2 2.5S3 9 4 9zm9-3h-1v1h1c1 0 2 1.22 2 2.5S13.98 12 13 12H9c-.98 0-2-1.22-2-2.5 0-.83.42-1.64 1-2.09V6.25c-1.09.53-2 1.84-2 3.25C6 11.31 7.55 13 9 13h4c1.45 0 3-1.69 3-3.5S14.5 6 13 6z\"\n  }))), \"Windows\"), mdx(Message, {\n    type: \"red\",\n    title: \"Warning\",\n    text: \"\\nNative development of Substrate is _not_ very well supported! It is _highly_ recommend to\\nuse [Windows Subsystem Linux](https://docs.microsoft.com/en-us/windows/wsl/install-win10) (WSL)\\nand follow the instructions for [Ubuntu/Debian](#ubuntudebian). Please refer to the separate\\n[guide for native Windows development](/v3/getting-started/windows-users).\\n  \",\n    mdxType: \"Message\"\n  }), mdx(\"h2\", {\n    \"id\": \"2-rust-developer-environment\",\n    \"style\": {\n      \"position\": \"relative\"\n    }\n  }, mdx(\"a\", {\n    parentName: \"h2\",\n    \"href\": \"#2-rust-developer-environment\",\n    \"aria-label\": \"2 rust developer environment permalink\",\n    \"className\": \"anchor before\"\n  }, mdx(\"svg\", {\n    parentName: \"a\",\n    \"className\": \"fill-current text-substrateDark dark:text-white\",\n    \"aria-hidden\": \"true\",\n    \"focusable\": \"false\",\n    \"height\": \"16\",\n    \"version\": \"1.1\",\n    \"viewBox\": \"0 0 16 16\",\n    \"width\": \"16\"\n  }, mdx(\"path\", {\n    parentName: \"svg\",\n    \"fillRule\": \"evenodd\",\n    \"d\": \"M4 9h1v1H4c-1.5 0-3-1.69-3-3.5S2.55 3 4 3h4c1.45 0 3 1.69 3 3.5 0 1.41-.91 2.72-2 3.25V8.59c.58-.45 1-1.27 1-2.09C10 5.22 8.98 4 8 4H4c-.98 0-2 1.22-2 2.5S3 9 4 9zm9-3h-1v1h1c1 0 2 1.22 2 2.5S13.98 12 13 12H9c-.98 0-2-1.22-2-2.5 0-.83.42-1.64 1-2.09V6.25c-1.09.53-2 1.84-2 3.25C6 11.31 7.55 13 9 13h4c1.45 0 3-1.69 3-3.5S14.5 6 13 6z\"\n  }))), \"2. Rust developer environment\"), mdx(\"h3\", {\n    \"id\": \"automated-getsubstrateio-script\",\n    \"style\": {\n      \"position\": \"relative\"\n    }\n  }, mdx(\"a\", {\n    parentName: \"h3\",\n    \"href\": \"#automated-getsubstrateio-script\",\n    \"aria-label\": \"automated getsubstrateio script permalink\",\n    \"className\": \"anchor before\"\n  }, mdx(\"svg\", {\n    parentName: \"a\",\n    \"className\": \"fill-current text-substrateDark dark:text-white\",\n    \"aria-hidden\": \"true\",\n    \"focusable\": \"false\",\n    \"height\": \"16\",\n    \"version\": \"1.1\",\n    \"viewBox\": \"0 0 16 16\",\n    \"width\": \"16\"\n  }, mdx(\"path\", {\n    parentName: \"svg\",\n    \"fillRule\": \"evenodd\",\n    \"d\": \"M4 9h1v1H4c-1.5 0-3-1.69-3-3.5S2.55 3 4 3h4c1.45 0 3 1.69 3 3.5 0 1.41-.91 2.72-2 3.25V8.59c.58-.45 1-1.27 1-2.09C10 5.22 8.98 4 8 4H4c-.98 0-2 1.22-2 2.5S3 9 4 9zm9-3h-1v1h1c1 0 2 1.22 2 2.5S13.98 12 13 12H9c-.98 0-2-1.22-2-2.5 0-.83.42-1.64 1-2.09V6.25c-1.09.53-2 1.84-2 3.25C6 11.31 7.55 13 9 13h4c1.45 0 3-1.69 3-3.5S14.5 6 13 6z\"\n  }))), \"Automated \", mdx(\"inlineCode\", {\n    parentName: \"h3\"\n  }, \"getsubstrate.io\"), \" script\"), mdx(\"p\", null, \"For most users you can run our script to automate the steps listed below:\"), mdx(\"pre\", null, mdx(\"code\", {\n    parentName: \"pre\",\n    \"className\": \"language-bash\"\n  }, \"curl https://getsubstrate.io -sSf | bash -s -- --fast\\n\")), mdx(\"p\", null, \"If this gives any errors, please follow the steps below to manually configure rust on your machine.\"), mdx(\"h3\", {\n    \"id\": \"manual-rust-configuration\",\n    \"style\": {\n      \"position\": \"relative\"\n    }\n  }, mdx(\"a\", {\n    parentName: \"h3\",\n    \"href\": \"#manual-rust-configuration\",\n    \"aria-label\": \"manual rust configuration permalink\",\n    \"className\": \"anchor before\"\n  }, mdx(\"svg\", {\n    parentName: \"a\",\n    \"className\": \"fill-current text-substrateDark dark:text-white\",\n    \"aria-hidden\": \"true\",\n    \"focusable\": \"false\",\n    \"height\": \"16\",\n    \"version\": \"1.1\",\n    \"viewBox\": \"0 0 16 16\",\n    \"width\": \"16\"\n  }, mdx(\"path\", {\n    parentName: \"svg\",\n    \"fillRule\": \"evenodd\",\n    \"d\": \"M4 9h1v1H4c-1.5 0-3-1.69-3-3.5S2.55 3 4 3h4c1.45 0 3 1.69 3 3.5 0 1.41-.91 2.72-2 3.25V8.59c.58-.45 1-1.27 1-2.09C10 5.22 8.98 4 8 4H4c-.98 0-2 1.22-2 2.5S3 9 4 9zm9-3h-1v1h1c1 0 2 1.22 2 2.5S13.98 12 13 12H9c-.98 0-2-1.22-2-2.5 0-.83.42-1.64 1-2.09V6.25c-1.09.53-2 1.84-2 3.25C6 11.31 7.55 13 9 13h4c1.45 0 3-1.69 3-3.5S14.5 6 13 6z\"\n  }))), \"Manual Rust configuration\"), mdx(\"p\", null, \"This guide uses \", mdx(\"a\", {\n    parentName: \"p\",\n    \"href\": \"https://rustup.rs/\"\n  }, mdx(\"inlineCode\", {\n    parentName: \"a\"\n  }, \"rustup\")), \" to help manage the Rust toolchain. First install and\\nconfigure \", mdx(\"inlineCode\", {\n    parentName: \"p\"\n  }, \"rustup\"), \":\"), mdx(\"pre\", null, mdx(\"code\", {\n    parentName: \"pre\",\n    \"className\": \"language-bash\"\n  }, \"# Install\\ncurl https://sh.rustup.rs -sSf | sh\\n# Configure\\nsource ~/.cargo/env\\n\")), mdx(\"p\", null, \"Configure the Rust toolchain to default to the latest stable version, add nightly and the nightly wasm target:\"), mdx(\"pre\", null, mdx(\"code\", {\n    parentName: \"pre\",\n    \"className\": \"language-bash\"\n  }, \"rustup default stable\\nrustup update\\nrustup update nightly\\nrustup target add wasm32-unknown-unknown --toolchain nightly\\n\")), mdx(\"h2\", {\n    \"id\": \"test-your-set-up\",\n    \"style\": {\n      \"position\": \"relative\"\n    }\n  }, mdx(\"a\", {\n    parentName: \"h2\",\n    \"href\": \"#test-your-set-up\",\n    \"aria-label\": \"test your set up permalink\",\n    \"className\": \"anchor before\"\n  }, mdx(\"svg\", {\n    parentName: \"a\",\n    \"className\": \"fill-current text-substrateDark dark:text-white\",\n    \"aria-hidden\": \"true\",\n    \"focusable\": \"false\",\n    \"height\": \"16\",\n    \"version\": \"1.1\",\n    \"viewBox\": \"0 0 16 16\",\n    \"width\": \"16\"\n  }, mdx(\"path\", {\n    parentName: \"svg\",\n    \"fillRule\": \"evenodd\",\n    \"d\": \"M4 9h1v1H4c-1.5 0-3-1.69-3-3.5S2.55 3 4 3h4c1.45 0 3 1.69 3 3.5 0 1.41-.91 2.72-2 3.25V8.59c.58-.45 1-1.27 1-2.09C10 5.22 8.98 4 8 4H4c-.98 0-2 1.22-2 2.5S3 9 4 9zm9-3h-1v1h1c1 0 2 1.22 2 2.5S13.98 12 13 12H9c-.98 0-2-1.22-2-2.5 0-.83.42-1.64 1-2.09V6.25c-1.09.53-2 1.84-2 3.25C6 11.31 7.55 13 9 13h4c1.45 0 3-1.69 3-3.5S14.5 6 13 6z\"\n  }))), \"Test your set-up\"), mdx(\"p\", null, \"Now the best way to ensure that you have successfully prepared a computer for Substrate\\ndevelopment is to follow the steps in \", mdx(\"a\", {\n    parentName: \"p\",\n    \"href\": \"/tutorials/v3/create-your-first-substrate-chain\"\n  }, \"our first tutorial\"), \".\"), mdx(Message, {\n    type: \"yellow\",\n    title: \"Information\",\n    text: \"For more details on _why_ these dependancies are used, and for _troubleshooting_ errors building the template, read on.\",\n    mdxType: \"Message\"\n  }), mdx(\"h2\", {\n    \"id\": \"troubleshooting-substrate-builds\",\n    \"style\": {\n      \"position\": \"relative\"\n    }\n  }, mdx(\"a\", {\n    parentName: \"h2\",\n    \"href\": \"#troubleshooting-substrate-builds\",\n    \"aria-label\": \"troubleshooting substrate builds permalink\",\n    \"className\": \"anchor before\"\n  }, mdx(\"svg\", {\n    parentName: \"a\",\n    \"className\": \"fill-current text-substrateDark dark:text-white\",\n    \"aria-hidden\": \"true\",\n    \"focusable\": \"false\",\n    \"height\": \"16\",\n    \"version\": \"1.1\",\n    \"viewBox\": \"0 0 16 16\",\n    \"width\": \"16\"\n  }, mdx(\"path\", {\n    parentName: \"svg\",\n    \"fillRule\": \"evenodd\",\n    \"d\": \"M4 9h1v1H4c-1.5 0-3-1.69-3-3.5S2.55 3 4 3h4c1.45 0 3 1.69 3 3.5 0 1.41-.91 2.72-2 3.25V8.59c.58-.45 1-1.27 1-2.09C10 5.22 8.98 4 8 4H4c-.98 0-2 1.22-2 2.5S3 9 4 9zm9-3h-1v1h1c1 0 2 1.22 2 2.5S13.98 12 13 12H9c-.98 0-2-1.22-2-2.5 0-.83.42-1.64 1-2.09V6.25c-1.09.53-2 1.84-2 3.25C6 11.31 7.55 13 9 13h4c1.45 0 3-1.69 3-3.5S14.5 6 13 6z\"\n  }))), \"Troubleshooting Substrate builds\"), mdx(\"p\", null, \"Sometimes you can't get the \", mdx(\"a\", {\n    parentName: \"p\",\n    \"href\": \"https://github.com/substrate-developer-hub/substrate-node-template\"\n  }, \"Substrate Node Template\"), \"\\nto compile out of the box. Here are some tips to help you work through that.\"), mdx(\"h3\", {\n    \"id\": \"rust-configuration-check\",\n    \"style\": {\n      \"position\": \"relative\"\n    }\n  }, mdx(\"a\", {\n    parentName: \"h3\",\n    \"href\": \"#rust-configuration-check\",\n    \"aria-label\": \"rust configuration check permalink\",\n    \"className\": \"anchor before\"\n  }, mdx(\"svg\", {\n    parentName: \"a\",\n    \"className\": \"fill-current text-substrateDark dark:text-white\",\n    \"aria-hidden\": \"true\",\n    \"focusable\": \"false\",\n    \"height\": \"16\",\n    \"version\": \"1.1\",\n    \"viewBox\": \"0 0 16 16\",\n    \"width\": \"16\"\n  }, mdx(\"path\", {\n    parentName: \"svg\",\n    \"fillRule\": \"evenodd\",\n    \"d\": \"M4 9h1v1H4c-1.5 0-3-1.69-3-3.5S2.55 3 4 3h4c1.45 0 3 1.69 3 3.5 0 1.41-.91 2.72-2 3.25V8.59c.58-.45 1-1.27 1-2.09C10 5.22 8.98 4 8 4H4c-.98 0-2 1.22-2 2.5S3 9 4 9zm9-3h-1v1h1c1 0 2 1.22 2 2.5S13.98 12 13 12H9c-.98 0-2-1.22-2-2.5 0-.83.42-1.64 1-2.09V6.25c-1.09.53-2 1.84-2 3.25C6 11.31 7.55 13 9 13h4c1.45 0 3-1.69 3-3.5S14.5 6 13 6z\"\n  }))), \"Rust configuration check\"), mdx(\"p\", null, \"To see what Rust toolchain you are presently using, run:\"), mdx(\"pre\", null, mdx(\"code\", {\n    parentName: \"pre\",\n    \"className\": \"language-bash\"\n  }, \"rustup show\\n\")), mdx(\"p\", null, \"This will show something like this (Ubuntu example) output:\"), mdx(\"pre\", null, mdx(\"code\", {\n    parentName: \"pre\",\n    \"className\": \"language-text\"\n  }, \"Default host: x86_64-unknown-linux-gnu\\nrustup home:  /home/user/.rustup\\n\\ninstalled toolchains\\n--------------------\\n\\nstable-x86_64-unknown-linux-gnu (default)\\nnightly-2020-10-06-x86_64-unknown-linux-gnu\\nnightly-x86_64-unknown-linux-gnu\\n\\ninstalled targets for active toolchain\\n--------------------------------------\\n\\nwasm32-unknown-unknown\\nx86_64-unknown-linux-gnu\\n\\nactive toolchain\\n----------------\\n\\nstable-x86_64-unknown-linux-gnu (default)\\nrustc 1.50.0 (cb75ad5db 2021-02-10)\\n\")), mdx(\"p\", null, \"As you can see above, the default toolchain is stable, and the\\n\", mdx(\"inlineCode\", {\n    parentName: \"p\"\n  }, \"nightly-x86_64-unknown-linux-gnu\"), \" toolchain as well as its \", mdx(\"inlineCode\", {\n    parentName: \"p\"\n  }, \"wasm32-unknown-unknown\"), \" target is installed.\\nYou also see that \", mdx(\"inlineCode\", {\n    parentName: \"p\"\n  }, \"nightly-2020-10-06-x86_64-unknown-linux-gnu\"), \" is installed, but is not used unless explicitly defined as illustrated in the \", mdx(\"a\", {\n    parentName: \"p\",\n    \"href\": \"#specifying-nightly-version\"\n  }, \"specify your nightly version\"), \"\\nsection.\"), mdx(\"h3\", {\n    \"id\": \"webassembly-compilation\",\n    \"style\": {\n      \"position\": \"relative\"\n    }\n  }, mdx(\"a\", {\n    parentName: \"h3\",\n    \"href\": \"#webassembly-compilation\",\n    \"aria-label\": \"webassembly compilation permalink\",\n    \"className\": \"anchor before\"\n  }, mdx(\"svg\", {\n    parentName: \"a\",\n    \"className\": \"fill-current text-substrateDark dark:text-white\",\n    \"aria-hidden\": \"true\",\n    \"focusable\": \"false\",\n    \"height\": \"16\",\n    \"version\": \"1.1\",\n    \"viewBox\": \"0 0 16 16\",\n    \"width\": \"16\"\n  }, mdx(\"path\", {\n    parentName: \"svg\",\n    \"fillRule\": \"evenodd\",\n    \"d\": \"M4 9h1v1H4c-1.5 0-3-1.69-3-3.5S2.55 3 4 3h4c1.45 0 3 1.69 3 3.5 0 1.41-.91 2.72-2 3.25V8.59c.58-.45 1-1.27 1-2.09C10 5.22 8.98 4 8 4H4c-.98 0-2 1.22-2 2.5S3 9 4 9zm9-3h-1v1h1c1 0 2 1.22 2 2.5S13.98 12 13 12H9c-.98 0-2-1.22-2-2.5 0-.83.42-1.64 1-2.09V6.25c-1.09.53-2 1.84-2 3.25C6 11.31 7.55 13 9 13h4c1.45 0 3-1.69 3-3.5S14.5 6 13 6z\"\n  }))), \"WebAssembly compilation\"), mdx(\"p\", null, \"Substrate uses \", mdx(\"a\", {\n    parentName: \"p\",\n    \"href\": \"https://webassembly.org\"\n  }, \"WebAssembly\"), \" (Wasm) to produce portable blockchain\\nruntimes. You will need to configure your Rust compiler to use\\n\", mdx(\"a\", {\n    parentName: \"p\",\n    \"href\": \"https://doc.rust-lang.org/book/appendix-07-nightly-rust.html\"\n  }, mdx(\"inlineCode\", {\n    parentName: \"a\"\n  }, \"nightly\"), \" builds\"), \" to allow you to\\ncompile Substrate runtime code to the Wasm target.\"), mdx(Message, {\n    type: \"yellow\",\n    title: \"Information\",\n    text: \"There are upstream issues in Rust that need to be resolved before all of Substrate can use\\nthe stable Rust toolchain.\\n[This is our tracking issue](https://github.com/paritytech/substrate/issues/1252)\\nif you're curious as to why and how this will be resolved.\",\n    mdxType: \"Message\"\n  }), mdx(\"h4\", null, \"Latest nightly for Substrate \", mdx(\"inlineCode\", {\n    parentName: \"h4\"\n  }, \"master\")), mdx(\"p\", null, \"Developers who are building Substrate \", mdx(\"em\", {\n    parentName: \"p\"\n  }, \"itself\"), \" should always use the latest bug-free versions of\\nRust stable and nightly. This is because the Substrate codebase follows the tip of Rust nightly,\\nwhich means that changes in Substrate often depend on upstream changes in the Rust nightly compiler.\\nTo ensure your Rust compiler is always up to date, you should run:\"), mdx(\"pre\", null, mdx(\"code\", {\n    parentName: \"pre\",\n    \"className\": \"language-bash\"\n  }, \"rustup update\\nrustup update nightly\\nrustup target add wasm32-unknown-unknown --toolchain nightly\\n\")), mdx(\"br\", null), mdx(Message, {\n    type: \"gray\",\n    title: \"Note\",\n    text: \"It may be necessary to occasionally rerun `rustup update` if a change in the upstream Substrate\\ncodebase depends on a new feature of the Rust compiler. When you do this, both your nightly\\nand stable toolchains will be pulled to the most recent release, and for nightly, it is\\ngenerally _not_ expected to compile WASM without error (although it very often does).\\nBe sure to [specify your nightly version](#specifying-nightly-version) if you get WASM build errors\\nfrom `rustup` and [downgrade nightly as needed](#downgrading-rust-nightly).\",\n    mdxType: \"Message\"\n  }), mdx(\"h4\", null, \"Rust nightly toolchain\"), mdx(\"p\", null, \"If you want to guarantee that your build works on your computer as you update Rust and other\\ndependencies, you should use a specific Rust nightly version that is known to be\\ncompatible with the version of Substrate they are using; this version will vary from project to\\nproject and different projects may use different mechanisms to communicate this version to\\ndevelopers. For instance, the Polkadot client specifies this information in its\\n\", mdx(\"a\", {\n    parentName: \"p\",\n    \"href\": \"https://github.com/paritytech/polkadot/releases\"\n  }, \"release notes\"), \".\"), mdx(\"pre\", null, mdx(\"code\", {\n    parentName: \"pre\",\n    \"className\": \"language-bash\"\n  }, \"# Specify the specific nightly toolchain in the date below:\\nrustup install nightly-<yyyy-MM-dd>\\n\")), mdx(\"h4\", null, \"Wasm toolchain\"), mdx(\"p\", null, \"Now, configure the nightly version to work with the Wasm compilation target:\"), mdx(\"pre\", null, mdx(\"code\", {\n    parentName: \"pre\",\n    \"className\": \"language-bash\"\n  }, \"rustup target add wasm32-unknown-unknown --toolchain nightly-<yyyy-MM-dd>\\n\")), mdx(\"h3\", {\n    \"id\": \"specifying-nightly-version\",\n    \"style\": {\n      \"position\": \"relative\"\n    }\n  }, mdx(\"a\", {\n    parentName: \"h3\",\n    \"href\": \"#specifying-nightly-version\",\n    \"aria-label\": \"specifying nightly version permalink\",\n    \"className\": \"anchor before\"\n  }, mdx(\"svg\", {\n    parentName: \"a\",\n    \"className\": \"fill-current text-substrateDark dark:text-white\",\n    \"aria-hidden\": \"true\",\n    \"focusable\": \"false\",\n    \"height\": \"16\",\n    \"version\": \"1.1\",\n    \"viewBox\": \"0 0 16 16\",\n    \"width\": \"16\"\n  }, mdx(\"path\", {\n    parentName: \"svg\",\n    \"fillRule\": \"evenodd\",\n    \"d\": \"M4 9h1v1H4c-1.5 0-3-1.69-3-3.5S2.55 3 4 3h4c1.45 0 3 1.69 3 3.5 0 1.41-.91 2.72-2 3.25V8.59c.58-.45 1-1.27 1-2.09C10 5.22 8.98 4 8 4H4c-.98 0-2 1.22-2 2.5S3 9 4 9zm9-3h-1v1h1c1 0 2 1.22 2 2.5S13.98 12 13 12H9c-.98 0-2-1.22-2-2.5 0-.83.42-1.64 1-2.09V6.25c-1.09.53-2 1.84-2 3.25C6 11.31 7.55 13 9 13h4c1.45 0 3-1.69 3-3.5S14.5 6 13 6z\"\n  }))), \"Specifying nightly version\"), mdx(\"p\", null, \"Use the \", mdx(\"inlineCode\", {\n    parentName: \"p\"\n  }, \"WASM_BUILD_TOOLCHAIN\"), \" environment variable to specify the Rust nightly version a Substrate\\nproject should use for Wasm compilation:\"), mdx(\"pre\", null, mdx(\"code\", {\n    parentName: \"pre\",\n    \"className\": \"language-bash\"\n  }, \"WASM_BUILD_TOOLCHAIN=nightly-<yyyy-MM-dd> cargo build --release\\n\")), mdx(\"br\", null), mdx(Message, {\n    type: \"yellow\",\n    title: \"Information\",\n    text: \"Note that this only builds _the runtime_ with the specified nightly. The rest of project will be\\ncompiled with **your default toolchain**, i.e. the latest installed stable toolchain.\",\n    mdxType: \"Message\"\n  }), mdx(\"h3\", {\n    \"id\": \"downgrading-rust-nightly\",\n    \"style\": {\n      \"position\": \"relative\"\n    }\n  }, mdx(\"a\", {\n    parentName: \"h3\",\n    \"href\": \"#downgrading-rust-nightly\",\n    \"aria-label\": \"downgrading rust nightly permalink\",\n    \"className\": \"anchor before\"\n  }, mdx(\"svg\", {\n    parentName: \"a\",\n    \"className\": \"fill-current text-substrateDark dark:text-white\",\n    \"aria-hidden\": \"true\",\n    \"focusable\": \"false\",\n    \"height\": \"16\",\n    \"version\": \"1.1\",\n    \"viewBox\": \"0 0 16 16\",\n    \"width\": \"16\"\n  }, mdx(\"path\", {\n    parentName: \"svg\",\n    \"fillRule\": \"evenodd\",\n    \"d\": \"M4 9h1v1H4c-1.5 0-3-1.69-3-3.5S2.55 3 4 3h4c1.45 0 3 1.69 3 3.5 0 1.41-.91 2.72-2 3.25V8.59c.58-.45 1-1.27 1-2.09C10 5.22 8.98 4 8 4H4c-.98 0-2 1.22-2 2.5S3 9 4 9zm9-3h-1v1h1c1 0 2 1.22 2 2.5S13.98 12 13 12H9c-.98 0-2-1.22-2-2.5 0-.83.42-1.64 1-2.09V6.25c-1.09.53-2 1.84-2 3.25C6 11.31 7.55 13 9 13h4c1.45 0 3-1.69 3-3.5S14.5 6 13 6z\"\n  }))), \"Downgrading Rust nightly\"), mdx(\"p\", null, \"If your computer is configured to use the latest Rust nightly and you would like to downgrade to a\\nspecific nightly version, follow these steps:\"), mdx(\"pre\", null, mdx(\"code\", {\n    parentName: \"pre\",\n    \"className\": \"language-sh\"\n  }, \"rustup uninstall nightly\\nrustup install nightly-<yyyy-MM-dd>\\nrustup target add wasm32-unknown-unknown --toolchain nightly-<yyyy-MM-dd>\\n\")));\n}\n;\nMDXContent.isMDXComponent = true;","tableOfContents":{"items":[{"url":"#1-build-dependencies","title":"1. Build dependencies","items":[{"url":"#ubuntudebian","title":"Ubuntu/Debian"},{"url":"#arch-linux","title":"Arch Linux"},{"url":"#fedora","title":"Fedora"},{"url":"#opensuse","title":"OpenSUSE"},{"url":"#macos","title":"macOS"},{"url":"#windows","title":"Windows"}]},{"url":"#2-rust-developer-environment","title":"2. Rust developer environment","items":[{"url":"#automated-getsubstrateio-script","title":"Automated getsubstrate.io script"},{"url":"#manual-rust-configuration","title":"Manual Rust configuration"}]},{"url":"#test-your-set-up","title":"Test your set-up"},{"url":"#troubleshooting-substrate-builds","title":"Troubleshooting Substrate builds","items":[{"url":"#rust-configuration-check","title":"Rust configuration check"},{"url":"#webassembly-compilation","title":"WebAssembly compilation"},{"url":"#specifying-nightly-version","title":"Specifying nightly version"},{"url":"#downgrading-rust-nightly","title":"Downgrading Rust nightly"}]}]},"fileAbsolutePath":"/Users/a212/Desktop/substrate-docs/v3/docs/01-getting-started/c-installation/index.mdx"}},"pageContext":{"slug":"/v3/getting-started/installation","version":"3.0","locale":"en","hrefLang":"en-US","originalPath":"/v3/getting-started/installation/","dateFormat":"MM/DD/YYYY"}},
    "staticQueryHashes": ["1239077767","1821483254","2966362950","3280999885"]}