{
    "componentChunkName": "component---src-templates-kb-template-tsx",
    "path": "/v3/advanced/executor/",
    "result": {"data":{"mdx":{"frontmatter":{"slug":"/v3/advanced/executor","title":"Executor","hideNav":null,"section":"docs","category":"advanced"},"body":"var _excluded = [\"components\"];\n\nfunction _extends() { _extends = Object.assign || function (target) { for (var i = 1; i < arguments.length; i++) { var source = arguments[i]; for (var key in source) { if (Object.prototype.hasOwnProperty.call(source, key)) { target[key] = source[key]; } } } return target; }; return _extends.apply(this, arguments); }\n\nfunction _objectWithoutProperties(source, excluded) { if (source == null) return {}; var target = _objectWithoutPropertiesLoose(source, excluded); var key, i; if (Object.getOwnPropertySymbols) { var sourceSymbolKeys = Object.getOwnPropertySymbols(source); for (i = 0; i < sourceSymbolKeys.length; i++) { key = sourceSymbolKeys[i]; if (excluded.indexOf(key) >= 0) continue; if (!Object.prototype.propertyIsEnumerable.call(source, key)) continue; target[key] = source[key]; } } return target; }\n\nfunction _objectWithoutPropertiesLoose(source, excluded) { if (source == null) return {}; var target = {}; var sourceKeys = Object.keys(source); var key, i; for (i = 0; i < sourceKeys.length; i++) { key = sourceKeys[i]; if (excluded.indexOf(key) >= 0) continue; target[key] = source[key]; } return target; }\n\n/* @jsxRuntime classic */\n\n/* @jsx mdx */\nvar _frontmatter = {\n  \"title\": \"Executor\",\n  \"slug\": \"/v3/advanced/executor\",\n  \"version\": 3,\n  \"section\": \"docs\",\n  \"category\": \"advanced\",\n  \"keywords\": null\n};\nvar layoutProps = {\n  _frontmatter: _frontmatter\n};\nvar MDXLayout = \"wrapper\";\nreturn function MDXContent(_ref) {\n  var components = _ref.components,\n      props = _objectWithoutProperties(_ref, _excluded);\n\n  return mdx(MDXLayout, _extends({}, layoutProps, props, {\n    components: components,\n    mdxType: \"MDXLayout\"\n  }), mdx(\"p\", null, \"The \", mdx(\"a\", {\n    parentName: \"p\",\n    \"href\": \"/v3/getting-started/glossary#executor\"\n  }, \"executor\"), \" is responsible for dispatching and executing\\ncalls into the Substrate runtime.\"), mdx(\"h2\", {\n    \"id\": \"runtime-execution\",\n    \"style\": {\n      \"position\": \"relative\"\n    }\n  }, mdx(\"a\", {\n    parentName: \"h2\",\n    \"href\": \"#runtime-execution\",\n    \"aria-label\": \"runtime execution permalink\",\n    \"className\": \"anchor before\"\n  }, mdx(\"svg\", {\n    parentName: \"a\",\n    \"className\": \"fill-current text-substrateDark dark:text-white\",\n    \"aria-hidden\": \"true\",\n    \"focusable\": \"false\",\n    \"height\": \"16\",\n    \"version\": \"1.1\",\n    \"viewBox\": \"0 0 16 16\",\n    \"width\": \"16\"\n  }, mdx(\"path\", {\n    parentName: \"svg\",\n    \"fillRule\": \"evenodd\",\n    \"d\": \"M4 9h1v1H4c-1.5 0-3-1.69-3-3.5S2.55 3 4 3h4c1.45 0 3 1.69 3 3.5 0 1.41-.91 2.72-2 3.25V8.59c.58-.45 1-1.27 1-2.09C10 5.22 8.98 4 8 4H4c-.98 0-2 1.22-2 2.5S3 9 4 9zm9-3h-1v1h1c1 0 2 1.22 2 2.5S13.98 12 13 12H9c-.98 0-2-1.22-2-2.5 0-.83.42-1.64 1-2.09V6.25c-1.09.53-2 1.84-2 3.25C6 11.31 7.55 13 9 13h4c1.45 0 3-1.69 3-3.5S14.5 6 13 6z\"\n  }))), \"Runtime execution\"), mdx(\"p\", null, \"The Substrate runtime is compiled into a native executable and a WebAssembly (Wasm) binary.\"), mdx(\"p\", null, \"The native runtime is included as part of the node executable, while the Wasm binary is stored on\\nthe blockchain under a well known storage key.\"), mdx(\"p\", null, \"These two representations of the runtime may not be the same. For example, after the runtime is\\nupgraded. The executor determines which version of the runtime to use when dispatching calls.\"), mdx(\"h3\", {\n    \"id\": \"execution-strategy\",\n    \"style\": {\n      \"position\": \"relative\"\n    }\n  }, mdx(\"a\", {\n    parentName: \"h3\",\n    \"href\": \"#execution-strategy\",\n    \"aria-label\": \"execution strategy permalink\",\n    \"className\": \"anchor before\"\n  }, mdx(\"svg\", {\n    parentName: \"a\",\n    \"className\": \"fill-current text-substrateDark dark:text-white\",\n    \"aria-hidden\": \"true\",\n    \"focusable\": \"false\",\n    \"height\": \"16\",\n    \"version\": \"1.1\",\n    \"viewBox\": \"0 0 16 16\",\n    \"width\": \"16\"\n  }, mdx(\"path\", {\n    parentName: \"svg\",\n    \"fillRule\": \"evenodd\",\n    \"d\": \"M4 9h1v1H4c-1.5 0-3-1.69-3-3.5S2.55 3 4 3h4c1.45 0 3 1.69 3 3.5 0 1.41-.91 2.72-2 3.25V8.59c.58-.45 1-1.27 1-2.09C10 5.22 8.98 4 8 4H4c-.98 0-2 1.22-2 2.5S3 9 4 9zm9-3h-1v1h1c1 0 2 1.22 2 2.5S13.98 12 13 12H9c-.98 0-2-1.22-2-2.5 0-.83.42-1.64 1-2.09V6.25c-1.09.53-2 1.84-2 3.25C6 11.31 7.55 13 9 13h4c1.45 0 3-1.69 3-3.5S14.5 6 13 6z\"\n  }))), \"Execution strategy\"), mdx(\"p\", null, \"Before runtime execution begins, the Substrate client proposes which runtime execution environment\\nshould be used. This is controlled by the execution strategy, which can be configured for the\\ndifferent parts of the blockchain execution process. The strategies are listed in the\\n\", mdx(\"a\", {\n    parentName: \"p\",\n    \"href\": \"/rustdocs/latest/sp_state_machine/enum.ExecutionStrategy.html\"\n  }, mdx(\"inlineCode\", {\n    parentName: \"a\"\n  }, \"ExecutionStrategy\"), \" enum\"), \":\"), mdx(\"ul\", null, mdx(\"li\", {\n    parentName: \"ul\"\n  }, mdx(\"inlineCode\", {\n    parentName: \"li\"\n  }, \"NativeWhenPossible\"), \": Execute with native build (if available, WebAssembly otherwise).\"), mdx(\"li\", {\n    parentName: \"ul\"\n  }, mdx(\"inlineCode\", {\n    parentName: \"li\"\n  }, \"AlwaysWasm\"), \": Only execute with the WebAssembly build.\"), mdx(\"li\", {\n    parentName: \"ul\"\n  }, mdx(\"inlineCode\", {\n    parentName: \"li\"\n  }, \"Both\"), \": Execute with both native (where available) and WebAssembly builds.\"), mdx(\"li\", {\n    parentName: \"ul\"\n  }, mdx(\"inlineCode\", {\n    parentName: \"li\"\n  }, \"NativeElseWasm\"), \": Execute with the native build if possible; if it fails, then execute with WebAssembly.\")), mdx(\"p\", null, \"All strategies respect the runtime version, meaning if the native and wasm runtime versions differ\\n(which the wasm runtime is more updated then the native one), the wasm runtime is chosen to run.\"), mdx(\"p\", null, \"The default execution strategies for the different parts of the blockchain execution process are:\"), mdx(\"ul\", null, mdx(\"li\", {\n    parentName: \"ul\"\n  }, \"Syncing: \", mdx(\"inlineCode\", {\n    parentName: \"li\"\n  }, \"NativeElseWasm\")), mdx(\"li\", {\n    parentName: \"ul\"\n  }, \"Block Import (for non-validator): \", mdx(\"inlineCode\", {\n    parentName: \"li\"\n  }, \"NativeElseWasm\")), mdx(\"li\", {\n    parentName: \"ul\"\n  }, \"Block Import (for validator): \", mdx(\"inlineCode\", {\n    parentName: \"li\"\n  }, \"AlwaysWasm\")), mdx(\"li\", {\n    parentName: \"ul\"\n  }, \"Block Construction: \", mdx(\"inlineCode\", {\n    parentName: \"li\"\n  }, \"AlwaysWasm\")), mdx(\"li\", {\n    parentName: \"ul\"\n  }, \"Off-Chain Worker: \", mdx(\"inlineCode\", {\n    parentName: \"li\"\n  }, \"NativeWhenPossible\")), mdx(\"li\", {\n    parentName: \"ul\"\n  }, \"Other: \", mdx(\"inlineCode\", {\n    parentName: \"li\"\n  }, \"NativeWhenPossible\"))), mdx(\"p\", null, \"Source: \", mdx(\"a\", {\n    parentName: \"p\",\n    \"href\": \"#footnotes\"\n  }, \"[1]\"), \", \", mdx(\"a\", {\n    parentName: \"p\",\n    \"href\": \"#footnotes\"\n  }, \"[2]\")), mdx(\"p\", null, \"They can be overridden via the command line argument \", mdx(\"inlineCode\", {\n    parentName: \"p\"\n  }, \"--execution-{block-construction, import-block, offchain-worker, other, syncing} <strategy>\"), \", or \", mdx(\"inlineCode\", {\n    parentName: \"p\"\n  }, \"--execution <strategy>\"), \" to apply the specified strategy to all five aspects. Details can be seen at \", mdx(\"inlineCode\", {\n    parentName: \"p\"\n  }, \"substrate --help\"), \". When specifying on cli, the following shorthand strategy names are used:\"), mdx(\"ul\", null, mdx(\"li\", {\n    parentName: \"ul\"\n  }, mdx(\"inlineCode\", {\n    parentName: \"li\"\n  }, \"Native\"), \" mapping to the \", mdx(\"inlineCode\", {\n    parentName: \"li\"\n  }, \"NativeWhenPossible\"), \" strategy\"), mdx(\"li\", {\n    parentName: \"ul\"\n  }, mdx(\"inlineCode\", {\n    parentName: \"li\"\n  }, \"Wasm\"), \" mapping to the \", mdx(\"inlineCode\", {\n    parentName: \"li\"\n  }, \"AlwaysWasm\"), \" strategy\"), mdx(\"li\", {\n    parentName: \"ul\"\n  }, mdx(\"inlineCode\", {\n    parentName: \"li\"\n  }, \"Both\"), \" mapping to the \", mdx(\"inlineCode\", {\n    parentName: \"li\"\n  }, \"Both\"), \" strategy\"), mdx(\"li\", {\n    parentName: \"ul\"\n  }, mdx(\"inlineCode\", {\n    parentName: \"li\"\n  }, \"NativeElseWasm\"), \" mapping to \", mdx(\"inlineCode\", {\n    parentName: \"li\"\n  }, \"NativeElsmWasm\"), \" strategy\")), mdx(\"h3\", {\n    \"id\": \"wasm-execution\",\n    \"style\": {\n      \"position\": \"relative\"\n    }\n  }, mdx(\"a\", {\n    parentName: \"h3\",\n    \"href\": \"#wasm-execution\",\n    \"aria-label\": \"wasm execution permalink\",\n    \"className\": \"anchor before\"\n  }, mdx(\"svg\", {\n    parentName: \"a\",\n    \"className\": \"fill-current text-substrateDark dark:text-white\",\n    \"aria-hidden\": \"true\",\n    \"focusable\": \"false\",\n    \"height\": \"16\",\n    \"version\": \"1.1\",\n    \"viewBox\": \"0 0 16 16\",\n    \"width\": \"16\"\n  }, mdx(\"path\", {\n    parentName: \"svg\",\n    \"fillRule\": \"evenodd\",\n    \"d\": \"M4 9h1v1H4c-1.5 0-3-1.69-3-3.5S2.55 3 4 3h4c1.45 0 3 1.69 3 3.5 0 1.41-.91 2.72-2 3.25V8.59c.58-.45 1-1.27 1-2.09C10 5.22 8.98 4 8 4H4c-.98 0-2 1.22-2 2.5S3 9 4 9zm9-3h-1v1h1c1 0 2 1.22 2 2.5S13.98 12 13 12H9c-.98 0-2-1.22-2-2.5 0-.83.42-1.64 1-2.09V6.25c-1.09.53-2 1.84-2 3.25C6 11.31 7.55 13 9 13h4c1.45 0 3-1.69 3-3.5S14.5 6 13 6z\"\n  }))), \"Wasm execution\"), mdx(\"p\", null, \"The Wasm representation of the Substrate runtime is considered the canonical runtime. Because this\\nWasm runtime is placed in the blockchain storage, the network must come to consensus about this\\nbinary. Thus it can be verified to be consistent across all syncing nodes.\"), mdx(\"p\", null, \"The Wasm execution environment can be more restrictive than the native execution environment. For\\nexample, the Wasm runtime always executes in a 32-bit environment with a configurable memory limit\\n(up to 4 GB).\"), mdx(\"p\", null, \"For these reasons, the blockchain prefers to do block construction with the Wasm runtime. Some logic\\nexecuted in Wasm will always work in the native execution environment, but the same cannot be said\\nthe other way around. Wasm execution can help to ensure that block producers create valid blocks.\"), mdx(\"h3\", {\n    \"id\": \"native-execution\",\n    \"style\": {\n      \"position\": \"relative\"\n    }\n  }, mdx(\"a\", {\n    parentName: \"h3\",\n    \"href\": \"#native-execution\",\n    \"aria-label\": \"native execution permalink\",\n    \"className\": \"anchor before\"\n  }, mdx(\"svg\", {\n    parentName: \"a\",\n    \"className\": \"fill-current text-substrateDark dark:text-white\",\n    \"aria-hidden\": \"true\",\n    \"focusable\": \"false\",\n    \"height\": \"16\",\n    \"version\": \"1.1\",\n    \"viewBox\": \"0 0 16 16\",\n    \"width\": \"16\"\n  }, mdx(\"path\", {\n    parentName: \"svg\",\n    \"fillRule\": \"evenodd\",\n    \"d\": \"M4 9h1v1H4c-1.5 0-3-1.69-3-3.5S2.55 3 4 3h4c1.45 0 3 1.69 3 3.5 0 1.41-.91 2.72-2 3.25V8.59c.58-.45 1-1.27 1-2.09C10 5.22 8.98 4 8 4H4c-.98 0-2 1.22-2 2.5S3 9 4 9zm9-3h-1v1h1c1 0 2 1.22 2 2.5S13.98 12 13 12H9c-.98 0-2-1.22-2-2.5 0-.83.42-1.64 1-2.09V6.25c-1.09.53-2 1.84-2 3.25C6 11.31 7.55 13 9 13h4c1.45 0 3-1.69 3-3.5S14.5 6 13 6z\"\n  }))), \"Native execution\"), mdx(\"p\", null, \"The native runtime will only be used by the executor when it is chosen as the execution strategy and\\nit is compatible with the requested runtime version (see\\n\", mdx(\"a\", {\n    parentName: \"p\",\n    \"href\": \"/v3/runtime/upgrades#runtime-versioning\"\n  }, \"Runtime Versioning\"), \").\\nFor all other execution processes other than block construction, the native runtime is preferred\\nsince it is more performant. In any situation where the native executable should not be run, the\\ncanonical Wasm runtime is executed instead.\"), mdx(\"h2\", {\n    \"id\": \"next-steps\",\n    \"style\": {\n      \"position\": \"relative\"\n    }\n  }, mdx(\"a\", {\n    parentName: \"h2\",\n    \"href\": \"#next-steps\",\n    \"aria-label\": \"next steps permalink\",\n    \"className\": \"anchor before\"\n  }, mdx(\"svg\", {\n    parentName: \"a\",\n    \"className\": \"fill-current text-substrateDark dark:text-white\",\n    \"aria-hidden\": \"true\",\n    \"focusable\": \"false\",\n    \"height\": \"16\",\n    \"version\": \"1.1\",\n    \"viewBox\": \"0 0 16 16\",\n    \"width\": \"16\"\n  }, mdx(\"path\", {\n    parentName: \"svg\",\n    \"fillRule\": \"evenodd\",\n    \"d\": \"M4 9h1v1H4c-1.5 0-3-1.69-3-3.5S2.55 3 4 3h4c1.45 0 3 1.69 3 3.5 0 1.41-.91 2.72-2 3.25V8.59c.58-.45 1-1.27 1-2.09C10 5.22 8.98 4 8 4H4c-.98 0-2 1.22-2 2.5S3 9 4 9zm9-3h-1v1h1c1 0 2 1.22 2 2.5S13.98 12 13 12H9c-.98 0-2-1.22-2-2.5 0-.83.42-1.64 1-2.09V6.25c-1.09.53-2 1.84-2 3.25C6 11.31 7.55 13 9 13h4c1.45 0 3-1.69 3-3.5S14.5 6 13 6z\"\n  }))), \"Next steps\"), mdx(\"h3\", {\n    \"id\": \"learn-more\",\n    \"style\": {\n      \"position\": \"relative\"\n    }\n  }, mdx(\"a\", {\n    parentName: \"h3\",\n    \"href\": \"#learn-more\",\n    \"aria-label\": \"learn more permalink\",\n    \"className\": \"anchor before\"\n  }, mdx(\"svg\", {\n    parentName: \"a\",\n    \"className\": \"fill-current text-substrateDark dark:text-white\",\n    \"aria-hidden\": \"true\",\n    \"focusable\": \"false\",\n    \"height\": \"16\",\n    \"version\": \"1.1\",\n    \"viewBox\": \"0 0 16 16\",\n    \"width\": \"16\"\n  }, mdx(\"path\", {\n    parentName: \"svg\",\n    \"fillRule\": \"evenodd\",\n    \"d\": \"M4 9h1v1H4c-1.5 0-3-1.69-3-3.5S2.55 3 4 3h4c1.45 0 3 1.69 3 3.5 0 1.41-.91 2.72-2 3.25V8.59c.58-.45 1-1.27 1-2.09C10 5.22 8.98 4 8 4H4c-.98 0-2 1.22-2 2.5S3 9 4 9zm9-3h-1v1h1c1 0 2 1.22 2 2.5S13.98 12 13 12H9c-.98 0-2-1.22-2-2.5 0-.83.42-1.64 1-2.09V6.25c-1.09.53-2 1.84-2 3.25C6 11.31 7.55 13 9 13h4c1.45 0 3-1.69 3-3.5S14.5 6 13 6z\"\n  }))), \"Learn more\"), mdx(\"ul\", null, mdx(\"li\", {\n    parentName: \"ul\"\n  }, \"Read more about runtime upgrades in the \", mdx(\"a\", {\n    parentName: \"li\",\n    \"href\": \"/v3/runtime/upgrades\"\n  }, \"Runtime documentation\"), \".\")), mdx(\"h3\", {\n    \"id\": \"references\",\n    \"style\": {\n      \"position\": \"relative\"\n    }\n  }, mdx(\"a\", {\n    parentName: \"h3\",\n    \"href\": \"#references\",\n    \"aria-label\": \"references permalink\",\n    \"className\": \"anchor before\"\n  }, mdx(\"svg\", {\n    parentName: \"a\",\n    \"className\": \"fill-current text-substrateDark dark:text-white\",\n    \"aria-hidden\": \"true\",\n    \"focusable\": \"false\",\n    \"height\": \"16\",\n    \"version\": \"1.1\",\n    \"viewBox\": \"0 0 16 16\",\n    \"width\": \"16\"\n  }, mdx(\"path\", {\n    parentName: \"svg\",\n    \"fillRule\": \"evenodd\",\n    \"d\": \"M4 9h1v1H4c-1.5 0-3-1.69-3-3.5S2.55 3 4 3h4c1.45 0 3 1.69 3 3.5 0 1.41-.91 2.72-2 3.25V8.59c.58-.45 1-1.27 1-2.09C10 5.22 8.98 4 8 4H4c-.98 0-2 1.22-2 2.5S3 9 4 9zm9-3h-1v1h1c1 0 2 1.22 2 2.5S13.98 12 13 12H9c-.98 0-2-1.22-2-2.5 0-.83.42-1.64 1-2.09V6.25c-1.09.53-2 1.84-2 3.25C6 11.31 7.55 13 9 13h4c1.45 0 3-1.69 3-3.5S14.5 6 13 6z\"\n  }))), \"References\"), mdx(\"ul\", null, mdx(\"li\", {\n    parentName: \"ul\"\n  }, mdx(\"p\", {\n    parentName: \"li\"\n  }, \"Check out the different\\n\", mdx(\"a\", {\n    parentName: \"p\",\n    \"href\": \"/rustdocs/latest/sc_client_api/execution_extensions/struct.ExecutionStrategies.html\"\n  }, \"Execution Strategies\"), \".\")), mdx(\"li\", {\n    parentName: \"ul\"\n  }, mdx(\"p\", {\n    parentName: \"li\"\n  }, \"Take a look at the different\\n\", mdx(\"a\", {\n    parentName: \"p\",\n    \"href\": \"/rustdocs/latest/sp_state_machine/enum.ExecutionStrategy.html\"\n  }, \"Execution Strategy Options\"))), mdx(\"li\", {\n    parentName: \"ul\"\n  }, mdx(\"p\", {\n    parentName: \"li\"\n  }, \"Review the\\n\", mdx(\"a\", {\n    parentName: \"p\",\n    \"href\": \"/rustdocs/latest/sp_version/struct.RuntimeVersion.html\"\n  }, \"Runtime Version definition\"), \".\"))), mdx(\"h2\", {\n    \"id\": \"footnotes\",\n    \"style\": {\n      \"position\": \"relative\"\n    }\n  }, mdx(\"a\", {\n    parentName: \"h2\",\n    \"href\": \"#footnotes\",\n    \"aria-label\": \"footnotes permalink\",\n    \"className\": \"anchor before\"\n  }, mdx(\"svg\", {\n    parentName: \"a\",\n    \"className\": \"fill-current text-substrateDark dark:text-white\",\n    \"aria-hidden\": \"true\",\n    \"focusable\": \"false\",\n    \"height\": \"16\",\n    \"version\": \"1.1\",\n    \"viewBox\": \"0 0 16 16\",\n    \"width\": \"16\"\n  }, mdx(\"path\", {\n    parentName: \"svg\",\n    \"fillRule\": \"evenodd\",\n    \"d\": \"M4 9h1v1H4c-1.5 0-3-1.69-3-3.5S2.55 3 4 3h4c1.45 0 3 1.69 3 3.5 0 1.41-.91 2.72-2 3.25V8.59c.58-.45 1-1.27 1-2.09C10 5.22 8.98 4 8 4H4c-.98 0-2 1.22-2 2.5S3 9 4 9zm9-3h-1v1h1c1 0 2 1.22 2 2.5S13.98 12 13 12H9c-.98 0-2-1.22-2-2.5 0-.83.42-1.64 1-2.09V6.25c-1.09.53-2 1.84-2 3.25C6 11.31 7.55 13 9 13h4c1.45 0 3-1.69 3-3.5S14.5 6 13 6z\"\n  }))), \"Footnotes\"), mdx(\"ol\", null, mdx(\"li\", {\n    parentName: \"ol\"\n  }, \"Substrate codebase \", mdx(\"a\", {\n    parentName: \"li\",\n    \"href\": \"https://github.com/paritytech/substrate/blob/9b08105b8c/client/cli/src/params/import_params.rs#L115-L124\"\n  }, mdx(\"inlineCode\", {\n    parentName: \"a\"\n  }, \"client/cli/src/params/import_params.rs\"))), mdx(\"li\", {\n    parentName: \"ol\"\n  }, \"Substrate codebase \", mdx(\"a\", {\n    parentName: \"li\",\n    \"href\": \"https://github.com/paritytech/substrate/blob/9b08105b8c/client/cli/src/arg_enums.rs#L193-L203\"\n  }, mdx(\"inlineCode\", {\n    parentName: \"a\"\n  }, \"client/cli/src/arg_enums.rs\")))));\n}\n;\nMDXContent.isMDXComponent = true;","tableOfContents":{"items":[{"url":"#runtime-execution","title":"Runtime execution","items":[{"url":"#execution-strategy","title":"Execution strategy"},{"url":"#wasm-execution","title":"Wasm execution"},{"url":"#native-execution","title":"Native execution"}]},{"url":"#next-steps","title":"Next steps","items":[{"url":"#learn-more","title":"Learn more"},{"url":"#references","title":"References"}]},{"url":"#footnotes","title":"Footnotes"}]},"fileAbsolutePath":"/Users/a212/Desktop/substrate-docs/v3/docs/07-advanced/e-executor/index.mdx"}},"pageContext":{"slug":"/v3/advanced/executor","version":"3.0","locale":"en","hrefLang":"en-US","originalPath":"/v3/advanced/executor/","dateFormat":"MM/DD/YYYY"}},
    "staticQueryHashes": ["1239077767","1821483254","2966362950","3280999885"]}