{
    "componentChunkName": "component---src-templates-htg-template-tsx",
    "path": "/how-to-guides/v3/pallet-design/loose-coupling/",
    "result": {"data":{"mdx":{"frontmatter":{"slug":"/how-to-guides/v3/pallet-design/loose-coupling","title":"Loosely Coupling a Pallet","hideNav":null,"difficulty":2,"section":"how to guides","category":"pallet design"},"body":"var _excluded = [\"components\"];\n\nfunction _extends() { _extends = Object.assign || function (target) { for (var i = 1; i < arguments.length; i++) { var source = arguments[i]; for (var key in source) { if (Object.prototype.hasOwnProperty.call(source, key)) { target[key] = source[key]; } } } return target; }; return _extends.apply(this, arguments); }\n\nfunction _objectWithoutProperties(source, excluded) { if (source == null) return {}; var target = _objectWithoutPropertiesLoose(source, excluded); var key, i; if (Object.getOwnPropertySymbols) { var sourceSymbolKeys = Object.getOwnPropertySymbols(source); for (i = 0; i < sourceSymbolKeys.length; i++) { key = sourceSymbolKeys[i]; if (excluded.indexOf(key) >= 0) continue; if (!Object.prototype.propertyIsEnumerable.call(source, key)) continue; target[key] = source[key]; } } return target; }\n\nfunction _objectWithoutPropertiesLoose(source, excluded) { if (source == null) return {}; var target = {}; var sourceKeys = Object.keys(source); var key, i; for (i = 0; i < sourceKeys.length; i++) { key = sourceKeys[i]; if (excluded.indexOf(key) >= 0) continue; target[key] = source[key]; } return target; }\n\n/* @jsxRuntime classic */\n\n/* @jsx mdx */\nvar _frontmatter = {\n  \"title\": \"Loosely Coupling a Pallet\",\n  \"slug\": \"/how-to-guides/v3/pallet-design/loose-coupling\",\n  \"version\": 3,\n  \"section\": \"how to guides\",\n  \"category\": \"pallet design\",\n  \"difficulty\": 2\n};\n\nvar makeShortcode = function makeShortcode(name) {\n  return function MDXDefaultShortcode(props) {\n    console.warn(\"Component \" + name + \" was not imported, exported, or provided by MDXProvider as global scope\");\n    return mdx(\"div\", props);\n  };\n};\n\nvar Objectives = makeShortcode(\"Objectives\");\nvar layoutProps = {\n  _frontmatter: _frontmatter\n};\nvar MDXLayout = \"wrapper\";\nreturn function MDXContent(_ref) {\n  var components = _ref.components,\n      props = _objectWithoutProperties(_ref, _excluded);\n\n  return mdx(MDXLayout, _extends({}, layoutProps, props, {\n    components: components,\n    mdxType: \"MDXLayout\"\n  }), mdx(Objectives, {\n    data: [{\n      title: 'Goal',\n      description: 'Learn how to use a function from another pallet.'\n    }, {\n      title: 'Use Cases',\n      description: \"Reuse a specific type from another pallet.\"\n    }, {\n      title: 'Overview',\n      description: \"Loose coupling is a technique that enables re-using logic from another pallet inside a pallet. In this guide\\n        we show the simple pattern of using a type from an outside pallet in our working pallet, by using\\n        trait bounds in our pallet's configuration trait. We will loosely couple a pallet to make use of the `Currency` trait\\n        from [`frame_support`](/rustdocs/latest/frame_support/traits/tokens/currency/trait.Currency.html).\"\n    }],\n    mdxType: \"Objectives\"\n  }), mdx(\"h2\", {\n    \"id\": \"steps\",\n    \"style\": {\n      \"position\": \"relative\"\n    }\n  }, mdx(\"a\", {\n    parentName: \"h2\",\n    \"href\": \"#steps\",\n    \"aria-label\": \"steps permalink\",\n    \"className\": \"anchor before\"\n  }, mdx(\"svg\", {\n    parentName: \"a\",\n    \"className\": \"fill-current text-substrateDark dark:text-white\",\n    \"aria-hidden\": \"true\",\n    \"focusable\": \"false\",\n    \"height\": \"16\",\n    \"version\": \"1.1\",\n    \"viewBox\": \"0 0 16 16\",\n    \"width\": \"16\"\n  }, mdx(\"path\", {\n    parentName: \"svg\",\n    \"fillRule\": \"evenodd\",\n    \"d\": \"M4 9h1v1H4c-1.5 0-3-1.69-3-3.5S2.55 3 4 3h4c1.45 0 3 1.69 3 3.5 0 1.41-.91 2.72-2 3.25V8.59c.58-.45 1-1.27 1-2.09C10 5.22 8.98 4 8 4H4c-.98 0-2 1.22-2 2.5S3 9 4 9zm9-3h-1v1h1c1 0 2 1.22 2 2.5S13.98 12 13 12H9c-.98 0-2-1.22-2-2.5 0-.83.42-1.64 1-2.09V6.25c-1.09.53-2 1.84-2 3.25C6 11.31 7.55 13 9 13h4c1.45 0 3-1.69 3-3.5S14.5 6 13 6z\"\n  }))), \"Steps\"), mdx(\"h3\", {\n    \"id\": \"1-configure-your-workspace\",\n    \"style\": {\n      \"position\": \"relative\"\n    }\n  }, mdx(\"a\", {\n    parentName: \"h3\",\n    \"href\": \"#1-configure-your-workspace\",\n    \"aria-label\": \"1 configure your workspace permalink\",\n    \"className\": \"anchor before\"\n  }, mdx(\"svg\", {\n    parentName: \"a\",\n    \"className\": \"fill-current text-substrateDark dark:text-white\",\n    \"aria-hidden\": \"true\",\n    \"focusable\": \"false\",\n    \"height\": \"16\",\n    \"version\": \"1.1\",\n    \"viewBox\": \"0 0 16 16\",\n    \"width\": \"16\"\n  }, mdx(\"path\", {\n    parentName: \"svg\",\n    \"fillRule\": \"evenodd\",\n    \"d\": \"M4 9h1v1H4c-1.5 0-3-1.69-3-3.5S2.55 3 4 3h4c1.45 0 3 1.69 3 3.5 0 1.41-.91 2.72-2 3.25V8.59c.58-.45 1-1.27 1-2.09C10 5.22 8.98 4 8 4H4c-.98 0-2 1.22-2 2.5S3 9 4 9zm9-3h-1v1h1c1 0 2 1.22 2 2.5S13.98 12 13 12H9c-.98 0-2-1.22-2-2.5 0-.83.42-1.64 1-2.09V6.25c-1.09.53-2 1.84-2 3.25C6 11.31 7.55 13 9 13h4c1.45 0 3-1.69 3-3.5S14.5 6 13 6z\"\n  }))), \"1. Configure your workspace\"), mdx(\"p\", null, \"In the \", mdx(\"inlineCode\", {\n    parentName: \"p\"\n  }, \"Cargo.toml\"), \" file of the pallet in your working directory, make sure you specify the\\npallet you want to couple to accordingly:\"), mdx(\"pre\", null, mdx(\"code\", {\n    parentName: \"pre\",\n    \"className\": \"language-toml\"\n  }, \"[dependencies]\\nframe-support = { default-features = false, git = 'https://github.com/paritytech/substrate.git', tag = 'monthly-2021-08', version = '4.0.0-dev' }\\n\\n# -- snip \\n\\n[features]\\ndefault = ['std']\\nstd = [\\n    'frame-support/std',\\n# -- snip \\n]\\n\")), mdx(\"h3\", {\n    \"id\": \"2-import-the-trait\",\n    \"style\": {\n      \"position\": \"relative\"\n    }\n  }, mdx(\"a\", {\n    parentName: \"h3\",\n    \"href\": \"#2-import-the-trait\",\n    \"aria-label\": \"2 import the trait permalink\",\n    \"className\": \"anchor before\"\n  }, mdx(\"svg\", {\n    parentName: \"a\",\n    \"className\": \"fill-current text-substrateDark dark:text-white\",\n    \"aria-hidden\": \"true\",\n    \"focusable\": \"false\",\n    \"height\": \"16\",\n    \"version\": \"1.1\",\n    \"viewBox\": \"0 0 16 16\",\n    \"width\": \"16\"\n  }, mdx(\"path\", {\n    parentName: \"svg\",\n    \"fillRule\": \"evenodd\",\n    \"d\": \"M4 9h1v1H4c-1.5 0-3-1.69-3-3.5S2.55 3 4 3h4c1.45 0 3 1.69 3 3.5 0 1.41-.91 2.72-2 3.25V8.59c.58-.45 1-1.27 1-2.09C10 5.22 8.98 4 8 4H4c-.98 0-2 1.22-2 2.5S3 9 4 9zm9-3h-1v1h1c1 0 2 1.22 2 2.5S13.98 12 13 12H9c-.98 0-2-1.22-2-2.5 0-.83.42-1.64 1-2.09V6.25c-1.09.53-2 1.84-2 3.25C6 11.31 7.55 13 9 13h4c1.45 0 3-1.69 3-3.5S14.5 6 13 6z\"\n  }))), \"2. Import the trait\"), mdx(\"p\", null, \"We want to use the \", mdx(\"a\", {\n    parentName: \"p\",\n    \"href\": \"/rustdocs/latest/frame_support/traits/tokens/currency/trait.Currency.html\"\n  }, mdx(\"inlineCode\", {\n    parentName: \"a\"\n  }, \"Currency\"), \" trait\"), \" so\\nthat we can give our pallet access to the its methods. \"), mdx(\"p\", null, \"Import the trait in your pallet:\"), mdx(\"pre\", null, mdx(\"code\", {\n    parentName: \"pre\",\n    \"className\": \"language-rust\"\n  }, \"use frame_support::traits::Currency;\\n\")), mdx(\"h3\", {\n    \"id\": \"3-create-a-type-for-your-pallets-config-trait\",\n    \"style\": {\n      \"position\": \"relative\"\n    }\n  }, mdx(\"a\", {\n    parentName: \"h3\",\n    \"href\": \"#3-create-a-type-for-your-pallets-config-trait\",\n    \"aria-label\": \"3 create a type for your pallets config trait permalink\",\n    \"className\": \"anchor before\"\n  }, mdx(\"svg\", {\n    parentName: \"a\",\n    \"className\": \"fill-current text-substrateDark dark:text-white\",\n    \"aria-hidden\": \"true\",\n    \"focusable\": \"false\",\n    \"height\": \"16\",\n    \"version\": \"1.1\",\n    \"viewBox\": \"0 0 16 16\",\n    \"width\": \"16\"\n  }, mdx(\"path\", {\n    parentName: \"svg\",\n    \"fillRule\": \"evenodd\",\n    \"d\": \"M4 9h1v1H4c-1.5 0-3-1.69-3-3.5S2.55 3 4 3h4c1.45 0 3 1.69 3 3.5 0 1.41-.91 2.72-2 3.25V8.59c.58-.45 1-1.27 1-2.09C10 5.22 8.98 4 8 4H4c-.98 0-2 1.22-2 2.5S3 9 4 9zm9-3h-1v1h1c1 0 2 1.22 2 2.5S13.98 12 13 12H9c-.98 0-2-1.22-2-2.5 0-.83.42-1.64 1-2.09V6.25c-1.09.53-2 1.84-2 3.25C6 11.31 7.55 13 9 13h4c1.45 0 3-1.69 3-3.5S14.5 6 13 6z\"\n  }))), \"3. Create a type for your pallet's \", mdx(\"inlineCode\", {\n    parentName: \"h3\"\n  }, \"Config\"), \" trait\"), mdx(\"p\", null, \"In your configuration trait, create a type that is bound by the type you want to expose to your pallet\", mdx(\"br\", {\n    parentName: \"p\"\n  }), \"\\n\", \"(in \", mdx(\"inlineCode\", {\n    parentName: \"p\"\n  }, \"this-pallet/src/lib.rs\"), \"):\"), mdx(\"pre\", null, mdx(\"code\", {\n    parentName: \"pre\",\n    \"className\": \"language-rust\"\n  }, \"pub trait Config: frame_system::Config {\\n    // --snip--\\n\\n    /// A type that is accessing our loosely coupled pallet `my-pallet`\\n    type LocalCurrency: Currency<Self::AccountId>;\\n}\\n\")), mdx(\"h3\", {\n    \"id\": \"4-use-the-type\",\n    \"style\": {\n      \"position\": \"relative\"\n    }\n  }, mdx(\"a\", {\n    parentName: \"h3\",\n    \"href\": \"#4-use-the-type\",\n    \"aria-label\": \"4 use the type permalink\",\n    \"className\": \"anchor before\"\n  }, mdx(\"svg\", {\n    parentName: \"a\",\n    \"className\": \"fill-current text-substrateDark dark:text-white\",\n    \"aria-hidden\": \"true\",\n    \"focusable\": \"false\",\n    \"height\": \"16\",\n    \"version\": \"1.1\",\n    \"viewBox\": \"0 0 16 16\",\n    \"width\": \"16\"\n  }, mdx(\"path\", {\n    parentName: \"svg\",\n    \"fillRule\": \"evenodd\",\n    \"d\": \"M4 9h1v1H4c-1.5 0-3-1.69-3-3.5S2.55 3 4 3h4c1.45 0 3 1.69 3 3.5 0 1.41-.91 2.72-2 3.25V8.59c.58-.45 1-1.27 1-2.09C10 5.22 8.98 4 8 4H4c-.98 0-2 1.22-2 2.5S3 9 4 9zm9-3h-1v1h1c1 0 2 1.22 2 2.5S13.98 12 13 12H9c-.98 0-2-1.22-2-2.5 0-.83.42-1.64 1-2.09V6.25c-1.09.53-2 1.84-2 3.25C6 11.31 7.55 13 9 13h4c1.45 0 3-1.69 3-3.5S14.5 6 13 6z\"\n  }))), \"4. Use the type\"), mdx(\"p\", null, \"Use the method that the type of your loosely coupled pallet provides (in \", mdx(\"inlineCode\", {\n    parentName: \"p\"\n  }, \"this-pallet/src/lib.rs\"), \"):\"), mdx(\"pre\", null, mdx(\"code\", {\n    parentName: \"pre\",\n    \"className\": \"language-rust\"\n  }, \"// Use the getter from `my-pallet`\\nlet total_balance = T::LocalCurrency::total_issuance();\\n\")), mdx(\"p\", null, \"In the above snippet, we're using \", mdx(\"a\", {\n    parentName: \"p\",\n    \"href\": \"/rustdocs/latest/frame_support/traits/tokens/currency/trait.Currency.html#tymethod.total_issuance\"\n  }, mdx(\"inlineCode\", {\n    parentName: \"a\"\n  }, \"total_issuance\")), \"\\nthat the Currency trait exposes from \", mdx(\"inlineCode\", {\n    parentName: \"p\"\n  }, \"frame_support\"), \".\"), mdx(\"h3\", {\n    \"id\": \"5-provide-the-implementation-in-runtime-configuration\",\n    \"style\": {\n      \"position\": \"relative\"\n    }\n  }, mdx(\"a\", {\n    parentName: \"h3\",\n    \"href\": \"#5-provide-the-implementation-in-runtime-configuration\",\n    \"aria-label\": \"5 provide the implementation in runtime configuration permalink\",\n    \"className\": \"anchor before\"\n  }, mdx(\"svg\", {\n    parentName: \"a\",\n    \"className\": \"fill-current text-substrateDark dark:text-white\",\n    \"aria-hidden\": \"true\",\n    \"focusable\": \"false\",\n    \"height\": \"16\",\n    \"version\": \"1.1\",\n    \"viewBox\": \"0 0 16 16\",\n    \"width\": \"16\"\n  }, mdx(\"path\", {\n    parentName: \"svg\",\n    \"fillRule\": \"evenodd\",\n    \"d\": \"M4 9h1v1H4c-1.5 0-3-1.69-3-3.5S2.55 3 4 3h4c1.45 0 3 1.69 3 3.5 0 1.41-.91 2.72-2 3.25V8.59c.58-.45 1-1.27 1-2.09C10 5.22 8.98 4 8 4H4c-.98 0-2 1.22-2 2.5S3 9 4 9zm9-3h-1v1h1c1 0 2 1.22 2 2.5S13.98 12 13 12H9c-.98 0-2-1.22-2-2.5 0-.83.42-1.64 1-2.09V6.25c-1.09.53-2 1.84-2 3.25C6 11.31 7.55 13 9 13h4c1.45 0 3-1.69 3-3.5S14.5 6 13 6z\"\n  }))), \"5. Provide the implementation in runtime configuration\"), mdx(\"p\", null, \"In our runtime configuration, usually \", mdx(\"inlineCode\", {\n    parentName: \"p\"\n  }, \"runtime/src/lib.rs\"), \", we specify the \", mdx(\"inlineCode\", {\n    parentName: \"p\"\n  }, \"LocalCurrency\"), \" to be\\n\", mdx(\"inlineCode\", {\n    parentName: \"p\"\n  }, \"Balances\"), \", which is defined inside \", mdx(\"inlineCode\", {\n    parentName: \"p\"\n  }, \"construct_runtime!\"), \" macro and has a type of \", mdx(\"inlineCode\", {\n    parentName: \"p\"\n  }, \"pallet_balances\"), \"\\nthat \", mdx(\"a\", {\n    parentName: \"p\",\n    \"href\": \"/rustdocs/latest/pallet_balances/index.html#implementations-1\"\n  }, \"implements the \", mdx(\"inlineCode\", {\n    parentName: \"a\"\n  }, \"Currency\"), \" trait\"), \".\"), mdx(\"pre\", null, mdx(\"code\", {\n    parentName: \"pre\",\n    \"className\": \"language-rust\"\n  }, \"impl my_pallet::Config for Runtime {\\n    type LocalCurrency = Balances;\\n}\\n\\nconstruct_runtime! (\\n  pub enum Runtime where\\n    Block = Block,\\n    NodeBlock = opaque::Block,\\n    UncheckedExtrinsic = UncheckedExtrinsic\\n  {\\n    Balances: pallet_balances::{Pallet, Call, Storage, Config<T>, Event<T>},\\n  }\\n)\\n\")), mdx(\"h2\", {\n    \"id\": \"examples\",\n    \"style\": {\n      \"position\": \"relative\"\n    }\n  }, mdx(\"a\", {\n    parentName: \"h2\",\n    \"href\": \"#examples\",\n    \"aria-label\": \"examples permalink\",\n    \"className\": \"anchor before\"\n  }, mdx(\"svg\", {\n    parentName: \"a\",\n    \"className\": \"fill-current text-substrateDark dark:text-white\",\n    \"aria-hidden\": \"true\",\n    \"focusable\": \"false\",\n    \"height\": \"16\",\n    \"version\": \"1.1\",\n    \"viewBox\": \"0 0 16 16\",\n    \"width\": \"16\"\n  }, mdx(\"path\", {\n    parentName: \"svg\",\n    \"fillRule\": \"evenodd\",\n    \"d\": \"M4 9h1v1H4c-1.5 0-3-1.69-3-3.5S2.55 3 4 3h4c1.45 0 3 1.69 3 3.5 0 1.41-.91 2.72-2 3.25V8.59c.58-.45 1-1.27 1-2.09C10 5.22 8.98 4 8 4H4c-.98 0-2 1.22-2 2.5S3 9 4 9zm9-3h-1v1h1c1 0 2 1.22 2 2.5S13.98 12 13 12H9c-.98 0-2-1.22-2-2.5 0-.83.42-1.64 1-2.09V6.25c-1.09.53-2 1.84-2 3.25C6 11.31 7.55 13 9 13h4c1.45 0 3-1.69 3-3.5S14.5 6 13 6z\"\n  }))), \"Examples\"), mdx(\"ul\", null, mdx(\"li\", {\n    parentName: \"ul\"\n  }, mdx(\"inlineCode\", {\n    parentName: \"li\"\n  }, \"try_origin\"), \" from the \", mdx(\"a\", {\n    parentName: \"li\",\n    \"href\": \"/rustdocs/latest/frame_support/traits/trait.EnsureOrigin.html\"\n  }, mdx(\"inlineCode\", {\n    parentName: \"a\"\n  }, \"EnsureOrigin\")), \" trait\\nin FRAME's \", mdx(\"a\", {\n    parentName: \"li\",\n    \"href\": \"https://github.com/paritytech/substrate/blob/master/frame/democracy/src/lib.rs#L294-L352\"\n  }, \"Democracy pallet\")), mdx(\"li\", {\n    parentName: \"ul\"\n  }, \"the use of \", mdx(\"inlineCode\", {\n    parentName: \"li\"\n  }, \"WeightInfo\"), \" in all FRAME pallets, such as the\\nthe \", mdx(\"a\", {\n    parentName: \"li\",\n    \"href\": \"https://github.com/paritytech/substrate/blob/master/frame/identity/src/lib.rs#L149-L151\"\n  }, \"Identity pallet\"), \" and its use of its\\n\", mdx(\"a\", {\n    parentName: \"li\",\n    \"href\": \"https://github.com/paritytech/substrate/blob/master/frame/identity/src/weights.rs#L46-L64\"\n  }, \"specific weighting methods\"), \" \"), mdx(\"li\", {\n    parentName: \"ul\"\n  }, \"the \", mdx(\"a\", {\n    parentName: \"li\",\n    \"href\": \"/rustdocs/latest/frame_support/traits/trait.KeyOwnerProofSystem.html\"\n  }, mdx(\"inlineCode\", {\n    parentName: \"a\"\n  }, \"KeyOwnerProofSystem\"), \" trait\"), mdx(\"a\", {\n    parentName: \"li\",\n    \"href\": \"https://github.com/paritytech/substrate/blob/master/frame/grandpa/src/lib.rs#L106\"\n  }, \"used in \", mdx(\"inlineCode\", {\n    parentName: \"a\"\n  }, \"pallet_granpa\")))), mdx(\"h2\", {\n    \"id\": \"resources\",\n    \"style\": {\n      \"position\": \"relative\"\n    }\n  }, mdx(\"a\", {\n    parentName: \"h2\",\n    \"href\": \"#resources\",\n    \"aria-label\": \"resources permalink\",\n    \"className\": \"anchor before\"\n  }, mdx(\"svg\", {\n    parentName: \"a\",\n    \"className\": \"fill-current text-substrateDark dark:text-white\",\n    \"aria-hidden\": \"true\",\n    \"focusable\": \"false\",\n    \"height\": \"16\",\n    \"version\": \"1.1\",\n    \"viewBox\": \"0 0 16 16\",\n    \"width\": \"16\"\n  }, mdx(\"path\", {\n    parentName: \"svg\",\n    \"fillRule\": \"evenodd\",\n    \"d\": \"M4 9h1v1H4c-1.5 0-3-1.69-3-3.5S2.55 3 4 3h4c1.45 0 3 1.69 3 3.5 0 1.41-.91 2.72-2 3.25V8.59c.58-.45 1-1.27 1-2.09C10 5.22 8.98 4 8 4H4c-.98 0-2 1.22-2 2.5S3 9 4 9zm9-3h-1v1h1c1 0 2 1.22 2 2.5S13.98 12 13 12H9c-.98 0-2-1.22-2-2.5 0-.83.42-1.64 1-2.09V6.25c-1.09.53-2 1.84-2 3.25C6 11.31 7.55 13 9 13h4c1.45 0 3-1.69 3-3.5S14.5 6 13 6z\"\n  }))), \"Resources\"), mdx(\"ul\", null, mdx(\"li\", {\n    parentName: \"ul\"\n  }, mdx(\"a\", {\n    parentName: \"li\",\n    \"href\": \"/v3/runtime/pallet-coupling\"\n  }, \"Pallet Coupling\")), mdx(\"li\", {\n    parentName: \"ul\"\n  }, \"A how-to guide on \", mdx(\"a\", {\n    parentName: \"li\",\n    \"href\": \"../tight-coupling\"\n  }, \"Tightly Coupling two pallets\"))));\n}\n;\nMDXContent.isMDXComponent = true;","tableOfContents":{"items":[{"url":"#steps","title":"Steps","items":[{"url":"#1-configure-your-workspace","title":"1. Configure your workspace"},{"url":"#2-import-the-trait","title":"2. Import the trait"},{"url":"#3-create-a-type-for-your-pallets-config-trait","title":"3. Create a type for your pallet's Config trait"},{"url":"#4-use-the-type","title":"4. Use the type"},{"url":"#5-provide-the-implementation-in-runtime-configuration","title":"5. Provide the implementation in runtime configuration"}]},{"url":"#examples","title":"Examples"},{"url":"#resources","title":"Resources"}]},"fileAbsolutePath":"/Users/a212/Desktop/substrate-docs/v3/how-to-guides/02-pallet-design/g-loose-coupling/index.mdx"}},"pageContext":{"slug":"/how-to-guides/v3/pallet-design/loose-coupling","version":"3.0","locale":"en","hrefLang":"en-US","originalPath":"/how-to-guides/v3/pallet-design/loose-coupling/","dateFormat":"MM/DD/YYYY"}},
    "staticQueryHashes": ["1239077767","1821483254","2966362950","3280999885"]}