{
    "componentChunkName": "component---src-templates-kb-template-tsx",
    "path": "/v3/integration/substrate-connect/",
    "result": {"data":{"mdx":{"frontmatter":{"slug":"/v3/integration/substrate-connect","title":"Substrate Connect","hideNav":null,"section":"docs","category":"tools"},"body":"var _excluded = [\"components\"];\n\nfunction _extends() { _extends = Object.assign || function (target) { for (var i = 1; i < arguments.length; i++) { var source = arguments[i]; for (var key in source) { if (Object.prototype.hasOwnProperty.call(source, key)) { target[key] = source[key]; } } } return target; }; return _extends.apply(this, arguments); }\n\nfunction _objectWithoutProperties(source, excluded) { if (source == null) return {}; var target = _objectWithoutPropertiesLoose(source, excluded); var key, i; if (Object.getOwnPropertySymbols) { var sourceSymbolKeys = Object.getOwnPropertySymbols(source); for (i = 0; i < sourceSymbolKeys.length; i++) { key = sourceSymbolKeys[i]; if (excluded.indexOf(key) >= 0) continue; if (!Object.prototype.propertyIsEnumerable.call(source, key)) continue; target[key] = source[key]; } } return target; }\n\nfunction _objectWithoutPropertiesLoose(source, excluded) { if (source == null) return {}; var target = {}; var sourceKeys = Object.keys(source); var key, i; for (i = 0; i < sourceKeys.length; i++) { key = sourceKeys[i]; if (excluded.indexOf(key) >= 0) continue; target[key] = source[key]; } return target; }\n\n/* @jsxRuntime classic */\n\n/* @jsx mdx */\nvar _frontmatter = {\n  \"title\": \"Substrate Connect\",\n  \"slug\": \"/v3/integration/substrate-connect\",\n  \"version\": 3,\n  \"section\": \"docs\",\n  \"category\": \"tools\",\n  \"keywords\": \"client, wasm, rpc, node\"\n};\nvar layoutProps = {\n  _frontmatter: _frontmatter\n};\nvar MDXLayout = \"wrapper\";\nreturn function MDXContent(_ref) {\n  var components = _ref.components,\n      props = _objectWithoutProperties(_ref, _excluded);\n\n  return mdx(MDXLayout, _extends({}, layoutProps, props, {\n    components: components,\n    mdxType: \"MDXLayout\"\n  }), mdx(\"p\", null, mdx(\"a\", {\n    parentName: \"p\",\n    \"href\": \"https://paritytech.github.io/substrate-connect/\"\n  }, \"Substrate Connect\"), \" is\\na JavaScript library and browser extension that builds on the \", mdx(\"a\", {\n    parentName: \"p\",\n    \"href\": \"/v3/integration/polkadot-js#polkadot-js-api\"\n  }, \"Polkadot JS\\nAPI\"), \" to enable developers to build application\\nspecific light clients for Substrate chains. By using light clients available to all\\nSubstrate built blockchains, application developers no longer need to rely on single RPC\\nnodes to allow end-users to interact with their applications. This introduces\\na new paradigm for decentralization: instead of specifying a centralized RPC node, developers\\njust need to specify the blockchain's \", mdx(\"a\", {\n    parentName: \"p\",\n    \"href\": \"/v3/runtime/chain-specs\"\n  }, \"chain specification\"), \" for\\ntheir application to synchronize with the chain.\"), mdx(\"h2\", {\n    \"id\": \"what-it-enables\",\n    \"style\": {\n      \"position\": \"relative\"\n    }\n  }, mdx(\"a\", {\n    parentName: \"h2\",\n    \"href\": \"#what-it-enables\",\n    \"aria-label\": \"what it enables permalink\",\n    \"className\": \"anchor before\"\n  }, mdx(\"svg\", {\n    parentName: \"a\",\n    \"className\": \"fill-current text-substrateDark dark:text-white\",\n    \"aria-hidden\": \"true\",\n    \"focusable\": \"false\",\n    \"height\": \"16\",\n    \"version\": \"1.1\",\n    \"viewBox\": \"0 0 16 16\",\n    \"width\": \"16\"\n  }, mdx(\"path\", {\n    parentName: \"svg\",\n    \"fillRule\": \"evenodd\",\n    \"d\": \"M4 9h1v1H4c-1.5 0-3-1.69-3-3.5S2.55 3 4 3h4c1.45 0 3 1.69 3 3.5 0 1.41-.91 2.72-2 3.25V8.59c.58-.45 1-1.27 1-2.09C10 5.22 8.98 4 8 4H4c-.98 0-2 1.22-2 2.5S3 9 4 9zm9-3h-1v1h1c1 0 2 1.22 2 2.5S13.98 12 13 12H9c-.98 0-2-1.22-2-2.5 0-.83.42-1.64 1-2.09V6.25c-1.09.53-2 1.84-2 3.25C6 11.31 7.55 13 9 13h4c1.45 0 3-1.69 3-3.5S14.5 6 13 6z\"\n  }))), \"What it enables\"), mdx(\"p\", null, \"Substrate Connect provides application developers ways to run a Substrate light client in any\\nNodeJS environment, from in-browser applications and extensions, to Electron apps,\\nIOT devices, and mobile phones.\"), mdx(\"p\", null, \"For in-browser end-users, Substrate Connect is a browser extension designed to facilitate\\nusing applications with multiple blockchains, where all light clients can run in a single tab. \"), mdx(\"p\", null, \"This implies two key features:\"), mdx(\"ol\", null, mdx(\"li\", {\n    parentName: \"ol\"\n  }, mdx(\"p\", {\n    parentName: \"li\"\n  }, mdx(\"strong\", {\n    parentName: \"p\"\n  }, \"Ready-to-use light clients for Substrate chains.\"), \" Light clients are\\npart of the Substrate framework and with that, available for every Substrate based blockchain. This\\nmeans that all you need in order to connect a Substrate chain to your application is provide the\\n\", mdx(\"a\", {\n    parentName: \"p\",\n    \"href\": \"/v3/runtime/chain-specs\"\n  }, \"chain specification\"), \" of the chain you want to connect to.\")), mdx(\"li\", {\n    parentName: \"ol\"\n  }, mdx(\"p\", {\n    parentName: \"li\"\n  }, mdx(\"strong\", {\n    parentName: \"p\"\n  }, \"Bundling light-clients of multiple chains.\"), \" With the browser extension, end-users are able to\\ninteract with applications connected to multiple blockchains or connect their own blockchains to\\napplications that support it.\"))), mdx(\"h2\", {\n    \"id\": \"motivation\",\n    \"style\": {\n      \"position\": \"relative\"\n    }\n  }, mdx(\"a\", {\n    parentName: \"h2\",\n    \"href\": \"#motivation\",\n    \"aria-label\": \"motivation permalink\",\n    \"className\": \"anchor before\"\n  }, mdx(\"svg\", {\n    parentName: \"a\",\n    \"className\": \"fill-current text-substrateDark dark:text-white\",\n    \"aria-hidden\": \"true\",\n    \"focusable\": \"false\",\n    \"height\": \"16\",\n    \"version\": \"1.1\",\n    \"viewBox\": \"0 0 16 16\",\n    \"width\": \"16\"\n  }, mdx(\"path\", {\n    parentName: \"svg\",\n    \"fillRule\": \"evenodd\",\n    \"d\": \"M4 9h1v1H4c-1.5 0-3-1.69-3-3.5S2.55 3 4 3h4c1.45 0 3 1.69 3 3.5 0 1.41-.91 2.72-2 3.25V8.59c.58-.45 1-1.27 1-2.09C10 5.22 8.98 4 8 4H4c-.98 0-2 1.22-2 2.5S3 9 4 9zm9-3h-1v1h1c1 0 2 1.22 2 2.5S13.98 12 13 12H9c-.98 0-2-1.22-2-2.5 0-.83.42-1.64 1-2.09V6.25c-1.09.53-2 1.84-2 3.25C6 11.31 7.55 13 9 13h4c1.45 0 3-1.69 3-3.5S14.5 6 13 6z\"\n  }))), \"Motivation\"), mdx(\"p\", null, \"Interacting with a Substrate chain via an RPC server requires a layer of third party trust which\\ncan be avoided. Substrate Connect uses a Wasm light client which connects to a Substrate chain\\nwithout any unecessary intermediary.\"), mdx(\"p\", null, \"In addition, due to browser limitations on websockets from HTTPS pages, establishing a good number of peers\\nis difficult as nodes are reachable only if they provide a TLS (Transport Layer Security) certificate.\\nSubstrate Connect provides a browser extension to overcome this limitation and to keep the chains synced in\\nthe background, making applications on a Substrate chain faster.\"), mdx(\"h2\", {\n    \"id\": \"how-it-works\",\n    \"style\": {\n      \"position\": \"relative\"\n    }\n  }, mdx(\"a\", {\n    parentName: \"h2\",\n    \"href\": \"#how-it-works\",\n    \"aria-label\": \"how it works permalink\",\n    \"className\": \"anchor before\"\n  }, mdx(\"svg\", {\n    parentName: \"a\",\n    \"className\": \"fill-current text-substrateDark dark:text-white\",\n    \"aria-hidden\": \"true\",\n    \"focusable\": \"false\",\n    \"height\": \"16\",\n    \"version\": \"1.1\",\n    \"viewBox\": \"0 0 16 16\",\n    \"width\": \"16\"\n  }, mdx(\"path\", {\n    parentName: \"svg\",\n    \"fillRule\": \"evenodd\",\n    \"d\": \"M4 9h1v1H4c-1.5 0-3-1.69-3-3.5S2.55 3 4 3h4c1.45 0 3 1.69 3 3.5 0 1.41-.91 2.72-2 3.25V8.59c.58-.45 1-1.27 1-2.09C10 5.22 8.98 4 8 4H4c-.98 0-2 1.22-2 2.5S3 9 4 9zm9-3h-1v1h1c1 0 2 1.22 2 2.5S13.98 12 13 12H9c-.98 0-2-1.22-2-2.5 0-.83.42-1.64 1-2.09V6.25c-1.09.53-2 1.84-2 3.25C6 11.31 7.55 13 9 13h4c1.45 0 3-1.69 3-3.5S14.5 6 13 6z\"\n  }))), \"How it works\"), mdx(\"p\", null, \"The extension runs a single light client, \", mdx(\"a\", {\n    parentName: \"p\",\n    \"href\": \"https://github.com/paritytech/smoldot\"\n  }, \"Smoldot\"), \" that\\nmanages connecting to different blockchains. Whenever a user opens an app in a new browser tab it\\nasks the extension to connect to whatever blockchains the app is interested in. The light client is\\nsmart enough to share resources so that it only connects to a network once even if there are\\nmultiple apps talking to it.\"), mdx(\"p\", null, \"The \", mdx(\"a\", {\n    parentName: \"p\",\n    \"href\": \"https://www.npmjs.com/package/@substrate/connect\"\n  }, mdx(\"inlineCode\", {\n    parentName: \"a\"\n  }, \"@substrate/connect\")), \" library has the following\\ncapabilities:\"), mdx(\"ul\", null, mdx(\"li\", {\n    parentName: \"ul\"\n  }, mdx(\"p\", {\n    parentName: \"li\"\n  }, \"It detects whether a user has the Substrate Connect browser extension installed. If it\\nisn't installed, it falls back to instantiating a light client directly in the page.\")), mdx(\"li\", {\n    parentName: \"ul\"\n  }, mdx(\"p\", {\n    parentName: \"li\"\n  }, \"It handles receiving and listening for messages from the browser extension and provider.\")), mdx(\"li\", {\n    parentName: \"ul\"\n  }, mdx(\"p\", {\n    parentName: \"li\"\n  }, \"It manages an app's connection to multiple blockchains, creating an instance of Smoldot\\nand connecting the app to it.\"))), mdx(\"h3\", {\n    \"id\": \"usage\",\n    \"style\": {\n      \"position\": \"relative\"\n    }\n  }, mdx(\"a\", {\n    parentName: \"h3\",\n    \"href\": \"#usage\",\n    \"aria-label\": \"usage permalink\",\n    \"className\": \"anchor before\"\n  }, mdx(\"svg\", {\n    parentName: \"a\",\n    \"className\": \"fill-current text-substrateDark dark:text-white\",\n    \"aria-hidden\": \"true\",\n    \"focusable\": \"false\",\n    \"height\": \"16\",\n    \"version\": \"1.1\",\n    \"viewBox\": \"0 0 16 16\",\n    \"width\": \"16\"\n  }, mdx(\"path\", {\n    parentName: \"svg\",\n    \"fillRule\": \"evenodd\",\n    \"d\": \"M4 9h1v1H4c-1.5 0-3-1.69-3-3.5S2.55 3 4 3h4c1.45 0 3 1.69 3 3.5 0 1.41-.91 2.72-2 3.25V8.59c.58-.45 1-1.27 1-2.09C10 5.22 8.98 4 8 4H4c-.98 0-2 1.22-2 2.5S3 9 4 9zm9-3h-1v1h1c1 0 2 1.22 2 2.5S13.98 12 13 12H9c-.98 0-2-1.22-2-2.5 0-.83.42-1.64 1-2.09V6.25c-1.09.53-2 1.84-2 3.25C6 11.31 7.55 13 9 13h4c1.45 0 3-1.69 3-3.5S14.5 6 13 6z\"\n  }))), \"Usage\"), mdx(\"p\", null, \"When used in individual projects, the Substrate Connect node module will first check for the\\ninstalled extension. If available, it will try to connect to the light client running inside the\\nextension. Only if the extension is not installed will it start a light client in the browser tab.\"), mdx(\"h3\", {\n    \"id\": \"ways-to-use-it\",\n    \"style\": {\n      \"position\": \"relative\"\n    }\n  }, mdx(\"a\", {\n    parentName: \"h3\",\n    \"href\": \"#ways-to-use-it\",\n    \"aria-label\": \"ways to use it permalink\",\n    \"className\": \"anchor before\"\n  }, mdx(\"svg\", {\n    parentName: \"a\",\n    \"className\": \"fill-current text-substrateDark dark:text-white\",\n    \"aria-hidden\": \"true\",\n    \"focusable\": \"false\",\n    \"height\": \"16\",\n    \"version\": \"1.1\",\n    \"viewBox\": \"0 0 16 16\",\n    \"width\": \"16\"\n  }, mdx(\"path\", {\n    parentName: \"svg\",\n    \"fillRule\": \"evenodd\",\n    \"d\": \"M4 9h1v1H4c-1.5 0-3-1.69-3-3.5S2.55 3 4 3h4c1.45 0 3 1.69 3 3.5 0 1.41-.91 2.72-2 3.25V8.59c.58-.45 1-1.27 1-2.09C10 5.22 8.98 4 8 4H4c-.98 0-2 1.22-2 2.5S3 9 4 9zm9-3h-1v1h1c1 0 2 1.22 2 2.5S13.98 12 13 12H9c-.98 0-2-1.22-2-2.5 0-.83.42-1.64 1-2.09V6.25c-1.09.53-2 1.84-2 3.25C6 11.31 7.55 13 9 13h4c1.45 0 3-1.69 3-3.5S14.5 6 13 6z\"\n  }))), \"Ways to use it\"), mdx(\"p\", null, \"Learn how to integrate Substrate Connect in your applications \", mdx(\"a\", {\n    parentName: \"p\",\n    \"href\": \"https://paritytech.github.io/substrate-connect/\"\n  }, \"here\"), \".\"), mdx(\"h2\", {\n    \"id\": \"next-steps\",\n    \"style\": {\n      \"position\": \"relative\"\n    }\n  }, mdx(\"a\", {\n    parentName: \"h2\",\n    \"href\": \"#next-steps\",\n    \"aria-label\": \"next steps permalink\",\n    \"className\": \"anchor before\"\n  }, mdx(\"svg\", {\n    parentName: \"a\",\n    \"className\": \"fill-current text-substrateDark dark:text-white\",\n    \"aria-hidden\": \"true\",\n    \"focusable\": \"false\",\n    \"height\": \"16\",\n    \"version\": \"1.1\",\n    \"viewBox\": \"0 0 16 16\",\n    \"width\": \"16\"\n  }, mdx(\"path\", {\n    parentName: \"svg\",\n    \"fillRule\": \"evenodd\",\n    \"d\": \"M4 9h1v1H4c-1.5 0-3-1.69-3-3.5S2.55 3 4 3h4c1.45 0 3 1.69 3 3.5 0 1.41-.91 2.72-2 3.25V8.59c.58-.45 1-1.27 1-2.09C10 5.22 8.98 4 8 4H4c-.98 0-2 1.22-2 2.5S3 9 4 9zm9-3h-1v1h1c1 0 2 1.22 2 2.5S13.98 12 13 12H9c-.98 0-2-1.22-2-2.5 0-.83.42-1.64 1-2.09V6.25c-1.09.53-2 1.84-2 3.25C6 11.31 7.55 13 9 13h4c1.45 0 3-1.69 3-3.5S14.5 6 13 6z\"\n  }))), \"Next steps\"), mdx(\"h3\", {\n    \"id\": \"learn-more\",\n    \"style\": {\n      \"position\": \"relative\"\n    }\n  }, mdx(\"a\", {\n    parentName: \"h3\",\n    \"href\": \"#learn-more\",\n    \"aria-label\": \"learn more permalink\",\n    \"className\": \"anchor before\"\n  }, mdx(\"svg\", {\n    parentName: \"a\",\n    \"className\": \"fill-current text-substrateDark dark:text-white\",\n    \"aria-hidden\": \"true\",\n    \"focusable\": \"false\",\n    \"height\": \"16\",\n    \"version\": \"1.1\",\n    \"viewBox\": \"0 0 16 16\",\n    \"width\": \"16\"\n  }, mdx(\"path\", {\n    parentName: \"svg\",\n    \"fillRule\": \"evenodd\",\n    \"d\": \"M4 9h1v1H4c-1.5 0-3-1.69-3-3.5S2.55 3 4 3h4c1.45 0 3 1.69 3 3.5 0 1.41-.91 2.72-2 3.25V8.59c.58-.45 1-1.27 1-2.09C10 5.22 8.98 4 8 4H4c-.98 0-2 1.22-2 2.5S3 9 4 9zm9-3h-1v1h1c1 0 2 1.22 2 2.5S13.98 12 13 12H9c-.98 0-2-1.22-2-2.5 0-.83.42-1.64 1-2.09V6.25c-1.09.53-2 1.84-2 3.25C6 11.31 7.55 13 9 13h4c1.45 0 3-1.69 3-3.5S14.5 6 13 6z\"\n  }))), \"Learn more\"), mdx(\"ul\", null, mdx(\"li\", {\n    parentName: \"ul\"\n  }, \"Learn how \", mdx(\"a\", {\n    parentName: \"li\",\n    \"href\": \"/v3/runtime/custom-rpcs\"\n  }, \"Custom RPCs\"), \" work in Substrate \"), mdx(\"li\", {\n    parentName: \"ul\"\n  }, \"Learn more about \", mdx(\"a\", {\n    parentName: \"li\",\n    \"href\": \"https://github.com/paritytech/smoldot\"\n  }, \"Smoldot\"), \", the lightweight client for Substrate chains\")));\n}\n;\nMDXContent.isMDXComponent = true;","tableOfContents":{"items":[{"url":"#what-it-enables","title":"What it enables"},{"url":"#motivation","title":"Motivation"},{"url":"#how-it-works","title":"How it works","items":[{"url":"#usage","title":"Usage"},{"url":"#ways-to-use-it","title":"Ways to use it"}]},{"url":"#next-steps","title":"Next steps","items":[{"url":"#learn-more","title":"Learn more"}]}]},"fileAbsolutePath":"/Users/a212/Desktop/substrate-docs/v3/docs/05-integrate/c-substrate-connect/index.mdx"}},"pageContext":{"slug":"/v3/integration/substrate-connect","version":"3.0","locale":"en","hrefLang":"en-US","originalPath":"/v3/integration/substrate-connect/","dateFormat":"MM/DD/YYYY"}},
    "staticQueryHashes": ["1239077767","1821483254","2966362950","3280999885"]}