{
    "componentChunkName": "component---src-templates-htg-template-tsx",
    "path": "/how-to-guides/v3/testing/transfer-function/",
    "result": {"data":{"mdx":{"frontmatter":{"slug":"/how-to-guides/v3/testing/transfer-function","title":"Testing a Transfer Function","hideNav":null,"difficulty":1,"section":"how to guides","category":"testing"},"body":"var _excluded = [\"components\"];\n\nfunction _extends() { _extends = Object.assign || function (target) { for (var i = 1; i < arguments.length; i++) { var source = arguments[i]; for (var key in source) { if (Object.prototype.hasOwnProperty.call(source, key)) { target[key] = source[key]; } } } return target; }; return _extends.apply(this, arguments); }\n\nfunction _objectWithoutProperties(source, excluded) { if (source == null) return {}; var target = _objectWithoutPropertiesLoose(source, excluded); var key, i; if (Object.getOwnPropertySymbols) { var sourceSymbolKeys = Object.getOwnPropertySymbols(source); for (i = 0; i < sourceSymbolKeys.length; i++) { key = sourceSymbolKeys[i]; if (excluded.indexOf(key) >= 0) continue; if (!Object.prototype.propertyIsEnumerable.call(source, key)) continue; target[key] = source[key]; } } return target; }\n\nfunction _objectWithoutPropertiesLoose(source, excluded) { if (source == null) return {}; var target = {}; var sourceKeys = Object.keys(source); var key, i; for (i = 0; i < sourceKeys.length; i++) { key = sourceKeys[i]; if (excluded.indexOf(key) >= 0) continue; target[key] = source[key]; } return target; }\n\n/* @jsxRuntime classic */\n\n/* @jsx mdx */\nvar _frontmatter = {\n  \"title\": \"Testing a Transfer Function\",\n  \"slug\": \"/how-to-guides/v3/testing/transfer-function\",\n  \"keywords\": \"testing, runtime, beginner\",\n  \"version\": 3,\n  \"section\": \"how to guides\",\n  \"category\": \"testing\",\n  \"difficulty\": 1\n};\n\nvar makeShortcode = function makeShortcode(name) {\n  return function MDXDefaultShortcode(props) {\n    console.warn(\"Component \" + name + \" was not imported, exported, or provided by MDXProvider as global scope\");\n    return mdx(\"div\", props);\n  };\n};\n\nvar Objectives = makeShortcode(\"Objectives\");\nvar layoutProps = {\n  _frontmatter: _frontmatter\n};\nvar MDXLayout = \"wrapper\";\nreturn function MDXContent(_ref) {\n  var components = _ref.components,\n      props = _objectWithoutProperties(_ref, _excluded);\n\n  return mdx(MDXLayout, _extends({}, layoutProps, props, {\n    components: components,\n    mdxType: \"MDXLayout\"\n  }), mdx(Objectives, {\n    data: [{\n      title: 'Goal',\n      description: 'Learn how to write tests and improve the correctness of a `transfer` function.'\n    }, {\n      title: 'Use Cases',\n      description: \"Testing a custom transfer function.\"\n    }, {\n      title: 'Overview',\n      description: \"Testing each function is an important part of developing pallets for production.\\n      This guide steps you through best practices for writing test cases for a basic `transfer` function.\"\n    }],\n    mdxType: \"Objectives\"\n  }), mdx(\"h2\", {\n    \"id\": \"steps\",\n    \"style\": {\n      \"position\": \"relative\"\n    }\n  }, mdx(\"a\", {\n    parentName: \"h2\",\n    \"href\": \"#steps\",\n    \"aria-label\": \"steps permalink\",\n    \"className\": \"anchor before\"\n  }, mdx(\"svg\", {\n    parentName: \"a\",\n    \"className\": \"fill-current text-substrateDark dark:text-white\",\n    \"aria-hidden\": \"true\",\n    \"focusable\": \"false\",\n    \"height\": \"16\",\n    \"version\": \"1.1\",\n    \"viewBox\": \"0 0 16 16\",\n    \"width\": \"16\"\n  }, mdx(\"path\", {\n    parentName: \"svg\",\n    \"fillRule\": \"evenodd\",\n    \"d\": \"M4 9h1v1H4c-1.5 0-3-1.69-3-3.5S2.55 3 4 3h4c1.45 0 3 1.69 3 3.5 0 1.41-.91 2.72-2 3.25V8.59c.58-.45 1-1.27 1-2.09C10 5.22 8.98 4 8 4H4c-.98 0-2 1.22-2 2.5S3 9 4 9zm9-3h-1v1h1c1 0 2 1.22 2 2.5S13.98 12 13 12H9c-.98 0-2-1.22-2-2.5 0-.83.42-1.64 1-2.09V6.25c-1.09.53-2 1.84-2 3.25C6 11.31 7.55 13 9 13h4c1.45 0 3-1.69 3-3.5S14.5 6 13 6z\"\n  }))), \"Steps\"), mdx(\"h3\", {\n    \"id\": \"1-outline-the-transfer-function\",\n    \"style\": {\n      \"position\": \"relative\"\n    }\n  }, mdx(\"a\", {\n    parentName: \"h3\",\n    \"href\": \"#1-outline-the-transfer-function\",\n    \"aria-label\": \"1 outline the transfer function permalink\",\n    \"className\": \"anchor before\"\n  }, mdx(\"svg\", {\n    parentName: \"a\",\n    \"className\": \"fill-current text-substrateDark dark:text-white\",\n    \"aria-hidden\": \"true\",\n    \"focusable\": \"false\",\n    \"height\": \"16\",\n    \"version\": \"1.1\",\n    \"viewBox\": \"0 0 16 16\",\n    \"width\": \"16\"\n  }, mdx(\"path\", {\n    parentName: \"svg\",\n    \"fillRule\": \"evenodd\",\n    \"d\": \"M4 9h1v1H4c-1.5 0-3-1.69-3-3.5S2.55 3 4 3h4c1.45 0 3 1.69 3 3.5 0 1.41-.91 2.72-2 3.25V8.59c.58-.45 1-1.27 1-2.09C10 5.22 8.98 4 8 4H4c-.98 0-2 1.22-2 2.5S3 9 4 9zm9-3h-1v1h1c1 0 2 1.22 2 2.5S13.98 12 13 12H9c-.98 0-2-1.22-2-2.5 0-.83.42-1.64 1-2.09V6.25c-1.09.53-2 1.84-2 3.25C6 11.31 7.55 13 9 13h4c1.45 0 3-1.69 3-3.5S14.5 6 13 6z\"\n  }))), \"1. Outline the \", mdx(\"inlineCode\", {\n    parentName: \"h3\"\n  }, \"transfer\"), \" function\"), mdx(\"p\", null, \"A transfer function has two key elements: subtracting a balance from an account and adding that\\nbalance to another account.\\nHere, we'll start by outlining this function:\"), mdx(\"pre\", null, mdx(\"code\", {\n    parentName: \"pre\",\n    \"className\": \"language-rust\"\n  }, \"#[pallet::weight(10_000)]\\npub (super) fn transfer(\\n    origin: OriginFor<T>,\\n    to: T::AccountId,\\n    #[pallet::compact] amount: T::Balance,\\n) -> DispatchResultWithPostInfo {\\n    let sender = ensure_signed(origin)?;\\n\\n    Accounts::<T>::mutate(&sender, |bal| {\\n        *bal = bal.saturating_sub(amount);\\n    });\\n    Accounts::<T>::mutate(&to, |bal| {\\n        *bal = bal.saturating_add(amount);\\n    });\\n    Self::deposit_event(Event::<T>::Transferred(sender, to, amount))\\n    Ok(().into())\\n}\\n\")), mdx(\"h3\", {\n    \"id\": \"2-check-that-the-sender-has-enough-balance\",\n    \"style\": {\n      \"position\": \"relative\"\n    }\n  }, mdx(\"a\", {\n    parentName: \"h3\",\n    \"href\": \"#2-check-that-the-sender-has-enough-balance\",\n    \"aria-label\": \"2 check that the sender has enough balance permalink\",\n    \"className\": \"anchor before\"\n  }, mdx(\"svg\", {\n    parentName: \"a\",\n    \"className\": \"fill-current text-substrateDark dark:text-white\",\n    \"aria-hidden\": \"true\",\n    \"focusable\": \"false\",\n    \"height\": \"16\",\n    \"version\": \"1.1\",\n    \"viewBox\": \"0 0 16 16\",\n    \"width\": \"16\"\n  }, mdx(\"path\", {\n    parentName: \"svg\",\n    \"fillRule\": \"evenodd\",\n    \"d\": \"M4 9h1v1H4c-1.5 0-3-1.69-3-3.5S2.55 3 4 3h4c1.45 0 3 1.69 3 3.5 0 1.41-.91 2.72-2 3.25V8.59c.58-.45 1-1.27 1-2.09C10 5.22 8.98 4 8 4H4c-.98 0-2 1.22-2 2.5S3 9 4 9zm9-3h-1v1h1c1 0 2 1.22 2 2.5S13.98 12 13 12H9c-.98 0-2-1.22-2-2.5 0-.83.42-1.64 1-2.09V6.25c-1.09.53-2 1.84-2 3.25C6 11.31 7.55 13 9 13h4c1.45 0 3-1.69 3-3.5S14.5 6 13 6z\"\n  }))), \"2. Check that the sender has enough balance\"), mdx(\"p\", null, \"The first thing to verify, is whether the sender has enough balance.\\nIn a separate \", mdx(\"inlineCode\", {\n    parentName: \"p\"\n  }, \"tests.rs\"), \" file, write out this first test case:\"), mdx(\"pre\", null, mdx(\"code\", {\n    parentName: \"pre\",\n    \"className\": \"language-rust\"\n  }, \"#[test]\\nfn transfer_works() {\\n    new_test_ext().execute_with(|| {\\n        MetaDataStore::<Test>::put(MetaData {\\n            issuance: 0,\\n            minter: 1,\\n            burner: 1,\\n        });\\n        // Mint 42 coins to account 2.\\n        assert_ok!(RewardCoin::mint(Origin::signed(1), 2, 42));\\n        // Send 50 coins to account 3.\\n        asset_noop!(RewardCoin::transfer(Origin::signed(2), 3, 50), Error::<T>::InsufficientBalance);\\n\")), mdx(\"h4\", null, \"Configure error handling\"), mdx(\"p\", null, \"To implement some error check, replace \", mdx(\"inlineCode\", {\n    parentName: \"p\"\n  }, \"mutate\"), \" with \", mdx(\"inlineCode\", {\n    parentName: \"p\"\n  }, \"try_mutate\"), \" to use \", mdx(\"inlineCode\", {\n    parentName: \"p\"\n  }, \"ensure!\"), \".\\nThis will check whether \", mdx(\"em\", {\n    parentName: \"p\"\n  }, \"bal is greater or equal to amount\"), \" and throw an error message if not:\"), mdx(\"pre\", null, mdx(\"code\", {\n    parentName: \"pre\",\n    \"className\": \"language-rust\"\n  }, \"Accounts::<T>::try_mutate(&sender, |bal| {\\n    ensure!(bal >= amount, Error::<T>::InsufficientBalance);\\n    *bal = bal.saturating_sub(amount);\\n    Ok(())\\n});\\n\")), mdx(\"p\", null, \"Run \", mdx(\"inlineCode\", {\n    parentName: \"p\"\n  }, \"cargo test\"), \" from your pallet's directory.\"), mdx(\"h3\", {\n    \"id\": \"3-check-that-sending-account-doesnt-go-below-minimum-balance\",\n    \"style\": {\n      \"position\": \"relative\"\n    }\n  }, mdx(\"a\", {\n    parentName: \"h3\",\n    \"href\": \"#3-check-that-sending-account-doesnt-go-below-minimum-balance\",\n    \"aria-label\": \"3 check that sending account doesnt go below minimum balance permalink\",\n    \"className\": \"anchor before\"\n  }, mdx(\"svg\", {\n    parentName: \"a\",\n    \"className\": \"fill-current text-substrateDark dark:text-white\",\n    \"aria-hidden\": \"true\",\n    \"focusable\": \"false\",\n    \"height\": \"16\",\n    \"version\": \"1.1\",\n    \"viewBox\": \"0 0 16 16\",\n    \"width\": \"16\"\n  }, mdx(\"path\", {\n    parentName: \"svg\",\n    \"fillRule\": \"evenodd\",\n    \"d\": \"M4 9h1v1H4c-1.5 0-3-1.69-3-3.5S2.55 3 4 3h4c1.45 0 3 1.69 3 3.5 0 1.41-.91 2.72-2 3.25V8.59c.58-.45 1-1.27 1-2.09C10 5.22 8.98 4 8 4H4c-.98 0-2 1.22-2 2.5S3 9 4 9zm9-3h-1v1h1c1 0 2 1.22 2 2.5S13.98 12 13 12H9c-.98 0-2-1.22-2-2.5 0-.83.42-1.64 1-2.09V6.25c-1.09.53-2 1.84-2 3.25C6 11.31 7.55 13 9 13h4c1.45 0 3-1.69 3-3.5S14.5 6 13 6z\"\n  }))), \"3. Check that sending account doesn't go below minimum balance\"), mdx(\"p\", null, \"Inside your \", mdx(\"inlineCode\", {\n    parentName: \"p\"\n  }, \"transfer_works\"), \" function:\"), mdx(\"pre\", null, mdx(\"code\", {\n    parentName: \"pre\",\n    \"className\": \"language-rust\"\n  }, \"assert_noop!(RewardCoin::transfer(Origin::signed(2), 3, 50), Error::<Test>::InsufficientBalance);\\n\")), mdx(\"h3\", {\n    \"id\": \"4-check-that-both-tests-work-together\",\n    \"style\": {\n      \"position\": \"relative\"\n    }\n  }, mdx(\"a\", {\n    parentName: \"h3\",\n    \"href\": \"#4-check-that-both-tests-work-together\",\n    \"aria-label\": \"4 check that both tests work together permalink\",\n    \"className\": \"anchor before\"\n  }, mdx(\"svg\", {\n    parentName: \"a\",\n    \"className\": \"fill-current text-substrateDark dark:text-white\",\n    \"aria-hidden\": \"true\",\n    \"focusable\": \"false\",\n    \"height\": \"16\",\n    \"version\": \"1.1\",\n    \"viewBox\": \"0 0 16 16\",\n    \"width\": \"16\"\n  }, mdx(\"path\", {\n    parentName: \"svg\",\n    \"fillRule\": \"evenodd\",\n    \"d\": \"M4 9h1v1H4c-1.5 0-3-1.69-3-3.5S2.55 3 4 3h4c1.45 0 3 1.69 3 3.5 0 1.41-.91 2.72-2 3.25V8.59c.58-.45 1-1.27 1-2.09C10 5.22 8.98 4 8 4H4c-.98 0-2 1.22-2 2.5S3 9 4 9zm9-3h-1v1h1c1 0 2 1.22 2 2.5S13.98 12 13 12H9c-.98 0-2-1.22-2-2.5 0-.83.42-1.64 1-2.09V6.25c-1.09.53-2 1.84-2 3.25C6 11.31 7.55 13 9 13h4c1.45 0 3-1.69 3-3.5S14.5 6 13 6z\"\n  }))), \"4. Check that both tests work together\"), mdx(\"p\", null, \"Use \", mdx(\"inlineCode\", {\n    parentName: \"p\"\n  }, \"#[transactional]\"), \" to generate a wrapper around both checks:\"), mdx(\"pre\", null, mdx(\"code\", {\n    parentName: \"pre\",\n    \"className\": \"language-rust\"\n  }, \"#[transactional]\\n    pub(super) fn transfer(\\n/*--snip--*/\\n\")), mdx(\"h3\", {\n    \"id\": \"5-handle-dust-accounts\",\n    \"style\": {\n      \"position\": \"relative\"\n    }\n  }, mdx(\"a\", {\n    parentName: \"h3\",\n    \"href\": \"#5-handle-dust-accounts\",\n    \"aria-label\": \"5 handle dust accounts permalink\",\n    \"className\": \"anchor before\"\n  }, mdx(\"svg\", {\n    parentName: \"a\",\n    \"className\": \"fill-current text-substrateDark dark:text-white\",\n    \"aria-hidden\": \"true\",\n    \"focusable\": \"false\",\n    \"height\": \"16\",\n    \"version\": \"1.1\",\n    \"viewBox\": \"0 0 16 16\",\n    \"width\": \"16\"\n  }, mdx(\"path\", {\n    parentName: \"svg\",\n    \"fillRule\": \"evenodd\",\n    \"d\": \"M4 9h1v1H4c-1.5 0-3-1.69-3-3.5S2.55 3 4 3h4c1.45 0 3 1.69 3 3.5 0 1.41-.91 2.72-2 3.25V8.59c.58-.45 1-1.27 1-2.09C10 5.22 8.98 4 8 4H4c-.98 0-2 1.22-2 2.5S3 9 4 9zm9-3h-1v1h1c1 0 2 1.22 2 2.5S13.98 12 13 12H9c-.98 0-2-1.22-2-2.5 0-.83.42-1.64 1-2.09V6.25c-1.09.53-2 1.84-2 3.25C6 11.31 7.55 13 9 13h4c1.45 0 3-1.69 3-3.5S14.5 6 13 6z\"\n  }))), \"5. Handle dust accounts\"), mdx(\"p\", null, \"Make sure that sending and receiving accounts aren't dust accounts. Use \", mdx(\"inlineCode\", {\n    parentName: \"p\"\n  }, \"T::MinBalance::get()\"), \":\"), mdx(\"pre\", null, mdx(\"code\", {\n    parentName: \"pre\",\n    \"className\": \"language-rust\"\n  }, \"/*--snip--*/\\n    let new_bal = bal.checked_sub(&amount).ok_or(Error::<T>::InsufficientBalance)?;\\n    ensure!(new_bal >= T::MinBalance::get(), Error::<T>::BelowMinBalance);\\n/*--snip--*/\\n\")), mdx(\"h2\", {\n    \"id\": \"examples\",\n    \"style\": {\n      \"position\": \"relative\"\n    }\n  }, mdx(\"a\", {\n    parentName: \"h2\",\n    \"href\": \"#examples\",\n    \"aria-label\": \"examples permalink\",\n    \"className\": \"anchor before\"\n  }, mdx(\"svg\", {\n    parentName: \"a\",\n    \"className\": \"fill-current text-substrateDark dark:text-white\",\n    \"aria-hidden\": \"true\",\n    \"focusable\": \"false\",\n    \"height\": \"16\",\n    \"version\": \"1.1\",\n    \"viewBox\": \"0 0 16 16\",\n    \"width\": \"16\"\n  }, mdx(\"path\", {\n    parentName: \"svg\",\n    \"fillRule\": \"evenodd\",\n    \"d\": \"M4 9h1v1H4c-1.5 0-3-1.69-3-3.5S2.55 3 4 3h4c1.45 0 3 1.69 3 3.5 0 1.41-.91 2.72-2 3.25V8.59c.58-.45 1-1.27 1-2.09C10 5.22 8.98 4 8 4H4c-.98 0-2 1.22-2 2.5S3 9 4 9zm9-3h-1v1h1c1 0 2 1.22 2 2.5S13.98 12 13 12H9c-.98 0-2-1.22-2-2.5 0-.83.42-1.64 1-2.09V6.25c-1.09.53-2 1.84-2 3.25C6 11.31 7.55 13 9 13h4c1.45 0 3-1.69 3-3.5S14.5 6 13 6z\"\n  }))), \"Examples\"), mdx(\"ul\", null, mdx(\"li\", {\n    parentName: \"ul\"\n  }, \"Tests in the \", mdx(\"a\", {\n    parentName: \"li\",\n    \"href\": \"https://github.com/substrate-developer-hub/substrate-how-to-guides/blob/main/example-code/template-node/pallets/reward-coin/src/tests.rs\"\n  }, mdx(\"inlineCode\", {\n    parentName: \"a\"\n  }, \"reward-coin\"), \" example pallet\"), \".\")), mdx(\"h2\", {\n    \"id\": \"resources\",\n    \"style\": {\n      \"position\": \"relative\"\n    }\n  }, mdx(\"a\", {\n    parentName: \"h2\",\n    \"href\": \"#resources\",\n    \"aria-label\": \"resources permalink\",\n    \"className\": \"anchor before\"\n  }, mdx(\"svg\", {\n    parentName: \"a\",\n    \"className\": \"fill-current text-substrateDark dark:text-white\",\n    \"aria-hidden\": \"true\",\n    \"focusable\": \"false\",\n    \"height\": \"16\",\n    \"version\": \"1.1\",\n    \"viewBox\": \"0 0 16 16\",\n    \"width\": \"16\"\n  }, mdx(\"path\", {\n    parentName: \"svg\",\n    \"fillRule\": \"evenodd\",\n    \"d\": \"M4 9h1v1H4c-1.5 0-3-1.69-3-3.5S2.55 3 4 3h4c1.45 0 3 1.69 3 3.5 0 1.41-.91 2.72-2 3.25V8.59c.58-.45 1-1.27 1-2.09C10 5.22 8.98 4 8 4H4c-.98 0-2 1.22-2 2.5S3 9 4 9zm9-3h-1v1h1c1 0 2 1.22 2 2.5S13.98 12 13 12H9c-.98 0-2-1.22-2-2.5 0-.83.42-1.64 1-2.09V6.25c-1.09.53-2 1.84-2 3.25C6 11.31 7.55 13 9 13h4c1.45 0 3-1.69 3-3.5S14.5 6 13 6z\"\n  }))), \"Resources\"), mdx(\"h4\", null, \"Rust docs\"), mdx(\"ul\", null, mdx(\"li\", {\n    parentName: \"ul\"\n  }, mdx(\"a\", {\n    parentName: \"li\",\n    \"href\": \"/rustdocs/latest/frame_support/macro.assert_ok.html\"\n  }, mdx(\"inlineCode\", {\n    parentName: \"a\"\n  }, \"assert_ok!\"))), mdx(\"li\", {\n    parentName: \"ul\"\n  }, mdx(\"a\", {\n    parentName: \"li\",\n    \"href\": \"/rustdocs/latest/frame_support/macro.assert_noop.html\"\n  }, mdx(\"inlineCode\", {\n    parentName: \"a\"\n  }, \"assert_noop!\"))), mdx(\"li\", {\n    parentName: \"ul\"\n  }, mdx(\"a\", {\n    parentName: \"li\",\n    \"href\": \"/rustdocs/latest/frame_support/macro.ensure.html\"\n  }, mdx(\"inlineCode\", {\n    parentName: \"a\"\n  }, \"ensure!\"))), mdx(\"li\", {\n    parentName: \"ul\"\n  }, mdx(\"a\", {\n    parentName: \"li\",\n    \"href\": \"/rustdocs/latest/frame_support/storage/trait.StorageMap.html#tymethod.try_mutate\"\n  }, mdx(\"inlineCode\", {\n    parentName: \"a\"\n  }, \"try_mutate\")))));\n}\n;\nMDXContent.isMDXComponent = true;","tableOfContents":{"items":[{"url":"#steps","title":"Steps","items":[{"url":"#1-outline-the-transfer-function","title":"1. Outline the transfer function"},{"url":"#2-check-that-the-sender-has-enough-balance","title":"2. Check that the sender has enough balance"},{"url":"#3-check-that-sending-account-doesnt-go-below-minimum-balance","title":"3. Check that sending account doesn't go below minimum balance"},{"url":"#4-check-that-both-tests-work-together","title":"4. Check that both tests work together"},{"url":"#5-handle-dust-accounts","title":"5. Handle dust accounts"}]},{"url":"#examples","title":"Examples"},{"url":"#resources","title":"Resources"}]},"fileAbsolutePath":"/Users/a212/Desktop/substrate-docs/v3/how-to-guides/04-testing/b-test-transfer/index.mdx"}},"pageContext":{"slug":"/how-to-guides/v3/testing/transfer-function","version":"3.0","locale":"en","hrefLang":"en-US","originalPath":"/how-to-guides/v3/testing/transfer-function/","dateFormat":"MM/DD/YYYY"}},
    "staticQueryHashes": ["1239077767","1821483254","2966362950","3280999885"]}