{
    "componentChunkName": "component---src-templates-htg-template-tsx",
    "path": "/how-to-guides/v3/pallet-design/lockable-currency/",
    "result": {"data":{"mdx":{"frontmatter":{"slug":"/how-to-guides/v3/pallet-design/lockable-currency","title":"Implement a Lockable Currency","hideNav":null,"difficulty":2,"section":"how to guides","category":"pallet design"},"body":"var _excluded = [\"components\"];\n\nfunction _extends() { _extends = Object.assign || function (target) { for (var i = 1; i < arguments.length; i++) { var source = arguments[i]; for (var key in source) { if (Object.prototype.hasOwnProperty.call(source, key)) { target[key] = source[key]; } } } return target; }; return _extends.apply(this, arguments); }\n\nfunction _objectWithoutProperties(source, excluded) { if (source == null) return {}; var target = _objectWithoutPropertiesLoose(source, excluded); var key, i; if (Object.getOwnPropertySymbols) { var sourceSymbolKeys = Object.getOwnPropertySymbols(source); for (i = 0; i < sourceSymbolKeys.length; i++) { key = sourceSymbolKeys[i]; if (excluded.indexOf(key) >= 0) continue; if (!Object.prototype.propertyIsEnumerable.call(source, key)) continue; target[key] = source[key]; } } return target; }\n\nfunction _objectWithoutPropertiesLoose(source, excluded) { if (source == null) return {}; var target = {}; var sourceKeys = Object.keys(source); var key, i; for (i = 0; i < sourceKeys.length; i++) { key = sourceKeys[i]; if (excluded.indexOf(key) >= 0) continue; target[key] = source[key]; } return target; }\n\n/* @jsxRuntime classic */\n\n/* @jsx mdx */\nvar _frontmatter = {\n  \"title\": \"Implement a Lockable Currency\",\n  \"slug\": \"/how-to-guides/v3/pallet-design/lockable-currency\",\n  \"keywords\": \"pallet design, currency, intermediate, runtime\",\n  \"version\": 3,\n  \"section\": \"how to guides\",\n  \"category\": \"pallet design\",\n  \"difficulty\": 2\n};\n\nvar makeShortcode = function makeShortcode(name) {\n  return function MDXDefaultShortcode(props) {\n    console.warn(\"Component \" + name + \" was not imported, exported, or provided by MDXProvider as global scope\");\n    return mdx(\"div\", props);\n  };\n};\n\nvar Objectives = makeShortcode(\"Objectives\");\nvar layoutProps = {\n  _frontmatter: _frontmatter\n};\nvar MDXLayout = \"wrapper\";\nreturn function MDXContent(_ref) {\n  var components = _ref.components,\n      props = _objectWithoutProperties(_ref, _excluded);\n\n  return mdx(MDXLayout, _extends({}, layoutProps, props, {\n    components: components,\n    mdxType: \"MDXLayout\"\n  }), mdx(Objectives, {\n    data: [{\n      title: 'Goal',\n      description: 'Write a pallet that allows users to lock funds.'\n    }, {\n      title: 'Use Cases',\n      description: \"- Staking\\n- Conviction voting\"\n    }, {\n      title: 'Overview',\n      description: \"The [`LockableCurrency`](/rustdocs/latest/frame_support/traits/trait.LockableCurrency.html) trait can be very useful in the context of economic systems that enforce accountability by collateralizing fungible resources.\\n\\t\\tSubstrate's [staking pallet](/rustdocs/latest/pallet_staking/index.html) makes use of the same trait to handle locked funds in time-based increments. In\\n\\t\\tthis guide, we will make use of it in our own custom pallet.\\n\\t\\t\"\n    }],\n    mdxType: \"Objectives\"\n  }), mdx(\"h2\", {\n    \"id\": \"steps\",\n    \"style\": {\n      \"position\": \"relative\"\n    }\n  }, mdx(\"a\", {\n    parentName: \"h2\",\n    \"href\": \"#steps\",\n    \"aria-label\": \"steps permalink\",\n    \"className\": \"anchor before\"\n  }, mdx(\"svg\", {\n    parentName: \"a\",\n    \"className\": \"fill-current text-substrateDark dark:text-white\",\n    \"aria-hidden\": \"true\",\n    \"focusable\": \"false\",\n    \"height\": \"16\",\n    \"version\": \"1.1\",\n    \"viewBox\": \"0 0 16 16\",\n    \"width\": \"16\"\n  }, mdx(\"path\", {\n    parentName: \"svg\",\n    \"fillRule\": \"evenodd\",\n    \"d\": \"M4 9h1v1H4c-1.5 0-3-1.69-3-3.5S2.55 3 4 3h4c1.45 0 3 1.69 3 3.5 0 1.41-.91 2.72-2 3.25V8.59c.58-.45 1-1.27 1-2.09C10 5.22 8.98 4 8 4H4c-.98 0-2 1.22-2 2.5S3 9 4 9zm9-3h-1v1h1c1 0 2 1.22 2 2.5S13.98 12 13 12H9c-.98 0-2-1.22-2-2.5 0-.83.42-1.64 1-2.09V6.25c-1.09.53-2 1.84-2 3.25C6 11.31 7.55 13 9 13h4c1.45 0 3-1.69 3-3.5S14.5 6 13 6z\"\n  }))), \"Steps\"), mdx(\"h3\", {\n    \"id\": \"1-declare-relevant-imports\",\n    \"style\": {\n      \"position\": \"relative\"\n    }\n  }, mdx(\"a\", {\n    parentName: \"h3\",\n    \"href\": \"#1-declare-relevant-imports\",\n    \"aria-label\": \"1 declare relevant imports permalink\",\n    \"className\": \"anchor before\"\n  }, mdx(\"svg\", {\n    parentName: \"a\",\n    \"className\": \"fill-current text-substrateDark dark:text-white\",\n    \"aria-hidden\": \"true\",\n    \"focusable\": \"false\",\n    \"height\": \"16\",\n    \"version\": \"1.1\",\n    \"viewBox\": \"0 0 16 16\",\n    \"width\": \"16\"\n  }, mdx(\"path\", {\n    parentName: \"svg\",\n    \"fillRule\": \"evenodd\",\n    \"d\": \"M4 9h1v1H4c-1.5 0-3-1.69-3-3.5S2.55 3 4 3h4c1.45 0 3 1.69 3 3.5 0 1.41-.91 2.72-2 3.25V8.59c.58-.45 1-1.27 1-2.09C10 5.22 8.98 4 8 4H4c-.98 0-2 1.22-2 2.5S3 9 4 9zm9-3h-1v1h1c1 0 2 1.22 2 2.5S13.98 12 13 12H9c-.98 0-2-1.22-2-2.5 0-.83.42-1.64 1-2.09V6.25c-1.09.53-2 1.84-2 3.25C6 11.31 7.55 13 9 13h4c1.45 0 3-1.69 3-3.5S14.5 6 13 6z\"\n  }))), \"1. Declare relevant imports\"), mdx(\"p\", null, \"Import the following traits:\"), mdx(\"pre\", null, mdx(\"code\", {\n    parentName: \"pre\",\n    \"className\": \"language-rust\"\n  }, \"use frame_support::{\\n    dispatch::DispatchResult,\\n    traits::{Currency, LockIdentifier, LockableCurrency, WithdrawReasons},\\n};\\n\")), mdx(\"h3\", {\n    \"id\": \"2declare-the-lockidentifier-constant\",\n    \"style\": {\n      \"position\": \"relative\"\n    }\n  }, mdx(\"a\", {\n    parentName: \"h3\",\n    \"href\": \"#2declare-the-lockidentifier-constant\",\n    \"aria-label\": \"2declare the lockidentifier constant permalink\",\n    \"className\": \"anchor before\"\n  }, mdx(\"svg\", {\n    parentName: \"a\",\n    \"className\": \"fill-current text-substrateDark dark:text-white\",\n    \"aria-hidden\": \"true\",\n    \"focusable\": \"false\",\n    \"height\": \"16\",\n    \"version\": \"1.1\",\n    \"viewBox\": \"0 0 16 16\",\n    \"width\": \"16\"\n  }, mdx(\"path\", {\n    parentName: \"svg\",\n    \"fillRule\": \"evenodd\",\n    \"d\": \"M4 9h1v1H4c-1.5 0-3-1.69-3-3.5S2.55 3 4 3h4c1.45 0 3 1.69 3 3.5 0 1.41-.91 2.72-2 3.25V8.59c.58-.45 1-1.27 1-2.09C10 5.22 8.98 4 8 4H4c-.98 0-2 1.22-2 2.5S3 9 4 9zm9-3h-1v1h1c1 0 2 1.22 2 2.5S13.98 12 13 12H9c-.98 0-2-1.22-2-2.5 0-.83.42-1.64 1-2.09V6.25c-1.09.53-2 1.84-2 3.25C6 11.31 7.55 13 9 13h4c1.45 0 3-1.69 3-3.5S14.5 6 13 6z\"\n  }))), \"2.Declare the \", mdx(\"inlineCode\", {\n    parentName: \"h3\"\n  }, \"LockIdentifier\"), \" constant\"), mdx(\"p\", null, \"In order to use \", mdx(\"inlineCode\", {\n    parentName: \"p\"\n  }, \"LockableCurrency\"), \", we need to declare a \", mdx(\"a\", {\n    parentName: \"p\",\n    \"href\": \"/rustdocs/latest/frame_support/traits/type.LockIdentifier.html\"\n  }, mdx(\"inlineCode\", {\n    parentName: \"a\"\n  }, \"LockIdentifier\")), \" (must be 8 characters long):\"), mdx(\"pre\", null, mdx(\"code\", {\n    parentName: \"pre\",\n    \"className\": \"language-rust\"\n  }, \"const EXAMPLE_ID: LockIdentifier = *b\\\"example \\\";\\n\")), mdx(\"h3\", {\n    \"id\": \"3-define-the-required-types\",\n    \"style\": {\n      \"position\": \"relative\"\n    }\n  }, mdx(\"a\", {\n    parentName: \"h3\",\n    \"href\": \"#3-define-the-required-types\",\n    \"aria-label\": \"3 define the required types permalink\",\n    \"className\": \"anchor before\"\n  }, mdx(\"svg\", {\n    parentName: \"a\",\n    \"className\": \"fill-current text-substrateDark dark:text-white\",\n    \"aria-hidden\": \"true\",\n    \"focusable\": \"false\",\n    \"height\": \"16\",\n    \"version\": \"1.1\",\n    \"viewBox\": \"0 0 16 16\",\n    \"width\": \"16\"\n  }, mdx(\"path\", {\n    parentName: \"svg\",\n    \"fillRule\": \"evenodd\",\n    \"d\": \"M4 9h1v1H4c-1.5 0-3-1.69-3-3.5S2.55 3 4 3h4c1.45 0 3 1.69 3 3.5 0 1.41-.91 2.72-2 3.25V8.59c.58-.45 1-1.27 1-2.09C10 5.22 8.98 4 8 4H4c-.98 0-2 1.22-2 2.5S3 9 4 9zm9-3h-1v1h1c1 0 2 1.22 2 2.5S13.98 12 13 12H9c-.98 0-2-1.22-2-2.5 0-.83.42-1.64 1-2.09V6.25c-1.09.53-2 1.84-2 3.25C6 11.31 7.55 13 9 13h4c1.45 0 3-1.69 3-3.5S14.5 6 13 6z\"\n  }))), \"3. Define the required types\"), mdx(\"p\", null, \"Define the lockable currency type:\"), mdx(\"pre\", null, mdx(\"code\", {\n    parentName: \"pre\",\n    \"className\": \"language-rust\"\n  }, \"type BalanceOf<T> =\\n    <<T as Config>::Currency as Currency<<T as frame_system::Config>::AccountId>>::Balance;\\n/*--snip--*/\\n    type Currency: LockableCurrency<Self::AccountId, Moment = Self::BlockNumber>;\\n\")), mdx(\"p\", null, \"The new \", mdx(\"inlineCode\", {\n    parentName: \"p\"\n  }, \"BalanceOf<T>\"), \" type satisfies the type constraints of \", mdx(\"inlineCode\", {\n    parentName: \"p\"\n  }, \"Self::Balance\"), \" for all provided\\nmethods in\", mdx(\"inlineCode\", {\n    parentName: \"p\"\n  }, \"Currency\"), \".\"), mdx(\"h3\", {\n    \"id\": \"4-write-out-the-required-functions\",\n    \"style\": {\n      \"position\": \"relative\"\n    }\n  }, mdx(\"a\", {\n    parentName: \"h3\",\n    \"href\": \"#4-write-out-the-required-functions\",\n    \"aria-label\": \"4 write out the required functions permalink\",\n    \"className\": \"anchor before\"\n  }, mdx(\"svg\", {\n    parentName: \"a\",\n    \"className\": \"fill-current text-substrateDark dark:text-white\",\n    \"aria-hidden\": \"true\",\n    \"focusable\": \"false\",\n    \"height\": \"16\",\n    \"version\": \"1.1\",\n    \"viewBox\": \"0 0 16 16\",\n    \"width\": \"16\"\n  }, mdx(\"path\", {\n    parentName: \"svg\",\n    \"fillRule\": \"evenodd\",\n    \"d\": \"M4 9h1v1H4c-1.5 0-3-1.69-3-3.5S2.55 3 4 3h4c1.45 0 3 1.69 3 3.5 0 1.41-.91 2.72-2 3.25V8.59c.58-.45 1-1.27 1-2.09C10 5.22 8.98 4 8 4H4c-.98 0-2 1.22-2 2.5S3 9 4 9zm9-3h-1v1h1c1 0 2 1.22 2 2.5S13.98 12 13 12H9c-.98 0-2-1.22-2-2.5 0-.83.42-1.64 1-2.09V6.25c-1.09.53-2 1.84-2 3.25C6 11.31 7.55 13 9 13h4c1.45 0 3-1.69 3-3.5S14.5 6 13 6z\"\n  }))), \"4. Write out the required functions\"), mdx(\"p\", null, \"Our pallet must contain the following key functions to ensure it handles the basic logical components for locking and\\nunlocking a curency for a period of time. These are:\"), mdx(\"ul\", null, mdx(\"li\", {\n    parentName: \"ul\"\n  }, mdx(\"inlineCode\", {\n    parentName: \"li\"\n  }, \"fn lock_capital\"), \": Locks the specified amount of tokens from the caller.\"), mdx(\"li\", {\n    parentName: \"ul\"\n  }, mdx(\"inlineCode\", {\n    parentName: \"li\"\n  }, \"fn extend_lock\"), \": Extends the lock period.\"), mdx(\"li\", {\n    parentName: \"ul\"\n  }, mdx(\"inlineCode\", {\n    parentName: \"li\"\n  }, \"fn unlock_all\"), \": Releases all locked tokens.\")), mdx(\"h4\", null, mdx(\"inlineCode\", {\n    parentName: \"h4\"\n  }, \"fn lock_capital\")), mdx(\"p\", null, \"Call the \", mdx(\"inlineCode\", {\n    parentName: \"p\"\n  }, \"set_lock()\"), \" method from \", mdx(\"inlineCode\", {\n    parentName: \"p\"\n  }, \"Currency\"), \":\"), mdx(\"pre\", null, mdx(\"code\", {\n    parentName: \"pre\",\n    \"className\": \"language-rust\"\n  }, \"    #[pallet::weight(10_000 + T::DbWeight::get().writes(1))]\\n    pub(super) fn lock_capital(\\n        origin: OriginFor<T>,\\n        #[pallet::compact] amount: BalanceOf<T>\\n    ) -> DispatchResultWithPostInfo {\\n\\n        let user = ensure_signed(origin)?;\\n\\n        T::Currency::set_lock(\\n            EXAMPLE_ID,\\n            &user,\\n            amount,\\n            WithdrawReasons::all(),\\n        );\\n\\n        Self::deposit_event(Event::Locked(user, amount));\\n        Ok(().into())\\n    }\\n\")), mdx(\"h4\", null, mdx(\"inlineCode\", {\n    parentName: \"h4\"\n  }, \"fn extend_lock\")), mdx(\"p\", null, \"Call the \", mdx(\"inlineCode\", {\n    parentName: \"p\"\n  }, \"extend_lock()\"), \" method from \", mdx(\"inlineCode\", {\n    parentName: \"p\"\n  }, \"Currency\"), \":\"), mdx(\"pre\", null, mdx(\"code\", {\n    parentName: \"pre\",\n    \"className\": \"language-rust\"\n  }, \"    #[pallet::weight(1_000)]\\n    pub(super) fn extend_lock(\\n        origin: OriginFor<T>,\\n        #[pallet::compact] amount: BalanceOf<T>,\\n    ) -> DispatchResultWithPostInfo {\\n        let user = ensure_signed(origin)?;\\n\\n        T::Currency::extend_lock(\\n            EXAMPLE_ID,\\n            &user,\\n            amount,\\n            WithdrawReasons::all(),\\n        );\\n\\n        Self::deposit_event(Event::ExtendedLock(user, amount));\\n        Ok(().into())\\n    }\\n\")), mdx(\"h4\", null, mdx(\"inlineCode\", {\n    parentName: \"h4\"\n  }, \"fn unlock_all\")), mdx(\"p\", null, \"Call the \", mdx(\"inlineCode\", {\n    parentName: \"p\"\n  }, \"remove_lock()\"), \" method from \", mdx(\"inlineCode\", {\n    parentName: \"p\"\n  }, \"Currency\"), \":\"), mdx(\"pre\", null, mdx(\"code\", {\n    parentName: \"pre\",\n    \"className\": \"language-rust\"\n  }, \"    #[pallet::weight(1_000)]\\n    pub(super) fn unlock_all(\\n        origin: OriginFor<T>,\\n    ) -> DispatchResultWithPostInfo {\\n        let user = ensure_signed(origin)?;\\n\\n        T::Currency::remove_lock(EXAMPLE_ID, &user);\\n\\n        Self::deposit_event(Event::Unlocked(user));\\n        Ok(().into())\\n    }\\n\")), mdx(\"h2\", {\n    \"id\": \"examples\",\n    \"style\": {\n      \"position\": \"relative\"\n    }\n  }, mdx(\"a\", {\n    parentName: \"h2\",\n    \"href\": \"#examples\",\n    \"aria-label\": \"examples permalink\",\n    \"className\": \"anchor before\"\n  }, mdx(\"svg\", {\n    parentName: \"a\",\n    \"className\": \"fill-current text-substrateDark dark:text-white\",\n    \"aria-hidden\": \"true\",\n    \"focusable\": \"false\",\n    \"height\": \"16\",\n    \"version\": \"1.1\",\n    \"viewBox\": \"0 0 16 16\",\n    \"width\": \"16\"\n  }, mdx(\"path\", {\n    parentName: \"svg\",\n    \"fillRule\": \"evenodd\",\n    \"d\": \"M4 9h1v1H4c-1.5 0-3-1.69-3-3.5S2.55 3 4 3h4c1.45 0 3 1.69 3 3.5 0 1.41-.91 2.72-2 3.25V8.59c.58-.45 1-1.27 1-2.09C10 5.22 8.98 4 8 4H4c-.98 0-2 1.22-2 2.5S3 9 4 9zm9-3h-1v1h1c1 0 2 1.22 2 2.5S13.98 12 13 12H9c-.98 0-2-1.22-2-2.5 0-.83.42-1.64 1-2.09V6.25c-1.09.53-2 1.84-2 3.25C6 11.31 7.55 13 9 13h4c1.45 0 3-1.69 3-3.5S14.5 6 13 6z\"\n  }))), \"Examples\"), mdx(\"ul\", null, mdx(\"li\", {\n    parentName: \"ul\"\n  }, mdx(\"a\", {\n    parentName: \"li\",\n    \"href\": \"https://github.com/substrate-developer-hub/substrate-how-to-guides/blob/main/example-code/template-node/pallets/lockable-currency/src/lib.rs\"\n  }, mdx(\"inlineCode\", {\n    parentName: \"a\"\n  }, \"lockable-currency\")), \" example pallet\")), mdx(\"h2\", {\n    \"id\": \"related-material\",\n    \"style\": {\n      \"position\": \"relative\"\n    }\n  }, mdx(\"a\", {\n    parentName: \"h2\",\n    \"href\": \"#related-material\",\n    \"aria-label\": \"related material permalink\",\n    \"className\": \"anchor before\"\n  }, mdx(\"svg\", {\n    parentName: \"a\",\n    \"className\": \"fill-current text-substrateDark dark:text-white\",\n    \"aria-hidden\": \"true\",\n    \"focusable\": \"false\",\n    \"height\": \"16\",\n    \"version\": \"1.1\",\n    \"viewBox\": \"0 0 16 16\",\n    \"width\": \"16\"\n  }, mdx(\"path\", {\n    parentName: \"svg\",\n    \"fillRule\": \"evenodd\",\n    \"d\": \"M4 9h1v1H4c-1.5 0-3-1.69-3-3.5S2.55 3 4 3h4c1.45 0 3 1.69 3 3.5 0 1.41-.91 2.72-2 3.25V8.59c.58-.45 1-1.27 1-2.09C10 5.22 8.98 4 8 4H4c-.98 0-2 1.22-2 2.5S3 9 4 9zm9-3h-1v1h1c1 0 2 1.22 2 2.5S13.98 12 13 12H9c-.98 0-2-1.22-2-2.5 0-.83.42-1.64 1-2.09V6.25c-1.09.53-2 1.84-2 3.25C6 11.31 7.55 13 9 13h4c1.45 0 3-1.69 3-3.5S14.5 6 13 6z\"\n  }))), \"Related material\"), mdx(\"h4\", null, \"Rust docs\"), mdx(\"ul\", null, mdx(\"li\", {\n    parentName: \"ul\"\n  }, mdx(\"a\", {\n    parentName: \"li\",\n    \"href\": \"/rustdocs/latest/frame_support/traits/trait.Currency.html\"\n  }, \"Currency trait\")), mdx(\"li\", {\n    parentName: \"ul\"\n  }, mdx(\"a\", {\n    parentName: \"li\",\n    \"href\": \"/rustdocs/latest/frame_support/traits/trait.LockableCurrency.html\"\n  }, \"LockableCurrency\")), mdx(\"li\", {\n    parentName: \"ul\"\n  }, mdx(\"a\", {\n    parentName: \"li\",\n    \"href\": \"/rustdocs/latest/frame_support/traits/type.LockIdentifier.html\"\n  }, \"LockIdentifier\"))));\n}\n;\nMDXContent.isMDXComponent = true;","tableOfContents":{"items":[{"url":"#steps","title":"Steps","items":[{"url":"#1-declare-relevant-imports","title":"1. Declare relevant imports"},{"url":"#2declare-the-lockidentifier-constant","title":"2.Declare the LockIdentifier constant"},{"url":"#3-define-the-required-types","title":"3. Define the required types"},{"url":"#4-write-out-the-required-functions","title":"4. Write out the required functions"}]},{"url":"#examples","title":"Examples"},{"url":"#related-material","title":"Related material"}]},"fileAbsolutePath":"/Users/a212/Desktop/substrate-docs/v3/how-to-guides/02-pallet-design/b-lockcable-currency/index.mdx"}},"pageContext":{"slug":"/how-to-guides/v3/pallet-design/lockable-currency","version":"3.0","locale":"en","hrefLang":"en-US","originalPath":"/how-to-guides/v3/pallet-design/lockable-currency/","dateFormat":"MM/DD/YYYY"}},
    "staticQueryHashes": ["1239077767","1821483254","2966362950","3280999885"]}