{
    "componentChunkName": "component---src-templates-htg-template-tsx",
    "path": "/how-to-guides/v3/parachains/pre-launch/",
    "result": {"data":{"mdx":{"frontmatter":{"slug":"/how-to-guides/v3/parachains/pre-launch","title":"Pre-Launch Requirements","hideNav":null,"difficulty":2,"section":"how to guides","category":"parachains"},"body":"var _excluded = [\"components\"];\n\nfunction _extends() { _extends = Object.assign || function (target) { for (var i = 1; i < arguments.length; i++) { var source = arguments[i]; for (var key in source) { if (Object.prototype.hasOwnProperty.call(source, key)) { target[key] = source[key]; } } } return target; }; return _extends.apply(this, arguments); }\n\nfunction _objectWithoutProperties(source, excluded) { if (source == null) return {}; var target = _objectWithoutPropertiesLoose(source, excluded); var key, i; if (Object.getOwnPropertySymbols) { var sourceSymbolKeys = Object.getOwnPropertySymbols(source); for (i = 0; i < sourceSymbolKeys.length; i++) { key = sourceSymbolKeys[i]; if (excluded.indexOf(key) >= 0) continue; if (!Object.prototype.propertyIsEnumerable.call(source, key)) continue; target[key] = source[key]; } } return target; }\n\nfunction _objectWithoutPropertiesLoose(source, excluded) { if (source == null) return {}; var target = {}; var sourceKeys = Object.keys(source); var key, i; for (i = 0; i < sourceKeys.length; i++) { key = sourceKeys[i]; if (excluded.indexOf(key) >= 0) continue; target[key] = source[key]; } return target; }\n\n/* @jsxRuntime classic */\n\n/* @jsx mdx */\nvar _frontmatter = {\n  \"title\": \"Pre-Launch Requirements\",\n  \"slug\": \"/how-to-guides/v3/parachains/pre-launch\",\n  \"version\": \"polkadot-0.9.10\",\n  \"section\": \"how to guides\",\n  \"category\": \"parachains\",\n  \"difficulty\": 2,\n  \"keywords\": [\"collator\", \"parachain\", \"launch\", \"prereq\", \"requirements\", \"checklist\", \"weight\", \"migration\"]\n};\n\nvar makeShortcode = function makeShortcode(name) {\n  return function MDXDefaultShortcode(props) {\n    console.warn(\"Component \" + name + \" was not imported, exported, or provided by MDXProvider as global scope\");\n    return mdx(\"div\", props);\n  };\n};\n\nvar Objectives = makeShortcode(\"Objectives\");\nvar Message = makeShortcode(\"Message\");\nvar layoutProps = {\n  _frontmatter: _frontmatter\n};\nvar MDXLayout = \"wrapper\";\nreturn function MDXContent(_ref) {\n  var components = _ref.components,\n      props = _objectWithoutProperties(_ref, _excluded);\n\n  return mdx(MDXLayout, _extends({}, layoutProps, props, {\n    components: components,\n    mdxType: \"MDXLayout\"\n  }), mdx(Objectives, {\n    data: [{\n      title: 'Goal',\n      description: 'Ensure \\`protocolId\\` is set uniquely and that runtime weights are correct.'\n    }, {\n      title: 'Use Cases',\n      description: 'Launching a parachain outside of a local testing environment.'\n    }, {\n      title: 'Overview',\n      description: 'The runtime constraints on a parachain are much stricter than a solochain, as you must coordinate with the relay chain to finalize state transitions. When launching a parachain to production, it is critically important to make sure a chain\\'s runtime is properly configured and tested.'\n    }],\n    mdxType: \"Objectives\"\n  }), mdx(\"h2\", {\n    \"id\": \"steps\",\n    \"style\": {\n      \"position\": \"relative\"\n    }\n  }, mdx(\"a\", {\n    parentName: \"h2\",\n    \"href\": \"#steps\",\n    \"aria-label\": \"steps permalink\",\n    \"className\": \"anchor before\"\n  }, mdx(\"svg\", {\n    parentName: \"a\",\n    \"className\": \"fill-current text-substrateDark dark:text-white\",\n    \"aria-hidden\": \"true\",\n    \"focusable\": \"false\",\n    \"height\": \"16\",\n    \"version\": \"1.1\",\n    \"viewBox\": \"0 0 16 16\",\n    \"width\": \"16\"\n  }, mdx(\"path\", {\n    parentName: \"svg\",\n    \"fillRule\": \"evenodd\",\n    \"d\": \"M4 9h1v1H4c-1.5 0-3-1.69-3-3.5S2.55 3 4 3h4c1.45 0 3 1.69 3 3.5 0 1.41-.91 2.72-2 3.25V8.59c.58-.45 1-1.27 1-2.09C10 5.22 8.98 4 8 4H4c-.98 0-2 1.22-2 2.5S3 9 4 9zm9-3h-1v1h1c1 0 2 1.22 2 2.5S13.98 12 13 12H9c-.98 0-2-1.22-2-2.5 0-.83.42-1.64 1-2.09V6.25c-1.09.53-2 1.84-2 3.25C6 11.31 7.55 13 9 13h4c1.45 0 3-1.69 3-3.5S14.5 6 13 6z\"\n  }))), \"Steps\"), mdx(\"h3\", {\n    \"id\": \"1-set-a-unique-protocolid\",\n    \"style\": {\n      \"position\": \"relative\"\n    }\n  }, mdx(\"a\", {\n    parentName: \"h3\",\n    \"href\": \"#1-set-a-unique-protocolid\",\n    \"aria-label\": \"1 set a unique protocolid permalink\",\n    \"className\": \"anchor before\"\n  }, mdx(\"svg\", {\n    parentName: \"a\",\n    \"className\": \"fill-current text-substrateDark dark:text-white\",\n    \"aria-hidden\": \"true\",\n    \"focusable\": \"false\",\n    \"height\": \"16\",\n    \"version\": \"1.1\",\n    \"viewBox\": \"0 0 16 16\",\n    \"width\": \"16\"\n  }, mdx(\"path\", {\n    parentName: \"svg\",\n    \"fillRule\": \"evenodd\",\n    \"d\": \"M4 9h1v1H4c-1.5 0-3-1.69-3-3.5S2.55 3 4 3h4c1.45 0 3 1.69 3 3.5 0 1.41-.91 2.72-2 3.25V8.59c.58-.45 1-1.27 1-2.09C10 5.22 8.98 4 8 4H4c-.98 0-2 1.22-2 2.5S3 9 4 9zm9-3h-1v1h1c1 0 2 1.22 2 2.5S13.98 12 13 12H9c-.98 0-2-1.22-2-2.5 0-.83.42-1.64 1-2.09V6.25c-1.09.53-2 1.84-2 3.25C6 11.31 7.55 13 9 13h4c1.45 0 3-1.69 3-3.5S14.5 6 13 6z\"\n  }))), \"1. Set a unique \", mdx(\"inlineCode\", {\n    parentName: \"h3\"\n  }, \"protocolId\")), mdx(Message, {\n    type: \"red\",\n    title: \"Network collisions can cause major headaches\",\n    text: \"\\n_All_ chains should use a **unique** `protocolId` that _no other network_ (testnets, relay chain,\\nparachains, etc) uses. This ensures your nodes do not incorrectly peer with\\nnodes from other libp2p networks. You want to isolate them to a distinct peer group with this ID.\\nProtocol ID collisions will cause _many_ issues for your nodes!\\n\",\n    mdxType: \"Message\"\n  }), mdx(\"p\", null, \"In order to set a unique protocol ID, change make sure you use some nonce or salt value. This is set\\n(for the \", mdx(\"a\", {\n    parentName: \"p\",\n    \"href\": \"https://github.com/substrate-developer-hub/substrate-parachain-template/\"\n  }, \"parachain node template\"), \")\\nas a CLI item in \", mdx(\"inlineCode\", {\n    parentName: \"p\"\n  }, \"/client/network/src/command.rs\"), \", and passed to extend the \", mdx(\"inlineCode\", {\n    parentName: \"p\"\n  }, \"/client/network/src/chain_spec.rs\")), mdx(\"p\", null, \"All \", mdx(\"a\", {\n    parentName: \"p\",\n    \"href\": \"/v3/runtime/chain-specs\"\n  }, \"chain specification\"), \" files include this item as a field. For example,\\nthe primary \", mdx(\"a\", {\n    parentName: \"p\",\n    \"href\": \"https://github.com/paritytech/polkadot/tree/master/node/service/res\"\n  }, \"relay chain\\nruntime\"), \"\\nchain specs have unique protocol IDs. For Polkadot:\"), mdx(\"pre\", null, mdx(\"code\", {\n    parentName: \"pre\",\n    \"className\": \"language-json\"\n  }, \"// raw chain spec file in polkadot repo `/node/service/res/polkadot.json`\\n{\\n  //--snip--\\n  \\\"protocolId\\\": \\\"dot\\\"\\n  //--snip--\\n}\\n\")), mdx(\"p\", null, \"Keep an eye (subscribe)\\nto \", mdx(\"a\", {\n    parentName: \"p\",\n    \"href\": \"https://github.com/paritytech/substrate/issues/7746\"\n  }, \"this issue\"), \"\\nthat will address a better method to safely configure this constant in the future.\"), mdx(\"h3\", {\n    \"id\": \"2-memory-profiling\",\n    \"style\": {\n      \"position\": \"relative\"\n    }\n  }, mdx(\"a\", {\n    parentName: \"h3\",\n    \"href\": \"#2-memory-profiling\",\n    \"aria-label\": \"2 memory profiling permalink\",\n    \"className\": \"anchor before\"\n  }, mdx(\"svg\", {\n    parentName: \"a\",\n    \"className\": \"fill-current text-substrateDark dark:text-white\",\n    \"aria-hidden\": \"true\",\n    \"focusable\": \"false\",\n    \"height\": \"16\",\n    \"version\": \"1.1\",\n    \"viewBox\": \"0 0 16 16\",\n    \"width\": \"16\"\n  }, mdx(\"path\", {\n    parentName: \"svg\",\n    \"fillRule\": \"evenodd\",\n    \"d\": \"M4 9h1v1H4c-1.5 0-3-1.69-3-3.5S2.55 3 4 3h4c1.45 0 3 1.69 3 3.5 0 1.41-.91 2.72-2 3.25V8.59c.58-.45 1-1.27 1-2.09C10 5.22 8.98 4 8 4H4c-.98 0-2 1.22-2 2.5S3 9 4 9zm9-3h-1v1h1c1 0 2 1.22 2 2.5S13.98 12 13 12H9c-.98 0-2-1.22-2-2.5 0-.83.42-1.64 1-2.09V6.25c-1.09.53-2 1.84-2 3.25C6 11.31 7.55 13 9 13h4c1.45 0 3-1.69 3-3.5S14.5 6 13 6z\"\n  }))), \"2. Memory profiling\"), mdx(\"p\", null, mdx(\"a\", {\n    parentName: \"p\",\n    \"href\": \"/v3/tools/memory-profiling\"\n  }, \"Profiling your collator\"), \" should be done to analyze memory leaks,\\nidentify where memory consumption is happening, define temporary allocations, and investigate\\nexcessive memory fragmentation within applications.\"), mdx(\"h3\", {\n    \"id\": \"3-minimize-your-runtime-size\",\n    \"style\": {\n      \"position\": \"relative\"\n    }\n  }, mdx(\"a\", {\n    parentName: \"h3\",\n    \"href\": \"#3-minimize-your-runtime-size\",\n    \"aria-label\": \"3 minimize your runtime size permalink\",\n    \"className\": \"anchor before\"\n  }, mdx(\"svg\", {\n    parentName: \"a\",\n    \"className\": \"fill-current text-substrateDark dark:text-white\",\n    \"aria-hidden\": \"true\",\n    \"focusable\": \"false\",\n    \"height\": \"16\",\n    \"version\": \"1.1\",\n    \"viewBox\": \"0 0 16 16\",\n    \"width\": \"16\"\n  }, mdx(\"path\", {\n    parentName: \"svg\",\n    \"fillRule\": \"evenodd\",\n    \"d\": \"M4 9h1v1H4c-1.5 0-3-1.69-3-3.5S2.55 3 4 3h4c1.45 0 3 1.69 3 3.5 0 1.41-.91 2.72-2 3.25V8.59c.58-.45 1-1.27 1-2.09C10 5.22 8.98 4 8 4H4c-.98 0-2 1.22-2 2.5S3 9 4 9zm9-3h-1v1h1c1 0 2 1.22 2 2.5S13.98 12 13 12H9c-.98 0-2-1.22-2-2.5 0-.83.42-1.64 1-2.09V6.25c-1.09.53-2 1.84-2 3.25C6 11.31 7.55 13 9 13h4c1.45 0 3-1.69 3-3.5S14.5 6 13 6z\"\n  }))), \"3. Minimize your runtime size\"), mdx(\"p\", null, \"When launching a parachain, it is critical to use the \", mdx(\"strong\", {\n    parentName: \"p\"\n  }, \"compressed version of the runtime\"), \" to lower\\nthe amount of resource consumption as much as possible for the relay chain.\"), mdx(\"ul\", null, mdx(\"li\", {\n    parentName: \"ul\"\n  }, mdx(\"p\", {\n    parentName: \"li\"\n  }, \"It is recommended to launch a parachain with limited functionality and gradually increase it with\\nruntime upgrades. The reason behind that is that during a runtime upgrade both the previous runtime\\nand the new runtime are included in the PoVBlock and therefore if the changes are large enough the\\nblock might be rejected by the Relay Chain due to PoVBlock size limits.\")), mdx(\"li\", {\n    parentName: \"ul\"\n  }, mdx(\"p\", {\n    parentName: \"li\"\n  }, \"If the runtime is included in the state proof, ensure the PoV block (i.e. the set of extrinsics,\\nincluding the new runtime, the PoV state proof, potentially the old runtime) fits within the\\nPoVBlock size limit. If the runtime is not included in the state proof, the size limit of the new\\nruntime will be much higher.\"))), mdx(Message, {\n    type: \"yellow\",\n    title: \"Critical parachain constraints\",\n    text: \"\\nYou can check the maximum sizes [in the Polkadot\\nrepo](https://github.com/paritytech/polkadot/blob/master/primitives/src/v1/mod.rs#L247-L253)\\nfor all relay chains (these are common constants). Make note of:\\n- The runtime version of the relay chain you are targeting (these _may_ change)\\n- `MAX_CODE_SIZE`\\n- `MAX_HEAD_DATA_SIZE`\\n- `MAX_POV_SIZE`\\n\\n\\nYou **must** have your parachain fit comfortably within these maxima.\\nYou can also use the the Polkadot-JS Apps UI connected to a relay node to see these\\nconstants: _Developers_ -> _ParachainsConfiguration_ -> _ActiveConfiguration_\\n  \",\n    mdxType: \"Message\"\n  }), mdx(\"h3\", {\n    \"id\": \"4-use-proper-weights\",\n    \"style\": {\n      \"position\": \"relative\"\n    }\n  }, mdx(\"a\", {\n    parentName: \"h3\",\n    \"href\": \"#4-use-proper-weights\",\n    \"aria-label\": \"4 use proper weights permalink\",\n    \"className\": \"anchor before\"\n  }, mdx(\"svg\", {\n    parentName: \"a\",\n    \"className\": \"fill-current text-substrateDark dark:text-white\",\n    \"aria-hidden\": \"true\",\n    \"focusable\": \"false\",\n    \"height\": \"16\",\n    \"version\": \"1.1\",\n    \"viewBox\": \"0 0 16 16\",\n    \"width\": \"16\"\n  }, mdx(\"path\", {\n    parentName: \"svg\",\n    \"fillRule\": \"evenodd\",\n    \"d\": \"M4 9h1v1H4c-1.5 0-3-1.69-3-3.5S2.55 3 4 3h4c1.45 0 3 1.69 3 3.5 0 1.41-.91 2.72-2 3.25V8.59c.58-.45 1-1.27 1-2.09C10 5.22 8.98 4 8 4H4c-.98 0-2 1.22-2 2.5S3 9 4 9zm9-3h-1v1h1c1 0 2 1.22 2 2.5S13.98 12 13 12H9c-.98 0-2-1.22-2-2.5 0-.83.42-1.64 1-2.09V6.25c-1.09.53-2 1.84-2 3.25C6 11.31 7.55 13 9 13h4c1.45 0 3-1.69 3-3.5S14.5 6 13 6z\"\n  }))), \"4. Use proper weights\"), mdx(\"p\", null, \"Use \", mdx(\"a\", {\n    parentName: \"p\",\n    \"href\": \"/v3/runtime/benchmarking\"\n  }, \"runtime benchmarking\"), \" to ensure that your runtime weights are\\nactually indicative of the resources used by your runtime.\"), mdx(\"h4\", null, \"Custom weights\"), mdx(\"p\", null, \"If you need to diverge from benchmarks, make sure that each pallet in your runtime employs the\\ncorrect weighting system. Default and \\\"guessed at\\\" weights \", mdx(\"strong\", {\n    parentName: \"p\"\n  }, \"are not\"), \" to be used in production, as\\na general rule.\"), mdx(\"h4\", null, \"Set block weight limit\"), mdx(\"p\", null, \"It is recommended to have a block weight limit (block production time) of 0.5 seconds in the\\nbeginning due to uncertainties in block execution time. As the execution time of the network\\nstabilizes the weight limit can be increased to 2 seconds.\"), mdx(\"h3\", {\n    \"id\": \"5-setup-call-filters\",\n    \"style\": {\n      \"position\": \"relative\"\n    }\n  }, mdx(\"a\", {\n    parentName: \"h3\",\n    \"href\": \"#5-setup-call-filters\",\n    \"aria-label\": \"5 setup call filters permalink\",\n    \"className\": \"anchor before\"\n  }, mdx(\"svg\", {\n    parentName: \"a\",\n    \"className\": \"fill-current text-substrateDark dark:text-white\",\n    \"aria-hidden\": \"true\",\n    \"focusable\": \"false\",\n    \"height\": \"16\",\n    \"version\": \"1.1\",\n    \"viewBox\": \"0 0 16 16\",\n    \"width\": \"16\"\n  }, mdx(\"path\", {\n    parentName: \"svg\",\n    \"fillRule\": \"evenodd\",\n    \"d\": \"M4 9h1v1H4c-1.5 0-3-1.69-3-3.5S2.55 3 4 3h4c1.45 0 3 1.69 3 3.5 0 1.41-.91 2.72-2 3.25V8.59c.58-.45 1-1.27 1-2.09C10 5.22 8.98 4 8 4H4c-.98 0-2 1.22-2 2.5S3 9 4 9zm9-3h-1v1h1c1 0 2 1.22 2 2.5S13.98 12 13 12H9c-.98 0-2-1.22-2-2.5 0-.83.42-1.64 1-2.09V6.25c-1.09.53-2 1.84-2 3.25C6 11.31 7.55 13 9 13h4c1.45 0 3-1.69 3-3.5S14.5 6 13 6z\"\n  }))), \"5. Setup call filters\"), mdx(\"p\", null, \"Especially when launching a parachain, you might need to highly constrict what is enabled for\\n\", mdx(\"em\", {\n    parentName: \"p\"\n  }, \"specific classes\"), \" of users. This can be accomplished with \", mdx(\"strong\", {\n    parentName: \"p\"\n  }, \"call filters\"), \".\"), mdx(Message, {\n    type: \"gray\",\n    title: \"Call Filter Examples\",\n    text: \"\\nHere you can see an example of how to\\n[limit](https://github.com/paritytech/cumulus/blob/59cdbb6a56b1c49009413d66ba2232494563b57c/polkadot-parachains/statemine/src/lib.rs#L148) \\nand [enable](https://github.com/paritytech/cumulus/pull/476/files#diff-09b95657e9aa1b646722afa7944a00ddc2541e8753254a86180b338d3376f93eL151) \\nfunctionality with filters as implemented in\\nthe [Statemine runtime deployment](https://github.com/paritytech/cumulus/pull/476).\\n\",\n    mdxType: \"Message\"\n  }), mdx(\"h3\", {\n    \"id\": \"6-incremental-runtime-deployments\",\n    \"style\": {\n      \"position\": \"relative\"\n    }\n  }, mdx(\"a\", {\n    parentName: \"h3\",\n    \"href\": \"#6-incremental-runtime-deployments\",\n    \"aria-label\": \"6 incremental runtime deployments permalink\",\n    \"className\": \"anchor before\"\n  }, mdx(\"svg\", {\n    parentName: \"a\",\n    \"className\": \"fill-current text-substrateDark dark:text-white\",\n    \"aria-hidden\": \"true\",\n    \"focusable\": \"false\",\n    \"height\": \"16\",\n    \"version\": \"1.1\",\n    \"viewBox\": \"0 0 16 16\",\n    \"width\": \"16\"\n  }, mdx(\"path\", {\n    parentName: \"svg\",\n    \"fillRule\": \"evenodd\",\n    \"d\": \"M4 9h1v1H4c-1.5 0-3-1.69-3-3.5S2.55 3 4 3h4c1.45 0 3 1.69 3 3.5 0 1.41-.91 2.72-2 3.25V8.59c.58-.45 1-1.27 1-2.09C10 5.22 8.98 4 8 4H4c-.98 0-2 1.22-2 2.5S3 9 4 9zm9-3h-1v1h1c1 0 2 1.22 2 2.5S13.98 12 13 12H9c-.98 0-2-1.22-2-2.5 0-.83.42-1.64 1-2.09V6.25c-1.09.53-2 1.84-2 3.25C6 11.31 7.55 13 9 13h4c1.45 0 3-1.69 3-3.5S14.5 6 13 6z\"\n  }))), \"6. Incremental runtime deployments\"), mdx(\"p\", null, \"If you are approaching limits outline above before launch (like a too-large large runtime) it is\\nhighly advisable to prune down functionality as much as practical and \", mdx(\"strong\", {\n    parentName: \"p\"\n  }, \"incrementally upgrade\"), \".\\nIn these cases, you can:\"), mdx(\"ol\", null, mdx(\"li\", {\n    parentName: \"ol\"\n  }, mdx(\"p\", {\n    parentName: \"li\"\n  }, \"Generate the genesis state of your chain with full runtime functionality (including all the pallets)\")), mdx(\"li\", {\n    parentName: \"ol\"\n  }, mdx(\"p\", {\n    parentName: \"li\"\n  }, \"Remove all pallets that you will not need upon parachain launch from your runtime\")), mdx(\"li\", {\n    parentName: \"ol\"\n  }, mdx(\"p\", {\n    parentName: \"li\"\n  }, \"Re-build the WASM blob (validation logic) and the runtime of the chain\")), mdx(\"li\", {\n    parentName: \"ol\"\n  }, mdx(\"p\", {\n    parentName: \"li\"\n  }, \"Register your parachain with the updated genesis and the WASM blob generated in (3)\")), mdx(\"li\", {\n    parentName: \"ol\"\n  }, mdx(\"p\", {\n    parentName: \"li\"\n  }, \"After your parachain is live you can upgrade your runtime on-chain to include the missing pallets\\n(ensure that pallet indices and names match those used to generate the genesis state in step (1)\\nwithout having to do storage migrations. For more information on on-chain runtime upgrades refer to\\nthe next section.\"))), mdx(\"p\", null, mdx(\"strong\", {\n    parentName: \"p\"\n  }, \"See the \", mdx(\"a\", {\n    parentName: \"strong\",\n    \"href\": \"/how-to-guides/v3/parachains/runtime-upgrades\"\n  }, \"parachain runtime upgrade guide\")), \" for how\\nto go about actually performing these incremental runtime upgrades.\"), mdx(\"h3\", {\n    \"id\": \"7-launch-simulation\",\n    \"style\": {\n      \"position\": \"relative\"\n    }\n  }, mdx(\"a\", {\n    parentName: \"h3\",\n    \"href\": \"#7-launch-simulation\",\n    \"aria-label\": \"7 launch simulation permalink\",\n    \"className\": \"anchor before\"\n  }, mdx(\"svg\", {\n    parentName: \"a\",\n    \"className\": \"fill-current text-substrateDark dark:text-white\",\n    \"aria-hidden\": \"true\",\n    \"focusable\": \"false\",\n    \"height\": \"16\",\n    \"version\": \"1.1\",\n    \"viewBox\": \"0 0 16 16\",\n    \"width\": \"16\"\n  }, mdx(\"path\", {\n    parentName: \"svg\",\n    \"fillRule\": \"evenodd\",\n    \"d\": \"M4 9h1v1H4c-1.5 0-3-1.69-3-3.5S2.55 3 4 3h4c1.45 0 3 1.69 3 3.5 0 1.41-.91 2.72-2 3.25V8.59c.58-.45 1-1.27 1-2.09C10 5.22 8.98 4 8 4H4c-.98 0-2 1.22-2 2.5S3 9 4 9zm9-3h-1v1h1c1 0 2 1.22 2 2.5S13.98 12 13 12H9c-.98 0-2-1.22-2-2.5 0-.83.42-1.64 1-2.09V6.25c-1.09.53-2 1.84-2 3.25C6 11.31 7.55 13 9 13h4c1.45 0 3-1.69 3-3.5S14.5 6 13 6z\"\n  }))), \"7. Launch simulation\"), mdx(\"p\", null, \"Before you try anything on a production testnet or mainnet, be sure to \", mdx(\"em\", {\n    parentName: \"p\"\n  }, \"as close as possible\"), \"\\nsimulate the behavior of a mock network to launch your chain.\"), mdx(Message, {\n    type: \"yellow\",\n    title: \"You need to test!\",\n    text: \"\\nSee the [cumulus tutorial](/tutorials/v3/cumulus/start-relay) to learn the `polkadot-launch` tool\\nfor such testing.\\n\\n\\nAlso keep in mind that testing in a confined small dummy network will tests your failure modes in a\\nreal network with latency and many collators and validators. The closer you can get to testing this\\nin the same environment, the more sure you can be that your runtime upgrades will not fail.\\n\",\n    mdxType: \"Message\"\n  }), mdx(\"h2\", {\n    \"id\": \"examples\",\n    \"style\": {\n      \"position\": \"relative\"\n    }\n  }, mdx(\"a\", {\n    parentName: \"h2\",\n    \"href\": \"#examples\",\n    \"aria-label\": \"examples permalink\",\n    \"className\": \"anchor before\"\n  }, mdx(\"svg\", {\n    parentName: \"a\",\n    \"className\": \"fill-current text-substrateDark dark:text-white\",\n    \"aria-hidden\": \"true\",\n    \"focusable\": \"false\",\n    \"height\": \"16\",\n    \"version\": \"1.1\",\n    \"viewBox\": \"0 0 16 16\",\n    \"width\": \"16\"\n  }, mdx(\"path\", {\n    parentName: \"svg\",\n    \"fillRule\": \"evenodd\",\n    \"d\": \"M4 9h1v1H4c-1.5 0-3-1.69-3-3.5S2.55 3 4 3h4c1.45 0 3 1.69 3 3.5 0 1.41-.91 2.72-2 3.25V8.59c.58-.45 1-1.27 1-2.09C10 5.22 8.98 4 8 4H4c-.98 0-2 1.22-2 2.5S3 9 4 9zm9-3h-1v1h1c1 0 2 1.22 2 2.5S13.98 12 13 12H9c-.98 0-2-1.22-2-2.5 0-.83.42-1.64 1-2.09V6.25c-1.09.53-2 1.84-2 3.25C6 11.31 7.55 13 9 13h4c1.45 0 3-1.69 3-3.5S14.5 6 13 6z\"\n  }))), \"Examples\"), mdx(\"ul\", null, mdx(\"li\", {\n    parentName: \"ul\"\n  }, mdx(\"a\", {\n    parentName: \"li\",\n    \"href\": \"https://github.com/paritytech/cumulus/pull/476\"\n  }, \"Statemine runtime deployment\"))), mdx(\"h2\", {\n    \"id\": \"resources\",\n    \"style\": {\n      \"position\": \"relative\"\n    }\n  }, mdx(\"a\", {\n    parentName: \"h2\",\n    \"href\": \"#resources\",\n    \"aria-label\": \"resources permalink\",\n    \"className\": \"anchor before\"\n  }, mdx(\"svg\", {\n    parentName: \"a\",\n    \"className\": \"fill-current text-substrateDark dark:text-white\",\n    \"aria-hidden\": \"true\",\n    \"focusable\": \"false\",\n    \"height\": \"16\",\n    \"version\": \"1.1\",\n    \"viewBox\": \"0 0 16 16\",\n    \"width\": \"16\"\n  }, mdx(\"path\", {\n    parentName: \"svg\",\n    \"fillRule\": \"evenodd\",\n    \"d\": \"M4 9h1v1H4c-1.5 0-3-1.69-3-3.5S2.55 3 4 3h4c1.45 0 3 1.69 3 3.5 0 1.41-.91 2.72-2 3.25V8.59c.58-.45 1-1.27 1-2.09C10 5.22 8.98 4 8 4H4c-.98 0-2 1.22-2 2.5S3 9 4 9zm9-3h-1v1h1c1 0 2 1.22 2 2.5S13.98 12 13 12H9c-.98 0-2-1.22-2-2.5 0-.83.42-1.64 1-2.09V6.25c-1.09.53-2 1.84-2 3.25C6 11.31 7.55 13 9 13h4c1.45 0 3-1.69 3-3.5S14.5 6 13 6z\"\n  }))), \"Resources\"), mdx(\"ul\", null, mdx(\"li\", {\n    parentName: \"ul\"\n  }, mdx(\"a\", {\n    parentName: \"li\",\n    \"href\": \"/v3/runtime/upgrades\"\n  }, \"Reference documentation for runtime upgrades\")), mdx(\"li\", {\n    parentName: \"ul\"\n  }, mdx(\"a\", {\n    parentName: \"li\",\n    \"href\": \"/how-to-guides/v3/weights/use-benchmark-weights\"\n  }, \"A how-to guide to use benchmarked weights\")), mdx(\"li\", {\n    parentName: \"ul\"\n  }, mdx(\"a\", {\n    parentName: \"li\",\n    \"href\": \"/v3/tools/try-runtime\"\n  }, \"Reference for \", mdx(\"inlineCode\", {\n    parentName: \"a\"\n  }, \"try-runtime\"), \" documentation\"), mdx(\"ul\", {\n    parentName: \"li\"\n  }, mdx(\"li\", {\n    parentName: \"ul\"\n  }, mdx(\"a\", {\n    parentName: \"li\",\n    \"href\": \"https://www.crowdcast.io/e/substrate-seminar/41\"\n  }, mdx(\"inlineCode\", {\n    parentName: \"a\"\n  }, \"try-runtime\"), \" video workshop\")))), mdx(\"li\", {\n    parentName: \"ul\"\n  }, mdx(\"a\", {\n    parentName: \"li\",\n    \"href\": \"https://github.com/maxsam4/fork-off-substrate\"\n  }, \"Fork Off Substrate tool\"))));\n}\n;\nMDXContent.isMDXComponent = true;","tableOfContents":{"items":[{"url":"#steps","title":"Steps","items":[{"url":"#1-set-a-unique-protocolid","title":"1. Set a unique protocolId"},{"url":"#2-memory-profiling","title":"2. Memory profiling"},{"url":"#3-minimize-your-runtime-size","title":"3. Minimize your runtime size"},{"url":"#4-use-proper-weights","title":"4. Use proper weights"},{"url":"#5-setup-call-filters","title":"5. Setup call filters"},{"url":"#6-incremental-runtime-deployments","title":"6. Incremental runtime deployments"},{"url":"#7-launch-simulation","title":"7. Launch simulation"}]},{"url":"#examples","title":"Examples"},{"url":"#resources","title":"Resources"}]},"fileAbsolutePath":"/Users/a212/Desktop/substrate-docs/v3/how-to-guides/07-parachains/c-pre-launch/index.mdx"}},"pageContext":{"slug":"/how-to-guides/v3/parachains/pre-launch","version":"3.0","locale":"en","hrefLang":"en-US","originalPath":"/how-to-guides/v3/parachains/pre-launch/","dateFormat":"MM/DD/YYYY"}},
    "staticQueryHashes": ["1239077767","1821483254","2966362950","3280999885"]}