{
    "componentChunkName": "component---src-templates-kb-template-tsx",
    "path": "/v3/runtime/randomness/",
    "result": {"data":{"mdx":{"frontmatter":{"slug":"/v3/runtime/randomness","title":"Randomness","hideNav":null,"section":"docs","category":"runtime"},"body":"var _excluded = [\"components\"];\n\nfunction _extends() { _extends = Object.assign || function (target) { for (var i = 1; i < arguments.length; i++) { var source = arguments[i]; for (var key in source) { if (Object.prototype.hasOwnProperty.call(source, key)) { target[key] = source[key]; } } } return target; }; return _extends.apply(this, arguments); }\n\nfunction _objectWithoutProperties(source, excluded) { if (source == null) return {}; var target = _objectWithoutPropertiesLoose(source, excluded); var key, i; if (Object.getOwnPropertySymbols) { var sourceSymbolKeys = Object.getOwnPropertySymbols(source); for (i = 0; i < sourceSymbolKeys.length; i++) { key = sourceSymbolKeys[i]; if (excluded.indexOf(key) >= 0) continue; if (!Object.prototype.propertyIsEnumerable.call(source, key)) continue; target[key] = source[key]; } } return target; }\n\nfunction _objectWithoutPropertiesLoose(source, excluded) { if (source == null) return {}; var target = {}; var sourceKeys = Object.keys(source); var key, i; for (i = 0; i < sourceKeys.length; i++) { key = sourceKeys[i]; if (excluded.indexOf(key) >= 0) continue; target[key] = source[key]; } return target; }\n\n/* @jsxRuntime classic */\n\n/* @jsx mdx */\nvar _frontmatter = {\n  \"title\": \"Randomness\",\n  \"slug\": \"/v3/runtime/randomness\",\n  \"version\": 3,\n  \"section\": \"docs\",\n  \"category\": \"runtime\",\n  \"keywords\": null\n};\nvar layoutProps = {\n  _frontmatter: _frontmatter\n};\nvar MDXLayout = \"wrapper\";\nreturn function MDXContent(_ref) {\n  var components = _ref.components,\n      props = _objectWithoutProperties(_ref, _excluded);\n\n  return mdx(MDXLayout, _extends({}, layoutProps, props, {\n    components: components,\n    mdxType: \"MDXLayout\"\n  }), mdx(\"p\", null, \"Randomness has many applications in computer science and beyond. For example it is used in selecting\\ncouncilors in some governance systems, performing statistical or scientific analyses, performing\\ncryptographic operations, and gaming and gambling. Many randomness-requiring applications are\\nalready finding a home on blockchain networks. This article describes how randomness is produced and\\nused in Substrate runtimes.\"), mdx(\"h2\", {\n    \"id\": \"deterministic-randomness\",\n    \"style\": {\n      \"position\": \"relative\"\n    }\n  }, mdx(\"a\", {\n    parentName: \"h2\",\n    \"href\": \"#deterministic-randomness\",\n    \"aria-label\": \"deterministic randomness permalink\",\n    \"className\": \"anchor before\"\n  }, mdx(\"svg\", {\n    parentName: \"a\",\n    \"className\": \"fill-current text-substrateDark dark:text-white\",\n    \"aria-hidden\": \"true\",\n    \"focusable\": \"false\",\n    \"height\": \"16\",\n    \"version\": \"1.1\",\n    \"viewBox\": \"0 0 16 16\",\n    \"width\": \"16\"\n  }, mdx(\"path\", {\n    parentName: \"svg\",\n    \"fillRule\": \"evenodd\",\n    \"d\": \"M4 9h1v1H4c-1.5 0-3-1.69-3-3.5S2.55 3 4 3h4c1.45 0 3 1.69 3 3.5 0 1.41-.91 2.72-2 3.25V8.59c.58-.45 1-1.27 1-2.09C10 5.22 8.98 4 8 4H4c-.98 0-2 1.22-2 2.5S3 9 4 9zm9-3h-1v1h1c1 0 2 1.22 2 2.5S13.98 12 13 12H9c-.98 0-2-1.22-2-2.5 0-.83.42-1.64 1-2.09V6.25c-1.09.53-2 1.84-2 3.25C6 11.31 7.55 13 9 13h4c1.45 0 3-1.69 3-3.5S14.5 6 13 6z\"\n  }))), \"Deterministic randomness\"), mdx(\"p\", null, \"In traditional non-blockchain computing, an application that required randomness could choose to use\\na real random value drawn from hardware, or a pseudo-random value that is actually deterministic,\\nbut impractical to predict thanks to cryptography.\"), mdx(\"p\", null, \"Applications that run on the blockchain are more tightly constrained because all authorities in the\\nnetwork must agree on any on-chain value, including any randomness data that is injected. Because of\\nthis constraint, using real randomness directly is impossible.\"), mdx(\"p\", null, \"Luckily, advancements in cryptographic primitives like\\n\", mdx(\"a\", {\n    parentName: \"p\",\n    \"href\": \"https://en.wikipedia.org/wiki/Verifiable_random_function\"\n  }, \"Verifiable Random Functions\"), \" and the\\ndevelopment of multi-party randomness computation allow application that require randomness to still\\nbe used in the Blockchain.\"), mdx(\"h2\", {\n    \"id\": \"substrates-randomness-trait\",\n    \"style\": {\n      \"position\": \"relative\"\n    }\n  }, mdx(\"a\", {\n    parentName: \"h2\",\n    \"href\": \"#substrates-randomness-trait\",\n    \"aria-label\": \"substrates randomness trait permalink\",\n    \"className\": \"anchor before\"\n  }, mdx(\"svg\", {\n    parentName: \"a\",\n    \"className\": \"fill-current text-substrateDark dark:text-white\",\n    \"aria-hidden\": \"true\",\n    \"focusable\": \"false\",\n    \"height\": \"16\",\n    \"version\": \"1.1\",\n    \"viewBox\": \"0 0 16 16\",\n    \"width\": \"16\"\n  }, mdx(\"path\", {\n    parentName: \"svg\",\n    \"fillRule\": \"evenodd\",\n    \"d\": \"M4 9h1v1H4c-1.5 0-3-1.69-3-3.5S2.55 3 4 3h4c1.45 0 3 1.69 3 3.5 0 1.41-.91 2.72-2 3.25V8.59c.58-.45 1-1.27 1-2.09C10 5.22 8.98 4 8 4H4c-.98 0-2 1.22-2 2.5S3 9 4 9zm9-3h-1v1h1c1 0 2 1.22 2 2.5S13.98 12 13 12H9c-.98 0-2-1.22-2-2.5 0-.83.42-1.64 1-2.09V6.25c-1.09.53-2 1.84-2 3.25C6 11.31 7.55 13 9 13h4c1.45 0 3-1.69 3-3.5S14.5 6 13 6z\"\n  }))), \"Substrate's randomness trait\"), mdx(\"p\", null, \"Substrate provides a trait called\\n\", mdx(\"a\", {\n    parentName: \"p\",\n    \"href\": \"/rustdocs/latest/frame_support/traits/trait.Randomness.html\"\n  }, mdx(\"inlineCode\", {\n    parentName: \"a\"\n  }, \"Randomness\")), \" that codifies\\nthe interface between the logic that generates randomness and the logic that consumes it. This trait\\nallows the two pieces of logic to be written independently of each other.\"), mdx(\"h3\", {\n    \"id\": \"consuming-randomness\",\n    \"style\": {\n      \"position\": \"relative\"\n    }\n  }, mdx(\"a\", {\n    parentName: \"h3\",\n    \"href\": \"#consuming-randomness\",\n    \"aria-label\": \"consuming randomness permalink\",\n    \"className\": \"anchor before\"\n  }, mdx(\"svg\", {\n    parentName: \"a\",\n    \"className\": \"fill-current text-substrateDark dark:text-white\",\n    \"aria-hidden\": \"true\",\n    \"focusable\": \"false\",\n    \"height\": \"16\",\n    \"version\": \"1.1\",\n    \"viewBox\": \"0 0 16 16\",\n    \"width\": \"16\"\n  }, mdx(\"path\", {\n    parentName: \"svg\",\n    \"fillRule\": \"evenodd\",\n    \"d\": \"M4 9h1v1H4c-1.5 0-3-1.69-3-3.5S2.55 3 4 3h4c1.45 0 3 1.69 3 3.5 0 1.41-.91 2.72-2 3.25V8.59c.58-.45 1-1.27 1-2.09C10 5.22 8.98 4 8 4H4c-.98 0-2 1.22-2 2.5S3 9 4 9zm9-3h-1v1h1c1 0 2 1.22 2 2.5S13.98 12 13 12H9c-.98 0-2-1.22-2-2.5 0-.83.42-1.64 1-2.09V6.25c-1.09.53-2 1.84-2 3.25C6 11.31 7.55 13 9 13h4c1.45 0 3-1.69 3-3.5S14.5 6 13 6z\"\n  }))), \"Consuming randomness\"), mdx(\"p\", null, \"A developer who is writing a pallet that needs randomness, does not need to worry about providing\\nthat randomness. Rather, the pallet can simply require a randomness source that implements the trait.\\nThe \", mdx(\"inlineCode\", {\n    parentName: \"p\"\n  }, \"Randomness\"), \" Trait provides two methods for gaining randomness.\"), mdx(\"p\", null, \"The first method is called \", mdx(\"inlineCode\", {\n    parentName: \"p\"\n  }, \"random_seed\"), \". It takes no parameters and gives back a raw piece of\\nrandomness. Calling this method multiple times in a block will return the same value each time.\\nThus, it is not recommended to use this method directly.\"), mdx(\"p\", null, \"The second method is called random. It takes a byte-array which is used as a context identifier and\\nreturns a result as unique to this context and as independently from other contexts as allowed by\\nthe underlying randomness source.\"), mdx(\"h3\", {\n    \"id\": \"generating-randomness\",\n    \"style\": {\n      \"position\": \"relative\"\n    }\n  }, mdx(\"a\", {\n    parentName: \"h3\",\n    \"href\": \"#generating-randomness\",\n    \"aria-label\": \"generating randomness permalink\",\n    \"className\": \"anchor before\"\n  }, mdx(\"svg\", {\n    parentName: \"a\",\n    \"className\": \"fill-current text-substrateDark dark:text-white\",\n    \"aria-hidden\": \"true\",\n    \"focusable\": \"false\",\n    \"height\": \"16\",\n    \"version\": \"1.1\",\n    \"viewBox\": \"0 0 16 16\",\n    \"width\": \"16\"\n  }, mdx(\"path\", {\n    parentName: \"svg\",\n    \"fillRule\": \"evenodd\",\n    \"d\": \"M4 9h1v1H4c-1.5 0-3-1.69-3-3.5S2.55 3 4 3h4c1.45 0 3 1.69 3 3.5 0 1.41-.91 2.72-2 3.25V8.59c.58-.45 1-1.27 1-2.09C10 5.22 8.98 4 8 4H4c-.98 0-2 1.22-2 2.5S3 9 4 9zm9-3h-1v1h1c1 0 2 1.22 2 2.5S13.98 12 13 12H9c-.98 0-2-1.22-2-2.5 0-.83.42-1.64 1-2.09V6.25c-1.09.53-2 1.84-2 3.25C6 11.31 7.55 13 9 13h4c1.45 0 3-1.69 3-3.5S14.5 6 13 6z\"\n  }))), \"Generating randomness\"), mdx(\"p\", null, \"There are many different ways to implement the \", mdx(\"inlineCode\", {\n    parentName: \"p\"\n  }, \"Randomness\"), \" trait, each of which represents\\ndifferent trade-offs between performance, complexity, and security. Substrate ships with two\\nimplementations, and developers are able to provide their own implementation if they would like to\\nmake different tradeoffs.\"), mdx(\"p\", null, \"The first implementation provided by Substrate is the\\n\", mdx(\"a\", {\n    parentName: \"p\",\n    \"href\": \"/rustdocs/latest/pallet_randomness_collective_flip/index.html\"\n  }, \"Randomness Collective Flip Pallet\"), \".\\nThis pallet is based on collective coin flipping. It is quite performant, but not very secure. This\\npallet should be used only when testing randomness-consuming pallets, not it production.\"), mdx(\"p\", null, \"The second implementation is the \", mdx(\"a\", {\n    parentName: \"p\",\n    \"href\": \"/rustdocs/latest/pallet_babe/index.html\"\n  }, \"BABE pallet\"), \",\\nwhich uses verifiable random functions. This pallet provides production-grade randomness, and is\\nused in Polkadot. Selecting this randomness source dictates that your blockchain use Babe consensus.\"), mdx(\"h2\", {\n    \"id\": \"security-properties\",\n    \"style\": {\n      \"position\": \"relative\"\n    }\n  }, mdx(\"a\", {\n    parentName: \"h2\",\n    \"href\": \"#security-properties\",\n    \"aria-label\": \"security properties permalink\",\n    \"className\": \"anchor before\"\n  }, mdx(\"svg\", {\n    parentName: \"a\",\n    \"className\": \"fill-current text-substrateDark dark:text-white\",\n    \"aria-hidden\": \"true\",\n    \"focusable\": \"false\",\n    \"height\": \"16\",\n    \"version\": \"1.1\",\n    \"viewBox\": \"0 0 16 16\",\n    \"width\": \"16\"\n  }, mdx(\"path\", {\n    parentName: \"svg\",\n    \"fillRule\": \"evenodd\",\n    \"d\": \"M4 9h1v1H4c-1.5 0-3-1.69-3-3.5S2.55 3 4 3h4c1.45 0 3 1.69 3 3.5 0 1.41-.91 2.72-2 3.25V8.59c.58-.45 1-1.27 1-2.09C10 5.22 8.98 4 8 4H4c-.98 0-2 1.22-2 2.5S3 9 4 9zm9-3h-1v1h1c1 0 2 1.22 2 2.5S13.98 12 13 12H9c-.98 0-2-1.22-2-2.5 0-.83.42-1.64 1-2.09V6.25c-1.09.53-2 1.84-2 3.25C6 11.31 7.55 13 9 13h4c1.45 0 3-1.69 3-3.5S14.5 6 13 6z\"\n  }))), \"Security properties\"), mdx(\"p\", null, \"The \", mdx(\"inlineCode\", {\n    parentName: \"p\"\n  }, \"Randomness\"), \" trait provides a convenient and useful abstraction over randomness sources in\\nSubstrate runtimes. But the trait itself does not make any security guarantees. A\\nruntime developer must ensure that the randomness source used meets the security requirements of\\n\", mdx(\"em\", {\n    parentName: \"p\"\n  }, \"all\"), \" pallet's that consume its randomness.\"), mdx(\"h2\", {\n    \"id\": \"next-steps\",\n    \"style\": {\n      \"position\": \"relative\"\n    }\n  }, mdx(\"a\", {\n    parentName: \"h2\",\n    \"href\": \"#next-steps\",\n    \"aria-label\": \"next steps permalink\",\n    \"className\": \"anchor before\"\n  }, mdx(\"svg\", {\n    parentName: \"a\",\n    \"className\": \"fill-current text-substrateDark dark:text-white\",\n    \"aria-hidden\": \"true\",\n    \"focusable\": \"false\",\n    \"height\": \"16\",\n    \"version\": \"1.1\",\n    \"viewBox\": \"0 0 16 16\",\n    \"width\": \"16\"\n  }, mdx(\"path\", {\n    parentName: \"svg\",\n    \"fillRule\": \"evenodd\",\n    \"d\": \"M4 9h1v1H4c-1.5 0-3-1.69-3-3.5S2.55 3 4 3h4c1.45 0 3 1.69 3 3.5 0 1.41-.91 2.72-2 3.25V8.59c.58-.45 1-1.27 1-2.09C10 5.22 8.98 4 8 4H4c-.98 0-2 1.22-2 2.5S3 9 4 9zm9-3h-1v1h1c1 0 2 1.22 2 2.5S13.98 12 13 12H9c-.98 0-2-1.22-2-2.5 0-.83.42-1.64 1-2.09V6.25c-1.09.53-2 1.84-2 3.25C6 11.31 7.55 13 9 13h4c1.45 0 3-1.69 3-3.5S14.5 6 13 6z\"\n  }))), \"Next steps\"), mdx(\"h3\", {\n    \"id\": \"learn-more\",\n    \"style\": {\n      \"position\": \"relative\"\n    }\n  }, mdx(\"a\", {\n    parentName: \"h3\",\n    \"href\": \"#learn-more\",\n    \"aria-label\": \"learn more permalink\",\n    \"className\": \"anchor before\"\n  }, mdx(\"svg\", {\n    parentName: \"a\",\n    \"className\": \"fill-current text-substrateDark dark:text-white\",\n    \"aria-hidden\": \"true\",\n    \"focusable\": \"false\",\n    \"height\": \"16\",\n    \"version\": \"1.1\",\n    \"viewBox\": \"0 0 16 16\",\n    \"width\": \"16\"\n  }, mdx(\"path\", {\n    parentName: \"svg\",\n    \"fillRule\": \"evenodd\",\n    \"d\": \"M4 9h1v1H4c-1.5 0-3-1.69-3-3.5S2.55 3 4 3h4c1.45 0 3 1.69 3 3.5 0 1.41-.91 2.72-2 3.25V8.59c.58-.45 1-1.27 1-2.09C10 5.22 8.98 4 8 4H4c-.98 0-2 1.22-2 2.5S3 9 4 9zm9-3h-1v1h1c1 0 2 1.22 2 2.5S13.98 12 13 12H9c-.98 0-2-1.22-2-2.5 0-.83.42-1.64 1-2.09V6.25c-1.09.53-2 1.84-2 3.25C6 11.31 7.55 13 9 13h4c1.45 0 3-1.69 3-3.5S14.5 6 13 6z\"\n  }))), \"Learn more\"), mdx(\"ul\", null, mdx(\"li\", {\n    parentName: \"ul\"\n  }, mdx(\"a\", {\n    parentName: \"li\",\n    \"href\": \"https://en.wikipedia.org/wiki/Random_number_generation\"\n  }, \"Random number generation\")), mdx(\"li\", {\n    parentName: \"ul\"\n  }, mdx(\"a\", {\n    parentName: \"li\",\n    \"href\": \"https://en.wikipedia.org/wiki/Applications_of_randomness\"\n  }, \"Different applications for randomness\"))), mdx(\"h3\", {\n    \"id\": \"examples\",\n    \"style\": {\n      \"position\": \"relative\"\n    }\n  }, mdx(\"a\", {\n    parentName: \"h3\",\n    \"href\": \"#examples\",\n    \"aria-label\": \"examples permalink\",\n    \"className\": \"anchor before\"\n  }, mdx(\"svg\", {\n    parentName: \"a\",\n    \"className\": \"fill-current text-substrateDark dark:text-white\",\n    \"aria-hidden\": \"true\",\n    \"focusable\": \"false\",\n    \"height\": \"16\",\n    \"version\": \"1.1\",\n    \"viewBox\": \"0 0 16 16\",\n    \"width\": \"16\"\n  }, mdx(\"path\", {\n    parentName: \"svg\",\n    \"fillRule\": \"evenodd\",\n    \"d\": \"M4 9h1v1H4c-1.5 0-3-1.69-3-3.5S2.55 3 4 3h4c1.45 0 3 1.69 3 3.5 0 1.41-.91 2.72-2 3.25V8.59c.58-.45 1-1.27 1-2.09C10 5.22 8.98 4 8 4H4c-.98 0-2 1.22-2 2.5S3 9 4 9zm9-3h-1v1h1c1 0 2 1.22 2 2.5S13.98 12 13 12H9c-.98 0-2-1.22-2-2.5 0-.83.42-1.64 1-2.09V6.25c-1.09.53-2 1.84-2 3.25C6 11.31 7.55 13 9 13h4c1.45 0 3-1.69 3-3.5S14.5 6 13 6z\"\n  }))), \"Examples\"), mdx(\"ul\", null, mdx(\"li\", {\n    parentName: \"ul\"\n  }, \"Explore this \", mdx(\"a\", {\n    parentName: \"li\",\n    \"href\": \"/how-to-guides/v3/pallet-design/randomness/\"\n  }, \"guide about implementing Randomness\"))), mdx(\"h3\", {\n    \"id\": \"references\",\n    \"style\": {\n      \"position\": \"relative\"\n    }\n  }, mdx(\"a\", {\n    parentName: \"h3\",\n    \"href\": \"#references\",\n    \"aria-label\": \"references permalink\",\n    \"className\": \"anchor before\"\n  }, mdx(\"svg\", {\n    parentName: \"a\",\n    \"className\": \"fill-current text-substrateDark dark:text-white\",\n    \"aria-hidden\": \"true\",\n    \"focusable\": \"false\",\n    \"height\": \"16\",\n    \"version\": \"1.1\",\n    \"viewBox\": \"0 0 16 16\",\n    \"width\": \"16\"\n  }, mdx(\"path\", {\n    parentName: \"svg\",\n    \"fillRule\": \"evenodd\",\n    \"d\": \"M4 9h1v1H4c-1.5 0-3-1.69-3-3.5S2.55 3 4 3h4c1.45 0 3 1.69 3 3.5 0 1.41-.91 2.72-2 3.25V8.59c.58-.45 1-1.27 1-2.09C10 5.22 8.98 4 8 4H4c-.98 0-2 1.22-2 2.5S3 9 4 9zm9-3h-1v1h1c1 0 2 1.22 2 2.5S13.98 12 13 12H9c-.98 0-2-1.22-2-2.5 0-.83.42-1.64 1-2.09V6.25c-1.09.53-2 1.84-2 3.25C6 11.31 7.55 13 9 13h4c1.45 0 3-1.69 3-3.5S14.5 6 13 6z\"\n  }))), \"References\"), mdx(\"ul\", null, mdx(\"li\", {\n    parentName: \"ul\"\n  }, \"Read more in the \", mdx(\"a\", {\n    parentName: \"li\",\n    \"href\": \"https://wiki.polkadot.network/docs/en/learn-randomness\"\n  }, \"Polkadot Wiki\")), mdx(\"li\", {\n    parentName: \"ul\"\n  }, \"View the Rustdocs on the\\n\", mdx(\"a\", {\n    parentName: \"li\",\n    \"href\": \"/rustdocs/latest/frame_support/traits/trait.Randomness.html\"\n  }, mdx(\"inlineCode\", {\n    parentName: \"a\"\n  }, \"Randomness\"), \" Trait\"))));\n}\n;\nMDXContent.isMDXComponent = true;","tableOfContents":{"items":[{"url":"#deterministic-randomness","title":"Deterministic randomness"},{"url":"#substrates-randomness-trait","title":"Substrate's randomness trait","items":[{"url":"#consuming-randomness","title":"Consuming randomness"},{"url":"#generating-randomness","title":"Generating randomness"}]},{"url":"#security-properties","title":"Security properties"},{"url":"#next-steps","title":"Next steps","items":[{"url":"#learn-more","title":"Learn more"},{"url":"#examples","title":"Examples"},{"url":"#references","title":"References"}]}]},"fileAbsolutePath":"/Users/a212/Desktop/substrate-docs/v3/docs/03-runtime/l-randomness/index.mdx"}},"pageContext":{"slug":"/v3/runtime/randomness","version":"3.0","locale":"en","hrefLang":"en-US","originalPath":"/v3/runtime/randomness/","dateFormat":"MM/DD/YYYY"}},
    "staticQueryHashes": ["1239077767","1821483254","2966362950","3280999885"]}