{
    "componentChunkName": "component---src-templates-kb-template-tsx",
    "path": "/v3/concepts/account-abstractions/",
    "result": {"data":{"mdx":{"frontmatter":{"slug":"/v3/concepts/account-abstractions","title":"Account Abstractions","hideNav":null,"section":"docs","category":"concepts"},"body":"var _excluded = [\"components\"];\n\nfunction _extends() { _extends = Object.assign || function (target) { for (var i = 1; i < arguments.length; i++) { var source = arguments[i]; for (var key in source) { if (Object.prototype.hasOwnProperty.call(source, key)) { target[key] = source[key]; } } } return target; }; return _extends.apply(this, arguments); }\n\nfunction _objectWithoutProperties(source, excluded) { if (source == null) return {}; var target = _objectWithoutPropertiesLoose(source, excluded); var key, i; if (Object.getOwnPropertySymbols) { var sourceSymbolKeys = Object.getOwnPropertySymbols(source); for (i = 0; i < sourceSymbolKeys.length; i++) { key = sourceSymbolKeys[i]; if (excluded.indexOf(key) >= 0) continue; if (!Object.prototype.propertyIsEnumerable.call(source, key)) continue; target[key] = source[key]; } } return target; }\n\nfunction _objectWithoutPropertiesLoose(source, excluded) { if (source == null) return {}; var target = {}; var sourceKeys = Object.keys(source); var key, i; for (i = 0; i < sourceKeys.length; i++) { key = sourceKeys[i]; if (excluded.indexOf(key) >= 0) continue; target[key] = source[key]; } return target; }\n\n/* @jsxRuntime classic */\n\n/* @jsx mdx */\nvar _frontmatter = {\n  \"title\": \"Account Abstractions\",\n  \"slug\": \"/v3/concepts/account-abstractions\",\n  \"version\": 3,\n  \"section\": \"docs\",\n  \"category\": \"concepts\",\n  \"keywords\": null\n};\n\nvar makeShortcode = function makeShortcode(name) {\n  return function MDXDefaultShortcode(props) {\n    console.warn(\"Component \" + name + \" was not imported, exported, or provided by MDXProvider as global scope\");\n    return mdx(\"div\", props);\n  };\n};\n\nvar Message = makeShortcode(\"Message\");\nvar layoutProps = {\n  _frontmatter: _frontmatter\n};\nvar MDXLayout = \"wrapper\";\nreturn function MDXContent(_ref) {\n  var components = _ref.components,\n      props = _objectWithoutProperties(_ref, _excluded);\n\n  return mdx(MDXLayout, _extends({}, layoutProps, props, {\n    components: components,\n    mdxType: \"MDXLayout\"\n  }), mdx(\"p\", null, \"Substrate uses multiple sets of public/private key pairs to represent participants of the network,\\nincluding validators, nominators and normal users.\"), mdx(\"p\", null, \"As an example, the Substrate node uses a Nominated Proof-of-Stake (NPoS) algorithm to select\\nvalidators. Validators and nominators may hold significant amounts of funds, so Substrate's \", mdx(\"a\", {\n    parentName: \"p\",\n    \"href\": \"/v3/runtime/frame#staking\"\n  }, \"Staking\\npallet\"), \" introduces account abstractions that help keep funds as secure as possible.\"), mdx(\"p\", null, \"These abstractions are:\"), mdx(\"ul\", null, mdx(\"li\", {\n    parentName: \"ul\"\n  }, mdx(\"strong\", {\n    parentName: \"li\"\n  }, \"Stash Key\"), \": a Stash account is meant to hold large amounts of funds. Its private key should be\\nas secure as possible in a cold wallet.\"), mdx(\"li\", {\n    parentName: \"ul\"\n  }, mdx(\"strong\", {\n    parentName: \"li\"\n  }, \"Controller Key\"), \": a Controller account signals choices on behalf of the Stash account, like\\npayout preferences, but should only hold a minimal amount of funds to pay transaction fees. Its\\nprivate key should be secure as it can affect validator settings, but will be used somewhat\\nregularly for validator maintenance.\"), mdx(\"li\", {\n    parentName: \"ul\"\n  }, mdx(\"strong\", {\n    parentName: \"li\"\n  }, \"Session Keys\"), \": these are \\\"hot\\\" keys kept in the validator client and used for signing\\ncertain validator operations. They should never hold funds.\")), mdx(Message, {\n    type: \"green\",\n    title: \"Further Learning\",\n    text: \"Learn more about validators and nominators \\n  in the context of the Substrate's NPoS [Staking pallet](/rustdocs/latest/pallet_staking/index.html).\",\n    mdxType: \"Message\"\n  }), mdx(\"h2\", {\n    \"id\": \"account-keys\",\n    \"style\": {\n      \"position\": \"relative\"\n    }\n  }, mdx(\"a\", {\n    parentName: \"h2\",\n    \"href\": \"#account-keys\",\n    \"aria-label\": \"account keys permalink\",\n    \"className\": \"anchor before\"\n  }, mdx(\"svg\", {\n    parentName: \"a\",\n    \"className\": \"fill-current text-substrateDark dark:text-white\",\n    \"aria-hidden\": \"true\",\n    \"focusable\": \"false\",\n    \"height\": \"16\",\n    \"version\": \"1.1\",\n    \"viewBox\": \"0 0 16 16\",\n    \"width\": \"16\"\n  }, mdx(\"path\", {\n    parentName: \"svg\",\n    \"fillRule\": \"evenodd\",\n    \"d\": \"M4 9h1v1H4c-1.5 0-3-1.69-3-3.5S2.55 3 4 3h4c1.45 0 3 1.69 3 3.5 0 1.41-.91 2.72-2 3.25V8.59c.58-.45 1-1.27 1-2.09C10 5.22 8.98 4 8 4H4c-.98 0-2 1.22-2 2.5S3 9 4 9zm9-3h-1v1h1c1 0 2 1.22 2 2.5S13.98 12 13 12H9c-.98 0-2-1.22-2-2.5 0-.83.42-1.64 1-2.09V6.25c-1.09.53-2 1.84-2 3.25C6 11.31 7.55 13 9 13h4c1.45 0 3-1.69 3-3.5S14.5 6 13 6z\"\n  }))), \"Account keys\"), mdx(\"p\", null, \"A key pair can represent an account and control funds, like normal accounts that you would expect\\nfrom other blockchains. In the context of Substrate's\\n\", mdx(\"a\", {\n    parentName: \"p\",\n    \"href\": \"/rustdocs/latest/pallet_balances/index.html\"\n  }, \"Balances pallet\"), \", these accounts\\nmust have a minimum amount (an \\\"existential deposit\\\") to exist in storage.\"), mdx(\"p\", null, \"Account keys are defined generically and made concrete in the runtime.\"), mdx(\"p\", null, \"To continue with our example of Stash and Controller accounts, the keys to these accounts are\\ndistinguished by their intended use, not by any underlying cryptographic difference. When creating\\nStash or Controller keys, all cryptography supported for normal account keys are also supported.\"), mdx(\"h3\", {\n    \"id\": \"stash-keys\",\n    \"style\": {\n      \"position\": \"relative\"\n    }\n  }, mdx(\"a\", {\n    parentName: \"h3\",\n    \"href\": \"#stash-keys\",\n    \"aria-label\": \"stash keys permalink\",\n    \"className\": \"anchor before\"\n  }, mdx(\"svg\", {\n    parentName: \"a\",\n    \"className\": \"fill-current text-substrateDark dark:text-white\",\n    \"aria-hidden\": \"true\",\n    \"focusable\": \"false\",\n    \"height\": \"16\",\n    \"version\": \"1.1\",\n    \"viewBox\": \"0 0 16 16\",\n    \"width\": \"16\"\n  }, mdx(\"path\", {\n    parentName: \"svg\",\n    \"fillRule\": \"evenodd\",\n    \"d\": \"M4 9h1v1H4c-1.5 0-3-1.69-3-3.5S2.55 3 4 3h4c1.45 0 3 1.69 3 3.5 0 1.41-.91 2.72-2 3.25V8.59c.58-.45 1-1.27 1-2.09C10 5.22 8.98 4 8 4H4c-.98 0-2 1.22-2 2.5S3 9 4 9zm9-3h-1v1h1c1 0 2 1.22 2 2.5S13.98 12 13 12H9c-.98 0-2-1.22-2-2.5 0-.83.42-1.64 1-2.09V6.25c-1.09.53-2 1.84-2 3.25C6 11.31 7.55 13 9 13h4c1.45 0 3-1.69 3-3.5S14.5 6 13 6z\"\n  }))), \"Stash keys\"), mdx(\"p\", null, \"The Stash keys are the public/private key pair that defines a Stash account. This account is like a\\n\\\"savings account\\\" in that you should not make frequent transactions from it. Therefore, its private\\nkey should be treated with the utmost security, for example protected in a safe or layers of\\nhardware security.\"), mdx(\"p\", null, \"Since the Stash key is kept offline, it designates a Controller account to make non-spending\\ndecisions with the weight of the Stash account's funds. It can also designate a Proxy account to\\nvote in governance on its behalf.\"), mdx(\"h3\", {\n    \"id\": \"controller-keys\",\n    \"style\": {\n      \"position\": \"relative\"\n    }\n  }, mdx(\"a\", {\n    parentName: \"h3\",\n    \"href\": \"#controller-keys\",\n    \"aria-label\": \"controller keys permalink\",\n    \"className\": \"anchor before\"\n  }, mdx(\"svg\", {\n    parentName: \"a\",\n    \"className\": \"fill-current text-substrateDark dark:text-white\",\n    \"aria-hidden\": \"true\",\n    \"focusable\": \"false\",\n    \"height\": \"16\",\n    \"version\": \"1.1\",\n    \"viewBox\": \"0 0 16 16\",\n    \"width\": \"16\"\n  }, mdx(\"path\", {\n    parentName: \"svg\",\n    \"fillRule\": \"evenodd\",\n    \"d\": \"M4 9h1v1H4c-1.5 0-3-1.69-3-3.5S2.55 3 4 3h4c1.45 0 3 1.69 3 3.5 0 1.41-.91 2.72-2 3.25V8.59c.58-.45 1-1.27 1-2.09C10 5.22 8.98 4 8 4H4c-.98 0-2 1.22-2 2.5S3 9 4 9zm9-3h-1v1h1c1 0 2 1.22 2 2.5S13.98 12 13 12H9c-.98 0-2-1.22-2-2.5 0-.83.42-1.64 1-2.09V6.25c-1.09.53-2 1.84-2 3.25C6 11.31 7.55 13 9 13h4c1.45 0 3-1.69 3-3.5S14.5 6 13 6z\"\n  }))), \"Controller keys\"), mdx(\"p\", null, \"The Controller keys are the public/private key pair that defines a Controller account. In the\\ncontext of Substrate's NPoS model, the Controller key will signal one's intent to validate or\\nnominate.\"), mdx(\"p\", null, \"The Controller key is used to set preferences like the rewards destination and, in the case of\\nvalidators, to set their Session keys. The Controller account only needs to pay transaction fees, so\\nit only needs a minimal amount of funds.\"), mdx(\"p\", null, \"The Controller key can never be used to spend funds from its Stash account. However, actions taken\\nby the Controller can result in slashing, so it should still be well secured.\"), mdx(\"h2\", {\n    \"id\": \"next-steps\",\n    \"style\": {\n      \"position\": \"relative\"\n    }\n  }, mdx(\"a\", {\n    parentName: \"h2\",\n    \"href\": \"#next-steps\",\n    \"aria-label\": \"next steps permalink\",\n    \"className\": \"anchor before\"\n  }, mdx(\"svg\", {\n    parentName: \"a\",\n    \"className\": \"fill-current text-substrateDark dark:text-white\",\n    \"aria-hidden\": \"true\",\n    \"focusable\": \"false\",\n    \"height\": \"16\",\n    \"version\": \"1.1\",\n    \"viewBox\": \"0 0 16 16\",\n    \"width\": \"16\"\n  }, mdx(\"path\", {\n    parentName: \"svg\",\n    \"fillRule\": \"evenodd\",\n    \"d\": \"M4 9h1v1H4c-1.5 0-3-1.69-3-3.5S2.55 3 4 3h4c1.45 0 3 1.69 3 3.5 0 1.41-.91 2.72-2 3.25V8.59c.58-.45 1-1.27 1-2.09C10 5.22 8.98 4 8 4H4c-.98 0-2 1.22-2 2.5S3 9 4 9zm9-3h-1v1h1c1 0 2 1.22 2 2.5S13.98 12 13 12H9c-.98 0-2-1.22-2-2.5 0-.83.42-1.64 1-2.09V6.25c-1.09.53-2 1.84-2 3.25C6 11.31 7.55 13 9 13h4c1.45 0 3-1.69 3-3.5S14.5 6 13 6z\"\n  }))), \"Next steps\"), mdx(\"h3\", {\n    \"id\": \"learn-more\",\n    \"style\": {\n      \"position\": \"relative\"\n    }\n  }, mdx(\"a\", {\n    parentName: \"h3\",\n    \"href\": \"#learn-more\",\n    \"aria-label\": \"learn more permalink\",\n    \"className\": \"anchor before\"\n  }, mdx(\"svg\", {\n    parentName: \"a\",\n    \"className\": \"fill-current text-substrateDark dark:text-white\",\n    \"aria-hidden\": \"true\",\n    \"focusable\": \"false\",\n    \"height\": \"16\",\n    \"version\": \"1.1\",\n    \"viewBox\": \"0 0 16 16\",\n    \"width\": \"16\"\n  }, mdx(\"path\", {\n    parentName: \"svg\",\n    \"fillRule\": \"evenodd\",\n    \"d\": \"M4 9h1v1H4c-1.5 0-3-1.69-3-3.5S2.55 3 4 3h4c1.45 0 3 1.69 3 3.5 0 1.41-.91 2.72-2 3.25V8.59c.58-.45 1-1.27 1-2.09C10 5.22 8.98 4 8 4H4c-.98 0-2 1.22-2 2.5S3 9 4 9zm9-3h-1v1h1c1 0 2 1.22 2 2.5S13.98 12 13 12H9c-.98 0-2-1.22-2-2.5 0-.83.42-1.64 1-2.09V6.25c-1.09.53-2 1.84-2 3.25C6 11.31 7.55 13 9 13h4c1.45 0 3-1.69 3-3.5S14.5 6 13 6z\"\n  }))), \"Learn more\"), mdx(\"ul\", null, mdx(\"li\", {\n    parentName: \"ul\"\n  }, \"Learn more about Session Keys in the \", mdx(\"a\", {\n    parentName: \"li\",\n    \"href\": \"/v3/concepts/session-keys\"\n  }, \"this article\"), \".\"), mdx(\"li\", {\n    parentName: \"ul\"\n  }, \"Learn about the \", mdx(\"a\", {\n    parentName: \"li\",\n    \"href\": \"/v3/advanced/cryptography\"\n  }, \"cryptography used within Substrate\"), \".\")), mdx(\"h3\", {\n    \"id\": \"examples\",\n    \"style\": {\n      \"position\": \"relative\"\n    }\n  }, mdx(\"a\", {\n    parentName: \"h3\",\n    \"href\": \"#examples\",\n    \"aria-label\": \"examples permalink\",\n    \"className\": \"anchor before\"\n  }, mdx(\"svg\", {\n    parentName: \"a\",\n    \"className\": \"fill-current text-substrateDark dark:text-white\",\n    \"aria-hidden\": \"true\",\n    \"focusable\": \"false\",\n    \"height\": \"16\",\n    \"version\": \"1.1\",\n    \"viewBox\": \"0 0 16 16\",\n    \"width\": \"16\"\n  }, mdx(\"path\", {\n    parentName: \"svg\",\n    \"fillRule\": \"evenodd\",\n    \"d\": \"M4 9h1v1H4c-1.5 0-3-1.69-3-3.5S2.55 3 4 3h4c1.45 0 3 1.69 3 3.5 0 1.41-.91 2.72-2 3.25V8.59c.58-.45 1-1.27 1-2.09C10 5.22 8.98 4 8 4H4c-.98 0-2 1.22-2 2.5S3 9 4 9zm9-3h-1v1h1c1 0 2 1.22 2 2.5S13.98 12 13 12H9c-.98 0-2-1.22-2-2.5 0-.83.42-1.64 1-2.09V6.25c-1.09.53-2 1.84-2 3.25C6 11.31 7.55 13 9 13h4c1.45 0 3-1.69 3-3.5S14.5 6 13 6z\"\n  }))), \"Examples\"), mdx(\"ul\", null, mdx(\"li\", {\n    parentName: \"ul\"\n  }, \"Follow our\\n\", mdx(\"a\", {\n    parentName: \"li\",\n    \"href\": \"/tutorials/v3/private-network\"\n  }, \"tutorial to create a local network and generate keys\"), \".\")), mdx(\"h3\", {\n    \"id\": \"references\",\n    \"style\": {\n      \"position\": \"relative\"\n    }\n  }, mdx(\"a\", {\n    parentName: \"h3\",\n    \"href\": \"#references\",\n    \"aria-label\": \"references permalink\",\n    \"className\": \"anchor before\"\n  }, mdx(\"svg\", {\n    parentName: \"a\",\n    \"className\": \"fill-current text-substrateDark dark:text-white\",\n    \"aria-hidden\": \"true\",\n    \"focusable\": \"false\",\n    \"height\": \"16\",\n    \"version\": \"1.1\",\n    \"viewBox\": \"0 0 16 16\",\n    \"width\": \"16\"\n  }, mdx(\"path\", {\n    parentName: \"svg\",\n    \"fillRule\": \"evenodd\",\n    \"d\": \"M4 9h1v1H4c-1.5 0-3-1.69-3-3.5S2.55 3 4 3h4c1.45 0 3 1.69 3 3.5 0 1.41-.91 2.72-2 3.25V8.59c.58-.45 1-1.27 1-2.09C10 5.22 8.98 4 8 4H4c-.98 0-2 1.22-2 2.5S3 9 4 9zm9-3h-1v1h1c1 0 2 1.22 2 2.5S13.98 12 13 12H9c-.98 0-2-1.22-2-2.5 0-.83.42-1.64 1-2.09V6.25c-1.09.53-2 1.84-2 3.25C6 11.31 7.55 13 9 13h4c1.45 0 3-1.69 3-3.5S14.5 6 13 6z\"\n  }))), \"References\"), mdx(\"ul\", null, mdx(\"li\", {\n    parentName: \"ul\"\n  }, mdx(\"p\", {\n    parentName: \"li\"\n  }, \"Visit the reference docs for the\\n\", mdx(\"a\", {\n    parentName: \"p\",\n    \"href\": \"/rustdocs/latest/sp_session/trait.SessionKeys.html\"\n  }, \"session keys runtime API\"), \".\")), mdx(\"li\", {\n    parentName: \"ul\"\n  }, mdx(\"p\", {\n    parentName: \"li\"\n  }, \"Take a look at the default\\n\", mdx(\"a\", {\n    parentName: \"p\",\n    \"href\": \"/rustdocs/latest/node_runtime/struct.SessionKeys.html\"\n  }, \"session keys in the Substrate node runtime\"), \".\"))));\n}\n;\nMDXContent.isMDXComponent = true;","tableOfContents":{"items":[{"url":"#account-keys","title":"Account keys","items":[{"url":"#stash-keys","title":"Stash keys"},{"url":"#controller-keys","title":"Controller keys"}]},{"url":"#next-steps","title":"Next steps","items":[{"url":"#learn-more","title":"Learn more"},{"url":"#examples","title":"Examples"},{"url":"#references","title":"References"}]}]},"fileAbsolutePath":"/Users/a212/Desktop/substrate-docs/v3/docs/02-concepts/c-account-abstractions/index.mdx"}},"pageContext":{"slug":"/v3/concepts/account-abstractions","version":"3.0","locale":"en","hrefLang":"en-US","originalPath":"/v3/concepts/account-abstractions/","dateFormat":"MM/DD/YYYY"}},
    "staticQueryHashes": ["1239077767","1821483254","2966362950","3280999885"]}