{
    "componentChunkName": "component---src-templates-kb-template-tsx",
    "path": "/v3/tools/subkey/",
    "result": {"data":{"mdx":{"frontmatter":{"slug":"/v3/tools/subkey","title":"Subkey","hideNav":null,"section":"docs","category":"tools"},"body":"var _excluded = [\"components\"];\n\nfunction _extends() { _extends = Object.assign || function (target) { for (var i = 1; i < arguments.length; i++) { var source = arguments[i]; for (var key in source) { if (Object.prototype.hasOwnProperty.call(source, key)) { target[key] = source[key]; } } } return target; }; return _extends.apply(this, arguments); }\n\nfunction _objectWithoutProperties(source, excluded) { if (source == null) return {}; var target = _objectWithoutPropertiesLoose(source, excluded); var key, i; if (Object.getOwnPropertySymbols) { var sourceSymbolKeys = Object.getOwnPropertySymbols(source); for (i = 0; i < sourceSymbolKeys.length; i++) { key = sourceSymbolKeys[i]; if (excluded.indexOf(key) >= 0) continue; if (!Object.prototype.propertyIsEnumerable.call(source, key)) continue; target[key] = source[key]; } } return target; }\n\nfunction _objectWithoutPropertiesLoose(source, excluded) { if (source == null) return {}; var target = {}; var sourceKeys = Object.keys(source); var key, i; for (i = 0; i < sourceKeys.length; i++) { key = sourceKeys[i]; if (excluded.indexOf(key) >= 0) continue; target[key] = source[key]; } return target; }\n\n/* @jsxRuntime classic */\n\n/* @jsx mdx */\nvar _frontmatter = {\n  \"title\": \"Subkey\",\n  \"slug\": \"/v3/tools/subkey\",\n  \"version\": 3,\n  \"section\": \"docs\",\n  \"category\": \"tools\",\n  \"keywords\": null\n};\n\nvar makeShortcode = function makeShortcode(name) {\n  return function MDXDefaultShortcode(props) {\n    console.warn(\"Component \" + name + \" was not imported, exported, or provided by MDXProvider as global scope\");\n    return mdx(\"div\", props);\n  };\n};\n\nvar Message = makeShortcode(\"Message\");\nvar layoutProps = {\n  _frontmatter: _frontmatter\n};\nvar MDXLayout = \"wrapper\";\nreturn function MDXContent(_ref) {\n  var components = _ref.components,\n      props = _objectWithoutProperties(_ref, _excluded);\n\n  return mdx(MDXLayout, _extends({}, layoutProps, props, {\n    components: components,\n    mdxType: \"MDXLayout\"\n  }), mdx(\"p\", null, \"Subkey is a \", mdx(\"a\", {\n    parentName: \"p\",\n    \"href\": \"https://en.wikipedia.org/wiki/Public-key_cryptography\"\n  }, \"public key cryptographic\"), \"\\nutility that is developed\\n\", mdx(\"a\", {\n    parentName: \"p\",\n    \"href\": \"https://github.com/paritytech/substrate/tree/master/bin/utils/subkey\"\n  }, \"within Substrate itself\"), \".\\nIts main feature is generating and inspecting key pairs, currently supporting these scheme:\"), mdx(\"ul\", null, mdx(\"li\", {\n    parentName: \"ul\"\n  }, mdx(\"a\", {\n    parentName: \"li\",\n    \"href\": \"https://wiki.polkadot.network/docs/en/learn-cryptography\"\n  }, \"sr25519\"), \": Schorr signatures on\\nthe Ristretto group\"), mdx(\"li\", {\n    parentName: \"ul\"\n  }, mdx(\"a\", {\n    parentName: \"li\",\n    \"href\": \"https://en.wikipedia.org/wiki/EdDSA#Ed25519\"\n  }, \"ed25519\"), \": SHA-512 (SHA-2) on Curve25519\"), mdx(\"li\", {\n    parentName: \"ul\"\n  }, mdx(\"a\", {\n    parentName: \"li\",\n    \"href\": \"https://en.bitcoin.it/wiki/Secp256k1\"\n  }, \"secp256k1\"), \": ECDSA signatures on secp256k1\")), mdx(\"p\", null, \"All keys in Substrate based networks\\n(\", mdx(\"a\", {\n    parentName: \"p\",\n    \"href\": \"https://wiki.polkadot.network/docs/learn-accounts#address-format\"\n  }, \"like polkadot\"), \")\\nuse the\\n\", mdx(\"a\", {\n    parentName: \"p\",\n    \"href\": \"/v3/advanced/ss58/\"\n  }, \"SS58 address encoding format\"), \"\\nthat is the primary user-facing way to interact with keys.\"), mdx(\"p\", null, \"Subkey also allows restoring keys from mnemonics and raw seeds; signing and verifying signatures\\non a message; and signing and verifying signatures for encoded transactions.\"), mdx(\"h2\", {\n    \"id\": \"installation\",\n    \"style\": {\n      \"position\": \"relative\"\n    }\n  }, mdx(\"a\", {\n    parentName: \"h2\",\n    \"href\": \"#installation\",\n    \"aria-label\": \"installation permalink\",\n    \"className\": \"anchor before\"\n  }, mdx(\"svg\", {\n    parentName: \"a\",\n    \"className\": \"fill-current text-substrateDark dark:text-white\",\n    \"aria-hidden\": \"true\",\n    \"focusable\": \"false\",\n    \"height\": \"16\",\n    \"version\": \"1.1\",\n    \"viewBox\": \"0 0 16 16\",\n    \"width\": \"16\"\n  }, mdx(\"path\", {\n    parentName: \"svg\",\n    \"fillRule\": \"evenodd\",\n    \"d\": \"M4 9h1v1H4c-1.5 0-3-1.69-3-3.5S2.55 3 4 3h4c1.45 0 3 1.69 3 3.5 0 1.41-.91 2.72-2 3.25V8.59c.58-.45 1-1.27 1-2.09C10 5.22 8.98 4 8 4H4c-.98 0-2 1.22-2 2.5S3 9 4 9zm9-3h-1v1h1c1 0 2 1.22 2 2.5S13.98 12 13 12H9c-.98 0-2-1.22-2-2.5 0-.83.42-1.64 1-2.09V6.25c-1.09.53-2 1.84-2 3.25C6 11.31 7.55 13 9 13h4c1.45 0 3-1.69 3-3.5S14.5 6 13 6z\"\n  }))), \"Installation\"), mdx(\"h3\", {\n    \"id\": \"install-with-cargo\",\n    \"style\": {\n      \"position\": \"relative\"\n    }\n  }, mdx(\"a\", {\n    parentName: \"h3\",\n    \"href\": \"#install-with-cargo\",\n    \"aria-label\": \"install with cargo permalink\",\n    \"className\": \"anchor before\"\n  }, mdx(\"svg\", {\n    parentName: \"a\",\n    \"className\": \"fill-current text-substrateDark dark:text-white\",\n    \"aria-hidden\": \"true\",\n    \"focusable\": \"false\",\n    \"height\": \"16\",\n    \"version\": \"1.1\",\n    \"viewBox\": \"0 0 16 16\",\n    \"width\": \"16\"\n  }, mdx(\"path\", {\n    parentName: \"svg\",\n    \"fillRule\": \"evenodd\",\n    \"d\": \"M4 9h1v1H4c-1.5 0-3-1.69-3-3.5S2.55 3 4 3h4c1.45 0 3 1.69 3 3.5 0 1.41-.91 2.72-2 3.25V8.59c.58-.45 1-1.27 1-2.09C10 5.22 8.98 4 8 4H4c-.98 0-2 1.22-2 2.5S3 9 4 9zm9-3h-1v1h1c1 0 2 1.22 2 2.5S13.98 12 13 12H9c-.98 0-2-1.22-2-2.5 0-.83.42-1.64 1-2.09V6.25c-1.09.53-2 1.84-2 3.25C6 11.31 7.55 13 9 13h4c1.45 0 3-1.69 3-3.5S14.5 6 13 6z\"\n  }))), \"Install with Cargo\"), mdx(\"p\", null, \"You will need to have the Substrate build dependencies to install Subkey.\\nUse the following two commands to install the dependencies and Subkey, respectively:\"), mdx(\"p\", null, mdx(\"em\", {\n    parentName: \"p\"\n  }, \"Command:\")), mdx(\"pre\", null, mdx(\"code\", {\n    parentName: \"pre\",\n    \"className\": \"language-bash\"\n  }, \"# Use the `--fast` flag to get the dependencies without needing to install the Substrate and Subkey binary\\ncurl https://getsubstrate.io -sSf | bash -s -- --fast\\n# Install only `subkey`, at a specific version\\ncargo install --force subkey --git https://github.com/paritytech/substrate --version 2.0.1 --locked\\n\")), mdx(\"h3\", {\n    \"id\": \"compiling-with-cargo\",\n    \"style\": {\n      \"position\": \"relative\"\n    }\n  }, mdx(\"a\", {\n    parentName: \"h3\",\n    \"href\": \"#compiling-with-cargo\",\n    \"aria-label\": \"compiling with cargo permalink\",\n    \"className\": \"anchor before\"\n  }, mdx(\"svg\", {\n    parentName: \"a\",\n    \"className\": \"fill-current text-substrateDark dark:text-white\",\n    \"aria-hidden\": \"true\",\n    \"focusable\": \"false\",\n    \"height\": \"16\",\n    \"version\": \"1.1\",\n    \"viewBox\": \"0 0 16 16\",\n    \"width\": \"16\"\n  }, mdx(\"path\", {\n    parentName: \"svg\",\n    \"fillRule\": \"evenodd\",\n    \"d\": \"M4 9h1v1H4c-1.5 0-3-1.69-3-3.5S2.55 3 4 3h4c1.45 0 3 1.69 3 3.5 0 1.41-.91 2.72-2 3.25V8.59c.58-.45 1-1.27 1-2.09C10 5.22 8.98 4 8 4H4c-.98 0-2 1.22-2 2.5S3 9 4 9zm9-3h-1v1h1c1 0 2 1.22 2 2.5S13.98 12 13 12H9c-.98 0-2-1.22-2-2.5 0-.83.42-1.64 1-2.09V6.25c-1.09.53-2 1.84-2 3.25C6 11.31 7.55 13 9 13h4c1.45 0 3-1.69 3-3.5S14.5 6 13 6z\"\n  }))), \"Compiling with Cargo\"), mdx(\"p\", null, \"If you already have the \", mdx(\"a\", {\n    parentName: \"p\",\n    \"href\": \"https://github.com/paritytech/substrate\"\n  }, \"Substrate repository\"), \", you can\\nbuild Subkey with:\"), mdx(\"p\", null, mdx(\"em\", {\n    parentName: \"p\"\n  }, \"Command:\")), mdx(\"pre\", null, mdx(\"code\", {\n    parentName: \"pre\",\n    \"className\": \"language-bash\"\n  }, \"# Run this in the Substrate working directory\\ncargo build -p subkey --release\\n\")), mdx(\"p\", null, \"This will generate the Subkey binary in \", mdx(\"inlineCode\", {\n    parentName: \"p\"\n  }, \"./target/release/subkey\"), \". Please be aware that the\\ninterface to Subkey may change between versions; the commands described below have all been tested\\nwith the version of Subkey specified by the \", mdx(\"inlineCode\", {\n    parentName: \"p\"\n  }, \"cargo install\"), \" command in the\\n\", mdx(\"a\", {\n    parentName: \"p\",\n    \"href\": \"#install-with-cargo\"\n  }, \"Install with Cargo\"), \" section.\"), mdx(Message, {\n    type: \"yellow\",\n    title: \"Important\",\n    text: \"If you follow the steps in this section to compile Subkey with Cargo, the version of Subkey will\\n  depend on the branch or commit of Substrate that you have checked out.\",\n    mdxType: \"Message\"\n  }), mdx(\"p\", null, \"Once installed, use the \", mdx(\"inlineCode\", {\n    parentName: \"p\"\n  }, \"subkey -h\"), \" command to see all the sub-commands and flags available.\\nUse \", mdx(\"inlineCode\", {\n    parentName: \"p\"\n  }, \"subkey <sub-command> -h\"), \" to see help items for ech sub-command.\"), mdx(\"h2\", {\n    \"id\": \"inspecting-keys\",\n    \"style\": {\n      \"position\": \"relative\"\n    }\n  }, mdx(\"a\", {\n    parentName: \"h2\",\n    \"href\": \"#inspecting-keys\",\n    \"aria-label\": \"inspecting keys permalink\",\n    \"className\": \"anchor before\"\n  }, mdx(\"svg\", {\n    parentName: \"a\",\n    \"className\": \"fill-current text-substrateDark dark:text-white\",\n    \"aria-hidden\": \"true\",\n    \"focusable\": \"false\",\n    \"height\": \"16\",\n    \"version\": \"1.1\",\n    \"viewBox\": \"0 0 16 16\",\n    \"width\": \"16\"\n  }, mdx(\"path\", {\n    parentName: \"svg\",\n    \"fillRule\": \"evenodd\",\n    \"d\": \"M4 9h1v1H4c-1.5 0-3-1.69-3-3.5S2.55 3 4 3h4c1.45 0 3 1.69 3 3.5 0 1.41-.91 2.72-2 3.25V8.59c.58-.45 1-1.27 1-2.09C10 5.22 8.98 4 8 4H4c-.98 0-2 1.22-2 2.5S3 9 4 9zm9-3h-1v1h1c1 0 2 1.22 2 2.5S13.98 12 13 12H9c-.98 0-2-1.22-2-2.5 0-.83.42-1.64 1-2.09V6.25c-1.09.53-2 1.84-2 3.25C6 11.31 7.55 13 9 13h4c1.45 0 3-1.69 3-3.5S14.5 6 13 6z\"\n  }))), \"Inspecting keys\"), mdx(\"p\", null, \"The \", mdx(\"inlineCode\", {\n    parentName: \"p\"\n  }, \"inspect\"), \" command recalculates a key pair's public key and public address given its secret seed.\\nYou most commonly inspect the key by the mnemonic phrase that is used to derive it:\"), mdx(\"p\", null, mdx(\"em\", {\n    parentName: \"p\"\n  }, \"Command:\")), mdx(\"pre\", null, mdx(\"code\", {\n    parentName: \"pre\",\n    \"className\": \"language-bash\"\n  }, \"subkey inspect \\\"caution juice atom organ advance problem want pledge someone senior holiday very\\\"\\n\")), mdx(\"p\", null, mdx(\"em\", {\n    parentName: \"p\"\n  }, \"Output:\")), mdx(\"pre\", null, mdx(\"code\", {\n    parentName: \"pre\",\n    \"className\": \"language-text\"\n  }, \"Secret phrase `caution juice atom organ advance problem want pledge someone senior holiday very` is account:\\n  Secret seed:       0xc8fa03532fb22ee1f7f6908b9c02b4e72483f0dbd66e4cd456b8f34c6230b849\\n  Public key (hex):  0xd6a3105d6768e956e9e5d41050ac29843f98561410d3a47f9dd5b3b227ab8746\\n  Public key (SS58): 5Gv8YYFu8H1btvmrJy9FjjAWfb99wrhV3uhPFoNEr918utyR\\n  Account ID:        0xd6a3105d6768e956e9e5d41050ac29843f98561410d3a47f9dd5b3b227ab8746\\n  SS58 Address:      5Gv8YYFu8H1btvmrJy9FjjAWfb99wrhV3uhPFoNEr918utyR\\n\")), mdx(\"p\", null, \"You can also use the secret seed directly, here the same result is seen for the secret shown above:\"), mdx(\"p\", null, mdx(\"em\", {\n    parentName: \"p\"\n  }, \"Command:\")), mdx(\"pre\", null, mdx(\"code\", {\n    parentName: \"pre\",\n    \"className\": \"language-bash\"\n  }, \"subkey inspect 0xc8fa03532fb22ee1f7f6908b9c02b4e72483f0dbd66e4cd456b8f34c6230b849\\n\")), mdx(\"p\", null, mdx(\"em\", {\n    parentName: \"p\"\n  }, \"Output:\")), mdx(\"pre\", null, mdx(\"code\", {\n    parentName: \"pre\",\n    \"className\": \"language-text\"\n  }, \"Secret Key URI `0xc8fa03532fb22ee1f7f6908b9c02b4e72483f0dbd66e4cd456b8f34c6230b849` is account:\\n  Secret seed:       0xc8fa03532fb22ee1f7f6908b9c02b4e72483f0dbd66e4cd456b8f34c6230b849\\n  Public key (hex):  0xd6a3105d6768e956e9e5d41050ac29843f98561410d3a47f9dd5b3b227ab8746\\n  Public key (SS58): 5Gv8YYFu8H1btvmrJy9FjjAWfb99wrhV3uhPFoNEr918utyR\\n  Account ID:        0xd6a3105d6768e956e9e5d41050ac29843f98561410d3a47f9dd5b3b227ab8746\\n  SS58 Address:      5Gv8YYFu8H1btvmrJy9FjjAWfb99wrhV3uhPFoNEr918utyR\\n\")), mdx(\"p\", null, \"Next in how to generate keys, we will also show you how to inspect more than a base seed.\"), mdx(\"h2\", {\n    \"id\": \"generating-keys\",\n    \"style\": {\n      \"position\": \"relative\"\n    }\n  }, mdx(\"a\", {\n    parentName: \"h2\",\n    \"href\": \"#generating-keys\",\n    \"aria-label\": \"generating keys permalink\",\n    \"className\": \"anchor before\"\n  }, mdx(\"svg\", {\n    parentName: \"a\",\n    \"className\": \"fill-current text-substrateDark dark:text-white\",\n    \"aria-hidden\": \"true\",\n    \"focusable\": \"false\",\n    \"height\": \"16\",\n    \"version\": \"1.1\",\n    \"viewBox\": \"0 0 16 16\",\n    \"width\": \"16\"\n  }, mdx(\"path\", {\n    parentName: \"svg\",\n    \"fillRule\": \"evenodd\",\n    \"d\": \"M4 9h1v1H4c-1.5 0-3-1.69-3-3.5S2.55 3 4 3h4c1.45 0 3 1.69 3 3.5 0 1.41-.91 2.72-2 3.25V8.59c.58-.45 1-1.27 1-2.09C10 5.22 8.98 4 8 4H4c-.98 0-2 1.22-2 2.5S3 9 4 9zm9-3h-1v1h1c1 0 2 1.22 2 2.5S13.98 12 13 12H9c-.98 0-2-1.22-2-2.5 0-.83.42-1.64 1-2.09V6.25c-1.09.53-2 1.84-2 3.25C6 11.31 7.55 13 9 13h4c1.45 0 3-1.69 3-3.5S14.5 6 13 6z\"\n  }))), \"Generating keys\"), mdx(\"p\", null, \"Generate an sr25519 key by running:\"), mdx(\"p\", null, mdx(\"em\", {\n    parentName: \"p\"\n  }, \"Command:\")), mdx(\"pre\", null, mdx(\"code\", {\n    parentName: \"pre\",\n    \"className\": \"language-bash\"\n  }, \"subkey generate\\n\")), mdx(\"p\", null, mdx(\"em\", {\n    parentName: \"p\"\n  }, \"Output:\")), mdx(\"pre\", null, mdx(\"code\", {\n    parentName: \"pre\",\n    \"className\": \"language-text\"\n  }, \"Secret phrase `caution juice atom organ advance problem want pledge someone senior holiday very` is account:\\n  Secret seed:       0xc8fa03532fb22ee1f7f6908b9c02b4e72483f0dbd66e4cd456b8f34c6230b849\\n  Public key (hex):  0xd6a3105d6768e956e9e5d41050ac29843f98561410d3a47f9dd5b3b227ab8746\\n  Public key (SS58): 5Gv8YYFu8H1btvmrJy9FjjAWfb99wrhV3uhPFoNEr918utyR\\n  Account ID:        0xd6a3105d6768e956e9e5d41050ac29843f98561410d3a47f9dd5b3b227ab8746\\n  SS58 Address:      5Gv8YYFu8H1btvmrJy9FjjAWfb99wrhV3uhPFoNEr918utyR\\n\")), mdx(\"p\", null, \"We will use this seed as the \", mdx(\"a\", {\n    parentName: \"p\",\n    \"href\": \"#example-seed\"\n  }, \"example\"), \" for the rest of this document.\"), mdx(\"hr\", null), mdx(\"p\", null, \"For more security, use \", mdx(\"inlineCode\", {\n    parentName: \"p\"\n  }, \"--words 24\"), \" (supports 12, 15, 18, 21, and 24):\"), mdx(\"p\", null, mdx(\"em\", {\n    parentName: \"p\"\n  }, \"Command:\")), mdx(\"pre\", null, mdx(\"code\", {\n    parentName: \"pre\",\n    \"className\": \"language-bash\"\n  }, \"subkey generate --words 24\\n\")), mdx(\"p\", null, mdx(\"em\", {\n    parentName: \"p\"\n  }, \"Output:\")), mdx(\"pre\", null, mdx(\"code\", {\n    parentName: \"pre\",\n    \"className\": \"language-text\"\n  }, \"Secret phrase `voice become refuse remove ordinary recall humble purity shock fetch open scale knee above axis blossom differ bamboo ski drip forest fade ill door` is account:\\n  Secret seed:       0xed26c8119b4872da9e5c2d4b679c82a7fbbabed22cb9f61d5fd4d7806ee5b014\\n  Public key (hex):  0x182a8385912e206910a11dfcfbadcc018d73ff3febe36f9eb85774e77591a314\\n  Public key (SS58): 5CcPdpUAhRvGjyxcpnL7emi7SruQ98eP7mC8cDNkjCKfXNZ7\\n  Account ID:        0x182a8385912e206910a11dfcfbadcc018d73ff3febe36f9eb85774e77591a314\\n  SS58 Address:      5CcPdpUAhRvGjyxcpnL7emi7SruQ98eP7mC8cDNkjCKfXNZ7\\n\")), mdx(\"p\", null, \"Use the \", mdx(\"inlineCode\", {\n    parentName: \"p\"\n  }, \"--scheme\"), \" option to generate an ed25519 key:\"), mdx(\"p\", null, mdx(\"em\", {\n    parentName: \"p\"\n  }, \"Command:\")), mdx(\"pre\", null, mdx(\"code\", {\n    parentName: \"pre\",\n    \"className\": \"language-bash\"\n  }, \"subkey generate --scheme ed25519\\n\")), mdx(\"p\", null, mdx(\"em\", {\n    parentName: \"p\"\n  }, \"Output:\")), mdx(\"pre\", null, mdx(\"code\", {\n    parentName: \"pre\",\n    \"className\": \"language-text\"\n  }, \"Secret phrase `voice become refuse remove ordinary recall humble purity shock fetch open scale knee above axis blossom differ bamboo ski drip forest fade ill door` is account:\\n  Secret seed:       0xed26c8119b4872da9e5c2d4b679c82a7fbbabed22cb9f61d5fd4d7806ee5b014\\n  Public key (hex):  0x182a8385912e206910a11dfcfbadcc018d73ff3febe36f9eb85774e77591a314\\n  Public key (SS58): 5CcPdpUAhRvGjyxcpnL7emi7SruQ98eP7mC8cDNkjCKfXNZ7\\n  Account ID:        0x182a8385912e206910a11dfcfbadcc018d73ff3febe36f9eb85774e77591a314\\n  SS58 Address:      5CcPdpUAhRvGjyxcpnL7emi7SruQ98eP7mC8cDNkjCKfXNZ7\\n\")), mdx(\"p\", null, \"The output gives us the following information about our key:\"), mdx(\"ul\", null, mdx(\"li\", {\n    parentName: \"ul\"\n  }, mdx(\"strong\", {\n    parentName: \"li\"\n  }, \"Secret phrase\"), \" (aka \\\"mnemonic phrase\\\") - A series of English words that encodes the seed in a\\nmore human-friendly way. Mnemonic phrases were first introduced in Bitcoin (see\\n\", mdx(\"a\", {\n    parentName: \"li\",\n    \"href\": \"https://github.com/bitcoin/bips/blob/master/bip-0039.mediawiki\"\n  }, \"BIP39\"), \") and make it much easier\\nto write down your key by hand.\"), mdx(\"li\", {\n    parentName: \"ul\"\n  }, mdx(\"strong\", {\n    parentName: \"li\"\n  }, \"Secret Seed\"), \" (aka \\\"Private Key\\\" or \\\"Raw Seed\\\") - The minimum necessary information to restore\\nthe key pair. All other information is calculated from the seed.\"), mdx(\"li\", {\n    parentName: \"ul\"\n  }, mdx(\"strong\", {\n    parentName: \"li\"\n  }, \"Public Key (hex)\"), \" - The public half of the cryptographic key pair in hexadecimal.\"), mdx(\"li\", {\n    parentName: \"ul\"\n  }, mdx(\"strong\", {\n    parentName: \"li\"\n  }, \"Public Key (SS58)\"), \" - The public half of the cryptographic key pair in SS58 encoding.\"), mdx(\"li\", {\n    parentName: \"ul\"\n  }, mdx(\"strong\", {\n    parentName: \"li\"\n  }, \"Account ID\"), \" - Alias for the Public Key in hexadecimal.\"), mdx(\"li\", {\n    parentName: \"ul\"\n  }, mdx(\"strong\", {\n    parentName: \"li\"\n  }, \"SS58 Address\"), \" (aka \\\"Public Address\\\") - An SS58-encoded address based on the public key.\")), mdx(\"p\", null, \"You can also create a vanity address, meaning an address that contains a specified sub-string. But\\nyou will not receive a mnemonic phrase for this address.\"), mdx(\"p\", null, mdx(\"em\", {\n    parentName: \"p\"\n  }, \"Command:\")), mdx(\"pre\", null, mdx(\"code\", {\n    parentName: \"pre\",\n    \"className\": \"language-bash\"\n  }, \"subkey vanity --pattern dan\\n\")), mdx(\"p\", null, mdx(\"em\", {\n    parentName: \"p\"\n  }, \"Output:\")), mdx(\"pre\", null, mdx(\"code\", {\n    parentName: \"pre\",\n    \"className\": \"language-text\"\n  }, \"Generating key containing pattern 'dan'\\nbest: 189 == top: 189\\nSecret Key URI `0xf58706b2057633b6d634d9cc54e8e9e8f11246290c0bbef934129978ede6439b` is account:\\n  Secret seed:       0xf58706b2057633b6d634d9cc54e8e9e8f11246290c0bbef934129978ede6439b\\n  Public key (hex):  0xca043bd23428eb023d59f4b7eb37416b343fc719a3c89c5256071b4f39d73130\\n  Public key (SS58): 5GdandXEVW1ER8cxW6uQgpjpyuEbZ3s2ED3ZU15LfrGdQhhz\\n  Account ID:        0xca043bd23428eb023d59f4b7eb37416b343fc719a3c89c5256071b4f39d73130\\n  SS58 Address:      5GdandXEVW1ER8cxW6uQgpjpyuEbZ3s2ED3ZU15LfrGdQhhz\\n\")), mdx(\"p\", null, \"Notice the SS58 Address\", mdx(\"inlineCode\", {\n    parentName: \"p\"\n  }, \"5GdandXEVW1ER8cxW6uQgpjpyuEbZ3s2ED3ZU15LfrGdQhhz\"), \" contains the string\\n\", mdx(\"inlineCode\", {\n    parentName: \"p\"\n  }, \"dan\"), \".\"), mdx(\"h3\", {\n    \"id\": \"example-seed\",\n    \"style\": {\n      \"position\": \"relative\"\n    }\n  }, mdx(\"a\", {\n    parentName: \"h3\",\n    \"href\": \"#example-seed\",\n    \"aria-label\": \"example seed permalink\",\n    \"className\": \"anchor before\"\n  }, mdx(\"svg\", {\n    parentName: \"a\",\n    \"className\": \"fill-current text-substrateDark dark:text-white\",\n    \"aria-hidden\": \"true\",\n    \"focusable\": \"false\",\n    \"height\": \"16\",\n    \"version\": \"1.1\",\n    \"viewBox\": \"0 0 16 16\",\n    \"width\": \"16\"\n  }, mdx(\"path\", {\n    parentName: \"svg\",\n    \"fillRule\": \"evenodd\",\n    \"d\": \"M4 9h1v1H4c-1.5 0-3-1.69-3-3.5S2.55 3 4 3h4c1.45 0 3 1.69 3 3.5 0 1.41-.91 2.72-2 3.25V8.59c.58-.45 1-1.27 1-2.09C10 5.22 8.98 4 8 4H4c-.98 0-2 1.22-2 2.5S3 9 4 9zm9-3h-1v1h1c1 0 2 1.22 2 2.5S13.98 12 13 12H9c-.98 0-2-1.22-2-2.5 0-.83.42-1.64 1-2.09V6.25c-1.09.53-2 1.84-2 3.25C6 11.31 7.55 13 9 13h4c1.45 0 3-1.69 3-3.5S14.5 6 13 6z\"\n  }))), \"Example seed\"), mdx(\"blockquote\", null, mdx(\"p\", {\n    parentName: \"blockquote\"\n  }, \"We will use the seed generated above to illustrate different\\n\", mdx(\"a\", {\n    parentName: \"p\",\n    \"href\": \"#hd-key-derivation\"\n  }, \"HD key derivation paths\"), \" and\\n\", mdx(\"a\", {\n    parentName: \"p\",\n    \"href\": \"#password-protected-keys\"\n  }, \"passwords\"), \":\"), mdx(\"pre\", {\n    parentName: \"blockquote\"\n  }, mdx(\"code\", {\n    parentName: \"pre\",\n    \"className\": \"language-text\"\n  }, \"caution juice atom organ advance problem want pledge someone senior holiday very\\n\"))), mdx(\"p\", null, mdx(\"em\", {\n    parentName: \"p\"\n  }, \"Command:\")), mdx(\"pre\", null, mdx(\"code\", {\n    parentName: \"pre\",\n    \"className\": \"language-bash\"\n  }, \"subkey inspect \\\"caution juice atom organ advance problem want pledge someone senior holiday very\\\"\\n\")), mdx(\"p\", null, mdx(\"em\", {\n    parentName: \"p\"\n  }, \"Output:\")), mdx(\"pre\", null, mdx(\"code\", {\n    parentName: \"pre\",\n    \"className\": \"language-text\"\n  }, \"Secret phrase `caution juice atom organ advance problem want pledge someone senior holiday very` is account:\\n  Secret seed:       0xc8fa03532fb22ee1f7f6908b9c02b4e72483f0dbd66e4cd456b8f34c6230b849\\n  Public key (hex):  0xd6a3105d6768e956e9e5d41050ac29843f98561410d3a47f9dd5b3b227ab8746\\n  Public key (SS58): 5Gv8YYFu8H1btvmrJy9FjjAWfb99wrhV3uhPFoNEr918utyR\\n  Account ID:        0xd6a3105d6768e956e9e5d41050ac29843f98561410d3a47f9dd5b3b227ab8746\\n  SS58 Address:      5Gv8YYFu8H1btvmrJy9FjjAWfb99wrhV3uhPFoNEr918utyR\\n\")), mdx(\"h2\", {\n    \"id\": \"specify-network-address-format\",\n    \"style\": {\n      \"position\": \"relative\"\n    }\n  }, mdx(\"a\", {\n    parentName: \"h2\",\n    \"href\": \"#specify-network-address-format\",\n    \"aria-label\": \"specify network address format permalink\",\n    \"className\": \"anchor before\"\n  }, mdx(\"svg\", {\n    parentName: \"a\",\n    \"className\": \"fill-current text-substrateDark dark:text-white\",\n    \"aria-hidden\": \"true\",\n    \"focusable\": \"false\",\n    \"height\": \"16\",\n    \"version\": \"1.1\",\n    \"viewBox\": \"0 0 16 16\",\n    \"width\": \"16\"\n  }, mdx(\"path\", {\n    parentName: \"svg\",\n    \"fillRule\": \"evenodd\",\n    \"d\": \"M4 9h1v1H4c-1.5 0-3-1.69-3-3.5S2.55 3 4 3h4c1.45 0 3 1.69 3 3.5 0 1.41-.91 2.72-2 3.25V8.59c.58-.45 1-1.27 1-2.09C10 5.22 8.98 4 8 4H4c-.98 0-2 1.22-2 2.5S3 9 4 9zm9-3h-1v1h1c1 0 2 1.22 2 2.5S13.98 12 13 12H9c-.98 0-2-1.22-2-2.5 0-.83.42-1.64 1-2.09V6.25c-1.09.53-2 1.84-2 3.25C6 11.31 7.55 13 9 13h4c1.45 0 3-1.69 3-3.5S14.5 6 13 6z\"\n  }))), \"Specify network address format\"), mdx(\"p\", null, \"Subkey encodes the address depending on the network. You can use the \", mdx(\"inlineCode\", {\n    parentName: \"p\"\n  }, \"--network\"), \" flag to change\\nthis. See \", mdx(\"inlineCode\", {\n    parentName: \"p\"\n  }, \"subkey <inspect/generate> -n\"), \" for supported networks.\"), mdx(\"p\", null, \"Let's say you want to use the \", mdx(\"strong\", {\n    parentName: \"p\"\n  }, \"same private key\"), \" on the Kusama network. Use \", mdx(\"inlineCode\", {\n    parentName: \"p\"\n  }, \"--network\"), \" to get\\nyour \", mdx(\"strong\", {\n    parentName: \"p\"\n  }, \"address\"), \" formatted for Kusama. Notice that the public key is the same, but the address has\\na different format. Here we use the \", mdx(\"a\", {\n    parentName: \"p\",\n    \"href\": \"#example-seed\"\n  }, \"example seed\"), \":\"), mdx(\"p\", null, mdx(\"em\", {\n    parentName: \"p\"\n  }, \"Command:\")), mdx(\"pre\", null, mdx(\"code\", {\n    parentName: \"pre\",\n    \"className\": \"language-bash\"\n  }, \"subkey inspect --network kusama \\\"caution juice atom organ advance problem want pledge someone senior holiday very\\\"\\n\")), mdx(\"p\", null, mdx(\"em\", {\n    parentName: \"p\"\n  }, \"Output:\")), mdx(\"pre\", null, mdx(\"code\", {\n    parentName: \"pre\",\n    \"className\": \"language-text\"\n  }, \"Secret phrase `caution juice atom organ advance problem want pledge someone senior holiday very` is account:\\n  Secret seed:       0xc8fa03532fb22ee1f7f6908b9c02b4e72483f0dbd66e4cd456b8f34c6230b849\\n  Public key (hex):  0xd6a3105d6768e956e9e5d41050ac29843f98561410d3a47f9dd5b3b227ab8746\\n  Public key (SS58): HRkCrbmke2XeabJ5fxJdgXWpBRPkXWfWHY8eTeCKwDdf4k6\\n  Account ID:        0xd6a3105d6768e956e9e5d41050ac29843f98561410d3a47f9dd5b3b227ab8746\\n  SS58 Address:      HRkCrbmke2XeabJ5fxJdgXWpBRPkXWfWHY8eTeCKwDdf4k6\\n\")), mdx(\"h2\", {\n    \"id\": \"hd-key-derivation\",\n    \"style\": {\n      \"position\": \"relative\"\n    }\n  }, mdx(\"a\", {\n    parentName: \"h2\",\n    \"href\": \"#hd-key-derivation\",\n    \"aria-label\": \"hd key derivation permalink\",\n    \"className\": \"anchor before\"\n  }, mdx(\"svg\", {\n    parentName: \"a\",\n    \"className\": \"fill-current text-substrateDark dark:text-white\",\n    \"aria-hidden\": \"true\",\n    \"focusable\": \"false\",\n    \"height\": \"16\",\n    \"version\": \"1.1\",\n    \"viewBox\": \"0 0 16 16\",\n    \"width\": \"16\"\n  }, mdx(\"path\", {\n    parentName: \"svg\",\n    \"fillRule\": \"evenodd\",\n    \"d\": \"M4 9h1v1H4c-1.5 0-3-1.69-3-3.5S2.55 3 4 3h4c1.45 0 3 1.69 3 3.5 0 1.41-.91 2.72-2 3.25V8.59c.58-.45 1-1.27 1-2.09C10 5.22 8.98 4 8 4H4c-.98 0-2 1.22-2 2.5S3 9 4 9zm9-3h-1v1h1c1 0 2 1.22 2 2.5S13.98 12 13 12H9c-.98 0-2-1.22-2-2.5 0-.83.42-1.64 1-2.09V6.25c-1.09.53-2 1.84-2 3.25C6 11.31 7.55 13 9 13h4c1.45 0 3-1.69 3-3.5S14.5 6 13 6z\"\n  }))), \"HD key derivation\"), mdx(Message, {\n    type: \"yellow\",\n    title: \"Important\",\n    text: \"Remember that passwords and derivation paths are just as important to backup as the seed itself!\\n  See the [password note](#important-password-and-derivation-note) for more information.\",\n    mdxType: \"Message\"\n  }), mdx(\"p\", null, \"Subkey supports hard and soft hierarchical deterministic (HD) key derivation compliant with\\n\", mdx(\"a\", {\n    parentName: \"p\",\n    \"href\": \"https://github.com/bitcoin/bips/blob/master/bip-0032.mediawiki\"\n  }, \"BIP32\"), \". HD keys allow you to have a\\nmaster seed and define a tree with a key pair at each leaf. The tree has a similar structure to a\\nfilesystem and can have any depth you want.\"), mdx(\"p\", null, \"Hard and soft key derivation both support:\"), mdx(\"ul\", null, mdx(\"li\", {\n    parentName: \"ul\"\n  }, \"parent private key + path \\u2794 child private key\"), mdx(\"li\", {\n    parentName: \"ul\"\n  }, \"parent private key + path \\u2794 child public key\")), mdx(\"p\", null, \"Further, soft key derivation supports:\"), mdx(\"ul\", null, mdx(\"li\", {\n    parentName: \"ul\"\n  }, \"parent public key + path \\u2794 child public key\")), mdx(\"h3\", {\n    \"id\": \"hard-key-derivation\",\n    \"style\": {\n      \"position\": \"relative\"\n    }\n  }, mdx(\"a\", {\n    parentName: \"h3\",\n    \"href\": \"#hard-key-derivation\",\n    \"aria-label\": \"hard key derivation permalink\",\n    \"className\": \"anchor before\"\n  }, mdx(\"svg\", {\n    parentName: \"a\",\n    \"className\": \"fill-current text-substrateDark dark:text-white\",\n    \"aria-hidden\": \"true\",\n    \"focusable\": \"false\",\n    \"height\": \"16\",\n    \"version\": \"1.1\",\n    \"viewBox\": \"0 0 16 16\",\n    \"width\": \"16\"\n  }, mdx(\"path\", {\n    parentName: \"svg\",\n    \"fillRule\": \"evenodd\",\n    \"d\": \"M4 9h1v1H4c-1.5 0-3-1.69-3-3.5S2.55 3 4 3h4c1.45 0 3 1.69 3 3.5 0 1.41-.91 2.72-2 3.25V8.59c.58-.45 1-1.27 1-2.09C10 5.22 8.98 4 8 4H4c-.98 0-2 1.22-2 2.5S3 9 4 9zm9-3h-1v1h1c1 0 2 1.22 2 2.5S13.98 12 13 12H9c-.98 0-2-1.22-2-2.5 0-.83.42-1.64 1-2.09V6.25c-1.09.53-2 1.84-2 3.25C6 11.31 7.55 13 9 13h4c1.45 0 3-1.69 3-3.5S14.5 6 13 6z\"\n  }))), \"Hard key derivation\"), mdx(\"p\", null, \"You can derive a hard key child using \", mdx(\"inlineCode\", {\n    parentName: \"p\"\n  }, \"//\"), \" after the mnemonic phrase:\"), mdx(\"p\", null, mdx(\"em\", {\n    parentName: \"p\"\n  }, \"Command:\")), mdx(\"pre\", null, mdx(\"code\", {\n    parentName: \"pre\",\n    \"className\": \"language-bash\"\n  }, \"subkey inspect \\\"caution juice atom organ advance problem want pledge someone senior holiday very//polkadot//0\\\"\\n\")), mdx(\"p\", null, mdx(\"em\", {\n    parentName: \"p\"\n  }, \"Output:\")), mdx(\"pre\", null, mdx(\"code\", {\n    parentName: \"pre\",\n    \"className\": \"language-text\"\n  }, \"Secret Key URI `caution juice atom organ advance problem want pledge someone senior holiday very//polkadot//0` is account:\\n  Secret seed:       0x056a6a4e203766ffbea3146967ef25e9daf677b14dc6f6ed8919b1983c9bebbc\\n  Public key (hex):  0x841226ea070c9577979ca2e854130fbe3253853c13c05943e09908312950275d\\n  Public key (SS58): 5F3sa2TJAWMqDhXG6jhV4N8ko9SxwGy8TpaNS1repo5EYjQX\\n  Account ID:        0x841226ea070c9577979ca2e854130fbe3253853c13c05943e09908312950275d\\n  SS58 Address:      5F3sa2TJAWMqDhXG6jhV4N8ko9SxwGy8TpaNS1repo5EYjQX\\n\")), mdx(\"h3\", {\n    \"id\": \"soft-key-derivation\",\n    \"style\": {\n      \"position\": \"relative\"\n    }\n  }, mdx(\"a\", {\n    parentName: \"h3\",\n    \"href\": \"#soft-key-derivation\",\n    \"aria-label\": \"soft key derivation permalink\",\n    \"className\": \"anchor before\"\n  }, mdx(\"svg\", {\n    parentName: \"a\",\n    \"className\": \"fill-current text-substrateDark dark:text-white\",\n    \"aria-hidden\": \"true\",\n    \"focusable\": \"false\",\n    \"height\": \"16\",\n    \"version\": \"1.1\",\n    \"viewBox\": \"0 0 16 16\",\n    \"width\": \"16\"\n  }, mdx(\"path\", {\n    parentName: \"svg\",\n    \"fillRule\": \"evenodd\",\n    \"d\": \"M4 9h1v1H4c-1.5 0-3-1.69-3-3.5S2.55 3 4 3h4c1.45 0 3 1.69 3 3.5 0 1.41-.91 2.72-2 3.25V8.59c.58-.45 1-1.27 1-2.09C10 5.22 8.98 4 8 4H4c-.98 0-2 1.22-2 2.5S3 9 4 9zm9-3h-1v1h1c1 0 2 1.22 2 2.5S13.98 12 13 12H9c-.98 0-2-1.22-2-2.5 0-.83.42-1.64 1-2.09V6.25c-1.09.53-2 1.84-2 3.25C6 11.31 7.55 13 9 13h4c1.45 0 3-1.69 3-3.5S14.5 6 13 6z\"\n  }))), \"Soft key derivation\"), mdx(\"p\", null, \"Likewise, you can derive a soft key child using a single \", mdx(\"inlineCode\", {\n    parentName: \"p\"\n  }, \"/\"), \" after the mnemonic phrase:\"), mdx(\"p\", null, mdx(\"em\", {\n    parentName: \"p\"\n  }, \"Command:\")), mdx(\"pre\", null, mdx(\"code\", {\n    parentName: \"pre\",\n    \"className\": \"language-bash\"\n  }, \"subkey inspect \\\"caution juice atom organ advance problem want pledge someone senior holiday very/polkadot/0\\\"\\n\")), mdx(\"p\", null, mdx(\"em\", {\n    parentName: \"p\"\n  }, \"Output:\")), mdx(\"pre\", null, mdx(\"code\", {\n    parentName: \"pre\",\n    \"className\": \"language-text\"\n  }, \"Secret Key URI `caution juice atom organ advance problem want pledge someone senior holiday very/polkadot/0` is account:\\n  Secret seed:       n/a\\n  Public key (hex):  0x94bec5342b23d74b8736c74ab1bf311182c62510d220313a424e63ea57172855\\n  Public key (SS58): 5FRjccB7s9fbMu4pwQhYng2quQnKYkCHXRUCMBRwL7Pzj8FX\\n  Account ID:        0x94bec5342b23d74b8736c74ab1bf311182c62510d220313a424e63ea57172855\\n  SS58 Address:      5FRjccB7s9fbMu4pwQhYng2quQnKYkCHXRUCMBRwL7Pzj8FX\\n\")), mdx(\"p\", null, \"Recall the \", mdx(\"em\", {\n    parentName: \"p\"\n  }, \"root\"), \" SS58 address from the \", mdx(\"a\", {\n    parentName: \"p\",\n    \"href\": \"#example-seed\"\n  }, \"example seed\"), \" is,\\n\", mdx(\"inlineCode\", {\n    parentName: \"p\"\n  }, \"5Gv8YYFu8H1btvmrJy9FjjAWfb99wrhV3uhPFoNEr918utyR\"), \". We can use that \", mdx(\"em\", {\n    parentName: \"p\"\n  }, \"public address\"), \" to derive the\\nsame child address as above using the \", mdx(\"em\", {\n    parentName: \"p\"\n  }, \"seed\"), \".\"), mdx(\"p\", null, mdx(\"em\", {\n    parentName: \"p\"\n  }, \"Command:\")), mdx(\"pre\", null, mdx(\"code\", {\n    parentName: \"pre\",\n    \"className\": \"language-bash\"\n  }, \"subkey inspect \\\"5Gv8YYFu8H1btvmrJy9FjjAWfb99wrhV3uhPFoNEr918utyR/polkadot/0\\\"\\n\")), mdx(\"p\", null, mdx(\"em\", {\n    parentName: \"p\"\n  }, \"Output:\")), mdx(\"pre\", null, mdx(\"code\", {\n    parentName: \"pre\",\n    \"className\": \"language-text\"\n  }, \"Public Key URI `5Gv8YYFu8H1btvmrJy9FjjAWfb99wrhV3uhPFoNEr918utyR/polkadot/0` is account:\\n  Network ID/version: substrate\\n  Public key (hex):   0x94bec5342b23d74b8736c74ab1bf311182c62510d220313a424e63ea57172855\\n  Public key (SS58):  5FRjccB7s9fbMu4pwQhYng2quQnKYkCHXRUCMBRwL7Pzj8FX\\n  Account ID:         0x94bec5342b23d74b8736c74ab1bf311182c62510d220313a424e63ea57172855\\n  SS58 Address:       5FRjccB7s9fbMu4pwQhYng2quQnKYkCHXRUCMBRwL7Pzj8FX\\n\")), mdx(\"p\", null, \"Note that the two addresses here match. This is not the case in hard key derivation!\"), mdx(\"h2\", {\n    \"id\": \"password-protected-keys\",\n    \"style\": {\n      \"position\": \"relative\"\n    }\n  }, mdx(\"a\", {\n    parentName: \"h2\",\n    \"href\": \"#password-protected-keys\",\n    \"aria-label\": \"password protected keys permalink\",\n    \"className\": \"anchor before\"\n  }, mdx(\"svg\", {\n    parentName: \"a\",\n    \"className\": \"fill-current text-substrateDark dark:text-white\",\n    \"aria-hidden\": \"true\",\n    \"focusable\": \"false\",\n    \"height\": \"16\",\n    \"version\": \"1.1\",\n    \"viewBox\": \"0 0 16 16\",\n    \"width\": \"16\"\n  }, mdx(\"path\", {\n    parentName: \"svg\",\n    \"fillRule\": \"evenodd\",\n    \"d\": \"M4 9h1v1H4c-1.5 0-3-1.69-3-3.5S2.55 3 4 3h4c1.45 0 3 1.69 3 3.5 0 1.41-.91 2.72-2 3.25V8.59c.58-.45 1-1.27 1-2.09C10 5.22 8.98 4 8 4H4c-.98 0-2 1.22-2 2.5S3 9 4 9zm9-3h-1v1h1c1 0 2 1.22 2 2.5S13.98 12 13 12H9c-.98 0-2-1.22-2-2.5 0-.83.42-1.64 1-2.09V6.25c-1.09.53-2 1.84-2 3.25C6 11.31 7.55 13 9 13h4c1.45 0 3-1.69 3-3.5S14.5 6 13 6z\"\n  }))), \"Password protected keys\"), mdx(Message, {\n    type: \"yellow\",\n    title: \"Important\",\n    text: \"Remember that passwords and derivation paths are just as important to backup as the seed itself!\\n  See the [password note](#important-password-and-derivation-note) for more information.\",\n    mdxType: \"Message\"\n  }), mdx(\"p\", null, \"To generate a key that is password protected, use the \", mdx(\"inlineCode\", {\n    parentName: \"p\"\n  }, \"--password <password>\"), \" flag:\"), mdx(\"p\", null, mdx(\"em\", {\n    parentName: \"p\"\n  }, \"Command:\")), mdx(\"pre\", null, mdx(\"code\", {\n    parentName: \"pre\",\n    \"className\": \"language-bash\"\n  }, \"subkey generate --password \\\"pencil laptop kitchen cutter\\\"\\n\")), mdx(\"p\", null, mdx(\"em\", {\n    parentName: \"p\"\n  }, \"Output:\")), mdx(\"pre\", null, mdx(\"code\", {\n    parentName: \"pre\",\n    \"className\": \"language-text\"\n  }, \"Secret phrase `apology truck manage valve merge front idea imitate coconut poverty trap gas` is account:\\n  Secret seed:       0x2da5ddf709c8cd6c9727d347cd1e867234802d15ce51581d86bcb949bba7bcb5\\n  Public key (hex):  0xc8e06268df6173a32a859da4b9601d5e11b503206f9817ae1c101d2984826d19\\n  Public key (SS58): 5Gc66BfkkebMv3EvP8ThfpiGLng1EPtUiAQ71gzwpJosJqvo\\n  Account ID:        0xc8e06268df6173a32a859da4b9601d5e11b503206f9817ae1c101d2984826d19\\n  SS58 Address:      5Gc66BfkkebMv3EvP8ThfpiGLng1EPtUiAQ71gzwpJosJqvo\\n\")), mdx(\"p\", null, \"You can inspect password-protected keys either by passing the \", mdx(\"inlineCode\", {\n    parentName: \"p\"\n  }, \"--password\"), \" flag or using \", mdx(\"inlineCode\", {\n    parentName: \"p\"\n  }, \"///\"), \" at\\nthe end of the mnemonic:\"), mdx(\"p\", null, mdx(\"em\", {\n    parentName: \"p\"\n  }, \"Command (--password flag):\")), mdx(\"pre\", null, mdx(\"code\", {\n    parentName: \"pre\",\n    \"className\": \"language-bash\"\n  }, \"subkey inspect \\\"caution juice atom organ advance problem want pledge someone senior holiday very\\\" --password \\\"pencil laptop kitchen cutter\\\"\\n\")), mdx(\"p\", null, mdx(\"em\", {\n    parentName: \"p\"\n  }, \"Output (--password flag):\")), mdx(\"pre\", null, mdx(\"code\", {\n    parentName: \"pre\",\n    \"className\": \"language-text\"\n  }, \"Secret phrase `caution juice atom organ advance problem want pledge someone senior holiday very` is account:\\n  Secret seed:       0xdfc5d5d5235a37fdc907ee1cb720299f96aeb02f9c7c2fcad7ee8c7bfbd2a4db\\n  Public key (hex):  0xdef8f78b123475265815b65a7c55e105e1ab185f4969954f68d92b7bb67a1045\\n  Public key (SS58): 5H74SqH1iQCWh5Gumyghh1WJMcmM6TdBHYSK7mKVJbv9NuSK\\n  Account ID:        0xdef8f78b123475265815b65a7c55e105e1ab185f4969954f68d92b7bb67a1045\\n  SS58 Address:      5H74SqH1iQCWh5Gumyghh1WJMcmM6TdBHYSK7mKVJbv9NuSK\\n\")), mdx(\"p\", null, mdx(\"em\", {\n    parentName: \"p\"\n  }, \"Command (password with \", mdx(\"inlineCode\", {\n    parentName: \"em\"\n  }, \"///\"), \"):\")), mdx(\"pre\", null, mdx(\"code\", {\n    parentName: \"pre\",\n    \"className\": \"language-bash\"\n  }, \"subkey inspect \\\"caution juice atom organ advance problem want pledge someone senior holiday very///pencil laptop kitchen cutter\\\"\\n\")), mdx(\"p\", null, mdx(\"em\", {\n    parentName: \"p\"\n  }, \"Output (password with \", mdx(\"inlineCode\", {\n    parentName: \"em\"\n  }, \"///\"), \"):\")), mdx(\"pre\", null, mdx(\"code\", {\n    parentName: \"pre\",\n    \"className\": \"language-text\"\n  }, \"Secret Key URI `caution juice atom organ advance problem want pledge someone senior holiday very///pencil laptop kitchen cutter` is account:\\n  Secret seed:       0xdfc5d5d5235a37fdc907ee1cb720299f96aeb02f9c7c2fcad7ee8c7bfbd2a4db\\n  Public key (hex):  0xdef8f78b123475265815b65a7c55e105e1ab185f4969954f68d92b7bb67a1045\\n  Public key (SS58): 5H74SqH1iQCWh5Gumyghh1WJMcmM6TdBHYSK7mKVJbv9NuSK\\n  Account ID:        0xdef8f78b123475265815b65a7c55e105e1ab185f4969954f68d92b7bb67a1045\\n  SS58 Address:      5H74SqH1iQCWh5Gumyghh1WJMcmM6TdBHYSK7mKVJbv9NuSK\\n\")), mdx(\"p\", null, \"Take note that the \", mdx(\"inlineCode\", {\n    parentName: \"p\"\n  }, \"--password\"), \" flag \", mdx(\"em\", {\n    parentName: \"p\"\n  }, \"does not\"), \" report the password used, but the \", mdx(\"inlineCode\", {\n    parentName: \"p\"\n  }, \"///\"), \" \", mdx(\"em\", {\n    parentName: \"p\"\n  }, \"does\"), \".\\nThe output is identical otherwise.\"), mdx(\"h2\", {\n    \"id\": \"combine-derivation-paths-and-passwords\",\n    \"style\": {\n      \"position\": \"relative\"\n    }\n  }, mdx(\"a\", {\n    parentName: \"h2\",\n    \"href\": \"#combine-derivation-paths-and-passwords\",\n    \"aria-label\": \"combine derivation paths and passwords permalink\",\n    \"className\": \"anchor before\"\n  }, mdx(\"svg\", {\n    parentName: \"a\",\n    \"className\": \"fill-current text-substrateDark dark:text-white\",\n    \"aria-hidden\": \"true\",\n    \"focusable\": \"false\",\n    \"height\": \"16\",\n    \"version\": \"1.1\",\n    \"viewBox\": \"0 0 16 16\",\n    \"width\": \"16\"\n  }, mdx(\"path\", {\n    parentName: \"svg\",\n    \"fillRule\": \"evenodd\",\n    \"d\": \"M4 9h1v1H4c-1.5 0-3-1.69-3-3.5S2.55 3 4 3h4c1.45 0 3 1.69 3 3.5 0 1.41-.91 2.72-2 3.25V8.59c.58-.45 1-1.27 1-2.09C10 5.22 8.98 4 8 4H4c-.98 0-2 1.22-2 2.5S3 9 4 9zm9-3h-1v1h1c1 0 2 1.22 2 2.5S13.98 12 13 12H9c-.98 0-2-1.22-2-2.5 0-.83.42-1.64 1-2.09V6.25c-1.09.53-2 1.84-2 3.25C6 11.31 7.55 13 9 13h4c1.45 0 3-1.69 3-3.5S14.5 6 13 6z\"\n  }))), \"Combine derivation paths and passwords\"), mdx(Message, {\n    type: \"yellow\",\n    title: \"Important password and derivation note\",\n    text: \"Note that the \\\"secret seed\\\" _is not_ password protected. Although it can still recover _an_\\naccount, the key pair that's derived _is not the same_ account as recovered with _any_ password!\\nThe same seed with different derivation paths passwords will derive **different keys**!\\n**The \\\"Secret phrase\\\" is not sufficient to recover a key pair!**\\nKeep your paths and passwords secure, as without it your key pair cannot be recovered!\",\n    mdxType: \"Message\"\n  }), mdx(\"p\", null, \"You can mix and match hard and soft key paths (although it doesn't make much sense to have hard\\npaths as children of soft paths). For example:\"), mdx(\"p\", null, mdx(\"em\", {\n    parentName: \"p\"\n  }, \"Command:\")), mdx(\"pre\", null, mdx(\"code\", {\n    parentName: \"pre\",\n    \"className\": \"language-bash\"\n  }, \"subkey inspect \\\"caution juice atom organ advance problem want pledge someone senior holiday very//polkadot/0\\\"\\n\")), mdx(\"p\", null, mdx(\"em\", {\n    parentName: \"p\"\n  }, \"Output:\")), mdx(\"pre\", null, mdx(\"code\", {\n    parentName: \"pre\",\n    \"className\": \"language-text\"\n  }, \"Secret Key URI `caution juice atom organ advance problem want pledge someone senior holiday very//polkadot/0` is account:\\n  Secret seed:       n/a\\n  Public key (hex):  0xd6f066a07b3ebb1572c00506c9dc86a64db63779e7791e7d37247f59e4bffc14\\n  Public key (SS58): 5GvXX2NpiR8qoeTUbdzTCmMtZgGrZxRoCJFEvfL1iaDjTFKb\\n  Account ID:        0xd6f066a07b3ebb1572c00506c9dc86a64db63779e7791e7d37247f59e4bffc14\\n  SS58 Address:      5GvXX2NpiR8qoeTUbdzTCmMtZgGrZxRoCJFEvfL1iaDjTFKb\\n\")), mdx(\"p\", null, \"The first level (\", mdx(\"inlineCode\", {\n    parentName: \"p\"\n  }, \"//polkadot\"), \") is \", mdx(\"strong\", {\n    parentName: \"p\"\n  }, \"hard-derived\"), \", while the leaf (\", mdx(\"inlineCode\", {\n    parentName: \"p\"\n  }, \"/0\"), \") is \", mdx(\"strong\", {\n    parentName: \"p\"\n  }, \"soft-derived\"), \".\"), mdx(\"p\", null, \"To use key derivation with a password-protected key, add your password to the end:\"), mdx(\"p\", null, mdx(\"em\", {\n    parentName: \"p\"\n  }, \"Command:\")), mdx(\"pre\", null, mdx(\"code\", {\n    parentName: \"pre\",\n    \"className\": \"language-bash\"\n  }, \"# Mnemonic phrase + derivation path + password\\nsubkey inspect \\\"caution juice atom organ advance problem want pledge someone senior holiday very//polkadot/0///pencil laptop kitchen cutter\\\"\\n\")), mdx(\"p\", null, mdx(\"em\", {\n    parentName: \"p\"\n  }, \"Output:\")), mdx(\"pre\", null, mdx(\"code\", {\n    parentName: \"pre\",\n    \"className\": \"language-text\"\n  }, \"Secret Key URI `caution juice atom organ advance problem want pledge someone senior holiday very//polkadot/0///pencil laptop kitchen cutter` is account:\\n  Secret seed:       n/a\\n  Public key (hex):  0xcaf1f5ec14b507b5c365c6528cc06de74a5615274694a0c895ed4109c0ff0d32\\n  Public key (SS58): 5GeoQa3nkeNmzZSfgBFuK3BkAggnTHcX3S1j94sffJYYphrP\\n  Account ID:        0xcaf1f5ec14b507b5c365c6528cc06de74a5615274694a0c895ed4109c0ff0d32\\n  SS58 Address:      5GeoQa3nkeNmzZSfgBFuK3BkAggnTHcX3S1j94sffJYYphrP\\n\")), mdx(\"p\", null, \"Notice that for \", mdx(\"strong\", {\n    parentName: \"p\"\n  }, \"soft-derived\"), \" keys, you can use the hard-derived (with optional password)\\n\", mdx(\"strong\", {\n    parentName: \"p\"\n  }, \"parent's public address\"), \" to derive new public addresses:\"), mdx(\"p\", null, mdx(\"em\", {\n    parentName: \"p\"\n  }, \"Command:\")), mdx(\"pre\", null, mdx(\"code\", {\n    parentName: \"pre\",\n    \"className\": \"language-bash\"\n  }, \"# A soft-derived SS58-address for a *public address* with a hidden seed, hard derivation path, and password\\nsubkey inspect \\\"5GsbzysSK8TKahXBC7FpS2myx3nWehMyYU7q8CLrzZCjpKbM/0\\\"\\n\")), mdx(\"p\", null, mdx(\"em\", {\n    parentName: \"p\"\n  }, \"Output:\")), mdx(\"pre\", null, mdx(\"code\", {\n    parentName: \"pre\",\n    \"className\": \"language-text\"\n  }, \"Public Key URI `5GsbzysSK8TKahXBC7FpS2myx3nWehMyYU7q8CLrzZCjpKbM/0` is account:\\n  Network ID/version: substrate\\n  Public key (hex):   0xcaf1f5ec14b507b5c365c6528cc06de74a5615274694a0c895ed4109c0ff0d32\\n  Public key (SS58):  5GeoQa3nkeNmzZSfgBFuK3BkAggnTHcX3S1j94sffJYYphrP\\n  Account ID:         0xcaf1f5ec14b507b5c365c6528cc06de74a5615274694a0c895ed4109c0ff0d32\\n  SS58 Address:       5GeoQa3nkeNmzZSfgBFuK3BkAggnTHcX3S1j94sffJYYphrP\\n\")), mdx(\"p\", null, \"Notice that the \\\"SS58-address + derivation path\\\" produces the same address as the \\\"mnemonic\\nphrase + derivation path + password.\\\" As such, you can reveal your parent public address\\nand soft derivation paths without revealing your mnemonic phrase or password, retaining control\\nof all derived addresses.\"), mdx(\"h2\", {\n    \"id\": \"signing-and-verifying-messages\",\n    \"style\": {\n      \"position\": \"relative\"\n    }\n  }, mdx(\"a\", {\n    parentName: \"h2\",\n    \"href\": \"#signing-and-verifying-messages\",\n    \"aria-label\": \"signing and verifying messages permalink\",\n    \"className\": \"anchor before\"\n  }, mdx(\"svg\", {\n    parentName: \"a\",\n    \"className\": \"fill-current text-substrateDark dark:text-white\",\n    \"aria-hidden\": \"true\",\n    \"focusable\": \"false\",\n    \"height\": \"16\",\n    \"version\": \"1.1\",\n    \"viewBox\": \"0 0 16 16\",\n    \"width\": \"16\"\n  }, mdx(\"path\", {\n    parentName: \"svg\",\n    \"fillRule\": \"evenodd\",\n    \"d\": \"M4 9h1v1H4c-1.5 0-3-1.69-3-3.5S2.55 3 4 3h4c1.45 0 3 1.69 3 3.5 0 1.41-.91 2.72-2 3.25V8.59c.58-.45 1-1.27 1-2.09C10 5.22 8.98 4 8 4H4c-.98 0-2 1.22-2 2.5S3 9 4 9zm9-3h-1v1h1c1 0 2 1.22 2 2.5S13.98 12 13 12H9c-.98 0-2-1.22-2-2.5 0-.83.42-1.64 1-2.09V6.25c-1.09.53-2 1.84-2 3.25C6 11.31 7.55 13 9 13h4c1.45 0 3-1.69 3-3.5S14.5 6 13 6z\"\n  }))), \"Signing and verifying messages\"), mdx(\"h3\", {\n    \"id\": \"signing\",\n    \"style\": {\n      \"position\": \"relative\"\n    }\n  }, mdx(\"a\", {\n    parentName: \"h3\",\n    \"href\": \"#signing\",\n    \"aria-label\": \"signing permalink\",\n    \"className\": \"anchor before\"\n  }, mdx(\"svg\", {\n    parentName: \"a\",\n    \"className\": \"fill-current text-substrateDark dark:text-white\",\n    \"aria-hidden\": \"true\",\n    \"focusable\": \"false\",\n    \"height\": \"16\",\n    \"version\": \"1.1\",\n    \"viewBox\": \"0 0 16 16\",\n    \"width\": \"16\"\n  }, mdx(\"path\", {\n    parentName: \"svg\",\n    \"fillRule\": \"evenodd\",\n    \"d\": \"M4 9h1v1H4c-1.5 0-3-1.69-3-3.5S2.55 3 4 3h4c1.45 0 3 1.69 3 3.5 0 1.41-.91 2.72-2 3.25V8.59c.58-.45 1-1.27 1-2.09C10 5.22 8.98 4 8 4H4c-.98 0-2 1.22-2 2.5S3 9 4 9zm9-3h-1v1h1c1 0 2 1.22 2 2.5S13.98 12 13 12H9c-.98 0-2-1.22-2-2.5 0-.83.42-1.64 1-2.09V6.25c-1.09.53-2 1.84-2 3.25C6 11.31 7.55 13 9 13h4c1.45 0 3-1.69 3-3.5S14.5 6 13 6z\"\n  }))), \"Signing\"), mdx(\"p\", null, \"You can sign a message by passing the message to Subkey on STDIN. You can sign with either your seed\\nor mnemonic phrase. We use the \", mdx(\"a\", {\n    parentName: \"p\",\n    \"href\": \"#example-seed\"\n  }, \"example raw seed and address\"), \" here:\"), mdx(\"p\", null, mdx(\"em\", {\n    parentName: \"p\"\n  }, \"Command:\")), mdx(\"pre\", null, mdx(\"code\", {\n    parentName: \"pre\",\n    \"className\": \"language-bash\"\n  }, \"# Usage\\n# echo \\\"msg\\\" | subkey sign --suri <secret-seed>\\n\\n# Example\\necho \\\"test message\\\" | subkey sign --suri 0xc8fa03532fb22ee1f7f6908b9c02b4e72483f0dbd66e4cd456b8f34c6230b849\\n\")), mdx(\"p\", null, mdx(\"em\", {\n    parentName: \"p\"\n  }, \"Output:\")), mdx(\"pre\", null, mdx(\"code\", {\n    parentName: \"pre\",\n    \"className\": \"language-text\"\n  }, \"22f91b41ba12f8663ddce26bfc90dbfe6a51683fd3782ad679ab2a5fdbe7d44c2a119f22c74eea22555e5483eb7f42b828f189a38379d59c3b607d2461f0858e\\n\")), mdx(\"h3\", {\n    \"id\": \"verifying\",\n    \"style\": {\n      \"position\": \"relative\"\n    }\n  }, mdx(\"a\", {\n    parentName: \"h3\",\n    \"href\": \"#verifying\",\n    \"aria-label\": \"verifying permalink\",\n    \"className\": \"anchor before\"\n  }, mdx(\"svg\", {\n    parentName: \"a\",\n    \"className\": \"fill-current text-substrateDark dark:text-white\",\n    \"aria-hidden\": \"true\",\n    \"focusable\": \"false\",\n    \"height\": \"16\",\n    \"version\": \"1.1\",\n    \"viewBox\": \"0 0 16 16\",\n    \"width\": \"16\"\n  }, mdx(\"path\", {\n    parentName: \"svg\",\n    \"fillRule\": \"evenodd\",\n    \"d\": \"M4 9h1v1H4c-1.5 0-3-1.69-3-3.5S2.55 3 4 3h4c1.45 0 3 1.69 3 3.5 0 1.41-.91 2.72-2 3.25V8.59c.58-.45 1-1.27 1-2.09C10 5.22 8.98 4 8 4H4c-.98 0-2 1.22-2 2.5S3 9 4 9zm9-3h-1v1h1c1 0 2 1.22 2 2.5S13.98 12 13 12H9c-.98 0-2-1.22-2-2.5 0-.83.42-1.64 1-2.09V6.25c-1.09.53-2 1.84-2 3.25C6 11.31 7.55 13 9 13h4c1.45 0 3-1.69 3-3.5S14.5 6 13 6z\"\n  }))), \"Verifying\"), mdx(\"p\", null, \"Although the signatures above are different, they both verify with the address:\"), mdx(\"p\", null, mdx(\"em\", {\n    parentName: \"p\"\n  }, \"Command:\")), mdx(\"pre\", null, mdx(\"code\", {\n    parentName: \"pre\",\n    \"className\": \"language-bash\"\n  }, \"# Usage\\n# echo \\\"msg\\\" | subkey verify <signature> <SS58-address>\\n\\n# Example\\necho \\\"test message\\\" | subkey verify 22f91b41ba12f8663ddce26bfc90dbfe6a51683fd3782ad679ab2a5fdbe7d44c2a119f22c74eea22555e5483eb7f42b828f189a38379d59c3b607d2461f0858e 5Gv8YYFu8H1btvmrJy9FjjAWfb99wrhV3uhPFoNEr918utyR\\n\")), mdx(\"p\", null, mdx(\"em\", {\n    parentName: \"p\"\n  }, \"Output:\")), mdx(\"pre\", null, mdx(\"code\", {\n    parentName: \"pre\",\n    \"className\": \"language-text\"\n  }, \"Signature verifies correctly.\\n\")), mdx(\"br\", null), mdx(Message, {\n    type: \"gray\",\n    title: \"Note\",\n    text: \"`echo` appends a newline character to the end of strings. Therefore, if you verify a message\\n  that was signed elsewhere, e.g. Polkadot JS, then you will need to use `echo -n` to remove the\\n  newline character and verify the correct message.\",\n    mdxType: \"Message\"\n  }), mdx(\"h2\", {\n    \"id\": \"generating-node-keys\",\n    \"style\": {\n      \"position\": \"relative\"\n    }\n  }, mdx(\"a\", {\n    parentName: \"h2\",\n    \"href\": \"#generating-node-keys\",\n    \"aria-label\": \"generating node keys permalink\",\n    \"className\": \"anchor before\"\n  }, mdx(\"svg\", {\n    parentName: \"a\",\n    \"className\": \"fill-current text-substrateDark dark:text-white\",\n    \"aria-hidden\": \"true\",\n    \"focusable\": \"false\",\n    \"height\": \"16\",\n    \"version\": \"1.1\",\n    \"viewBox\": \"0 0 16 16\",\n    \"width\": \"16\"\n  }, mdx(\"path\", {\n    parentName: \"svg\",\n    \"fillRule\": \"evenodd\",\n    \"d\": \"M4 9h1v1H4c-1.5 0-3-1.69-3-3.5S2.55 3 4 3h4c1.45 0 3 1.69 3 3.5 0 1.41-.91 2.72-2 3.25V8.59c.58-.45 1-1.27 1-2.09C10 5.22 8.98 4 8 4H4c-.98 0-2 1.22-2 2.5S3 9 4 9zm9-3h-1v1h1c1 0 2 1.22 2 2.5S13.98 12 13 12H9c-.98 0-2-1.22-2-2.5 0-.83.42-1.64 1-2.09V6.25c-1.09.53-2 1.84-2 3.25C6 11.31 7.55 13 9 13h4c1.45 0 3-1.69 3-3.5S14.5 6 13 6z\"\n  }))), \"Generating node keys\"), mdx(\"p\", null, \"You can generate a node's libp2p key by the following:\"), mdx(\"p\", null, mdx(\"em\", {\n    parentName: \"p\"\n  }, \"Command:\")), mdx(\"pre\", null, mdx(\"code\", {\n    parentName: \"pre\",\n    \"className\": \"language-bash\"\n  }, \"# Usage\\n# subkey generate-node-key --file <output-file>\\n\\n# Example\\nsubkey generate-node-key --file node-key\\n\")), mdx(\"p\", null, mdx(\"em\", {\n    parentName: \"p\"\n  }, \"Output:\")), mdx(\"pre\", null, mdx(\"code\", {\n    parentName: \"pre\",\n    \"className\": \"language-text\"\n  }, \"12D3KooWAhzqC4xstZKkAVYge2Q9tAMcnFhNEabLejRNVoQWLHHC\\n\")), mdx(\"p\", null, \"The peer ID is displayed on screen and the actual key is saved in the \", mdx(\"inlineCode\", {\n    parentName: \"p\"\n  }, \"<output-file>\"), \".\"), mdx(\"h2\", {\n    \"id\": \"well-known-keys\",\n    \"style\": {\n      \"position\": \"relative\"\n    }\n  }, mdx(\"a\", {\n    parentName: \"h2\",\n    \"href\": \"#well-known-keys\",\n    \"aria-label\": \"well known keys permalink\",\n    \"className\": \"anchor before\"\n  }, mdx(\"svg\", {\n    parentName: \"a\",\n    \"className\": \"fill-current text-substrateDark dark:text-white\",\n    \"aria-hidden\": \"true\",\n    \"focusable\": \"false\",\n    \"height\": \"16\",\n    \"version\": \"1.1\",\n    \"viewBox\": \"0 0 16 16\",\n    \"width\": \"16\"\n  }, mdx(\"path\", {\n    parentName: \"svg\",\n    \"fillRule\": \"evenodd\",\n    \"d\": \"M4 9h1v1H4c-1.5 0-3-1.69-3-3.5S2.55 3 4 3h4c1.45 0 3 1.69 3 3.5 0 1.41-.91 2.72-2 3.25V8.59c.58-.45 1-1.27 1-2.09C10 5.22 8.98 4 8 4H4c-.98 0-2 1.22-2 2.5S3 9 4 9zm9-3h-1v1h1c1 0 2 1.22 2 2.5S13.98 12 13 12H9c-.98 0-2-1.22-2-2.5 0-.83.42-1.64 1-2.09V6.25c-1.09.53-2 1.84-2 3.25C6 11.31 7.55 13 9 13h4c1.45 0 3-1.69 3-3.5S14.5 6 13 6z\"\n  }))), \"Well-known keys\"), mdx(\"p\", null, \"The common seed used for all development accounts is:\"), mdx(\"pre\", null, mdx(\"code\", {\n    parentName: \"pre\",\n    \"className\": \"language-text\"\n  }, \"bottom drive obey lake curtain smoke basket hold race lonely fit walk\\n\")), mdx(\"p\", null, \"Various development accounts are \", mdx(\"em\", {\n    parentName: \"p\"\n  }, \"derived\"), \" from this seed.\"), mdx(\"p\", null, \"If you've worked with Substrate previously, you have likely encountered the ubiquitous accounts for\\nAlice, Bob, and their friends. These keys are not at all private, but are useful for playing with\\nSubstrate without always generating new key pairs. You can inspect these \\\"well-known\\\" keys as well.\"), mdx(\"p\", null, mdx(\"em\", {\n    parentName: \"p\"\n  }, \"Command:\")), mdx(\"pre\", null, mdx(\"code\", {\n    parentName: \"pre\",\n    \"className\": \"language-bash\"\n  }, \"subkey inspect //Alice\\n\")), mdx(\"p\", null, mdx(\"em\", {\n    parentName: \"p\"\n  }, \"Output:\")), mdx(\"pre\", null, mdx(\"code\", {\n    parentName: \"pre\",\n    \"className\": \"language-text\"\n  }, \"Secret Key URI `//Alice` is account:\\n  Secret seed:      0xe5be9a5092b81bca64be81d212e7f2f9eba183bb7a90954f7b76361f6edb5c0a\\n  Public key (hex): 0xd43593c715fdd31c61141abd04a99fd6822c8558854ccde39a5684e7a56da27d\\n  Account ID:       0xd43593c715fdd31c61141abd04a99fd6822c8558854ccde39a5684e7a56da27d\\n  SS58 Address:     5GrwvaEF5zXb26Fz9rcQpDWS57CtERHpNehXCPcNoHGKutQY\\n\")), mdx(\"p\", null, \"A mnemonic phrase is a secret group of words that can be used to uniquely generate a private key. In\\nSubkey, there is a specific dev phrase used whenever a mnemonic phrase is omitted.\", mdx(\"inlineCode\", {\n    parentName: \"p\"\n  }, \"//Alice\"), \" for\\nexample is actually:\"), mdx(\"pre\", null, mdx(\"code\", {\n    parentName: \"pre\",\n    \"className\": \"language-text\"\n  }, \"bottom drive obey lake curtain smoke basket hold race lonely fit walk//Alice\\n\")), mdx(\"p\", null, \"It is important remember that keys such as this are \", mdx(\"em\", {\n    parentName: \"p\"\n  }, \"not\"), \" secure, and should be deployed only for\\ntesting. In addition, anyone not using PolkadotJS or Subkey should note this information to properly\\ngenerate the account.\"), mdx(\"h2\", {\n    \"id\": \"further-resources\",\n    \"style\": {\n      \"position\": \"relative\"\n    }\n  }, mdx(\"a\", {\n    parentName: \"h2\",\n    \"href\": \"#further-resources\",\n    \"aria-label\": \"further resources permalink\",\n    \"className\": \"anchor before\"\n  }, mdx(\"svg\", {\n    parentName: \"a\",\n    \"className\": \"fill-current text-substrateDark dark:text-white\",\n    \"aria-hidden\": \"true\",\n    \"focusable\": \"false\",\n    \"height\": \"16\",\n    \"version\": \"1.1\",\n    \"viewBox\": \"0 0 16 16\",\n    \"width\": \"16\"\n  }, mdx(\"path\", {\n    parentName: \"svg\",\n    \"fillRule\": \"evenodd\",\n    \"d\": \"M4 9h1v1H4c-1.5 0-3-1.69-3-3.5S2.55 3 4 3h4c1.45 0 3 1.69 3 3.5 0 1.41-.91 2.72-2 3.25V8.59c.58-.45 1-1.27 1-2.09C10 5.22 8.98 4 8 4H4c-.98 0-2 1.22-2 2.5S3 9 4 9zm9-3h-1v1h1c1 0 2 1.22 2 2.5S13.98 12 13 12H9c-.98 0-2-1.22-2-2.5 0-.83.42-1.64 1-2.09V6.25c-1.09.53-2 1.84-2 3.25C6 11.31 7.55 13 9 13h4c1.45 0 3-1.69 3-3.5S14.5 6 13 6z\"\n  }))), \"Further resources\"), mdx(Message, {\n    type: \"yellow\",\n    title: \"Important\",\n    text: \"Remember that passwords and derivation paths are just as important to backup as the seed itself!\\n  See the [password note](#important-password-and-derivation-note) for more information.\",\n    mdxType: \"Message\"\n  }), mdx(\"ul\", null, mdx(\"li\", {\n    parentName: \"ul\"\n  }, \"Learn more by running \", mdx(\"inlineCode\", {\n    parentName: \"li\"\n  }, \"subkey help\"), \" or see the\\n\", mdx(\"a\", {\n    parentName: \"li\",\n    \"href\": \"https://github.com/paritytech/substrate/tree/master/bin/utils/subkey\"\n  }, \"README\"), \".\"), mdx(\"li\", {\n    parentName: \"ul\"\n  }, \"Key pairs can also be generated in the \", mdx(\"a\", {\n    parentName: \"li\",\n    \"href\": \"https://polkadot.js.org/apps/\"\n  }, \"PolkadotJS Apps UI\"), \". Try\\ncreating keys with the UI and restoring them with Subkey or vice versa.\"), mdx(\"li\", {\n    parentName: \"ul\"\n  }, \"Learn more about\\n\", mdx(\"a\", {\n    parentName: \"li\",\n    \"href\": \"https://wiki.polkadot.network/docs/en/learn-cryptography\"\n  }, \"different cryptographic algorithms and choosing between them\"), \".\")));\n}\n;\nMDXContent.isMDXComponent = true;","tableOfContents":{"items":[{"url":"#installation","title":"Installation","items":[{"url":"#install-with-cargo","title":"Install with Cargo"},{"url":"#compiling-with-cargo","title":"Compiling with Cargo"}]},{"url":"#inspecting-keys","title":"Inspecting keys"},{"url":"#generating-keys","title":"Generating keys","items":[{"url":"#example-seed","title":"Example seed"}]},{"url":"#specify-network-address-format","title":"Specify network address format"},{"url":"#hd-key-derivation","title":"HD key derivation","items":[{"url":"#hard-key-derivation","title":"Hard key derivation"},{"url":"#soft-key-derivation","title":"Soft key derivation"}]},{"url":"#password-protected-keys","title":"Password protected keys"},{"url":"#combine-derivation-paths-and-passwords","title":"Combine derivation paths and passwords"},{"url":"#signing-and-verifying-messages","title":"Signing and verifying messages","items":[{"url":"#signing","title":"Signing"},{"url":"#verifying","title":"Verifying"}]},{"url":"#generating-node-keys","title":"Generating node keys"},{"url":"#well-known-keys","title":"Well-known keys"},{"url":"#further-resources","title":"Further resources"}]},"fileAbsolutePath":"/Users/a212/Desktop/substrate-docs/v3/docs/06-tools/a-subkey/index.mdx"}},"pageContext":{"slug":"/v3/tools/subkey","version":"3.0","locale":"en","hrefLang":"en-US","originalPath":"/v3/tools/subkey/","dateFormat":"MM/DD/YYYY"}},
    "staticQueryHashes": ["1239077767","1821483254","2966362950","3280999885"]}