{
    "componentChunkName": "component---src-templates-kb-template-tsx",
    "path": "/v3/integration/polkadot-js/",
    "result": {"data":{"mdx":{"frontmatter":{"slug":"/v3/integration/polkadot-js","title":"Polkadot-JS","hideNav":null,"section":"docs","category":"tools"},"body":"var _excluded = [\"components\"];\n\nfunction _extends() { _extends = Object.assign || function (target) { for (var i = 1; i < arguments.length; i++) { var source = arguments[i]; for (var key in source) { if (Object.prototype.hasOwnProperty.call(source, key)) { target[key] = source[key]; } } } return target; }; return _extends.apply(this, arguments); }\n\nfunction _objectWithoutProperties(source, excluded) { if (source == null) return {}; var target = _objectWithoutPropertiesLoose(source, excluded); var key, i; if (Object.getOwnPropertySymbols) { var sourceSymbolKeys = Object.getOwnPropertySymbols(source); for (i = 0; i < sourceSymbolKeys.length; i++) { key = sourceSymbolKeys[i]; if (excluded.indexOf(key) >= 0) continue; if (!Object.prototype.propertyIsEnumerable.call(source, key)) continue; target[key] = source[key]; } } return target; }\n\nfunction _objectWithoutPropertiesLoose(source, excluded) { if (source == null) return {}; var target = {}; var sourceKeys = Object.keys(source); var key, i; for (i = 0; i < sourceKeys.length; i++) { key = sourceKeys[i]; if (excluded.indexOf(key) >= 0) continue; target[key] = source[key]; } return target; }\n\n/* @jsxRuntime classic */\n\n/* @jsx mdx */\nvar _frontmatter = {\n  \"title\": \"Polkadot-JS\",\n  \"slug\": \"/v3/integration/polkadot-js\",\n  \"version\": 3,\n  \"section\": \"docs\",\n  \"category\": \"tools\",\n  \"keywords\": null\n};\n\nvar makeShortcode = function makeShortcode(name) {\n  return function MDXDefaultShortcode(props) {\n    console.warn(\"Component \" + name + \" was not imported, exported, or provided by MDXProvider as global scope\");\n    return mdx(\"div\", props);\n  };\n};\n\nvar Message = makeShortcode(\"Message\");\nvar RelatedMaterialBlock = makeShortcode(\"RelatedMaterialBlock\");\nvar layoutProps = {\n  _frontmatter: _frontmatter\n};\nvar MDXLayout = \"wrapper\";\nreturn function MDXContent(_ref) {\n  var components = _ref.components,\n      props = _objectWithoutProperties(_ref, _excluded);\n\n  return mdx(MDXLayout, _extends({}, layoutProps, props, {\n    components: components,\n    mdxType: \"MDXLayout\"\n  }), mdx(\"p\", null, \"The Polkadot-JS project is a collection of tools, interfaces, and libraries around Polkadot and\\nSubstrate.\"), mdx(Message, {\n    type: \"gray\",\n    title: \"Note\",\n    text: \"While the project is named after \\\"Polkadot\\\", know that these tools, interfaces, and\\n  libraries are fully compatible with any Substrate based chain.\",\n    mdxType: \"Message\"\n  }), mdx(\"h2\", {\n    \"id\": \"polkadot-js-api\",\n    \"style\": {\n      \"position\": \"relative\"\n    }\n  }, mdx(\"a\", {\n    parentName: \"h2\",\n    \"href\": \"#polkadot-js-api\",\n    \"aria-label\": \"polkadot js api permalink\",\n    \"className\": \"anchor before\"\n  }, mdx(\"svg\", {\n    parentName: \"a\",\n    \"className\": \"fill-current text-substrateDark dark:text-white\",\n    \"aria-hidden\": \"true\",\n    \"focusable\": \"false\",\n    \"height\": \"16\",\n    \"version\": \"1.1\",\n    \"viewBox\": \"0 0 16 16\",\n    \"width\": \"16\"\n  }, mdx(\"path\", {\n    parentName: \"svg\",\n    \"fillRule\": \"evenodd\",\n    \"d\": \"M4 9h1v1H4c-1.5 0-3-1.69-3-3.5S2.55 3 4 3h4c1.45 0 3 1.69 3 3.5 0 1.41-.91 2.72-2 3.25V8.59c.58-.45 1-1.27 1-2.09C10 5.22 8.98 4 8 4H4c-.98 0-2 1.22-2 2.5S3 9 4 9zm9-3h-1v1h1c1 0 2 1.22 2 2.5S13.98 12 13 12H9c-.98 0-2-1.22-2-2.5 0-.83.42-1.64 1-2.09V6.25c-1.09.53-2 1.84-2 3.25C6 11.31 7.55 13 9 13h4c1.45 0 3-1.69 3-3.5S14.5 6 13 6z\"\n  }))), \"Polkadot-JS API\"), mdx(RelatedMaterialBlock, {\n    title: \"\",\n    text: \"The API provides application developers the ability to query a node and interact with the Polkadot\\n  or Substrate chains using Javascript.\",\n    linkText: \"Go to Documentation\",\n    link: \"https://polkadot.js.org/docs/api\",\n    mdxType: \"RelatedMaterialBlock\"\n  }), mdx(RelatedMaterialBlock, {\n    title: \"\",\n    text: \"The Polkadot-JS API is a library of interfaces for communicating with Polkadot and Substrate nodes.\",\n    linkText: \"GitHub\",\n    link: \"https://github.com/polkadot-js/api\",\n    mdxType: \"RelatedMaterialBlock\"\n  }), mdx(\"h3\", {\n    \"id\": \"getting-started\",\n    \"style\": {\n      \"position\": \"relative\"\n    }\n  }, mdx(\"a\", {\n    parentName: \"h3\",\n    \"href\": \"#getting-started\",\n    \"aria-label\": \"getting started permalink\",\n    \"className\": \"anchor before\"\n  }, mdx(\"svg\", {\n    parentName: \"a\",\n    \"className\": \"fill-current text-substrateDark dark:text-white\",\n    \"aria-hidden\": \"true\",\n    \"focusable\": \"false\",\n    \"height\": \"16\",\n    \"version\": \"1.1\",\n    \"viewBox\": \"0 0 16 16\",\n    \"width\": \"16\"\n  }, mdx(\"path\", {\n    parentName: \"svg\",\n    \"fillRule\": \"evenodd\",\n    \"d\": \"M4 9h1v1H4c-1.5 0-3-1.69-3-3.5S2.55 3 4 3h4c1.45 0 3 1.69 3 3.5 0 1.41-.91 2.72-2 3.25V8.59c.58-.45 1-1.27 1-2.09C10 5.22 8.98 4 8 4H4c-.98 0-2 1.22-2 2.5S3 9 4 9zm9-3h-1v1h1c1 0 2 1.22 2 2.5S13.98 12 13 12H9c-.98 0-2-1.22-2-2.5 0-.83.42-1.64 1-2.09V6.25c-1.09.53-2 1.84-2 3.25C6 11.31 7.55 13 9 13h4c1.45 0 3-1.69 3-3.5S14.5 6 13 6z\"\n  }))), \"Getting started\"), mdx(\"p\", null, \"Follow the\\n\", mdx(\"a\", {\n    parentName: \"p\",\n    \"href\": \"https://polkadot.js.org/docs/api/\"\n  }, \"Getting Started\"), \" guide to learn how to install and start using\\nthe Polkadot-JS API right away.\"), mdx(\"h2\", {\n    \"id\": \"polkadot-js-apps\",\n    \"style\": {\n      \"position\": \"relative\"\n    }\n  }, mdx(\"a\", {\n    parentName: \"h2\",\n    \"href\": \"#polkadot-js-apps\",\n    \"aria-label\": \"polkadot js apps permalink\",\n    \"className\": \"anchor before\"\n  }, mdx(\"svg\", {\n    parentName: \"a\",\n    \"className\": \"fill-current text-substrateDark dark:text-white\",\n    \"aria-hidden\": \"true\",\n    \"focusable\": \"false\",\n    \"height\": \"16\",\n    \"version\": \"1.1\",\n    \"viewBox\": \"0 0 16 16\",\n    \"width\": \"16\"\n  }, mdx(\"path\", {\n    parentName: \"svg\",\n    \"fillRule\": \"evenodd\",\n    \"d\": \"M4 9h1v1H4c-1.5 0-3-1.69-3-3.5S2.55 3 4 3h4c1.45 0 3 1.69 3 3.5 0 1.41-.91 2.72-2 3.25V8.59c.58-.45 1-1.27 1-2.09C10 5.22 8.98 4 8 4H4c-.98 0-2 1.22-2 2.5S3 9 4 9zm9-3h-1v1h1c1 0 2 1.22 2 2.5S13.98 12 13 12H9c-.98 0-2-1.22-2-2.5 0-.83.42-1.64 1-2.09V6.25c-1.09.53-2 1.84-2 3.25C6 11.31 7.55 13 9 13h4c1.45 0 3-1.69 3-3.5S14.5 6 13 6z\"\n  }))), \"Polkadot-JS Apps\"), mdx(RelatedMaterialBlock, {\n    title: \"\",\n    text: \"The Polkadot-JS Apps is a flexible UI for interacting with a Polkadot or Substrate based node..\",\n    linkText: \"Go to Documentation\",\n    link: \"https://polkadot.js.org/apps\",\n    mdxType: \"RelatedMaterialBlock\"\n  }), mdx(RelatedMaterialBlock, {\n    title: \"\",\n    text: \"This is pre-built user-facing application, allowing access to all features available on Substrate\\n  chains.\",\n    linkText: \"GitHub\",\n    link: \"https://github.com/polkadot-js/apps\",\n    mdxType: \"RelatedMaterialBlock\"\n  }), mdx(\"h3\", {\n    \"id\": \"connecting-to-local-node\",\n    \"style\": {\n      \"position\": \"relative\"\n    }\n  }, mdx(\"a\", {\n    parentName: \"h3\",\n    \"href\": \"#connecting-to-local-node\",\n    \"aria-label\": \"connecting to local node permalink\",\n    \"className\": \"anchor before\"\n  }, mdx(\"svg\", {\n    parentName: \"a\",\n    \"className\": \"fill-current text-substrateDark dark:text-white\",\n    \"aria-hidden\": \"true\",\n    \"focusable\": \"false\",\n    \"height\": \"16\",\n    \"version\": \"1.1\",\n    \"viewBox\": \"0 0 16 16\",\n    \"width\": \"16\"\n  }, mdx(\"path\", {\n    parentName: \"svg\",\n    \"fillRule\": \"evenodd\",\n    \"d\": \"M4 9h1v1H4c-1.5 0-3-1.69-3-3.5S2.55 3 4 3h4c1.45 0 3 1.69 3 3.5 0 1.41-.91 2.72-2 3.25V8.59c.58-.45 1-1.27 1-2.09C10 5.22 8.98 4 8 4H4c-.98 0-2 1.22-2 2.5S3 9 4 9zm9-3h-1v1h1c1 0 2 1.22 2 2.5S13.98 12 13 12H9c-.98 0-2-1.22-2-2.5 0-.83.42-1.64 1-2.09V6.25c-1.09.53-2 1.84-2 3.25C6 11.31 7.55 13 9 13h4c1.45 0 3-1.69 3-3.5S14.5 6 13 6z\"\n  }))), \"Connecting to local node\"), mdx(\"p\", null, \"To connect the Polkadot-JS Apps to your local node, you must go into \", mdx(\"inlineCode\", {\n    parentName: \"p\"\n  }, \"Settings\"), \" and change the\\n\\\"endpoint to connect to\\\" to \", mdx(\"inlineCode\", {\n    parentName: \"p\"\n  }, \"Local Node (127.0.0.1:9944)\"), \".\"), mdx(Message, {\n    type: \"gray\",\n    title: \"Note\",\n    text: \"If you are connected to the Polkadot-JS Apps over a secure HTTPS connection, you will\\n  need to use a browser which also supports bridging to an insecure WebSocket endpoint. For example,\\n  Google Chrome supports this, but Mozilla Firefox does not.\",\n    mdxType: \"Message\"\n  }), mdx(\"h2\", {\n    \"id\": \"polkadot-js-extension\",\n    \"style\": {\n      \"position\": \"relative\"\n    }\n  }, mdx(\"a\", {\n    parentName: \"h2\",\n    \"href\": \"#polkadot-js-extension\",\n    \"aria-label\": \"polkadot js extension permalink\",\n    \"className\": \"anchor before\"\n  }, mdx(\"svg\", {\n    parentName: \"a\",\n    \"className\": \"fill-current text-substrateDark dark:text-white\",\n    \"aria-hidden\": \"true\",\n    \"focusable\": \"false\",\n    \"height\": \"16\",\n    \"version\": \"1.1\",\n    \"viewBox\": \"0 0 16 16\",\n    \"width\": \"16\"\n  }, mdx(\"path\", {\n    parentName: \"svg\",\n    \"fillRule\": \"evenodd\",\n    \"d\": \"M4 9h1v1H4c-1.5 0-3-1.69-3-3.5S2.55 3 4 3h4c1.45 0 3 1.69 3 3.5 0 1.41-.91 2.72-2 3.25V8.59c.58-.45 1-1.27 1-2.09C10 5.22 8.98 4 8 4H4c-.98 0-2 1.22-2 2.5S3 9 4 9zm9-3h-1v1h1c1 0 2 1.22 2 2.5S13.98 12 13 12H9c-.98 0-2-1.22-2-2.5 0-.83.42-1.64 1-2.09V6.25c-1.09.53-2 1.84-2 3.25C6 11.31 7.55 13 9 13h4c1.45 0 3-1.69 3-3.5S14.5 6 13 6z\"\n  }))), \"Polkadot-JS extension\"), mdx(\"p\", null, \"The Polkadot-JS Extension is a simple proof-of-concept for managing accounts in a browser extension\\nand allowing the signing of extrinsics using these accounts. It also provides a simple interface for\\ninteracting with extension-compliant dApps.\"), mdx(\"p\", null, \"Different ways to use the extension:\"), mdx(\"ul\", null, mdx(\"li\", {\n    parentName: \"ul\"\n  }, mdx(\"p\", {\n    parentName: \"li\"\n  }, mdx(\"a\", {\n    parentName: \"p\",\n    \"href\": \"https://chrome.google.com/webstore/detail/polkadot%7Bjs%7D-extension/mopnmbcafieddcagagdcbnhejhlodfdd\"\n  }, \"On Chrome\"))), mdx(\"li\", {\n    parentName: \"ul\"\n  }, mdx(\"p\", {\n    parentName: \"li\"\n  }, mdx(\"a\", {\n    parentName: \"p\",\n    \"href\": \"https://addons.mozilla.org/en-US/firefox/addon/polkadot-js-extension\"\n  }, \"On Firefox\"))), mdx(\"li\", {\n    parentName: \"ul\"\n  }, mdx(\"p\", {\n    parentName: \"li\"\n  }, mdx(\"a\", {\n    parentName: \"p\",\n    \"href\": \"https://github.com/polkadot-js/extension\"\n  }, \"Fork on GitHub\")))), mdx(\"h2\", {\n    \"id\": \"next-steps\",\n    \"style\": {\n      \"position\": \"relative\"\n    }\n  }, mdx(\"a\", {\n    parentName: \"h2\",\n    \"href\": \"#next-steps\",\n    \"aria-label\": \"next steps permalink\",\n    \"className\": \"anchor before\"\n  }, mdx(\"svg\", {\n    parentName: \"a\",\n    \"className\": \"fill-current text-substrateDark dark:text-white\",\n    \"aria-hidden\": \"true\",\n    \"focusable\": \"false\",\n    \"height\": \"16\",\n    \"version\": \"1.1\",\n    \"viewBox\": \"0 0 16 16\",\n    \"width\": \"16\"\n  }, mdx(\"path\", {\n    parentName: \"svg\",\n    \"fillRule\": \"evenodd\",\n    \"d\": \"M4 9h1v1H4c-1.5 0-3-1.69-3-3.5S2.55 3 4 3h4c1.45 0 3 1.69 3 3.5 0 1.41-.91 2.72-2 3.25V8.59c.58-.45 1-1.27 1-2.09C10 5.22 8.98 4 8 4H4c-.98 0-2 1.22-2 2.5S3 9 4 9zm9-3h-1v1h1c1 0 2 1.22 2 2.5S13.98 12 13 12H9c-.98 0-2-1.22-2-2.5 0-.83.42-1.64 1-2.09V6.25c-1.09.53-2 1.84-2 3.25C6 11.31 7.55 13 9 13h4c1.45 0 3-1.69 3-3.5S14.5 6 13 6z\"\n  }))), \"Next steps\"), mdx(\"h3\", {\n    \"id\": \"examples\",\n    \"style\": {\n      \"position\": \"relative\"\n    }\n  }, mdx(\"a\", {\n    parentName: \"h3\",\n    \"href\": \"#examples\",\n    \"aria-label\": \"examples permalink\",\n    \"className\": \"anchor before\"\n  }, mdx(\"svg\", {\n    parentName: \"a\",\n    \"className\": \"fill-current text-substrateDark dark:text-white\",\n    \"aria-hidden\": \"true\",\n    \"focusable\": \"false\",\n    \"height\": \"16\",\n    \"version\": \"1.1\",\n    \"viewBox\": \"0 0 16 16\",\n    \"width\": \"16\"\n  }, mdx(\"path\", {\n    parentName: \"svg\",\n    \"fillRule\": \"evenodd\",\n    \"d\": \"M4 9h1v1H4c-1.5 0-3-1.69-3-3.5S2.55 3 4 3h4c1.45 0 3 1.69 3 3.5 0 1.41-.91 2.72-2 3.25V8.59c.58-.45 1-1.27 1-2.09C10 5.22 8.98 4 8 4H4c-.98 0-2 1.22-2 2.5S3 9 4 9zm9-3h-1v1h1c1 0 2 1.22 2 2.5S13.98 12 13 12H9c-.98 0-2-1.22-2-2.5 0-.83.42-1.64 1-2.09V6.25c-1.09.53-2 1.84-2 3.25C6 11.31 7.55 13 9 13h4c1.45 0 3-1.69 3-3.5S14.5 6 13 6z\"\n  }))), \"Examples\"), mdx(\"ul\", null, mdx(\"li\", {\n    parentName: \"ul\"\n  }, \"Clone the\\n\", mdx(\"a\", {\n    parentName: \"li\",\n    \"href\": \"https://github.com/substrate-developer-hub/substrate-front-end-template\"\n  }, \"Substrate Front End Template\"), \"\\nto start building a custom ReactJS app for your blockchain using Polkadot-JS API.\"), mdx(\"li\", {\n    parentName: \"ul\"\n  }, \"Complete \", mdx(\"a\", {\n    parentName: \"li\",\n    \"href\": \"/tutorials/v3/kitties/pt2/\"\n  }, \"part II of the Kitties tutorial\"), \" to use PolkadotJS API in action\")), mdx(\"h3\", {\n    \"id\": \"references\",\n    \"style\": {\n      \"position\": \"relative\"\n    }\n  }, mdx(\"a\", {\n    parentName: \"h3\",\n    \"href\": \"#references\",\n    \"aria-label\": \"references permalink\",\n    \"className\": \"anchor before\"\n  }, mdx(\"svg\", {\n    parentName: \"a\",\n    \"className\": \"fill-current text-substrateDark dark:text-white\",\n    \"aria-hidden\": \"true\",\n    \"focusable\": \"false\",\n    \"height\": \"16\",\n    \"version\": \"1.1\",\n    \"viewBox\": \"0 0 16 16\",\n    \"width\": \"16\"\n  }, mdx(\"path\", {\n    parentName: \"svg\",\n    \"fillRule\": \"evenodd\",\n    \"d\": \"M4 9h1v1H4c-1.5 0-3-1.69-3-3.5S2.55 3 4 3h4c1.45 0 3 1.69 3 3.5 0 1.41-.91 2.72-2 3.25V8.59c.58-.45 1-1.27 1-2.09C10 5.22 8.98 4 8 4H4c-.98 0-2 1.22-2 2.5S3 9 4 9zm9-3h-1v1h1c1 0 2 1.22 2 2.5S13.98 12 13 12H9c-.98 0-2-1.22-2-2.5 0-.83.42-1.64 1-2.09V6.25c-1.09.53-2 1.84-2 3.25C6 11.31 7.55 13 9 13h4c1.45 0 3-1.69 3-3.5S14.5 6 13 6z\"\n  }))), \"References\"), mdx(\"ul\", null, mdx(\"li\", {\n    parentName: \"ul\"\n  }, mdx(\"p\", {\n    parentName: \"li\"\n  }, \"Visit the reference docs for the \", mdx(\"a\", {\n    parentName: \"p\",\n    \"href\": \"https://polkadot.js.org/api/\"\n  }, \"Polkadot-JS API\"))), mdx(\"li\", {\n    parentName: \"ul\"\n  }, mdx(\"p\", {\n    parentName: \"li\"\n  }, \"Visit the reference docs for the \", mdx(\"a\", {\n    parentName: \"p\",\n    \"href\": \"https://polkadot.js.org/common/\"\n  }, \"Polkadot-JS Common Utilities\")))));\n}\n;\nMDXContent.isMDXComponent = true;","tableOfContents":{"items":[{"url":"#polkadot-js-api","title":"Polkadot-JS API","items":[{"url":"#getting-started","title":"Getting started"}]},{"url":"#polkadot-js-apps","title":"Polkadot-JS Apps","items":[{"url":"#connecting-to-local-node","title":"Connecting to local node"}]},{"url":"#polkadot-js-extension","title":"Polkadot-JS extension"},{"url":"#next-steps","title":"Next steps","items":[{"url":"#examples","title":"Examples"},{"url":"#references","title":"References"}]}]},"fileAbsolutePath":"/Users/a212/Desktop/substrate-docs/v3/docs/05-integrate/a-polkadotjs/index.mdx"}},"pageContext":{"slug":"/v3/integration/polkadot-js","version":"3.0","locale":"en","hrefLang":"en-US","originalPath":"/v3/integration/polkadot-js/","dateFormat":"MM/DD/YYYY"}},
    "staticQueryHashes": ["1239077767","1821483254","2966362950","3280999885"]}