{
    "componentChunkName": "component---src-templates-kb-template-tsx",
    "path": "/v3/contribute/templates/",
    "result": {"data":{"mdx":{"frontmatter":{"slug":"/v3/contribute/templates","title":"How-to guide template","hideNav":null,"section":"docs","category":"style guide"},"body":"var _excluded = [\"components\"];\n\nfunction _extends() { _extends = Object.assign || function (target) { for (var i = 1; i < arguments.length; i++) { var source = arguments[i]; for (var key in source) { if (Object.prototype.hasOwnProperty.call(source, key)) { target[key] = source[key]; } } } return target; }; return _extends.apply(this, arguments); }\n\nfunction _objectWithoutProperties(source, excluded) { if (source == null) return {}; var target = _objectWithoutPropertiesLoose(source, excluded); var key, i; if (Object.getOwnPropertySymbols) { var sourceSymbolKeys = Object.getOwnPropertySymbols(source); for (i = 0; i < sourceSymbolKeys.length; i++) { key = sourceSymbolKeys[i]; if (excluded.indexOf(key) >= 0) continue; if (!Object.prototype.propertyIsEnumerable.call(source, key)) continue; target[key] = source[key]; } } return target; }\n\nfunction _objectWithoutPropertiesLoose(source, excluded) { if (source == null) return {}; var target = {}; var sourceKeys = Object.keys(source); var key, i; for (i = 0; i < sourceKeys.length; i++) { key = sourceKeys[i]; if (excluded.indexOf(key) >= 0) continue; target[key] = source[key]; } return target; }\n\n/* @jsxRuntime classic */\n\n/* @jsx mdx */\nvar _frontmatter = {\n  \"title\": \"How-to guide template\",\n  \"slug\": \"/v3/contribute/templates\",\n  \"version\": 3,\n  \"section\": \"docs\",\n  \"category\": \"style guide\",\n  \"keywords\": \"template, contribute, style guide\"\n};\nvar layoutProps = {\n  _frontmatter: _frontmatter\n};\nvar MDXLayout = \"wrapper\";\nreturn function MDXContent(_ref) {\n  var components = _ref.components,\n      props = _objectWithoutProperties(_ref, _excluded);\n\n  return mdx(MDXLayout, _extends({}, layoutProps, props, {\n    components: components,\n    mdxType: \"MDXLayout\"\n  }), mdx(\"p\", null, \"We recommend you use the following template to structure articles that you want to submit as to \\u201Chow-to\\u201D topics.\\nYou can download a copy of the Markdown template directly from \", mdx(\"a\", {\n    parentName: \"p\",\n    \"href\": \"https://github.com/substrate-developer-hub/substrate-docs/blob/main/static/assets/contribute-templates/how-to-template.md\"\n  }, \"here\"), \".\\nAfter downloading the template, rename the file and replace the description of each section with the relevant content. \"), mdx(\"h2\", {\n    \"id\": \"guide-title\",\n    \"style\": {\n      \"position\": \"relative\"\n    }\n  }, mdx(\"a\", {\n    parentName: \"h2\",\n    \"href\": \"#guide-title\",\n    \"aria-label\": \"guide title permalink\",\n    \"className\": \"anchor before\"\n  }, mdx(\"svg\", {\n    parentName: \"a\",\n    \"className\": \"fill-current text-substrateDark dark:text-white\",\n    \"aria-hidden\": \"true\",\n    \"focusable\": \"false\",\n    \"height\": \"16\",\n    \"version\": \"1.1\",\n    \"viewBox\": \"0 0 16 16\",\n    \"width\": \"16\"\n  }, mdx(\"path\", {\n    parentName: \"svg\",\n    \"fillRule\": \"evenodd\",\n    \"d\": \"M4 9h1v1H4c-1.5 0-3-1.69-3-3.5S2.55 3 4 3h4c1.45 0 3 1.69 3 3.5 0 1.41-.91 2.72-2 3.25V8.59c.58-.45 1-1.27 1-2.09C10 5.22 8.98 4 8 4H4c-.98 0-2 1.22-2 2.5S3 9 4 9zm9-3h-1v1h1c1 0 2 1.22 2 2.5S13.98 12 13 12H9c-.98 0-2-1.22-2-2.5 0-.83.42-1.64 1-2.09V6.25c-1.09.53-2 1.84-2 3.25C6 11.31 7.55 13 9 13h4c1.45 0 3-1.69 3-3.5S14.5 6 13 6z\"\n  }))), \"[Guide title]\"), mdx(\"p\", null, \"The guide title should summarize the goal of the article. For \\u201Chow-to\\u201D guides, the title should complete the \\u201CHow do I \\u2026?\\u201D sentence.\"), mdx(\"h3\", {\n    \"id\": \"overview\",\n    \"style\": {\n      \"position\": \"relative\"\n    }\n  }, mdx(\"a\", {\n    parentName: \"h3\",\n    \"href\": \"#overview\",\n    \"aria-label\": \"overview permalink\",\n    \"className\": \"anchor before\"\n  }, mdx(\"svg\", {\n    parentName: \"a\",\n    \"className\": \"fill-current text-substrateDark dark:text-white\",\n    \"aria-hidden\": \"true\",\n    \"focusable\": \"false\",\n    \"height\": \"16\",\n    \"version\": \"1.1\",\n    \"viewBox\": \"0 0 16 16\",\n    \"width\": \"16\"\n  }, mdx(\"path\", {\n    parentName: \"svg\",\n    \"fillRule\": \"evenodd\",\n    \"d\": \"M4 9h1v1H4c-1.5 0-3-1.69-3-3.5S2.55 3 4 3h4c1.45 0 3 1.69 3 3.5 0 1.41-.91 2.72-2 3.25V8.59c.58-.45 1-1.27 1-2.09C10 5.22 8.98 4 8 4H4c-.98 0-2 1.22-2 2.5S3 9 4 9zm9-3h-1v1h1c1 0 2 1.22 2 2.5S13.98 12 13 12H9c-.98 0-2-1.22-2-2.5 0-.83.42-1.64 1-2.09V6.25c-1.09.53-2 1.84-2 3.25C6 11.31 7.55 13 9 13h4c1.45 0 3-1.69 3-3.5S14.5 6 13 6z\"\n  }))), \"Overview\"), mdx(\"p\", null, \"The first paragraph of the article should provide a brief overview of what the article is about and why this information is useful to its audience.\\nThe overview section does not require an \", mdx(\"strong\", {\n    parentName: \"p\"\n  }, \"Overview\"), \" heading and it might be more than one paragraph.\"), mdx(\"p\", null, \"The opening section of each article sets the stage for what follows and should answer the obvious questions so readers can decide whether the content is relevant to them.\\nReaders should know\\u2014just from reading this section\\u2014whether they should continue or the content doesn\\u2019t apply to them and they should move on to something else.\"), mdx(\"p\", null, \"For your overview, try to answer the following questions:\"), mdx(\"ul\", null, mdx(\"li\", {\n    parentName: \"ul\"\n  }, mdx(\"p\", {\n    parentName: \"li\"\n  }, \"What is this article about?\")), mdx(\"li\", {\n    parentName: \"ul\"\n  }, mdx(\"p\", {\n    parentName: \"li\"\n  }, \"What is the purpose or goal to be accomplished by following the procedure or technique?\")), mdx(\"li\", {\n    parentName: \"ul\"\n  }, mdx(\"p\", {\n    parentName: \"li\"\n  }, \"Why would someone want to use this procedure or technique? For example, are there specific use case scenarios that are applicable?\")), mdx(\"li\", {\n    parentName: \"ul\"\n  }, mdx(\"p\", {\n    parentName: \"li\"\n  }, \"When would someone use this procedure? For example, is this an activity that is done once or repeated? Is it a pattern or a unique case?\")), mdx(\"li\", {\n    parentName: \"ul\"\n  }, mdx(\"p\", {\n    parentName: \"li\"\n  }, \"Where is the procedure or technique applicable?\")), mdx(\"li\", {\n    parentName: \"ul\"\n  }, mdx(\"p\", {\n    parentName: \"li\"\n  }, \"Who would use this procedure or technique? For example, are special skills required? Do specific permissions or restrictions apply?\"))), mdx(\"p\", null, \"The overview section is also a good place to link to other resources, including other guides.\\nAs the content creator, you want readers to have confidence that the guide will be useful for them.\"), mdx(\"h3\", {\n    \"id\": \"use-cases\",\n    \"style\": {\n      \"position\": \"relative\"\n    }\n  }, mdx(\"a\", {\n    parentName: \"h3\",\n    \"href\": \"#use-cases\",\n    \"aria-label\": \"use cases permalink\",\n    \"className\": \"anchor before\"\n  }, mdx(\"svg\", {\n    parentName: \"a\",\n    \"className\": \"fill-current text-substrateDark dark:text-white\",\n    \"aria-hidden\": \"true\",\n    \"focusable\": \"false\",\n    \"height\": \"16\",\n    \"version\": \"1.1\",\n    \"viewBox\": \"0 0 16 16\",\n    \"width\": \"16\"\n  }, mdx(\"path\", {\n    parentName: \"svg\",\n    \"fillRule\": \"evenodd\",\n    \"d\": \"M4 9h1v1H4c-1.5 0-3-1.69-3-3.5S2.55 3 4 3h4c1.45 0 3 1.69 3 3.5 0 1.41-.91 2.72-2 3.25V8.59c.58-.45 1-1.27 1-2.09C10 5.22 8.98 4 8 4H4c-.98 0-2 1.22-2 2.5S3 9 4 9zm9-3h-1v1h1c1 0 2 1.22 2 2.5S13.98 12 13 12H9c-.98 0-2-1.22-2-2.5 0-.83.42-1.64 1-2.09V6.25c-1.09.53-2 1.84-2 3.25C6 11.31 7.55 13 9 13h4c1.45 0 3-1.69 3-3.5S14.5 6 13 6z\"\n  }))), \"Use cases\"), mdx(\"p\", null, \"This section is optional because the guide title might be sufficient if your article is tightly focused on a single use case.\"), mdx(\"p\", null, \"If your article has more than one practical application, use this section to briefly describe each of them.\"), mdx(\"p\", null, \"If the only use case is a repetition of the article title or sufficiently covered in the overview section, skip this section.\"), mdx(\"p\", null, \"If your article only has one use case but it requires more explanation than the title provides, add this section and one or more sentences to provide the additional explanation. For example:\"), mdx(\"ul\", null, mdx(\"li\", {\n    parentName: \"ul\"\n  }, mdx(\"p\", {\n    parentName: \"li\"\n  }, \"This guide illustrates implementing a second currency for paying fees. If you want to support multiple currencies in your runtime, this guide provides practical advice and detailed steps that you can apply for the additional currencies you want to support.\")), mdx(\"li\", {\n    parentName: \"ul\"\n  }, mdx(\"p\", {\n    parentName: \"li\"\n  }, \"This guide shows you how to perform a runtime migration from a \", mdx(\"inlineCode\", {\n    parentName: \"p\"\n  }, \"Vec<u32>\"), \" to SomeStruct\"))), mdx(\"p\", null, \"If your article has more than one use case, use a bulleted list.\"), mdx(\"h3\", {\n    \"id\": \"before-you-begin\",\n    \"style\": {\n      \"position\": \"relative\"\n    }\n  }, mdx(\"a\", {\n    parentName: \"h3\",\n    \"href\": \"#before-you-begin\",\n    \"aria-label\": \"before you begin permalink\",\n    \"className\": \"anchor before\"\n  }, mdx(\"svg\", {\n    parentName: \"a\",\n    \"className\": \"fill-current text-substrateDark dark:text-white\",\n    \"aria-hidden\": \"true\",\n    \"focusable\": \"false\",\n    \"height\": \"16\",\n    \"version\": \"1.1\",\n    \"viewBox\": \"0 0 16 16\",\n    \"width\": \"16\"\n  }, mdx(\"path\", {\n    parentName: \"svg\",\n    \"fillRule\": \"evenodd\",\n    \"d\": \"M4 9h1v1H4c-1.5 0-3-1.69-3-3.5S2.55 3 4 3h4c1.45 0 3 1.69 3 3.5 0 1.41-.91 2.72-2 3.25V8.59c.58-.45 1-1.27 1-2.09C10 5.22 8.98 4 8 4H4c-.98 0-2 1.22-2 2.5S3 9 4 9zm9-3h-1v1h1c1 0 2 1.22 2 2.5S13.98 12 13 12H9c-.98 0-2-1.22-2-2.5 0-.83.42-1.64 1-2.09V6.25c-1.09.53-2 1.84-2 3.25C6 11.31 7.55 13 9 13h4c1.45 0 3-1.69 3-3.5S14.5 6 13 6z\"\n  }))), \"Before you begin\"), mdx(\"p\", null, \"This section is optional but \", mdx(\"strong\", {\n    parentName: \"p\"\n  }, \"recommended\"), \".\\nUse the Before you begin heading and use the section body to describe any prerequisites that apply to your article.\"), mdx(\"p\", null, \"This section should answer the following questions:\"), mdx(\"ul\", null, mdx(\"li\", {\n    parentName: \"ul\"\n  }, mdx(\"p\", {\n    parentName: \"li\"\n  }, \"What should someone \", mdx(\"strong\", {\n    parentName: \"p\"\n  }, \"have\"), \" before reading this article?\")), mdx(\"li\", {\n    parentName: \"ul\"\n  }, mdx(\"p\", {\n    parentName: \"li\"\n  }, \"What should someone \", mdx(\"strong\", {\n    parentName: \"p\"\n  }, \"know\"), \" before reading this article?\")), mdx(\"li\", {\n    parentName: \"ul\"\n  }, mdx(\"p\", {\n    parentName: \"li\"\n  }, \"What should someone \", mdx(\"strong\", {\n    parentName: \"p\"\n  }, \"do\"), \" before reading this article?\"))), mdx(\"h3\", {\n    \"id\": \"steps\",\n    \"style\": {\n      \"position\": \"relative\"\n    }\n  }, mdx(\"a\", {\n    parentName: \"h3\",\n    \"href\": \"#steps\",\n    \"aria-label\": \"steps permalink\",\n    \"className\": \"anchor before\"\n  }, mdx(\"svg\", {\n    parentName: \"a\",\n    \"className\": \"fill-current text-substrateDark dark:text-white\",\n    \"aria-hidden\": \"true\",\n    \"focusable\": \"false\",\n    \"height\": \"16\",\n    \"version\": \"1.1\",\n    \"viewBox\": \"0 0 16 16\",\n    \"width\": \"16\"\n  }, mdx(\"path\", {\n    parentName: \"svg\",\n    \"fillRule\": \"evenodd\",\n    \"d\": \"M4 9h1v1H4c-1.5 0-3-1.69-3-3.5S2.55 3 4 3h4c1.45 0 3 1.69 3 3.5 0 1.41-.91 2.72-2 3.25V8.59c.58-.45 1-1.27 1-2.09C10 5.22 8.98 4 8 4H4c-.98 0-2 1.22-2 2.5S3 9 4 9zm9-3h-1v1h1c1 0 2 1.22 2 2.5S13.98 12 13 12H9c-.98 0-2-1.22-2-2.5 0-.83.42-1.64 1-2.09V6.25c-1.09.53-2 1.84-2 3.25C6 11.31 7.55 13 9 13h4c1.45 0 3-1.69 3-3.5S14.5 6 13 6z\"\n  }))), \"Steps\"), mdx(\"p\", null, \"Use Steps as a heading only if the article has one set of steps that achieve a single goal.\\nFor example, use Steps if an article is tightly focused on a single use case and a more descriptive heading would simply repeat the article title.\"), mdx(\"p\", null, \"For more complex procedures and techniques, use clear, concise headings to describe each part of the procedure or technique.\"), mdx(\"p\", null, \"Each step should be action driven.\\nIn most cases, each step starts with a verb and ends with a period.\\nThe paragraph following a step should describe the result or outcome the reader should expect.\\nIf you feel a step needs any additional information, link to that information rather than embedding too much extraneous detail within the step. \"), mdx(\"p\", null, \"Code snippets can help illustrate the steps but should not overwhelm the focus on \\\"how do I do this\\\" (not on \\\"what do I do\\\").\"), mdx(\"p\", null, \"Keep in mind that most steps have results and readers like confirmation that they have taken the correct action as they progress through a procedure.\"), mdx(\"h3\", {\n    \"id\": \"examples\",\n    \"style\": {\n      \"position\": \"relative\"\n    }\n  }, mdx(\"a\", {\n    parentName: \"h3\",\n    \"href\": \"#examples\",\n    \"aria-label\": \"examples permalink\",\n    \"className\": \"anchor before\"\n  }, mdx(\"svg\", {\n    parentName: \"a\",\n    \"className\": \"fill-current text-substrateDark dark:text-white\",\n    \"aria-hidden\": \"true\",\n    \"focusable\": \"false\",\n    \"height\": \"16\",\n    \"version\": \"1.1\",\n    \"viewBox\": \"0 0 16 16\",\n    \"width\": \"16\"\n  }, mdx(\"path\", {\n    parentName: \"svg\",\n    \"fillRule\": \"evenodd\",\n    \"d\": \"M4 9h1v1H4c-1.5 0-3-1.69-3-3.5S2.55 3 4 3h4c1.45 0 3 1.69 3 3.5 0 1.41-.91 2.72-2 3.25V8.59c.58-.45 1-1.27 1-2.09C10 5.22 8.98 4 8 4H4c-.98 0-2 1.22-2 2.5S3 9 4 9zm9-3h-1v1h1c1 0 2 1.22 2 2.5S13.98 12 13 12H9c-.98 0-2-1.22-2-2.5 0-.83.42-1.64 1-2.09V6.25c-1.09.53-2 1.84-2 3.25C6 11.31 7.55 13 9 13h4c1.45 0 3-1.69 3-3.5S14.5 6 13 6z\"\n  }))), \"Examples\"), mdx(\"p\", null, \"Provide links to one or more code-based examples that make practical use of your article.\\nThis section should include at least one reference to a repository that exposes what this guide covers in the form of a working example.\\nYou can use reference an existing codebase within Substrate or new code in any publicly-available repository.\"), mdx(\"h3\", {\n    \"id\": \"related-resources\",\n    \"style\": {\n      \"position\": \"relative\"\n    }\n  }, mdx(\"a\", {\n    parentName: \"h3\",\n    \"href\": \"#related-resources\",\n    \"aria-label\": \"related resources permalink\",\n    \"className\": \"anchor before\"\n  }, mdx(\"svg\", {\n    parentName: \"a\",\n    \"className\": \"fill-current text-substrateDark dark:text-white\",\n    \"aria-hidden\": \"true\",\n    \"focusable\": \"false\",\n    \"height\": \"16\",\n    \"version\": \"1.1\",\n    \"viewBox\": \"0 0 16 16\",\n    \"width\": \"16\"\n  }, mdx(\"path\", {\n    parentName: \"svg\",\n    \"fillRule\": \"evenodd\",\n    \"d\": \"M4 9h1v1H4c-1.5 0-3-1.69-3-3.5S2.55 3 4 3h4c1.45 0 3 1.69 3 3.5 0 1.41-.91 2.72-2 3.25V8.59c.58-.45 1-1.27 1-2.09C10 5.22 8.98 4 8 4H4c-.98 0-2 1.22-2 2.5S3 9 4 9zm9-3h-1v1h1c1 0 2 1.22 2 2.5S13.98 12 13 12H9c-.98 0-2-1.22-2-2.5 0-.83.42-1.64 1-2.09V6.25c-1.09.53-2 1.84-2 3.25C6 11.31 7.55 13 9 13h4c1.45 0 3-1.69 3-3.5S14.5 6 13 6z\"\n  }))), \"Related resources\"), mdx(\"p\", null, \"This section is optional.\\nIf you include it, add a bulleted list of links to similar guides, other Developer Hub ressources, or related material. For example, you might add links to other how-to guides, tutorials, or Rust docs.\"));\n}\n;\nMDXContent.isMDXComponent = true;","tableOfContents":{"items":[{"url":"#guide-title","title":"Guide title","items":[{"url":"#overview","title":"Overview"},{"url":"#use-cases","title":"Use cases"},{"url":"#before-you-begin","title":"Before you begin"},{"url":"#steps","title":"Steps"},{"url":"#examples","title":"Examples"},{"url":"#related-resources","title":"Related resources"}]}]},"fileAbsolutePath":"/root/deeperchain-docs/v3/docs/00-style-and-contributor-guidelines/d-templates/index.mdx"}},"pageContext":{"slug":"/v3/contribute/templates","version":"3.0","locale":"en","hrefLang":"en-US","originalPath":"/v3/contribute/templates/","dateFormat":"MM/DD/YYYY"}},
    "staticQueryHashes": ["1239077767","1821483254","2966362950","3280999885"]}