{
    "componentChunkName": "component---src-templates-kb-template-tsx",
    "path": "/v3/runtime/smart-contracts/",
    "result": {"data":{"mdx":{"frontmatter":{"slug":"/v3/runtime/smart-contracts","title":"Smart Contract Toolkits","hideNav":null,"section":"docs","category":"smart contracts"},"body":"var _excluded = [\"components\"];\n\nfunction _extends() { _extends = Object.assign || function (target) { for (var i = 1; i < arguments.length; i++) { var source = arguments[i]; for (var key in source) { if (Object.prototype.hasOwnProperty.call(source, key)) { target[key] = source[key]; } } } return target; }; return _extends.apply(this, arguments); }\n\nfunction _objectWithoutProperties(source, excluded) { if (source == null) return {}; var target = _objectWithoutPropertiesLoose(source, excluded); var key, i; if (Object.getOwnPropertySymbols) { var sourceSymbolKeys = Object.getOwnPropertySymbols(source); for (i = 0; i < sourceSymbolKeys.length; i++) { key = sourceSymbolKeys[i]; if (excluded.indexOf(key) >= 0) continue; if (!Object.prototype.propertyIsEnumerable.call(source, key)) continue; target[key] = source[key]; } } return target; }\n\nfunction _objectWithoutPropertiesLoose(source, excluded) { if (source == null) return {}; var target = {}; var sourceKeys = Object.keys(source); var key, i; for (i = 0; i < sourceKeys.length; i++) { key = sourceKeys[i]; if (excluded.indexOf(key) >= 0) continue; target[key] = source[key]; } return target; }\n\n/* @jsxRuntime classic */\n\n/* @jsx mdx */\nvar _frontmatter = {\n  \"title\": \"Smart Contract Toolkits\",\n  \"slug\": \"/v3/runtime/smart-contracts\",\n  \"version\": 3,\n  \"section\": \"docs\",\n  \"category\": \"smart contracts\",\n  \"keywords\": \"contracts, evm, ethereum\"\n};\n\nvar makeShortcode = function makeShortcode(name) {\n  return function MDXDefaultShortcode(props) {\n    console.warn(\"Component \" + name + \" was not imported, exported, or provided by MDXProvider as global scope\");\n    return mdx(\"div\", props);\n  };\n};\n\nvar Message = makeShortcode(\"Message\");\nvar AccentButton = makeShortcode(\"AccentButton\");\nvar layoutProps = {\n  _frontmatter: _frontmatter\n};\nvar MDXLayout = \"wrapper\";\nreturn function MDXContent(_ref) {\n  var components = _ref.components,\n      props = _objectWithoutProperties(_ref, _excluded);\n\n  return mdx(MDXLayout, _extends({}, layoutProps, props, {\n    components: components,\n    mdxType: \"MDXLayout\"\n  }), mdx(\"p\", null, \"This article gives an overview of the different ways to implement\\nsmart contracts for Substrate-based blockchains. It also aims to provide insight on\\nreasons for choosing smart contract development over runtime development for your on-chain logic.\"), mdx(\"h2\", {\n    \"id\": \"smart-contracts-vs-runtime-development\",\n    \"style\": {\n      \"position\": \"relative\"\n    }\n  }, mdx(\"a\", {\n    parentName: \"h2\",\n    \"href\": \"#smart-contracts-vs-runtime-development\",\n    \"aria-label\": \"smart contracts vs runtime development permalink\",\n    \"className\": \"anchor before\"\n  }, mdx(\"svg\", {\n    parentName: \"a\",\n    \"className\": \"fill-current text-substrateDark dark:text-white\",\n    \"aria-hidden\": \"true\",\n    \"focusable\": \"false\",\n    \"height\": \"16\",\n    \"version\": \"1.1\",\n    \"viewBox\": \"0 0 16 16\",\n    \"width\": \"16\"\n  }, mdx(\"path\", {\n    parentName: \"svg\",\n    \"fillRule\": \"evenodd\",\n    \"d\": \"M4 9h1v1H4c-1.5 0-3-1.69-3-3.5S2.55 3 4 3h4c1.45 0 3 1.69 3 3.5 0 1.41-.91 2.72-2 3.25V8.59c.58-.45 1-1.27 1-2.09C10 5.22 8.98 4 8 4H4c-.98 0-2 1.22-2 2.5S3 9 4 9zm9-3h-1v1h1c1 0 2 1.22 2 2.5S13.98 12 13 12H9c-.98 0-2-1.22-2-2.5 0-.83.42-1.64 1-2.09V6.25c-1.09.53-2 1.84-2 3.25C6 11.31 7.55 13 9 13h4c1.45 0 3-1.69 3-3.5S14.5 6 13 6z\"\n  }))), \"Smart Contracts vs. Runtime Development\"), mdx(\"p\", null, \"Developing Substrate runtimes and smart contracts are two different approaches to building\\n\\\"decentralized applications\\\" using Substrate.\"), mdx(\"h3\", {\n    \"id\": \"smart-contracts\",\n    \"style\": {\n      \"position\": \"relative\"\n    }\n  }, mdx(\"a\", {\n    parentName: \"h3\",\n    \"href\": \"#smart-contracts\",\n    \"aria-label\": \"smart contracts permalink\",\n    \"className\": \"anchor before\"\n  }, mdx(\"svg\", {\n    parentName: \"a\",\n    \"className\": \"fill-current text-substrateDark dark:text-white\",\n    \"aria-hidden\": \"true\",\n    \"focusable\": \"false\",\n    \"height\": \"16\",\n    \"version\": \"1.1\",\n    \"viewBox\": \"0 0 16 16\",\n    \"width\": \"16\"\n  }, mdx(\"path\", {\n    parentName: \"svg\",\n    \"fillRule\": \"evenodd\",\n    \"d\": \"M4 9h1v1H4c-1.5 0-3-1.69-3-3.5S2.55 3 4 3h4c1.45 0 3 1.69 3 3.5 0 1.41-.91 2.72-2 3.25V8.59c.58-.45 1-1.27 1-2.09C10 5.22 8.98 4 8 4H4c-.98 0-2 1.22-2 2.5S3 9 4 9zm9-3h-1v1h1c1 0 2 1.22 2 2.5S13.98 12 13 12H9c-.98 0-2-1.22-2-2.5 0-.83.42-1.64 1-2.09V6.25c-1.09.53-2 1.84-2 3.25C6 11.31 7.55 13 9 13h4c1.45 0 3-1.69 3-3.5S14.5 6 13 6z\"\n  }))), \"Smart contracts\"), mdx(\"p\", null, \"A traditional smart contract platform allows users to publish additional logic on top of some core\\nblockchain logic. Since smart contract logic can be published by anyone, including malicious actors\\nand inexperienced developers, there are a number of intentional safe guards built around these\\npublic smart contract platform.\"), mdx(\"p\", null, \"Some examples are:\"), mdx(\"ul\", null, mdx(\"li\", {\n    parentName: \"ul\"\n  }, mdx(\"p\", {\n    parentName: \"li\"\n  }, mdx(\"strong\", {\n    parentName: \"p\"\n  }, \"Fees\"), \": Ensuring that contract execution incurs fees for the computation and storage it forces\\non the computers where it is runnning on, and not allowed to abuse the block creators.\")), mdx(\"li\", {\n    parentName: \"ul\"\n  }, mdx(\"p\", {\n    parentName: \"li\"\n  }, mdx(\"strong\", {\n    parentName: \"p\"\n  }, \"Sandbox\"), \": A contract is not able to modify core blockchain storage or the storage of other\\ncontracts directly. It's power is limited to only modifying it's own state, and the ability to\\nmake outside calls to other contracts or runtime functions.\")), mdx(\"li\", {\n    parentName: \"ul\"\n  }, mdx(\"p\", {\n    parentName: \"li\"\n  }, mdx(\"strong\", {\n    parentName: \"p\"\n  }, \"Storage Deposit\"), \": A contract takes up space on the blockchain, and thus should be charged for\\ntaking up space on the nodes' hard drives. This ensures that people don't take advantage of\\n\\\"free, unlimited storage\\\".\")), mdx(\"li\", {\n    parentName: \"ul\"\n  }, mdx(\"p\", {\n    parentName: \"li\"\n  }, mdx(\"strong\", {\n    parentName: \"p\"\n  }, \"Reversion\"), \": A contract can be prone to have situations which lead to logical errors. The\\nexpectations of a contract developer are low, so extra overhead is added to support reverting\\ntransactions when they fail so no state is updated when things go wrong.\"))), mdx(\"p\", null, \"These different overheads makes running contracts slower and more costly, but again, the \\\"target\\naudience\\\" for contract development is different than runtime developers.\"), mdx(\"p\", null, \"Contracts allow your community to extend and develop on top of your runtime logic without\\nneeding to go through all the craziness of proposals, runtime upgrades, etc... It may even be used\\nas a testing grounds for future runtime changes, but done in a way that isolates your network from\\nany of the growing pains or errors which may occur.\"), mdx(\"p\", null, mdx(\"strong\", {\n    parentName: \"p\"\n  }, \"In summary, Substrate Smart Contracts:\")), mdx(\"ul\", null, mdx(\"li\", {\n    parentName: \"ul\"\n  }, \"Are inherently safer to the network.\"), mdx(\"li\", {\n    parentName: \"ul\"\n  }, \"Have built in economic incentives against abuse.\"), mdx(\"li\", {\n    parentName: \"ul\"\n  }, \"Have computational overhead to support graceful failures in logic.\"), mdx(\"li\", {\n    parentName: \"ul\"\n  }, \"Have a lower bar to entry for development.\"), mdx(\"li\", {\n    parentName: \"ul\"\n  }, \"Enable fast pace community interaction through a playground to write new logic.\")), mdx(\"h3\", {\n    \"id\": \"runtime-development\",\n    \"style\": {\n      \"position\": \"relative\"\n    }\n  }, mdx(\"a\", {\n    parentName: \"h3\",\n    \"href\": \"#runtime-development\",\n    \"aria-label\": \"runtime development permalink\",\n    \"className\": \"anchor before\"\n  }, mdx(\"svg\", {\n    parentName: \"a\",\n    \"className\": \"fill-current text-substrateDark dark:text-white\",\n    \"aria-hidden\": \"true\",\n    \"focusable\": \"false\",\n    \"height\": \"16\",\n    \"version\": \"1.1\",\n    \"viewBox\": \"0 0 16 16\",\n    \"width\": \"16\"\n  }, mdx(\"path\", {\n    parentName: \"svg\",\n    \"fillRule\": \"evenodd\",\n    \"d\": \"M4 9h1v1H4c-1.5 0-3-1.69-3-3.5S2.55 3 4 3h4c1.45 0 3 1.69 3 3.5 0 1.41-.91 2.72-2 3.25V8.59c.58-.45 1-1.27 1-2.09C10 5.22 8.98 4 8 4H4c-.98 0-2 1.22-2 2.5S3 9 4 9zm9-3h-1v1h1c1 0 2 1.22 2 2.5S13.98 12 13 12H9c-.98 0-2-1.22-2-2.5 0-.83.42-1.64 1-2.09V6.25c-1.09.53-2 1.84-2 3.25C6 11.31 7.55 13 9 13h4c1.45 0 3-1.69 3-3.5S14.5 6 13 6z\"\n  }))), \"Runtime development\"), mdx(\"p\", null, \"On the other hand, runtime development affords none of these protections or safe guards that Smart\\nContracts give you. As a runtime developer, the barrier to entry on the code you produce jumps way up.\"), mdx(\"p\", null, \"You have full control of the underlying logic that each node on your network will run. You have full\\naccess to each and every storage item across all of your pallets, which you can modify and control.\\nYou can even brick your chain with incorrect logic or poor error handling. In essence, runtime engineers\\nhave a lot more responsibility for the correctness and robustness of the code they write.\"), mdx(\"p\", null, \"Substrate runtime development has the intention of producing lean, performant, and fast nodes.\\nIt provides none of the protections or overhead of transaction reverting, and does not\\nimplicitly introduce any fee system to the computation which nodes on your chain run. This means\\nwhile you are developing runtime functions, it is up to \", mdx(\"em\", {\n    parentName: \"p\"\n  }, \"you\"), \" to correctly assess and apply fees to\\ndifferent parts of your runtime logic such that it will not be abused by malicious actors.\"), mdx(\"p\", null, mdx(\"strong\", {\n    parentName: \"p\"\n  }, \"In summary, Substrate Runtime Development:\")), mdx(\"ul\", null, mdx(\"li\", {\n    parentName: \"ul\"\n  }, \"Provides low level access to your entire blockchain.\"), mdx(\"li\", {\n    parentName: \"ul\"\n  }, \"Removes the overhead of built-in safety for performance,\\ngiving developers increased flexibility at the cost of increased responsibility.\"), mdx(\"li\", {\n    parentName: \"ul\"\n  }, \"Raises the entry bar for developers, where developers are\\nnot only responsible for writing working code but must constantly check to avoid writing broken code.\"), mdx(\"li\", {\n    parentName: \"ul\"\n  }, \"Has no inherent economic incentives to repel bad actors.\")), mdx(\"h3\", {\n    \"id\": \"choosing-the-right-approach\",\n    \"style\": {\n      \"position\": \"relative\"\n    }\n  }, mdx(\"a\", {\n    parentName: \"h3\",\n    \"href\": \"#choosing-the-right-approach\",\n    \"aria-label\": \"choosing the right approach permalink\",\n    \"className\": \"anchor before\"\n  }, mdx(\"svg\", {\n    parentName: \"a\",\n    \"className\": \"fill-current text-substrateDark dark:text-white\",\n    \"aria-hidden\": \"true\",\n    \"focusable\": \"false\",\n    \"height\": \"16\",\n    \"version\": \"1.1\",\n    \"viewBox\": \"0 0 16 16\",\n    \"width\": \"16\"\n  }, mdx(\"path\", {\n    parentName: \"svg\",\n    \"fillRule\": \"evenodd\",\n    \"d\": \"M4 9h1v1H4c-1.5 0-3-1.69-3-3.5S2.55 3 4 3h4c1.45 0 3 1.69 3 3.5 0 1.41-.91 2.72-2 3.25V8.59c.58-.45 1-1.27 1-2.09C10 5.22 8.98 4 8 4H4c-.98 0-2 1.22-2 2.5S3 9 4 9zm9-3h-1v1h1c1 0 2 1.22 2 2.5S13.98 12 13 12H9c-.98 0-2-1.22-2-2.5 0-.83.42-1.64 1-2.09V6.25c-1.09.53-2 1.84-2 3.25C6 11.31 7.55 13 9 13h4c1.45 0 3-1.69 3-3.5S14.5 6 13 6z\"\n  }))), \"Choosing the right approach\"), mdx(\"p\", null, \"Substrate runtime development and Smart Contracts each provide tools designed for different problem spaces. There is likely some amount of overlap in the kinds of problems each one can solve, but\\nthere is also a clear set of problems suited for only one of the two. To give just one example in\\neach category:\"), mdx(\"ul\", null, mdx(\"li\", {\n    parentName: \"ul\"\n  }, mdx(\"strong\", {\n    parentName: \"li\"\n  }, \"Runtime Development:\"), \" Building a privacy layer on top of transactions in your blockchain.\"), mdx(\"li\", {\n    parentName: \"ul\"\n  }, mdx(\"strong\", {\n    parentName: \"li\"\n  }, \"Smart Contract:\"), \" Introducing multi-signature wallets over the currency of your blockchain.\"), mdx(\"li\", {\n    parentName: \"ul\"\n  }, mdx(\"strong\", {\n    parentName: \"li\"\n  }, \"Use Case Specific:\"), \" Building a gaming dApp which may need to build up a community of users (leaning towards a\\nSmart Contract), or may need to scale to millions of transactions a day (leaning more towards Runtime\\nDevelopment).\")), mdx(\"p\", null, \"In addition to everything written above, you also need to take into account the associated costs of setting up your\\ndApp using one approach over the other. Deploying a contract is a relatively simple and easy process since you\\ntake advantage of the existing network. The only costs to you are the fees which you pay to deploy\\nand maintain your contract.\"), mdx(\"p\", null, \"Setting up your own blockchain, on the other hand has the cost of building a community who find value\\nin the service you provide. Or, the additional costs\\nassociated with establishing a private network with the overhead of a cloud computing based architecture and\\ngeneral network maintenance.\"), mdx(\"p\", null, \"It is hard to provide guidance on every possible scenario\\nas each one depends on specific use cases and design decisions.\\nIn general, runtime development is most favorable for applications that\\nrequire higher degrees of flexibility and adaptability \", \"\\u2014\", \" for example,\\napplications that require accomodating different types of users or layers of\\ngovernance. The table below is meant to help inform your\\ndecisions on which approach to use based on different situations.\"), mdx(\"table\", null, mdx(\"thead\", null, mdx(\"tr\", null, mdx(\"th\", null, \"Runtime Development \"), mdx(\"th\", null, \"Smart Contract\"), mdx(\"th\", null, \"Use Case Specific\"))), mdx(\"tbody\", null, mdx(\"tr\", null, mdx(\"td\", null, mdx(\"ul\", null, mdx(\"li\", null, \" Privacy Layer \"), mdx(\"li\", null, \" Feeless Token \"), mdx(\"li\", null, \" Light-Client Bridge \"), mdx(\"li\", null, \" Decentralized Exchange \"), mdx(\"li\", null, \" Oracles \"), mdx(\"li\", null, \" Stable Coin \"))), mdx(\"td\", null, mdx(\"ul\", null, mdx(\"li\", null, \"Multi-signature Wallet \"), mdx(\"li\", null, \"Data services \"), mdx(\"li\", null, \"Simple fundraiser \"))), mdx(\"td\", null, \"Gaming dApp\", mdx(\"ul\", null, mdx(\"li\", null, \"Small scale (contract)\"), mdx(\"li\", null, \" Large scale (runtime)\")), \"Decentralized Autonomous Organizations (DAO)\", mdx(\"ul\", null, mdx(\"li\", null, \"Community driven (contract)\"), mdx(\"li\", null, \"Protocol driven (runtime)\")), \"Treasury\", mdx(\"ul\", null, mdx(\"li\", null, \"Community driven (contract)\"), mdx(\"li\", null, \"Protocol driven (runtime)\")))))), mdx(Message, {\n    type: \"green\",\n    title: \"Further learning\",\n    text: \"If you are building on Polkadot, you can also\\n  [deploy smart contracts on its parachain](https://wiki.polkadot.network/docs/en/build-smart-contracts). Check [here](https://wiki.polkadot.network/docs/build-build-with-polkadot#what-is-the-difference-between-building-a-parachain-a-parathread-or-a-smart-contract) for\\n  a comparison between developing on a parachain, parathread, and smart contract.\",\n    mdxType: \"Message\"\n  }), mdx(\"p\", null, \"Substrate provides two smart contract virtual machines which can be added to your runtime: the \", mdx(\"a\", {\n    parentName: \"p\",\n    \"href\": \"#contracts-pallet\"\n  }, \"Contracts pallet\"), \" and\\nthe \", mdx(\"a\", {\n    parentName: \"p\",\n    \"href\": \"#evm-pallet\"\n  }, \"EVM pallet\"), \". Each come with additional tools to ease development depending on your use cases.\"), mdx(\"h2\", {\n    \"id\": \"contracts-pallet\",\n    \"style\": {\n      \"position\": \"relative\"\n    }\n  }, mdx(\"a\", {\n    parentName: \"h2\",\n    \"href\": \"#contracts-pallet\",\n    \"aria-label\": \"contracts pallet permalink\",\n    \"className\": \"anchor before\"\n  }, mdx(\"svg\", {\n    parentName: \"a\",\n    \"className\": \"fill-current text-substrateDark dark:text-white\",\n    \"aria-hidden\": \"true\",\n    \"focusable\": \"false\",\n    \"height\": \"16\",\n    \"version\": \"1.1\",\n    \"viewBox\": \"0 0 16 16\",\n    \"width\": \"16\"\n  }, mdx(\"path\", {\n    parentName: \"svg\",\n    \"fillRule\": \"evenodd\",\n    \"d\": \"M4 9h1v1H4c-1.5 0-3-1.69-3-3.5S2.55 3 4 3h4c1.45 0 3 1.69 3 3.5 0 1.41-.91 2.72-2 3.25V8.59c.58-.45 1-1.27 1-2.09C10 5.22 8.98 4 8 4H4c-.98 0-2 1.22-2 2.5S3 9 4 9zm9-3h-1v1h1c1 0 2 1.22 2 2.5S13.98 12 13 12H9c-.98 0-2-1.22-2-2.5 0-.83.42-1.64 1-2.09V6.25c-1.09.53-2 1.84-2 3.25C6 11.31 7.55 13 9 13h4c1.45 0 3-1.69 3-3.5S14.5 6 13 6z\"\n  }))), \"Contracts pallet\"), mdx(\"p\", null, \"The \", mdx(\"a\", {\n    parentName: \"p\",\n    \"href\": \"/rustdocs/latest/pallet_contracts/index.html\"\n  }, \"Contracts pallet\"), \" provides\\nthe ability for the runtime to deploy and execute \", mdx(\"a\", {\n    parentName: \"p\",\n    \"href\": \"https://webassembly.org/\"\n  }, \"WebAssembly (Wasm)\"), \"\\nsmart contracts. It uses \", mdx(\"a\", {\n    parentName: \"p\",\n    \"href\": \"https://paritytech.github.io/ink-docs/\"\n  }, \"ink!\"), \", a \", mdx(\"a\", {\n    parentName: \"p\",\n    \"href\": \"https://www.rust-lang.org/\"\n  }, \"Rust\"), \"-based embedded domain specific language\\n(\", mdx(\"a\", {\n    parentName: \"p\",\n    \"href\": \"https://wiki.haskell.org/Embedded_domain_specific_language\"\n  }, \"eDSL\"), \") for writing\\n\", mdx(\"a\", {\n    parentName: \"p\",\n    \"href\": \"https://webassembly.org/\"\n  }, \"WebAssembly\"), \" smart contracts.\"), mdx(\"p\", null, \"Here are some of ink!'s key features:\"), mdx(\"ul\", null, mdx(\"li\", {\n    parentName: \"ul\"\n  }, \"Designed for correctness, conciseness and efficiency, ink! carries familiar concepts from other modern smart contract\\nlanguages. Learn more about \", mdx(\"a\", {\n    parentName: \"li\",\n    \"href\": \"https://paritytech.github.io/ink-docs/ink-vs-solidity\"\n  }, \"how it compares to Solidity\"), \".\"), mdx(\"li\", {\n    parentName: \"ul\"\n  }, \"ink! provides a built in test environment that can be used to perform off-chain unit testing with\\nthe Rust framework. This makes it simple and easy to ensure that your contract code functions as\\nexpected, without the need for third party testing platforms. Learn more \", mdx(\"a\", {\n    parentName: \"li\",\n    \"href\": \"https://paritytech.github.io/ink-docs/basics/contract-testing/\"\n  }, \"here\"), \".\"), mdx(\"li\", {\n    parentName: \"ul\"\n  }, \"Because ink! follows Rust standards, tools like \", mdx(\"a\", {\n    parentName: \"li\",\n    \"href\": \"https://github.com/rust-lang/rustfmt\"\n  }, mdx(\"inlineCode\", {\n    parentName: \"a\"\n  }, \"rustfmt\")), \"\\nand \", mdx(\"a\", {\n    parentName: \"li\",\n    \"href\": \"https://github.com/rust-analyzer/rust-analyzer\"\n  }, mdx(\"inlineCode\", {\n    parentName: \"a\"\n  }, \"rust-analyzer\")), \" already work out of the box.\")), mdx(AccentButton, {\n    text: \"Start the ink! workshop\",\n    link: \"/tutorials/v3/ink-workshop/pt1\",\n    mdxType: \"AccentButton\"\n  }), mdx(\"h3\", {\n    \"id\": \"features\",\n    \"style\": {\n      \"position\": \"relative\"\n    }\n  }, mdx(\"a\", {\n    parentName: \"h3\",\n    \"href\": \"#features\",\n    \"aria-label\": \"features permalink\",\n    \"className\": \"anchor before\"\n  }, mdx(\"svg\", {\n    parentName: \"a\",\n    \"className\": \"fill-current text-substrateDark dark:text-white\",\n    \"aria-hidden\": \"true\",\n    \"focusable\": \"false\",\n    \"height\": \"16\",\n    \"version\": \"1.1\",\n    \"viewBox\": \"0 0 16 16\",\n    \"width\": \"16\"\n  }, mdx(\"path\", {\n    parentName: \"svg\",\n    \"fillRule\": \"evenodd\",\n    \"d\": \"M4 9h1v1H4c-1.5 0-3-1.69-3-3.5S2.55 3 4 3h4c1.45 0 3 1.69 3 3.5 0 1.41-.91 2.72-2 3.25V8.59c.58-.45 1-1.27 1-2.09C10 5.22 8.98 4 8 4H4c-.98 0-2 1.22-2 2.5S3 9 4 9zm9-3h-1v1h1c1 0 2 1.22 2 2.5S13.98 12 13 12H9c-.98 0-2-1.22-2-2.5 0-.83.42-1.64 1-2.09V6.25c-1.09.53-2 1.84-2 3.25C6 11.31 7.55 13 9 13h4c1.45 0 3-1.69 3-3.5S14.5 6 13 6z\"\n  }))), \"Features\"), mdx(\"p\", null, \"The Contracts pallet has a number of familiar and new features for the deployment and execution of\\nsmart contracts.\"), mdx(\"h4\", null, \"Wasm Engine\"), mdx(\"p\", null, \"The Contracts pallet depends on a Wasm sandboxing interface defining the Wasm execution engine\\navailable within the runtime. This is currently implemented with\\n\", mdx(\"a\", {\n    parentName: \"p\",\n    \"href\": \"https://github.com/paritytech/wasmi\"\n  }, mdx(\"inlineCode\", {\n    parentName: \"a\"\n  }, \"wasmi\")), \", a Wasm interpreter.\"), mdx(\"h4\", null, \"Account based\"), mdx(\"p\", null, \"The Contracts pallet uses an account-based system similar to many existing smart contract platforms.\\nTo the Substrate runtime, contract accounts are just like normal user accounts; however, in addition\\nto an \", mdx(\"inlineCode\", {\n    parentName: \"p\"\n  }, \"AccountID\"), \" and \", mdx(\"inlineCode\", {\n    parentName: \"p\"\n  }, \"Balance\"), \" that normal accounts have, a contract account also has associated\\ncontract code and some persistent contract storage. A notable behaviour that arises from this\\nis that a contract's account can receive balances without having its code executed by a plain transfer transaction.\"), mdx(\"h3\", {\n    \"id\": \"deploying-and-calling-contracts\",\n    \"style\": {\n      \"position\": \"relative\"\n    }\n  }, mdx(\"a\", {\n    parentName: \"h3\",\n    \"href\": \"#deploying-and-calling-contracts\",\n    \"aria-label\": \"deploying and calling contracts permalink\",\n    \"className\": \"anchor before\"\n  }, mdx(\"svg\", {\n    parentName: \"a\",\n    \"className\": \"fill-current text-substrateDark dark:text-white\",\n    \"aria-hidden\": \"true\",\n    \"focusable\": \"false\",\n    \"height\": \"16\",\n    \"version\": \"1.1\",\n    \"viewBox\": \"0 0 16 16\",\n    \"width\": \"16\"\n  }, mdx(\"path\", {\n    parentName: \"svg\",\n    \"fillRule\": \"evenodd\",\n    \"d\": \"M4 9h1v1H4c-1.5 0-3-1.69-3-3.5S2.55 3 4 3h4c1.45 0 3 1.69 3 3.5 0 1.41-.91 2.72-2 3.25V8.59c.58-.45 1-1.27 1-2.09C10 5.22 8.98 4 8 4H4c-.98 0-2 1.22-2 2.5S3 9 4 9zm9-3h-1v1h1c1 0 2 1.22 2 2.5S13.98 12 13 12H9c-.98 0-2-1.22-2-2.5 0-.83.42-1.64 1-2.09V6.25c-1.09.53-2 1.84-2 3.25C6 11.31 7.55 13 9 13h4c1.45 0 3-1.69 3-3.5S14.5 6 13 6z\"\n  }))), \"Deploying and calling contracts\"), mdx(\"p\", null, \"Deploying a contract with the Contracts pallet takes two steps:\"), mdx(\"ol\", null, mdx(\"li\", {\n    parentName: \"ol\"\n  }, \"Store the Wasm contract on the blockchain.\"), mdx(\"li\", {\n    parentName: \"ol\"\n  }, \"Instantiate a new account, with new storage, associated with that Wasm contract.\")), mdx(\"p\", null, \"This means that multiple contract instances, with different constructor arguments, can be\\ninitialized using the same Wasm code, reducing the amount of storage space needed by the Contracts\\npallet on your blockchain.\"), mdx(\"p\", null, \"Calls to contracts can alter the storage of the contract, create new contracts, and call other\\ncontracts. Because Substrate provides you with the ability to write custom runtimes, the\\nContracts pallet also enables you to make synchronous calls directly to those runtime functions on\\nbehalf of the contract's account.\"), mdx(\"p\", null, \"The Contracts pallet is intended to be used by any user on a public network. This means that\\ncontracts only have the ability to directly modify their own storage. To provide safety to the\\nunderlying blockchain state, the Contracts pallet enables revertible transactions, which roll back\\nany changes to the storage by contract calls that do not complete successfully.\"), mdx(\"h3\", {\n    \"id\": \"gas\",\n    \"style\": {\n      \"position\": \"relative\"\n    }\n  }, mdx(\"a\", {\n    parentName: \"h3\",\n    \"href\": \"#gas\",\n    \"aria-label\": \"gas permalink\",\n    \"className\": \"anchor before\"\n  }, mdx(\"svg\", {\n    parentName: \"a\",\n    \"className\": \"fill-current text-substrateDark dark:text-white\",\n    \"aria-hidden\": \"true\",\n    \"focusable\": \"false\",\n    \"height\": \"16\",\n    \"version\": \"1.1\",\n    \"viewBox\": \"0 0 16 16\",\n    \"width\": \"16\"\n  }, mdx(\"path\", {\n    parentName: \"svg\",\n    \"fillRule\": \"evenodd\",\n    \"d\": \"M4 9h1v1H4c-1.5 0-3-1.69-3-3.5S2.55 3 4 3h4c1.45 0 3 1.69 3 3.5 0 1.41-.91 2.72-2 3.25V8.59c.58-.45 1-1.27 1-2.09C10 5.22 8.98 4 8 4H4c-.98 0-2 1.22-2 2.5S3 9 4 9zm9-3h-1v1h1c1 0 2 1.22 2 2.5S13.98 12 13 12H9c-.98 0-2-1.22-2-2.5 0-.83.42-1.64 1-2.09V6.25c-1.09.53-2 1.84-2 3.25C6 11.31 7.55 13 9 13h4c1.45 0 3-1.69 3-3.5S14.5 6 13 6z\"\n  }))), \"Gas\"), mdx(\"p\", null, \"Contract calls are charged a gas fee to limit the amount of computational resources a transaction\\ncan use. When forming a contract transaction, a gas limit is specified. As the contract executes,\\ngas is incrementally used up depending on the complexity of the computation. If the gas limit is\\nreached before the contract execution completes, the transaction fails, contract storage is\\nreverted, and the gas fee is \", mdx(\"strong\", {\n    parentName: \"p\"\n  }, \"not\"), \" returned to the user. If the contract execution completes with\\nremaining gas, it is returned to the user at the end of the transaction.\"), mdx(\"p\", null, \"The concept of gas is tightly integrated with substrates \", mdx(\"a\", {\n    parentName: \"p\",\n    \"href\": \"/v3/concepts/weight\"\n  }, mdx(\"strong\", {\n    parentName: \"a\"\n  }, \"weight system\")), \".\\nIn fact there is no difference between gas and weight. The specified \", mdx(\"inlineCode\", {\n    parentName: \"p\"\n  }, \"gas_limit\"), \" directly influences\\nthe weight of the submitted transaction. The contracts pallet uses\\n\", mdx(\"a\", {\n    parentName: \"p\",\n    \"href\": \"/v3/concepts/weight#post-dispatch-weight-correction\"\n  }, \"post dispatch weight correction\"), \" to change\\nthe pre dispatch weight derived from the \", mdx(\"inlineCode\", {\n    parentName: \"p\"\n  }, \"gas_limit\"), \" to the actual weight consumed.\\nThus, to execute a transaction, a user  must have a free balance of at least \", mdx(\"inlineCode\", {\n    parentName: \"p\"\n  }, \"weight price\"), \" \", \"*\", \" \", mdx(\"inlineCode\", {\n    parentName: \"p\"\n  }, \"gas limit\"), \"\\nwhich can be spent. The charged fee however, is based upon the actually consumed gas. The weight price\\nis determined due do the usual \", mdx(\"a\", {\n    parentName: \"p\",\n    \"href\": \"/v3/runtime/weights-and-fees\"\n  }, \"transaction fee mechanism\"), \".\\nThe Contracts pallet determines the gas price, which is a conversion between the Substrate\\n\", mdx(\"a\", {\n    parentName: \"p\",\n    \"href\": \"/v3/concepts/weight\"\n  }, mdx(\"strong\", {\n    parentName: \"a\"\n  }, \"weight system\")), \" and a single unit of gas. Thus, to execute a transaction, a user\\nmust have a free balance of at least \", mdx(\"inlineCode\", {\n    parentName: \"p\"\n  }, \"gas price\"), \" \", \"*\", \" \", mdx(\"inlineCode\", {\n    parentName: \"p\"\n  }, \"gas limit\"), \" which can be spent.\"), mdx(\"h3\", {\n    \"id\": \"storage-deposit\",\n    \"style\": {\n      \"position\": \"relative\"\n    }\n  }, mdx(\"a\", {\n    parentName: \"h3\",\n    \"href\": \"#storage-deposit\",\n    \"aria-label\": \"storage deposit permalink\",\n    \"className\": \"anchor before\"\n  }, mdx(\"svg\", {\n    parentName: \"a\",\n    \"className\": \"fill-current text-substrateDark dark:text-white\",\n    \"aria-hidden\": \"true\",\n    \"focusable\": \"false\",\n    \"height\": \"16\",\n    \"version\": \"1.1\",\n    \"viewBox\": \"0 0 16 16\",\n    \"width\": \"16\"\n  }, mdx(\"path\", {\n    parentName: \"svg\",\n    \"fillRule\": \"evenodd\",\n    \"d\": \"M4 9h1v1H4c-1.5 0-3-1.69-3-3.5S2.55 3 4 3h4c1.45 0 3 1.69 3 3.5 0 1.41-.91 2.72-2 3.25V8.59c.58-.45 1-1.27 1-2.09C10 5.22 8.98 4 8 4H4c-.98 0-2 1.22-2 2.5S3 9 4 9zm9-3h-1v1h1c1 0 2 1.22 2 2.5S13.98 12 13 12H9c-.98 0-2-1.22-2-2.5 0-.83.42-1.64 1-2.09V6.25c-1.09.53-2 1.84-2 3.25C6 11.31 7.55 13 9 13h4c1.45 0 3-1.69 3-3.5S14.5 6 13 6z\"\n  }))), \"Storage deposit\"), mdx(\"p\", null, \"Similar to how gas limits the amount of computational resources that can be used during a\\ntransaction, storage deposit limits the footprint that a contract can have on the blockchain's storage.\\nAny caller of a contract is charged a deposit proportionally to the amount of storage that the\\ncall in question adds to the blockchain. If a call removes storage the caller that removes it\\ngets a refund proportionally to the amount of storage that was removed. Please note that with\\ncaller we mean the origin of a contract execution and not any contract which calls into another\\ncontract during a transaction.\"), mdx(\"p\", null, \"Similar to the \", mdx(\"inlineCode\", {\n    parentName: \"p\"\n  }, \"gas_limit\"), \" argument there is also a \", mdx(\"inlineCode\", {\n    parentName: \"p\"\n  }, \"storage_limit\"), \" argument with which users\\ncan limit the amount of deposit that can be incurred. The argument is denominated in native\\nchain balance and hence the user must have at least that amount of free balance.\"), mdx(\"h3\", {\n    \"id\": \"contracts-pallet-vs-evm\",\n    \"style\": {\n      \"position\": \"relative\"\n    }\n  }, mdx(\"a\", {\n    parentName: \"h3\",\n    \"href\": \"#contracts-pallet-vs-evm\",\n    \"aria-label\": \"contracts pallet vs evm permalink\",\n    \"className\": \"anchor before\"\n  }, mdx(\"svg\", {\n    parentName: \"a\",\n    \"className\": \"fill-current text-substrateDark dark:text-white\",\n    \"aria-hidden\": \"true\",\n    \"focusable\": \"false\",\n    \"height\": \"16\",\n    \"version\": \"1.1\",\n    \"viewBox\": \"0 0 16 16\",\n    \"width\": \"16\"\n  }, mdx(\"path\", {\n    parentName: \"svg\",\n    \"fillRule\": \"evenodd\",\n    \"d\": \"M4 9h1v1H4c-1.5 0-3-1.69-3-3.5S2.55 3 4 3h4c1.45 0 3 1.69 3 3.5 0 1.41-.91 2.72-2 3.25V8.59c.58-.45 1-1.27 1-2.09C10 5.22 8.98 4 8 4H4c-.98 0-2 1.22-2 2.5S3 9 4 9zm9-3h-1v1h1c1 0 2 1.22 2 2.5S13.98 12 13 12H9c-.98 0-2-1.22-2-2.5 0-.83.42-1.64 1-2.09V6.25c-1.09.53-2 1.84-2 3.25C6 11.31 7.55 13 9 13h4c1.45 0 3-1.69 3-3.5S14.5 6 13 6z\"\n  }))), \"Contracts pallet vs. EVM\"), mdx(\"p\", null, \"The Contracts pallet iterates on existing ideas in the smart contract ecosystem, particularly\\nEthereum and the EVM.\"), mdx(\"p\", null, \"The most obvious difference between the Contracts pallet and the EVM is the underlying execution\\nengine used to run smart contracts. The EVM is a good theoretical execution environment, but it is\\nnot very practical to use with modern hardware. For example, manipulation of 256 bit integers on\\nmodern architectures is significantly more complex than standard types. Even the Ethereum team has\\ninvestigated the use of \", mdx(\"a\", {\n    parentName: \"p\",\n    \"href\": \"https://github.com/ewasm/design\"\n  }, \"Wasm\"), \" for the next generation of the\\nnetwork.\"), mdx(\"p\", null, \"The EVM charges for storage fees only at the time of storage. This one-time cost results in some\\npermanent amount of storage being used on the blockchain, \", mdx(\"em\", {\n    parentName: \"p\"\n  }, \"forever\"), \", which is economically unsound.\\nThe Contracts pallet attempts to repair this through \", mdx(\"a\", {\n    parentName: \"p\",\n    \"href\": \"#storage-deposit\"\n  }, \"storage deposit\"), \" which ensures\\nthat any data that persists on the blockchain is appropriately charged for those resources.\"), mdx(\"p\", null, \"The Contracts pallet chooses to approach contract creation using a\\n\", mdx(\"a\", {\n    parentName: \"p\",\n    \"href\": \"#deploying-and-calling-contracts\"\n  }, \"two-step process\"), \", which fundamentally changes how contracts are stored on\\nchain. Contract addresses, their storage, and balances are now separated from the underlying\\ncontract logic. This could enable behavior like what\\n\", mdx(\"a\", {\n    parentName: \"p\",\n    \"href\": \"https://eips.ethereum.org/EIPS/eip-1014\"\n  }, mdx(\"inlineCode\", {\n    parentName: \"a\"\n  }, \"create2\")), \" provided to Ethereum or even enable repairable\\nor upgradeable contracts on a Substrate based blockchain.\"), mdx(\"h2\", {\n    \"id\": \"evm-pallet\",\n    \"style\": {\n      \"position\": \"relative\"\n    }\n  }, mdx(\"a\", {\n    parentName: \"h2\",\n    \"href\": \"#evm-pallet\",\n    \"aria-label\": \"evm pallet permalink\",\n    \"className\": \"anchor before\"\n  }, mdx(\"svg\", {\n    parentName: \"a\",\n    \"className\": \"fill-current text-substrateDark dark:text-white\",\n    \"aria-hidden\": \"true\",\n    \"focusable\": \"false\",\n    \"height\": \"16\",\n    \"version\": \"1.1\",\n    \"viewBox\": \"0 0 16 16\",\n    \"width\": \"16\"\n  }, mdx(\"path\", {\n    parentName: \"svg\",\n    \"fillRule\": \"evenodd\",\n    \"d\": \"M4 9h1v1H4c-1.5 0-3-1.69-3-3.5S2.55 3 4 3h4c1.45 0 3 1.69 3 3.5 0 1.41-.91 2.72-2 3.25V8.59c.58-.45 1-1.27 1-2.09C10 5.22 8.98 4 8 4H4c-.98 0-2 1.22-2 2.5S3 9 4 9zm9-3h-1v1h1c1 0 2 1.22 2 2.5S13.98 12 13 12H9c-.98 0-2-1.22-2-2.5 0-.83.42-1.64 1-2.09V6.25c-1.09.53-2 1.84-2 3.25C6 11.31 7.55 13 9 13h4c1.45 0 3-1.69 3-3.5S14.5 6 13 6z\"\n  }))), \"EVM pallet\"), mdx(\"p\", null, \"The \", mdx(\"a\", {\n    parentName: \"p\",\n    \"href\": \"https://docs.rs/pallet_evm/\"\n  }, mdx(\"strong\", {\n    parentName: \"a\"\n  }, \"FRAME EVM pallet\")), \" provides an EVM execution environment for Substrate's Ethereum\\ncompatibility layer, known as \", mdx(\"a\", {\n    parentName: \"p\",\n    \"href\": \"https://github.com/paritytech/frontier\"\n  }, \"Frontier\"), \". It allows unmodified EVM\\ncode to be executed in a Substrate-based blockchain, designed to closely emulate the\\nfunctionality of executing contracts on the Ethereum mainnet within the Substrate runtime.\"), mdx(\"p\", null, \"It works alongside with the \", mdx(\"a\", {\n    parentName: \"p\",\n    \"href\": \"https://docs.rs/pallet-ethereum\"\n  }, \"Ethereum pallet\"), \" and the\\n\", mdx(\"a\", {\n    parentName: \"p\",\n    \"href\": \"https://docs.rs/pallet-dynamic-fee\"\n  }, \"Dynamic Fee pallet\"), \" to enable the creation of runtimes\\ncapable of fully emulating Ethereum block production and transaction processing.\"), mdx(AccentButton, {\n    text: \"Start the Frontier workshop\",\n    link: \"/tutorials/v3/frontier\",\n    mdxType: \"AccentButton\"\n  }), mdx(\"h3\", {\n    \"id\": \"evm-engine\",\n    \"style\": {\n      \"position\": \"relative\"\n    }\n  }, mdx(\"a\", {\n    parentName: \"h3\",\n    \"href\": \"#evm-engine\",\n    \"aria-label\": \"evm engine permalink\",\n    \"className\": \"anchor before\"\n  }, mdx(\"svg\", {\n    parentName: \"a\",\n    \"className\": \"fill-current text-substrateDark dark:text-white\",\n    \"aria-hidden\": \"true\",\n    \"focusable\": \"false\",\n    \"height\": \"16\",\n    \"version\": \"1.1\",\n    \"viewBox\": \"0 0 16 16\",\n    \"width\": \"16\"\n  }, mdx(\"path\", {\n    parentName: \"svg\",\n    \"fillRule\": \"evenodd\",\n    \"d\": \"M4 9h1v1H4c-1.5 0-3-1.69-3-3.5S2.55 3 4 3h4c1.45 0 3 1.69 3 3.5 0 1.41-.91 2.72-2 3.25V8.59c.58-.45 1-1.27 1-2.09C10 5.22 8.98 4 8 4H4c-.98 0-2 1.22-2 2.5S3 9 4 9zm9-3h-1v1h1c1 0 2 1.22 2 2.5S13.98 12 13 12H9c-.98 0-2-1.22-2-2.5 0-.83.42-1.64 1-2.09V6.25c-1.09.53-2 1.84-2 3.25C6 11.31 7.55 13 9 13h4c1.45 0 3-1.69 3-3.5S14.5 6 13 6z\"\n  }))), \"EVM engine\"), mdx(\"p\", null, \"The EVM pallet uses \", mdx(\"a\", {\n    parentName: \"p\",\n    \"href\": \"https://github.com/rust-blockchain/evm\"\n  }, \"SputnikVM\"), \" as the underlying EVM engine.\\nThe engine is overhauled so that it's \", mdx(\"a\", {\n    parentName: \"p\",\n    \"href\": \"https://github.com/corepaper/evm\"\n  }, \"modular\"), \". In the future, we\\nwill want to allow users to swap out components like gasometer, and inject their own customized\\nones.\"), mdx(\"h3\", {\n    \"id\": \"execution-lifecycle\",\n    \"style\": {\n      \"position\": \"relative\"\n    }\n  }, mdx(\"a\", {\n    parentName: \"h3\",\n    \"href\": \"#execution-lifecycle\",\n    \"aria-label\": \"execution lifecycle permalink\",\n    \"className\": \"anchor before\"\n  }, mdx(\"svg\", {\n    parentName: \"a\",\n    \"className\": \"fill-current text-substrateDark dark:text-white\",\n    \"aria-hidden\": \"true\",\n    \"focusable\": \"false\",\n    \"height\": \"16\",\n    \"version\": \"1.1\",\n    \"viewBox\": \"0 0 16 16\",\n    \"width\": \"16\"\n  }, mdx(\"path\", {\n    parentName: \"svg\",\n    \"fillRule\": \"evenodd\",\n    \"d\": \"M4 9h1v1H4c-1.5 0-3-1.69-3-3.5S2.55 3 4 3h4c1.45 0 3 1.69 3 3.5 0 1.41-.91 2.72-2 3.25V8.59c.58-.45 1-1.27 1-2.09C10 5.22 8.98 4 8 4H4c-.98 0-2 1.22-2 2.5S3 9 4 9zm9-3h-1v1h1c1 0 2 1.22 2 2.5S13.98 12 13 12H9c-.98 0-2-1.22-2-2.5 0-.83.42-1.64 1-2.09V6.25c-1.09.53-2 1.84-2 3.25C6 11.31 7.55 13 9 13h4c1.45 0 3-1.69 3-3.5S14.5 6 13 6z\"\n  }))), \"Execution lifecycle\"), mdx(\"p\", null, \"There are a separate set of accounts managed by the EVM pallet. Substrate based accounts can call\\nthe EVM pallet to deposit or withdraw balance from the Substrate base-currency into a different\\nbalance managed and used by the EVM pallet. Once a user has populated their balance, they can create\\nand call smart contracts using this pallet.\"), mdx(\"p\", null, \"There's one-to-one mapping from Substrate accounts and EVM external accounts that is defined by a\\nconversion function.\"), mdx(\"h3\", {\n    \"id\": \"evm-pallet-vs-ethereum-network\",\n    \"style\": {\n      \"position\": \"relative\"\n    }\n  }, mdx(\"a\", {\n    parentName: \"h3\",\n    \"href\": \"#evm-pallet-vs-ethereum-network\",\n    \"aria-label\": \"evm pallet vs ethereum network permalink\",\n    \"className\": \"anchor before\"\n  }, mdx(\"svg\", {\n    parentName: \"a\",\n    \"className\": \"fill-current text-substrateDark dark:text-white\",\n    \"aria-hidden\": \"true\",\n    \"focusable\": \"false\",\n    \"height\": \"16\",\n    \"version\": \"1.1\",\n    \"viewBox\": \"0 0 16 16\",\n    \"width\": \"16\"\n  }, mdx(\"path\", {\n    parentName: \"svg\",\n    \"fillRule\": \"evenodd\",\n    \"d\": \"M4 9h1v1H4c-1.5 0-3-1.69-3-3.5S2.55 3 4 3h4c1.45 0 3 1.69 3 3.5 0 1.41-.91 2.72-2 3.25V8.59c.58-.45 1-1.27 1-2.09C10 5.22 8.98 4 8 4H4c-.98 0-2 1.22-2 2.5S3 9 4 9zm9-3h-1v1h1c1 0 2 1.22 2 2.5S13.98 12 13 12H9c-.98 0-2-1.22-2-2.5 0-.83.42-1.64 1-2.09V6.25c-1.09.53-2 1.84-2 3.25C6 11.31 7.55 13 9 13h4c1.45 0 3-1.69 3-3.5S14.5 6 13 6z\"\n  }))), \"EVM pallet vs. Ethereum network\"), mdx(\"p\", null, \"The EVM pallet should be able to produce nearly identical results compared to the Ethereum mainnet,\\nincluding gas cost and balance changes.\"), mdx(\"p\", null, \"Observable differences include:\"), mdx(\"ul\", null, mdx(\"li\", {\n    parentName: \"ul\"\n  }, \"The available length of block hashes may not be 256 depending on the configuration of the\\n\", mdx(\"a\", {\n    parentName: \"li\",\n    \"href\": \"/rustdocs/latest/frame_system/index.html#system-pallet\"\n  }, \"System pallet\"), \" in the Substrate runtime.\"), mdx(\"li\", {\n    parentName: \"ul\"\n  }, \"Difficulty and coinbase, which do not make sense in this pallet and is currently hard coded to\\nzero.\")), mdx(\"p\", null, \"We currently do not aim to make unobservable behaviors, such as state root, to be the same. We also\\ndon't aim to follow the exact same transaction / receipt format. However, given one Ethereum\\ntransaction and one Substrate account's private key, one should be able to convert any Ethereum\\ntransaction into a transaction compatible with this pallet.\"), mdx(\"p\", null, \"The gas configurations are currently hard-coded to the Istanbul hard fork. It can later be expanded\\nto support earlier hard fork configurations.\"), mdx(Message, {\n    type: \"gray\",\n    title: \"Note\",\n    text: \"Substrate is built to enable developers to extend what's provided out of the box.\\n  We encourage further development of alternative smart contract platforms on top of the Substrate\\n  runtime.\\n  Use these pre-built pallets to inform how you might design your own system or how you could port over an\\n  existing system to work on a Substrate-based chain.\",\n    mdxType: \"Message\"\n  }), mdx(\"h2\", {\n    \"id\": \"faq\",\n    \"style\": {\n      \"position\": \"relative\"\n    }\n  }, mdx(\"a\", {\n    parentName: \"h2\",\n    \"href\": \"#faq\",\n    \"aria-label\": \"faq permalink\",\n    \"className\": \"anchor before\"\n  }, mdx(\"svg\", {\n    parentName: \"a\",\n    \"className\": \"fill-current text-substrateDark dark:text-white\",\n    \"aria-hidden\": \"true\",\n    \"focusable\": \"false\",\n    \"height\": \"16\",\n    \"version\": \"1.1\",\n    \"viewBox\": \"0 0 16 16\",\n    \"width\": \"16\"\n  }, mdx(\"path\", {\n    parentName: \"svg\",\n    \"fillRule\": \"evenodd\",\n    \"d\": \"M4 9h1v1H4c-1.5 0-3-1.69-3-3.5S2.55 3 4 3h4c1.45 0 3 1.69 3 3.5 0 1.41-.91 2.72-2 3.25V8.59c.58-.45 1-1.27 1-2.09C10 5.22 8.98 4 8 4H4c-.98 0-2 1.22-2 2.5S3 9 4 9zm9-3h-1v1h1c1 0 2 1.22 2 2.5S13.98 12 13 12H9c-.98 0-2-1.22-2-2.5 0-.83.42-1.64 1-2.09V6.25c-1.09.53-2 1.84-2 3.25C6 11.31 7.55 13 9 13h4c1.45 0 3-1.69 3-3.5S14.5 6 13 6z\"\n  }))), \"FAQ\"), mdx(\"h4\", null, \"What is the difference between memory and storage?\"), mdx(\"p\", null, \"In ink! we refer \", mdx(\"inlineCode\", {\n    parentName: \"p\"\n  }, \"memory\"), \" to being the computer memory that is commonly known to programmers while\\nwith \", mdx(\"inlineCode\", {\n    parentName: \"p\"\n  }, \"storage\"), \" we refer to the contract instance's memory. The \", mdx(\"inlineCode\", {\n    parentName: \"p\"\n  }, \"storage\"), \" is backed up by the runtime\\nin a database. Accesses to it are considered to be slow.\"), mdx(\"h4\", null, \"How do I run tests?\"), mdx(\"p\", null, \"When building a smart contract with ink, you can define a set of tests.\"), mdx(\"p\", null, \"For example, in the minimal\\n\", mdx(\"a\", {\n    parentName: \"p\",\n    \"href\": \"https://github.com/paritytech/ink/blob/master/examples/flipper/lib.rs\"\n  }, \"flipper contract\"), \",\\nyou can find a small test at the bottom of the contract.\"), mdx(\"p\", null, \"To run this test, type the following command:\"), mdx(\"pre\", null, mdx(\"code\", {\n    parentName: \"pre\",\n    \"className\": \"language-bash\"\n  }, \"cargo +nightly test\\n\")), mdx(\"h4\", null, \"How do I add the Contracts pallet to my custom chain?\"), mdx(\"p\", null, \"You can follow\\n\", mdx(\"a\", {\n    parentName: \"p\",\n    \"href\": \"/how-to-guides/v3/pallet-design/contracts-pallet\"\n  }, \"our guide here\"), \" for instructions on how to add the Contracts pallet\\nand other FRAME pallets to your blockchain's runtime.\"), mdx(\"h2\", {\n    \"id\": \"learn-more\",\n    \"style\": {\n      \"position\": \"relative\"\n    }\n  }, mdx(\"a\", {\n    parentName: \"h2\",\n    \"href\": \"#learn-more\",\n    \"aria-label\": \"learn more permalink\",\n    \"className\": \"anchor before\"\n  }, mdx(\"svg\", {\n    parentName: \"a\",\n    \"className\": \"fill-current text-substrateDark dark:text-white\",\n    \"aria-hidden\": \"true\",\n    \"focusable\": \"false\",\n    \"height\": \"16\",\n    \"version\": \"1.1\",\n    \"viewBox\": \"0 0 16 16\",\n    \"width\": \"16\"\n  }, mdx(\"path\", {\n    parentName: \"svg\",\n    \"fillRule\": \"evenodd\",\n    \"d\": \"M4 9h1v1H4c-1.5 0-3-1.69-3-3.5S2.55 3 4 3h4c1.45 0 3 1.69 3 3.5 0 1.41-.91 2.72-2 3.25V8.59c.58-.45 1-1.27 1-2.09C10 5.22 8.98 4 8 4H4c-.98 0-2 1.22-2 2.5S3 9 4 9zm9-3h-1v1h1c1 0 2 1.22 2 2.5S13.98 12 13 12H9c-.98 0-2-1.22-2-2.5 0-.83.42-1.64 1-2.09V6.25c-1.09.53-2 1.84-2 3.25C6 11.31 7.55 13 9 13h4c1.45 0 3-1.69 3-3.5S14.5 6 13 6z\"\n  }))), \"Learn more\"), mdx(\"ul\", null, mdx(\"li\", {\n    parentName: \"ul\"\n  }, \"Learn more about \", mdx(\"a\", {\n    parentName: \"li\",\n    \"href\": \"https://paritytech.github.io/ink-docs/why-rust-for-smart-contracts\"\n  }, \"why Rust is an ideal smart contract language\"), \".\"), mdx(\"li\", {\n    parentName: \"ul\"\n  }, \"Follow a \", mdx(\"a\", {\n    parentName: \"li\",\n    \"href\": \"/tutorials/v3/add-a-pallet/\"\n  }, \"tutorial to add a pallet to your FRAME runtime\"), \".\"), mdx(\"li\", {\n    parentName: \"ul\"\n  }, \"Read \", mdx(\"a\", {\n    parentName: \"li\",\n    \"href\": \"https://paritytech.github.io/ink-docs/\"\n  }, \"ink!'s documentation\"), \".\")), mdx(\"h3\", {\n    \"id\": \"examples\",\n    \"style\": {\n      \"position\": \"relative\"\n    }\n  }, mdx(\"a\", {\n    parentName: \"h3\",\n    \"href\": \"#examples\",\n    \"aria-label\": \"examples permalink\",\n    \"className\": \"anchor before\"\n  }, mdx(\"svg\", {\n    parentName: \"a\",\n    \"className\": \"fill-current text-substrateDark dark:text-white\",\n    \"aria-hidden\": \"true\",\n    \"focusable\": \"false\",\n    \"height\": \"16\",\n    \"version\": \"1.1\",\n    \"viewBox\": \"0 0 16 16\",\n    \"width\": \"16\"\n  }, mdx(\"path\", {\n    parentName: \"svg\",\n    \"fillRule\": \"evenodd\",\n    \"d\": \"M4 9h1v1H4c-1.5 0-3-1.69-3-3.5S2.55 3 4 3h4c1.45 0 3 1.69 3 3.5 0 1.41-.91 2.72-2 3.25V8.59c.58-.45 1-1.27 1-2.09C10 5.22 8.98 4 8 4H4c-.98 0-2 1.22-2 2.5S3 9 4 9zm9-3h-1v1h1c1 0 2 1.22 2 2.5S13.98 12 13 12H9c-.98 0-2-1.22-2-2.5 0-.83.42-1.64 1-2.09V6.25c-1.09.53-2 1.84-2 3.25C6 11.31 7.55 13 9 13h4c1.45 0 3-1.69 3-3.5S14.5 6 13 6z\"\n  }))), \"Examples\"), mdx(\"ul\", null, mdx(\"li\", {\n    parentName: \"ul\"\n  }, \"Follow a\\n\", mdx(\"a\", {\n    parentName: \"li\",\n    \"href\": \"/how-to-guides/v3/pallet-design/contracts-pallet\"\n  }, \"this guide\"), \" to learn how to add the Contracts pallet to your FRAME runtime.\"), mdx(\"li\", {\n    parentName: \"ul\"\n  }, \"Learn how to\\n\", mdx(\"a\", {\n    parentName: \"li\",\n    \"href\": \"/tutorials/v3/ink-workshop/pt1\"\n  }, \"start developing with the Contracts pallet and ink!\"), \".\")), mdx(\"h3\", {\n    \"id\": \"references\",\n    \"style\": {\n      \"position\": \"relative\"\n    }\n  }, mdx(\"a\", {\n    parentName: \"h3\",\n    \"href\": \"#references\",\n    \"aria-label\": \"references permalink\",\n    \"className\": \"anchor before\"\n  }, mdx(\"svg\", {\n    parentName: \"a\",\n    \"className\": \"fill-current text-substrateDark dark:text-white\",\n    \"aria-hidden\": \"true\",\n    \"focusable\": \"false\",\n    \"height\": \"16\",\n    \"version\": \"1.1\",\n    \"viewBox\": \"0 0 16 16\",\n    \"width\": \"16\"\n  }, mdx(\"path\", {\n    parentName: \"svg\",\n    \"fillRule\": \"evenodd\",\n    \"d\": \"M4 9h1v1H4c-1.5 0-3-1.69-3-3.5S2.55 3 4 3h4c1.45 0 3 1.69 3 3.5 0 1.41-.91 2.72-2 3.25V8.59c.58-.45 1-1.27 1-2.09C10 5.22 8.98 4 8 4H4c-.98 0-2 1.22-2 2.5S3 9 4 9zm9-3h-1v1h1c1 0 2 1.22 2 2.5S13.98 12 13 12H9c-.98 0-2-1.22-2-2.5 0-.83.42-1.64 1-2.09V6.25c-1.09.53-2 1.84-2 3.25C6 11.31 7.55 13 9 13h4c1.45 0 3-1.69 3-3.5S14.5 6 13 6z\"\n  }))), \"References\"), mdx(\"ul\", null, mdx(\"li\", {\n    parentName: \"ul\"\n  }, \"Visit the reference docs for the\\n\", mdx(\"a\", {\n    parentName: \"li\",\n    \"href\": \"/rustdocs/latest/pallet_contracts/index.html\"\n  }, \"Contracts pallet\"), \".\"), mdx(\"li\", {\n    parentName: \"ul\"\n  }, \"View source code and documentation of the\\n\", mdx(\"a\", {\n    parentName: \"li\",\n    \"href\": \"https://github.com/paritytech/frontier/tree/master/frame/evm\"\n  }, \"EVM pallet\"), \".\"), mdx(\"li\", {\n    parentName: \"ul\"\n  }, \"Visit the\\n\", mdx(\"a\", {\n    parentName: \"li\",\n    \"href\": \"https://github.com/paritytech/ink\"\n  }, \"ink! repository to look at the source\"), \".\"), mdx(\"li\", {\n    parentName: \"ul\"\n  }, \"Visit the reference docs for the \", mdx(\"a\", {\n    parentName: \"li\",\n    \"href\": \"https://docs.rs/pallet_evm\"\n  }, \"EVM pallet\"), \" and \", mdx(\"a\", {\n    parentName: \"li\",\n    \"href\": \"https://docs.rs/fp-evm/\"\n  }, mdx(\"inlineCode\", {\n    parentName: \"a\"\n  }, \"fp_evm\")), \".\"), mdx(\"li\", {\n    parentName: \"ul\"\n  }, \"Visit the reference docs for \", mdx(\"a\", {\n    parentName: \"li\",\n    \"href\": \"https://docs.rs/evm/\"\n  }, \"SputnikVM's \", mdx(\"inlineCode\", {\n    parentName: \"a\"\n  }, \"evm\"), \" crate\"), \".\"), mdx(\"li\", {\n    parentName: \"ul\"\n  }, \"Take a look at the \", mdx(\"a\", {\n    parentName: \"li\",\n    \"href\": \"https://github.com/paritytech/wasmi\"\n  }, \"repository for \", mdx(\"inlineCode\", {\n    parentName: \"a\"\n  }, \"wasmi\")), \".\")));\n}\n;\nMDXContent.isMDXComponent = true;","tableOfContents":{"items":[{"url":"#smart-contracts-vs-runtime-development","title":"Smart Contracts vs. Runtime Development","items":[{"url":"#smart-contracts","title":"Smart contracts"},{"url":"#runtime-development","title":"Runtime development"},{"url":"#choosing-the-right-approach","title":"Choosing the right approach"}]},{"url":"#contracts-pallet","title":"Contracts pallet","items":[{"url":"#features","title":"Features"},{"url":"#deploying-and-calling-contracts","title":"Deploying and calling contracts"},{"url":"#gas","title":"Gas"},{"url":"#storage-deposit","title":"Storage deposit"},{"url":"#contracts-pallet-vs-evm","title":"Contracts pallet vs. EVM"}]},{"url":"#evm-pallet","title":"EVM pallet","items":[{"url":"#evm-engine","title":"EVM engine"},{"url":"#execution-lifecycle","title":"Execution lifecycle"},{"url":"#evm-pallet-vs-ethereum-network","title":"EVM pallet vs. Ethereum network"}]},{"url":"#faq","title":"FAQ"},{"url":"#learn-more","title":"Learn more","items":[{"url":"#examples","title":"Examples"},{"url":"#references","title":"References"}]}]},"fileAbsolutePath":"/Users/a212/Desktop/substrate-docs/v3/docs/03-runtime/p-smart-contracts/a-overview/index.mdx"}},"pageContext":{"slug":"/v3/runtime/smart-contracts","version":"3.0","locale":"en","hrefLang":"en-US","originalPath":"/v3/runtime/smart-contracts/","dateFormat":"MM/DD/YYYY"}},
    "staticQueryHashes": ["1239077767","1821483254","2966362950","3280999885"]}