{
    "componentChunkName": "component---src-templates-tut-template-tsx",
    "path": "/tutorials/v3/ink-workshop/pt1/",
    "result": {"data":{"mdx":{"frontmatter":{"slug":"/tutorials/v3/ink-workshop/pt1","title":"Getting Started","hideNav":null,"difficulty":2,"duration":"2.5 Hours","relevantSkills":["ink!","Smart Contracts"],"section":"tutorials","category":"ink workshop"},"body":"var _excluded = [\"components\"];\n\nfunction _extends() { _extends = Object.assign || function (target) { for (var i = 1; i < arguments.length; i++) { var source = arguments[i]; for (var key in source) { if (Object.prototype.hasOwnProperty.call(source, key)) { target[key] = source[key]; } } } return target; }; return _extends.apply(this, arguments); }\n\nfunction _objectWithoutProperties(source, excluded) { if (source == null) return {}; var target = _objectWithoutPropertiesLoose(source, excluded); var key, i; if (Object.getOwnPropertySymbols) { var sourceSymbolKeys = Object.getOwnPropertySymbols(source); for (i = 0; i < sourceSymbolKeys.length; i++) { key = sourceSymbolKeys[i]; if (excluded.indexOf(key) >= 0) continue; if (!Object.prototype.propertyIsEnumerable.call(source, key)) continue; target[key] = source[key]; } } return target; }\n\nfunction _objectWithoutPropertiesLoose(source, excluded) { if (source == null) return {}; var target = {}; var sourceKeys = Object.keys(source); var key, i; for (i = 0; i < sourceKeys.length; i++) { key = sourceKeys[i]; if (excluded.indexOf(key) >= 0) continue; target[key] = source[key]; } return target; }\n\n/* @jsxRuntime classic */\n\n/* @jsx mdx */\nvar _frontmatter = {\n  \"title\": \"Getting Started\",\n  \"slug\": \"/tutorials/v3/ink-workshop/pt1\",\n  \"version\": 3,\n  \"section\": \"tutorials\",\n  \"category\": \"ink workshop\",\n  \"keywords\": \"smart contracts, erc20, wasm\",\n  \"difficulty\": 2,\n  \"duration\": \"2.5 Hours\",\n  \"relevantSkills\": [\"ink!\", \"Smart Contracts\"]\n};\n\nvar makeShortcode = function makeShortcode(name) {\n  return function MDXDefaultShortcode(props) {\n    console.warn(\"Component \" + name + \" was not imported, exported, or provided by MDXProvider as global scope\");\n    return mdx(\"div\", props);\n  };\n};\n\nvar TutorialObjective = makeShortcode(\"TutorialObjective\");\nvar AccentButton = makeShortcode(\"AccentButton\");\nvar Message = makeShortcode(\"Message\");\nvar layoutProps = {\n  _frontmatter: _frontmatter\n};\nvar MDXLayout = \"wrapper\";\nreturn function MDXContent(_ref) {\n  var components = _ref.components,\n      props = _objectWithoutProperties(_ref, _excluded);\n\n  return mdx(MDXLayout, _extends({}, layoutProps, props, {\n    components: components,\n    mdxType: \"MDXLayout\"\n  }), mdx(\"p\", null, \"This part will teach you everything you need to know to get started building smart contracts on Substrate with ink!.\"), mdx(TutorialObjective, {\n    data: {\n      textLineOne: '1. Installing prerequisites on your computer',\n      url: '#prerequisites'\n    },\n    mdxType: \"TutorialObjective\"\n  }), mdx(TutorialObjective, {\n    data: {\n      textLineOne: '2. Starting a new project with cargo-contract',\n      url: '#creating-an-ink-project'\n    },\n    mdxType: \"TutorialObjective\"\n  }), mdx(TutorialObjective, {\n    data: {\n      textLineOne: '3. Building and testing our contract',\n      url: '#running-a-substrate-smart-contracts-node'\n    },\n    mdxType: \"TutorialObjective\"\n  }), mdx(TutorialObjective, {\n    data: {\n      textLineOne: '4. Deploying our contract on a local Substrate node',\n      url: '#deploying-your-contract'\n    },\n    mdxType: \"TutorialObjective\"\n  }), mdx(TutorialObjective, {\n    data: {\n      textLineOne: '5. Interacting with our contract using the Canvas UI',\n      url: '#calling-your-contract'\n    },\n    mdxType: \"TutorialObjective\"\n  }), mdx(TutorialObjective, {\n    data: {\n      textLineOne: '6. Troubleshooting',\n      url: '#troubleshooting'\n    },\n    mdxType: \"TutorialObjective\"\n  }), mdx(\"h2\", {\n    \"id\": \"learning-outcomes\",\n    \"style\": {\n      \"position\": \"relative\"\n    }\n  }, mdx(\"a\", {\n    parentName: \"h2\",\n    \"href\": \"#learning-outcomes\",\n    \"aria-label\": \"learning outcomes permalink\",\n    \"className\": \"anchor before\"\n  }, mdx(\"svg\", {\n    parentName: \"a\",\n    \"className\": \"fill-current text-substrateDark dark:text-white\",\n    \"aria-hidden\": \"true\",\n    \"focusable\": \"false\",\n    \"height\": \"16\",\n    \"version\": \"1.1\",\n    \"viewBox\": \"0 0 16 16\",\n    \"width\": \"16\"\n  }, mdx(\"path\", {\n    parentName: \"svg\",\n    \"fillRule\": \"evenodd\",\n    \"d\": \"M4 9h1v1H4c-1.5 0-3-1.69-3-3.5S2.55 3 4 3h4c1.45 0 3 1.69 3 3.5 0 1.41-.91 2.72-2 3.25V8.59c.58-.45 1-1.27 1-2.09C10 5.22 8.98 4 8 4H4c-.98 0-2 1.22-2 2.5S3 9 4 9zm9-3h-1v1h1c1 0 2 1.22 2 2.5S13.98 12 13 12H9c-.98 0-2-1.22-2-2.5 0-.83.42-1.64 1-2.09V6.25c-1.09.53-2 1.84-2 3.25C6 11.31 7.55 13 9 13h4c1.45 0 3-1.69 3-3.5S14.5 6 13 6z\"\n  }))), \"Learning outcomes\"), mdx(\"ul\", null, mdx(\"li\", {\n    parentName: \"ul\"\n  }, \"Learn the basic of writing smart contracts with ink!\"), mdx(\"li\", {\n    parentName: \"ul\"\n  }, \"Learn how to deploy an ERC20 contract in a Substrate node using ink!\")), mdx(AccentButton, {\n    text: \"Sound reasonable? Let's begin!\",\n    link: \"#prerequisites\",\n    mdxType: \"AccentButton\"\n  }), mdx(\"p\", null, \"To follow this tutorial, you will need to set up some stuff on your computer.\"), mdx(\"h2\", {\n    \"id\": \"prerequisites\",\n    \"style\": {\n      \"position\": \"relative\"\n    }\n  }, mdx(\"a\", {\n    parentName: \"h2\",\n    \"href\": \"#prerequisites\",\n    \"aria-label\": \"prerequisites permalink\",\n    \"className\": \"anchor before\"\n  }, mdx(\"svg\", {\n    parentName: \"a\",\n    \"className\": \"fill-current text-substrateDark dark:text-white\",\n    \"aria-hidden\": \"true\",\n    \"focusable\": \"false\",\n    \"height\": \"16\",\n    \"version\": \"1.1\",\n    \"viewBox\": \"0 0 16 16\",\n    \"width\": \"16\"\n  }, mdx(\"path\", {\n    parentName: \"svg\",\n    \"fillRule\": \"evenodd\",\n    \"d\": \"M4 9h1v1H4c-1.5 0-3-1.69-3-3.5S2.55 3 4 3h4c1.45 0 3 1.69 3 3.5 0 1.41-.91 2.72-2 3.25V8.59c.58-.45 1-1.27 1-2.09C10 5.22 8.98 4 8 4H4c-.98 0-2 1.22-2 2.5S3 9 4 9zm9-3h-1v1h1c1 0 2 1.22 2 2.5S13.98 12 13 12H9c-.98 0-2-1.22-2-2.5 0-.83.42-1.64 1-2.09V6.25c-1.09.53-2 1.84-2 3.25C6 11.31 7.55 13 9 13h4c1.45 0 3-1.69 3-3.5S14.5 6 13 6z\"\n  }))), \"Prerequisites\"), mdx(\"p\", null, \"Follow the\\n\", mdx(\"a\", {\n    parentName: \"p\",\n    \"href\": \"/v3/getting-started/installation\"\n  }, \"official installation steps\"), \" to install the prerequisites.\"), mdx(\"p\", null, \"Once you have done the above you will also need to run:\"), mdx(\"pre\", null, mdx(\"code\", {\n    parentName: \"pre\"\n  }, \"rustup component add rust-src --toolchain nightly\\nrustup target add wasm32-unknown-unknown --toolchain nightly\\n\")), mdx(\"h3\", {\n    \"id\": \"1-installing-the-substrate-contracts-node\",\n    \"style\": {\n      \"position\": \"relative\"\n    }\n  }, mdx(\"a\", {\n    parentName: \"h3\",\n    \"href\": \"#1-installing-the-substrate-contracts-node\",\n    \"aria-label\": \"1 installing the substrate contracts node permalink\",\n    \"className\": \"anchor before\"\n  }, mdx(\"svg\", {\n    parentName: \"a\",\n    \"className\": \"fill-current text-substrateDark dark:text-white\",\n    \"aria-hidden\": \"true\",\n    \"focusable\": \"false\",\n    \"height\": \"16\",\n    \"version\": \"1.1\",\n    \"viewBox\": \"0 0 16 16\",\n    \"width\": \"16\"\n  }, mdx(\"path\", {\n    parentName: \"svg\",\n    \"fillRule\": \"evenodd\",\n    \"d\": \"M4 9h1v1H4c-1.5 0-3-1.69-3-3.5S2.55 3 4 3h4c1.45 0 3 1.69 3 3.5 0 1.41-.91 2.72-2 3.25V8.59c.58-.45 1-1.27 1-2.09C10 5.22 8.98 4 8 4H4c-.98 0-2 1.22-2 2.5S3 9 4 9zm9-3h-1v1h1c1 0 2 1.22 2 2.5S13.98 12 13 12H9c-.98 0-2-1.22-2-2.5 0-.83.42-1.64 1-2.09V6.25c-1.09.53-2 1.84-2 3.25C6 11.31 7.55 13 9 13h4c1.45 0 3-1.69 3-3.5S14.5 6 13 6z\"\n  }))), \"1. Installing The Substrate Contracts Node\"), mdx(\"p\", null, \"We need to use a Substrate node with the built-in \", mdx(\"inlineCode\", {\n    parentName: \"p\"\n  }, \"pallet-contracts\"), \" pallet. For this workshop we'll use a pre-configured Substrate node client.\"), mdx(\"pre\", null, mdx(\"code\", {\n    parentName: \"pre\",\n    \"className\": \"language-bash\"\n  }, \"cargo install contracts-node --git https://github.com/paritytech/substrate-contracts-node.git --tag v0.1.0 --force --locked\\n\")), mdx(\"h3\", {\n    \"id\": \"2-ink-cli\",\n    \"style\": {\n      \"position\": \"relative\"\n    }\n  }, mdx(\"a\", {\n    parentName: \"h3\",\n    \"href\": \"#2-ink-cli\",\n    \"aria-label\": \"2 ink cli permalink\",\n    \"className\": \"anchor before\"\n  }, mdx(\"svg\", {\n    parentName: \"a\",\n    \"className\": \"fill-current text-substrateDark dark:text-white\",\n    \"aria-hidden\": \"true\",\n    \"focusable\": \"false\",\n    \"height\": \"16\",\n    \"version\": \"1.1\",\n    \"viewBox\": \"0 0 16 16\",\n    \"width\": \"16\"\n  }, mdx(\"path\", {\n    parentName: \"svg\",\n    \"fillRule\": \"evenodd\",\n    \"d\": \"M4 9h1v1H4c-1.5 0-3-1.69-3-3.5S2.55 3 4 3h4c1.45 0 3 1.69 3 3.5 0 1.41-.91 2.72-2 3.25V8.59c.58-.45 1-1.27 1-2.09C10 5.22 8.98 4 8 4H4c-.98 0-2 1.22-2 2.5S3 9 4 9zm9-3h-1v1h1c1 0 2 1.22 2 2.5S13.98 12 13 12H9c-.98 0-2-1.22-2-2.5 0-.83.42-1.64 1-2.09V6.25c-1.09.53-2 1.84-2 3.25C6 11.31 7.55 13 9 13h4c1.45 0 3-1.69 3-3.5S14.5 6 13 6z\"\n  }))), \"2. ink! CLI\"), mdx(\"p\", null, \"The final tool we will be installing is the ink! command line utility which will make setting up Substrate smart contract projects easier.\"), mdx(\"p\", null, \"As a prerequisite for the tool you need to install the \", mdx(\"strong\", {\n    parentName: \"p\"\n  }, \"binaryen\"), \" package, which is used to optimize the WebAssembly bytecode of the contract.\"), mdx(\"p\", null, \"If you are using Ubuntu, Debian or MacOS, you could install it directly:\"), mdx(\"pre\", null, mdx(\"code\", {\n    parentName: \"pre\",\n    \"className\": \"language-bash\"\n  }, \"# For Ubuntu or Debian users\\nsudo apt install binaryen\\n# For MacOS users\\nbrew install binaryen\\n\")), mdx(\"br\", null), mdx(Message, {\n    type: \"gray\",\n    title: \"Note\",\n    text: \"If you're unable to find a version of `binaryen` compatible with your OS, you can [download the binary release directly](https://github.com/WebAssembly/binaryen/releases).\",\n    mdxType: \"Message\"\n  }), mdx(\"p\", null, \"After you've installed the package execute:\"), mdx(\"pre\", null, mdx(\"code\", {\n    parentName: \"pre\",\n    \"className\": \"language-bash\"\n  }, \"cargo install cargo-contract --vers ^0.15 --force --locked\\n\")), mdx(\"p\", null, \"You can then use \", mdx(\"inlineCode\", {\n    parentName: \"p\"\n  }, \"cargo contract --help\"), \" to start exploring the commands made available to you.\"), mdx(\"h2\", {\n    \"id\": \"creating-an-ink-project\",\n    \"style\": {\n      \"position\": \"relative\"\n    }\n  }, mdx(\"a\", {\n    parentName: \"h2\",\n    \"href\": \"#creating-an-ink-project\",\n    \"aria-label\": \"creating an ink project permalink\",\n    \"className\": \"anchor before\"\n  }, mdx(\"svg\", {\n    parentName: \"a\",\n    \"className\": \"fill-current text-substrateDark dark:text-white\",\n    \"aria-hidden\": \"true\",\n    \"focusable\": \"false\",\n    \"height\": \"16\",\n    \"version\": \"1.1\",\n    \"viewBox\": \"0 0 16 16\",\n    \"width\": \"16\"\n  }, mdx(\"path\", {\n    parentName: \"svg\",\n    \"fillRule\": \"evenodd\",\n    \"d\": \"M4 9h1v1H4c-1.5 0-3-1.69-3-3.5S2.55 3 4 3h4c1.45 0 3 1.69 3 3.5 0 1.41-.91 2.72-2 3.25V8.59c.58-.45 1-1.27 1-2.09C10 5.22 8.98 4 8 4H4c-.98 0-2 1.22-2 2.5S3 9 4 9zm9-3h-1v1h1c1 0 2 1.22 2 2.5S13.98 12 13 12H9c-.98 0-2-1.22-2-2.5 0-.83.42-1.64 1-2.09V6.25c-1.09.53-2 1.84-2 3.25C6 11.31 7.55 13 9 13h4c1.45 0 3-1.69 3-3.5S14.5 6 13 6z\"\n  }))), \"Creating An ink! Project\"), mdx(\"p\", null, \"We are going to use the ink! CLI to generate the files we need for a Substrate smart contract project.\"), mdx(\"p\", null, \"From your working directory, run:\"), mdx(\"pre\", null, mdx(\"code\", {\n    parentName: \"pre\",\n    \"className\": \"language-bash\"\n  }, \"cargo contract new flipper\\n\")), mdx(\"p\", null, \"This command will create a new project folder named \", mdx(\"inlineCode\", {\n    parentName: \"p\"\n  }, \"flipper\"), \" which we will explore:\"), mdx(\"pre\", null, mdx(\"code\", {\n    parentName: \"pre\",\n    \"className\": \"language-bash\"\n  }, \"cd flipper/\\n\")), mdx(\"p\", null, mdx(\"strong\", {\n    parentName: \"p\"\n  }, \"ink! Contract Project\")), mdx(\"pre\", null, mdx(\"code\", {\n    parentName: \"pre\"\n  }, \"flipper\\n  \\u2514\\u2500 lib.rs                <-- Contract Source Code\\n  \\u2514\\u2500 Cargo.toml            <-- Rust Dependencies and ink! Configuration\\n  \\u2514\\u2500 .gitignore\\n\")), mdx(\"h3\", {\n    \"id\": \"1-contract-source-code\",\n    \"style\": {\n      \"position\": \"relative\"\n    }\n  }, mdx(\"a\", {\n    parentName: \"h3\",\n    \"href\": \"#1-contract-source-code\",\n    \"aria-label\": \"1 contract source code permalink\",\n    \"className\": \"anchor before\"\n  }, mdx(\"svg\", {\n    parentName: \"a\",\n    \"className\": \"fill-current text-substrateDark dark:text-white\",\n    \"aria-hidden\": \"true\",\n    \"focusable\": \"false\",\n    \"height\": \"16\",\n    \"version\": \"1.1\",\n    \"viewBox\": \"0 0 16 16\",\n    \"width\": \"16\"\n  }, mdx(\"path\", {\n    parentName: \"svg\",\n    \"fillRule\": \"evenodd\",\n    \"d\": \"M4 9h1v1H4c-1.5 0-3-1.69-3-3.5S2.55 3 4 3h4c1.45 0 3 1.69 3 3.5 0 1.41-.91 2.72-2 3.25V8.59c.58-.45 1-1.27 1-2.09C10 5.22 8.98 4 8 4H4c-.98 0-2 1.22-2 2.5S3 9 4 9zm9-3h-1v1h1c1 0 2 1.22 2 2.5S13.98 12 13 12H9c-.98 0-2-1.22-2-2.5 0-.83.42-1.64 1-2.09V6.25c-1.09.53-2 1.84-2 3.25C6 11.31 7.55 13 9 13h4c1.45 0 3-1.69 3-3.5S14.5 6 13 6z\"\n  }))), \"1. Contract Source Code\"), mdx(\"p\", null, \"The ink! CLI automatically generates the source code for the \\\"Flipper\\\" contract, which is about the\\nsimplest \\\"smart\\\" contract you can build. You can take a sneak peak as to what will come by looking\\nat the \", mdx(\"a\", {\n    parentName: \"p\",\n    \"href\": \"https://github.com/paritytech/ink/blob/v3.0.0-rc5/examples/flipper/lib.rs\"\n  }, \"Flipper Example\"), \".\"), mdx(\"p\", null, \"The Flipper contract is nothing more than a \", mdx(\"inlineCode\", {\n    parentName: \"p\"\n  }, \"bool\"), \" which gets flipped from true to false through the \", mdx(\"inlineCode\", {\n    parentName: \"p\"\n  }, \"flip()\"), \" function. We won't go deep into the details of this source code because we will be walking you through the steps of building a more advanced contract!\"), mdx(\"h3\", {\n    \"id\": \"2-testing-your-contract\",\n    \"style\": {\n      \"position\": \"relative\"\n    }\n  }, mdx(\"a\", {\n    parentName: \"h3\",\n    \"href\": \"#2-testing-your-contract\",\n    \"aria-label\": \"2 testing your contract permalink\",\n    \"className\": \"anchor before\"\n  }, mdx(\"svg\", {\n    parentName: \"a\",\n    \"className\": \"fill-current text-substrateDark dark:text-white\",\n    \"aria-hidden\": \"true\",\n    \"focusable\": \"false\",\n    \"height\": \"16\",\n    \"version\": \"1.1\",\n    \"viewBox\": \"0 0 16 16\",\n    \"width\": \"16\"\n  }, mdx(\"path\", {\n    parentName: \"svg\",\n    \"fillRule\": \"evenodd\",\n    \"d\": \"M4 9h1v1H4c-1.5 0-3-1.69-3-3.5S2.55 3 4 3h4c1.45 0 3 1.69 3 3.5 0 1.41-.91 2.72-2 3.25V8.59c.58-.45 1-1.27 1-2.09C10 5.22 8.98 4 8 4H4c-.98 0-2 1.22-2 2.5S3 9 4 9zm9-3h-1v1h1c1 0 2 1.22 2 2.5S13.98 12 13 12H9c-.98 0-2-1.22-2-2.5 0-.83.42-1.64 1-2.09V6.25c-1.09.53-2 1.84-2 3.25C6 11.31 7.55 13 9 13h4c1.45 0 3-1.69 3-3.5S14.5 6 13 6z\"\n  }))), \"2. Testing Your Contract\"), mdx(\"p\", null, \"You will see at the bottom of the source code there are simple test cases which verify the functionality of the contract. We can quickly test this code is functioning as expected using the \", mdx(\"strong\", {\n    parentName: \"p\"\n  }, \"off-chain test environment\"), \" that ink! provides.\"), mdx(\"p\", null, \"In your project folder run:\"), mdx(\"pre\", null, mdx(\"code\", {\n    parentName: \"pre\",\n    \"className\": \"language-bash\"\n  }, \"cargo +nightly test\\n\")), mdx(\"p\", null, \"To which you should see a successful test completion:\"), mdx(\"pre\", null, mdx(\"code\", {\n    parentName: \"pre\",\n    \"className\": \"language-bash\"\n  }, \"$ cargo +nightly test\\n    running 2 tests\\n    test flipper::tests::it_works ... ok\\n    test flipper::tests::default_works ... ok\\n\\n    test result: ok. 2 passed; 0 failed; 0 ignored; 0 measured; 0 filtered out\\n\")), mdx(\"p\", null, \"Now that we are feeling confident things are working, we can actually compile this contract to Wasm.\"), mdx(\"h3\", {\n    \"id\": \"3-building-your-contract\",\n    \"style\": {\n      \"position\": \"relative\"\n    }\n  }, mdx(\"a\", {\n    parentName: \"h3\",\n    \"href\": \"#3-building-your-contract\",\n    \"aria-label\": \"3 building your contract permalink\",\n    \"className\": \"anchor before\"\n  }, mdx(\"svg\", {\n    parentName: \"a\",\n    \"className\": \"fill-current text-substrateDark dark:text-white\",\n    \"aria-hidden\": \"true\",\n    \"focusable\": \"false\",\n    \"height\": \"16\",\n    \"version\": \"1.1\",\n    \"viewBox\": \"0 0 16 16\",\n    \"width\": \"16\"\n  }, mdx(\"path\", {\n    parentName: \"svg\",\n    \"fillRule\": \"evenodd\",\n    \"d\": \"M4 9h1v1H4c-1.5 0-3-1.69-3-3.5S2.55 3 4 3h4c1.45 0 3 1.69 3 3.5 0 1.41-.91 2.72-2 3.25V8.59c.58-.45 1-1.27 1-2.09C10 5.22 8.98 4 8 4H4c-.98 0-2 1.22-2 2.5S3 9 4 9zm9-3h-1v1h1c1 0 2 1.22 2 2.5S13.98 12 13 12H9c-.98 0-2-1.22-2-2.5 0-.83.42-1.64 1-2.09V6.25c-1.09.53-2 1.84-2 3.25C6 11.31 7.55 13 9 13h4c1.45 0 3-1.69 3-3.5S14.5 6 13 6z\"\n  }))), \"3. Building Your Contract\"), mdx(\"p\", null, \"Run the following command to compile your smart contract in the Flipper project directory:\"), mdx(\"pre\", null, mdx(\"code\", {\n    parentName: \"pre\",\n    \"className\": \"language-bash\"\n  }, \"cargo +nightly contract build\\n\")), mdx(\"br\", null), mdx(Message, {\n    type: \"yellow\",\n    title: \"Information\",\n    text: \"If you run into a `call to unsafe function` error, run `cargo install --force cargo-contract && rustup update`\\n  to make sure everything is up to date.\",\n    mdxType: \"Message\"\n  }), mdx(\"p\", null, \"This command will build a Wasm binary for the ink! project, a metadata file (which contains the\\ncontract's ABI) and a \", mdx(\"inlineCode\", {\n    parentName: \"p\"\n  }, \".contract\"), \" file which bundles both. This \", mdx(\"inlineCode\", {\n    parentName: \"p\"\n  }, \".contract\"), \" file can be used for\\ndeploying your contract to your chain. If all goes well, you should see a \", mdx(\"inlineCode\", {\n    parentName: \"p\"\n  }, \"target\"), \" folder which\\ncontains these files:\"), mdx(\"pre\", null, mdx(\"code\", {\n    parentName: \"pre\"\n  }, \"target\\n  \\u2514\\u2500 ink\\n    \\u2514\\u2500 release\\n      \\u2514\\u2500 ...\\n    \\u2514\\u2500 .rustc_info.json\\n    \\u2514\\u2500 CACHEDIR.TAG\\n    \\u2514\\u2500 flipper.contract\\n    \\u2514\\u2500 flipper.wasm\\n    \\u2514\\u2500 metadata.json\\n\")), mdx(\"p\", null, \"Let's take a look at the structure of \", mdx(\"inlineCode\", {\n    parentName: \"p\"\n  }, \"metadata.json\"), \":\"), mdx(\"pre\", null, mdx(\"code\", {\n    parentName: \"pre\",\n    \"className\": \"language-JSON\"\n  }, \"{\\n  \\\"metadataVersion\\\": \\\"0.1.0\\\",\\n  \\\"source\\\": {...},\\n  \\\"contract\\\": {...},\\n  \\\"spec\\\": {\\n    \\\"constructors\\\": [...],\\n    \\\"docs\\\": [],\\n    \\\"events\\\": [],\\n    \\\"messages\\\": [...],\\n  },\\n  \\\"storage\\\": {...},\\n  \\\"types\\\": [...]\\n}\\n\")), mdx(\"p\", null, \"This file describes all the interfaces that can be used to interact with your contract:\"), mdx(\"ul\", null, mdx(\"li\", {\n    parentName: \"ul\"\n  }, mdx(\"inlineCode\", {\n    parentName: \"li\"\n  }, \"types\"), \" provides the custom \", mdx(\"strong\", {\n    parentName: \"li\"\n  }, \"data types\"), \" used throughout the rest of the JSON.\"), mdx(\"li\", {\n    parentName: \"ul\"\n  }, mdx(\"inlineCode\", {\n    parentName: \"li\"\n  }, \"storage\"), \" defines all the \", mdx(\"strong\", {\n    parentName: \"li\"\n  }, \"storage\"), \" items managed by your contract and how to ultimately access\\nthem.\"), mdx(\"li\", {\n    parentName: \"ul\"\n  }, mdx(\"inlineCode\", {\n    parentName: \"li\"\n  }, \"spec\"), \" stores information about the callable functions like \", mdx(\"strong\", {\n    parentName: \"li\"\n  }, \"constructors\"), \" and \", mdx(\"strong\", {\n    parentName: \"li\"\n  }, \"messages\"), \" a\\nuser can call to interact with the contract. It also has helpful information like the \", mdx(\"strong\", {\n    parentName: \"li\"\n  }, \"events\"), \"\\nthat are emitted by the contract or any \", mdx(\"strong\", {\n    parentName: \"li\"\n  }, \"docs\"), \".\")), mdx(\"p\", null, \"If you look closely at the constructors and messages, you will also notice a \", mdx(\"inlineCode\", {\n    parentName: \"p\"\n  }, \"selector\"), \" which\\ncontains a 4-byte hash of the function name and is used to route your contract calls to the correct\\nfunctions.\"), mdx(\"p\", null, \"In the next section we will start a\\n\", mdx(\"a\", {\n    parentName: \"p\",\n    \"href\": \"https://github.com/paritytech/substrate-contracts-node\"\n  }, \"Substrate Smart Contracts node\"), \" and\\nconfigure the \", mdx(\"a\", {\n    parentName: \"p\",\n    \"href\": \"https://github.com/paritytech/canvas-ui\"\n  }, \"Canvas UI\"), \" to interact with it.\"), mdx(\"h2\", {\n    \"id\": \"running-a-substrate-smart-contracts-node\",\n    \"style\": {\n      \"position\": \"relative\"\n    }\n  }, mdx(\"a\", {\n    parentName: \"h2\",\n    \"href\": \"#running-a-substrate-smart-contracts-node\",\n    \"aria-label\": \"running a substrate smart contracts node permalink\",\n    \"className\": \"anchor before\"\n  }, mdx(\"svg\", {\n    parentName: \"a\",\n    \"className\": \"fill-current text-substrateDark dark:text-white\",\n    \"aria-hidden\": \"true\",\n    \"focusable\": \"false\",\n    \"height\": \"16\",\n    \"version\": \"1.1\",\n    \"viewBox\": \"0 0 16 16\",\n    \"width\": \"16\"\n  }, mdx(\"path\", {\n    parentName: \"svg\",\n    \"fillRule\": \"evenodd\",\n    \"d\": \"M4 9h1v1H4c-1.5 0-3-1.69-3-3.5S2.55 3 4 3h4c1.45 0 3 1.69 3 3.5 0 1.41-.91 2.72-2 3.25V8.59c.58-.45 1-1.27 1-2.09C10 5.22 8.98 4 8 4H4c-.98 0-2 1.22-2 2.5S3 9 4 9zm9-3h-1v1h1c1 0 2 1.22 2 2.5S13.98 12 13 12H9c-.98 0-2-1.22-2-2.5 0-.83.42-1.64 1-2.09V6.25c-1.09.53-2 1.84-2 3.25C6 11.31 7.55 13 9 13h4c1.45 0 3-1.69 3-3.5S14.5 6 13 6z\"\n  }))), \"Running a Substrate Smart Contracts Node\"), mdx(\"p\", null, \"After successfully installing \", mdx(\"a\", {\n    parentName: \"p\",\n    \"href\": \"https://github.com/paritytech/substrate-contracts-node\"\n  }, mdx(\"inlineCode\", {\n    parentName: \"a\"\n  }, \"substrate-contracts-node\")), \",\\nyou can start a local development chain by running:\"), mdx(\"pre\", null, mdx(\"code\", {\n    parentName: \"pre\",\n    \"className\": \"language-bash\"\n  }, \"substrate-contracts-node --dev --tmp\\n\")), mdx(\"p\", null, mdx(\"img\", {\n    parentName: \"p\",\n    \"src\": \"/assets/tutorials/ink-workshop/start-canvas-node.png\",\n    \"alt\": \"Substrate Smart Contracts Node\"\n  })), mdx(\"p\", null, \"You should start seeing blocks being produced by your node in your terminal.\"), mdx(\"h2\", {\n    \"id\": \"deploying-your-contract\",\n    \"style\": {\n      \"position\": \"relative\"\n    }\n  }, mdx(\"a\", {\n    parentName: \"h2\",\n    \"href\": \"#deploying-your-contract\",\n    \"aria-label\": \"deploying your contract permalink\",\n    \"className\": \"anchor before\"\n  }, mdx(\"svg\", {\n    parentName: \"a\",\n    \"className\": \"fill-current text-substrateDark dark:text-white\",\n    \"aria-hidden\": \"true\",\n    \"focusable\": \"false\",\n    \"height\": \"16\",\n    \"version\": \"1.1\",\n    \"viewBox\": \"0 0 16 16\",\n    \"width\": \"16\"\n  }, mdx(\"path\", {\n    parentName: \"svg\",\n    \"fillRule\": \"evenodd\",\n    \"d\": \"M4 9h1v1H4c-1.5 0-3-1.69-3-3.5S2.55 3 4 3h4c1.45 0 3 1.69 3 3.5 0 1.41-.91 2.72-2 3.25V8.59c.58-.45 1-1.27 1-2.09C10 5.22 8.98 4 8 4H4c-.98 0-2 1.22-2 2.5S3 9 4 9zm9-3h-1v1h1c1 0 2 1.22 2 2.5S13.98 12 13 12H9c-.98 0-2-1.22-2-2.5 0-.83.42-1.64 1-2.09V6.25c-1.09.53-2 1.84-2 3.25C6 11.31 7.55 13 9 13h4c1.45 0 3-1.69 3-3.5S14.5 6 13 6z\"\n  }))), \"Deploying your Contract\"), mdx(Message, {\n    type: \"red\",\n    title: \"Important\",\n    text: \"Canvas UI is undergoing technical difficulties and is not functional at the moment. While we are working on a fix, \\n  please use https://polkadot.js.org/apps/ to deploy and interact with your contracts. Same principles apply, the UI differs slightly. \\n  Make sure you are connected to the local node by selecting it from the top left menu and that you navigate to Developer/Contracts page\",\n    mdxType: \"Message\"\n  }), mdx(\"p\", null, \"Go to the \", mdx(\"a\", {\n    parentName: \"p\",\n    \"href\": \"https://paritytech.github.io/canvas-ui\"\n  }, \"hosted version of Canvas UI\"), \" to interact with\\nyour node. You first need to configure the UI to connect to it:\"), mdx(\"ul\", null, mdx(\"li\", {\n    parentName: \"ul\"\n  }, \"Click on the dropdown selector at bottom left corner.\"), mdx(\"li\", {\n    parentName: \"ul\"\n  }, \"Choose the Local Node.\")), mdx(\"p\", null, mdx(\"img\", {\n    parentName: \"p\",\n    \"src\": \"/assets/tutorials/ink-workshop/canvas-connect-to-local.png\",\n    \"alt\": \"Connect to local node\"\n  })), mdx(\"p\", null, \"Now that we have generated the Wasm binary from our source code and connected to a local node node, we want\\nto deploy this contract onto our Substrate blockchain.\"), mdx(\"p\", null, \"Smart contract deployment on Substrate is a little different than on traditional smart contract\\nblockchains.\"), mdx(\"p\", null, \"Whereas a completely new blob of smart contract source code is deployed each time you push a\\ncontract on other platforms, Substrate opts to optimize this behavior. For example, the standard\\nERC20 token has been deployed to Ethereum thousands of times, sometimes only with changes to the\\ninitial configuration (through the Solidity \", mdx(\"inlineCode\", {\n    parentName: \"p\"\n  }, \"constructor\"), \" function). Each of these instances take\\nup space on the blockchain equivalent to the contract source code size, even though no code was\\nactually changed.\"), mdx(\"p\", null, \"In Substrate, the contract deployment process is split into two steps:\"), mdx(\"ol\", null, mdx(\"li\", {\n    parentName: \"ol\"\n  }, \"Putting your contract code on the blockchain\"), mdx(\"li\", {\n    parentName: \"ol\"\n  }, \"Creating an instance of your contract\")), mdx(\"p\", null, \"With this pattern, contract code like the ERC20 standard can be put on the blockchain one single\\ntime, but instantiated any number of times. No need to continually upload the same source code over\\nand waste space on the blockchain.\"), mdx(\"h3\", {\n    \"id\": \"1-upload-contract-code\",\n    \"style\": {\n      \"position\": \"relative\"\n    }\n  }, mdx(\"a\", {\n    parentName: \"h3\",\n    \"href\": \"#1-upload-contract-code\",\n    \"aria-label\": \"1 upload contract code permalink\",\n    \"className\": \"anchor before\"\n  }, mdx(\"svg\", {\n    parentName: \"a\",\n    \"className\": \"fill-current text-substrateDark dark:text-white\",\n    \"aria-hidden\": \"true\",\n    \"focusable\": \"false\",\n    \"height\": \"16\",\n    \"version\": \"1.1\",\n    \"viewBox\": \"0 0 16 16\",\n    \"width\": \"16\"\n  }, mdx(\"path\", {\n    parentName: \"svg\",\n    \"fillRule\": \"evenodd\",\n    \"d\": \"M4 9h1v1H4c-1.5 0-3-1.69-3-3.5S2.55 3 4 3h4c1.45 0 3 1.69 3 3.5 0 1.41-.91 2.72-2 3.25V8.59c.58-.45 1-1.27 1-2.09C10 5.22 8.98 4 8 4H4c-.98 0-2 1.22-2 2.5S3 9 4 9zm9-3h-1v1h1c1 0 2 1.22 2 2.5S13.98 12 13 12H9c-.98 0-2-1.22-2-2.5 0-.83.42-1.64 1-2.09V6.25c-1.09.53-2 1.84-2 3.25C6 11.31 7.55 13 9 13h4c1.45 0 3-1.69 3-3.5S14.5 6 13 6z\"\n  }))), \"1. Upload Contract Code\"), mdx(\"p\", null, \"Here we will upload the contract code and instantiate one copy of the contract on the blockchain (\\nwhich is usually why we upload the contract code in the first place):\"), mdx(\"ul\", null, mdx(\"li\", {\n    parentName: \"ul\"\n  }, \"Click the \", mdx(\"strong\", {\n    parentName: \"li\"\n  }, \"Upload & Instantiate Contract\"), \" button.\"), mdx(\"li\", {\n    parentName: \"ul\"\n  }, \"Choose an \", mdx(\"strong\", {\n    parentName: \"li\"\n  }, \"Instantiation account\"), \" (e.g. ALICE).\"), mdx(\"li\", {\n    parentName: \"ul\"\n  }, \"Give the contract a descriptive \", mdx(\"strong\", {\n    parentName: \"li\"\n  }, \"Name\"), \" (e.g. Flipper Contract).\"), mdx(\"li\", {\n    parentName: \"ul\"\n  }, \"Drag the \", mdx(\"inlineCode\", {\n    parentName: \"li\"\n  }, \"flipper.contract\"), \" file that contains the bundled Wasm blob and metadata into the drag\\n& drop area. You will see the UI parse the metadata and showing what functions the contract contains.\"), mdx(\"li\", {\n    parentName: \"ul\"\n  }, \"Click the \", mdx(\"strong\", {\n    parentName: \"li\"\n  }, \"Constructor Details\"))), mdx(\"p\", null, mdx(\"img\", {\n    parentName: \"p\",\n    \"src\": \"/assets/tutorials/ink-workshop/flipper-instantiate-01.png\",\n    \"alt\": \"Flipper Instantiate Contract 01\"\n  })), mdx(\"h3\", {\n    \"id\": \"2-instantiate-a-contract-on-the-blockchain\",\n    \"style\": {\n      \"position\": \"relative\"\n    }\n  }, mdx(\"a\", {\n    parentName: \"h3\",\n    \"href\": \"#2-instantiate-a-contract-on-the-blockchain\",\n    \"aria-label\": \"2 instantiate a contract on the blockchain permalink\",\n    \"className\": \"anchor before\"\n  }, mdx(\"svg\", {\n    parentName: \"a\",\n    \"className\": \"fill-current text-substrateDark dark:text-white\",\n    \"aria-hidden\": \"true\",\n    \"focusable\": \"false\",\n    \"height\": \"16\",\n    \"version\": \"1.1\",\n    \"viewBox\": \"0 0 16 16\",\n    \"width\": \"16\"\n  }, mdx(\"path\", {\n    parentName: \"svg\",\n    \"fillRule\": \"evenodd\",\n    \"d\": \"M4 9h1v1H4c-1.5 0-3-1.69-3-3.5S2.55 3 4 3h4c1.45 0 3 1.69 3 3.5 0 1.41-.91 2.72-2 3.25V8.59c.58-.45 1-1.27 1-2.09C10 5.22 8.98 4 8 4H4c-.98 0-2 1.22-2 2.5S3 9 4 9zm9-3h-1v1h1c1 0 2 1.22 2 2.5S13.98 12 13 12H9c-.98 0-2-1.22-2-2.5 0-.83.42-1.64 1-2.09V6.25c-1.09.53-2 1.84-2 3.25C6 11.31 7.55 13 9 13h4c1.45 0 3-1.69 3-3.5S14.5 6 13 6z\"\n  }))), \"2. Instantiate a Contract on the Blockchain\"), mdx(\"p\", null, \"Smart contracts exist as an extension of the account system on the blockchain. Thus creating an\\ninstance of this contract will create a new \", mdx(\"inlineCode\", {\n    parentName: \"p\"\n  }, \"AccountId\"), \" which will store any balance managed by the\\nsmart contract and allow us to interact with the contract.\"), mdx(\"p\", null, \"Now a screen displays the information that represents our smart contract. We are going to\\ninstantiate a copy of the smart contract:\"), mdx(\"ul\", null, mdx(\"li\", {\n    parentName: \"ul\"\n  }, \"Give the contract instance a \", mdx(\"strong\", {\n    parentName: \"li\"\n  }, \"Contract Name\"), \" (e.g. The First Flipper).\"), mdx(\"li\", {\n    parentName: \"ul\"\n  }, \"Accept the default options for the contract \", mdx(\"strong\", {\n    parentName: \"li\"\n  }, \"Instantiation Constructor\"), \".\"), mdx(\"li\", {\n    parentName: \"ul\"\n  }, \"Accept the default options \", mdx(\"strong\", {\n    parentName: \"li\"\n  }, \"Endowment\"), \" of \", mdx(\"inlineCode\", {\n    parentName: \"li\"\n  }, \"1000 Units\"), \" to pay the storage rent, and \", mdx(\"strong\", {\n    parentName: \"li\"\n  }, \"Max Gas\\nAllowed\"), \" of \", mdx(\"inlineCode\", {\n    parentName: \"li\"\n  }, \"200000\"), \".\"), mdx(\"li\", {\n    parentName: \"ul\"\n  }, \"Click on \", mdx(\"inlineCode\", {\n    parentName: \"li\"\n  }, \"Instantiate\"))), mdx(\"p\", null, mdx(\"img\", {\n    parentName: \"p\",\n    \"src\": \"/assets/tutorials/ink-workshop/flipper-instantiate-02.png\",\n    \"alt\": \"Flipper Instantiate Contract 02\"\n  })), mdx(\"blockquote\", null, mdx(\"p\", {\n    parentName: \"blockquote\"\n  }, mdx(\"strong\", {\n    parentName: \"p\"\n  }, \"Note:\"), \" As mentioned earlier, contract creation involves creation of a new account. As such, you\\nmust be sure to give the contract account at least the existential deposit defined by your\\nblockchain. We also need to be able to pay the contract's rent (endowment). If we consume all of\\nthis deposit, the contract will become a tombstone. We can always refill the contract's balance and\\nkeep it on chain.\")), mdx(\"p\", null, \"When you click \", mdx(\"strong\", {\n    parentName: \"p\"\n  }, \"Instantiate\"), \", and in the next confirmation screen \", mdx(\"strong\", {\n    parentName: \"p\"\n  }, \"Sign & Submit\"), \", you should see\\nthe extrinsic \", mdx(\"inlineCode\", {\n    parentName: \"p\"\n  }, \"contracts.instantiateWithCode\"), \" is called, and a flurry of events appear including the\\ncreation of a new account (\", mdx(\"inlineCode\", {\n    parentName: \"p\"\n  }, \"system.NewAccount\"), \") and the instantiation of the contract\\n(\", mdx(\"inlineCode\", {\n    parentName: \"p\"\n  }, \"contracts.Instantiated\"), \"):\"), mdx(\"p\", null, mdx(\"img\", {\n    parentName: \"p\",\n    \"src\": \"/assets/tutorials/ink-workshop/flipper-instantiate-03.png\",\n    \"alt\": \"Flipper Instantiate Contract 03\"\n  })), mdx(\"h2\", {\n    \"id\": \"calling-your-contract\",\n    \"style\": {\n      \"position\": \"relative\"\n    }\n  }, mdx(\"a\", {\n    parentName: \"h2\",\n    \"href\": \"#calling-your-contract\",\n    \"aria-label\": \"calling your contract permalink\",\n    \"className\": \"anchor before\"\n  }, mdx(\"svg\", {\n    parentName: \"a\",\n    \"className\": \"fill-current text-substrateDark dark:text-white\",\n    \"aria-hidden\": \"true\",\n    \"focusable\": \"false\",\n    \"height\": \"16\",\n    \"version\": \"1.1\",\n    \"viewBox\": \"0 0 16 16\",\n    \"width\": \"16\"\n  }, mdx(\"path\", {\n    parentName: \"svg\",\n    \"fillRule\": \"evenodd\",\n    \"d\": \"M4 9h1v1H4c-1.5 0-3-1.69-3-3.5S2.55 3 4 3h4c1.45 0 3 1.69 3 3.5 0 1.41-.91 2.72-2 3.25V8.59c.58-.45 1-1.27 1-2.09C10 5.22 8.98 4 8 4H4c-.98 0-2 1.22-2 2.5S3 9 4 9zm9-3h-1v1h1c1 0 2 1.22 2 2.5S13.98 12 13 12H9c-.98 0-2-1.22-2-2.5 0-.83.42-1.64 1-2.09V6.25c-1.09.53-2 1.84-2 3.25C6 11.31 7.55 13 9 13h4c1.45 0 3-1.69 3-3.5S14.5 6 13 6z\"\n  }))), \"Calling your Contract\"), mdx(Message, {\n    type: \"red\",\n    title: \"Important\",\n    text: \"Canvas UI is undergoing technical difficulties and is not functional at the moment. While we are working on a fix, \\n  please use https://polkadot.js.org/apps/ to deploy and interact with your contracts. Same principles apply, the UI differs slightly. \\n  Make sure you are connected to the local node by selecting it from the top left menu and that you navigate to Developer/Contracts page\",\n    mdxType: \"Message\"\n  }), mdx(\"p\", null, \"Now that your contract has been fully deployed, we can start interacting with it! Flipper only has\\ntwo functions, \", mdx(\"inlineCode\", {\n    parentName: \"p\"\n  }, \"flip()\"), \" and \", mdx(\"inlineCode\", {\n    parentName: \"p\"\n  }, \"get()\"), \" so we will show you what it's like to play with both of them.\\nClick the \", mdx(\"strong\", {\n    parentName: \"p\"\n  }, \"Execute\"), \" button under the contract after you instantiate the Flipper contract in the\\nprevious step.\"), mdx(\"h3\", {\n    \"id\": \"1-get-function\",\n    \"style\": {\n      \"position\": \"relative\"\n    }\n  }, mdx(\"a\", {\n    parentName: \"h3\",\n    \"href\": \"#1-get-function\",\n    \"aria-label\": \"1 get function permalink\",\n    \"className\": \"anchor before\"\n  }, mdx(\"svg\", {\n    parentName: \"a\",\n    \"className\": \"fill-current text-substrateDark dark:text-white\",\n    \"aria-hidden\": \"true\",\n    \"focusable\": \"false\",\n    \"height\": \"16\",\n    \"version\": \"1.1\",\n    \"viewBox\": \"0 0 16 16\",\n    \"width\": \"16\"\n  }, mdx(\"path\", {\n    parentName: \"svg\",\n    \"fillRule\": \"evenodd\",\n    \"d\": \"M4 9h1v1H4c-1.5 0-3-1.69-3-3.5S2.55 3 4 3h4c1.45 0 3 1.69 3 3.5 0 1.41-.91 2.72-2 3.25V8.59c.58-.45 1-1.27 1-2.09C10 5.22 8.98 4 8 4H4c-.98 0-2 1.22-2 2.5S3 9 4 9zm9-3h-1v1h1c1 0 2 1.22 2 2.5S13.98 12 13 12H9c-.98 0-2-1.22-2-2.5 0-.83.42-1.64 1-2.09V6.25c-1.09.53-2 1.84-2 3.25C6 11.31 7.55 13 9 13h4c1.45 0 3-1.69 3-3.5S14.5 6 13 6z\"\n  }))), \"1. get() function\"), mdx(\"p\", null, \"Take a look at our contract's \", mdx(\"inlineCode\", {\n    parentName: \"p\"\n  }, \"default()\"), \" function, we set the initial value of the Flipper contract\\n\", mdx(\"inlineCode\", {\n    parentName: \"p\"\n  }, \"value\"), \" to \", mdx(\"inlineCode\", {\n    parentName: \"p\"\n  }, \"No\"), \" when we instantiated the contract. Let's check that this is the case.\"), mdx(\"p\", null, \"In the \", mdx(\"strong\", {\n    parentName: \"p\"\n  }, \"Message to Send\"), \" section, select the \\\"\", mdx(\"strong\", {\n    parentName: \"p\"\n  }, \"get(): bool\"), \"\\\" message and accept the default\\nvalues for the other options.\"), mdx(\"p\", null, \"Press \", mdx(\"strong\", {\n    parentName: \"p\"\n  }, \"\\\"Call\\\"\"), \" and confirm that it returns the value \", mdx(\"inlineCode\", {\n    parentName: \"p\"\n  }, \"false\"), \":\"), mdx(\"p\", null, mdx(\"img\", {\n    parentName: \"p\",\n    \"src\": \"/assets/tutorials/ink-workshop/flipper-false.png\",\n    \"alt\": \"An image of Flipper RPC call with false\"\n  })), mdx(Message, {\n    type: \"gray\",\n    title: \"Note\",\n    text: \"You might be wondering \\\"Why did we need to specify gas when reading a value from a contract?\\\"\\nIf you notice right above the \\\"Call\\\" button is a dropdown select box that allows you to \\\"Send as\\nRPC call\\\" or \\\"Send as transaction\\\". For a read-only request like this, we can simply use an RPC call\\nwhich will _simulate_ a transaction, but not actually storing anything on-chain. Thus, you will still need to specify the right amount of gas to cover your \\\"virtual fee\\\". \\nBut don't worry, nothing will be charged when making a call this way. \\uD83D\\uDE42\",\n    mdxType: \"Message\"\n  }), mdx(\"h3\", {\n    \"id\": \"2-flip-function\",\n    \"style\": {\n      \"position\": \"relative\"\n    }\n  }, mdx(\"a\", {\n    parentName: \"h3\",\n    \"href\": \"#2-flip-function\",\n    \"aria-label\": \"2 flip function permalink\",\n    \"className\": \"anchor before\"\n  }, mdx(\"svg\", {\n    parentName: \"a\",\n    \"className\": \"fill-current text-substrateDark dark:text-white\",\n    \"aria-hidden\": \"true\",\n    \"focusable\": \"false\",\n    \"height\": \"16\",\n    \"version\": \"1.1\",\n    \"viewBox\": \"0 0 16 16\",\n    \"width\": \"16\"\n  }, mdx(\"path\", {\n    parentName: \"svg\",\n    \"fillRule\": \"evenodd\",\n    \"d\": \"M4 9h1v1H4c-1.5 0-3-1.69-3-3.5S2.55 3 4 3h4c1.45 0 3 1.69 3 3.5 0 1.41-.91 2.72-2 3.25V8.59c.58-.45 1-1.27 1-2.09C10 5.22 8.98 4 8 4H4c-.98 0-2 1.22-2 2.5S3 9 4 9zm9-3h-1v1h1c1 0 2 1.22 2 2.5S13.98 12 13 12H9c-.98 0-2-1.22-2-2.5 0-.83.42-1.64 1-2.09V6.25c-1.09.53-2 1.84-2 3.25C6 11.31 7.55 13 9 13h4c1.45 0 3-1.69 3-3.5S14.5 6 13 6z\"\n  }))), \"2. flip() function\"), mdx(\"p\", null, \"So let's make the value turn \", mdx(\"inlineCode\", {\n    parentName: \"p\"\n  }, \"true\"), \" now!\"), mdx(\"p\", null, \"The alternative message to send with the UI is \", mdx(\"inlineCode\", {\n    parentName: \"p\"\n  }, \"flip()\"), \". Again, accept the default values for the other options.\"), mdx(\"p\", null, \"You will notice that the \", mdx(\"inlineCode\", {\n    parentName: \"p\"\n  }, \"flip()\"), \" message defaults to a transaction call.\"), mdx(\"p\", null, mdx(\"img\", {\n    parentName: \"p\",\n    \"src\": \"/assets/tutorials/ink-workshop/send-as-transaction.png\",\n    \"alt\": \"An image of a Flipper transaction\"\n  })), mdx(\"p\", null, \"If the transaction was successful, we should then be able to go back to the \", mdx(\"inlineCode\", {\n    parentName: \"p\"\n  }, \"get()\"), \" function and see our updated storage:\"), mdx(\"p\", null, mdx(\"img\", {\n    parentName: \"p\",\n    \"src\": \"/assets/tutorials/ink-workshop/flipper-true.png\",\n    \"alt\": \"An image of Flipper RPC call with true\"\n  })), mdx(\"p\", null, \"Woohoo! You deployed your first smart contract!\"), mdx(\"h3\", {\n    \"id\": \"3-moving-forward\",\n    \"style\": {\n      \"position\": \"relative\"\n    }\n  }, mdx(\"a\", {\n    parentName: \"h3\",\n    \"href\": \"#3-moving-forward\",\n    \"aria-label\": \"3 moving forward permalink\",\n    \"className\": \"anchor before\"\n  }, mdx(\"svg\", {\n    parentName: \"a\",\n    \"className\": \"fill-current text-substrateDark dark:text-white\",\n    \"aria-hidden\": \"true\",\n    \"focusable\": \"false\",\n    \"height\": \"16\",\n    \"version\": \"1.1\",\n    \"viewBox\": \"0 0 16 16\",\n    \"width\": \"16\"\n  }, mdx(\"path\", {\n    parentName: \"svg\",\n    \"fillRule\": \"evenodd\",\n    \"d\": \"M4 9h1v1H4c-1.5 0-3-1.69-3-3.5S2.55 3 4 3h4c1.45 0 3 1.69 3 3.5 0 1.41-.91 2.72-2 3.25V8.59c.58-.45 1-1.27 1-2.09C10 5.22 8.98 4 8 4H4c-.98 0-2 1.22-2 2.5S3 9 4 9zm9-3h-1v1h1c1 0 2 1.22 2 2.5S13.98 12 13 12H9c-.98 0-2-1.22-2-2.5 0-.83.42-1.64 1-2.09V6.25c-1.09.53-2 1.84-2 3.25C6 11.31 7.55 13 9 13h4c1.45 0 3-1.69 3-3.5S14.5 6 13 6z\"\n  }))), \"3. Moving Forward\"), mdx(\"p\", null, \"We will not go over these setup and deployment steps again, but you can use them throughout the\\ntutorial to deploy certain contract on-chain.\"), mdx(\"p\", null, \"The rest of the tutorial will have \", mdx(\"strong\", {\n    parentName: \"p\"\n  }, \"template code\"), \" which you will use to walk through the\\ndifferent steps of contract development. Each template comes with a fully designed suite of tests\\nthat should pass if you programmed your contract correctly. Before you move on from a section, make\\nsure that you run:\"), mdx(\"pre\", null, mdx(\"code\", {\n    parentName: \"pre\",\n    \"className\": \"language-bash\"\n  }, \"cargo +nightly test\\n\")), mdx(\"p\", null, \"and that the tests all execute successfully without any warnings.\"), mdx(\"p\", null, \"You need not deploy your contract between each section, but if we ask you to deploy your contract,\\nyou will need to follow these same steps you have done with the Flipper contract.\"), mdx(\"h2\", {\n    \"id\": \"troubleshooting\",\n    \"style\": {\n      \"position\": \"relative\"\n    }\n  }, mdx(\"a\", {\n    parentName: \"h2\",\n    \"href\": \"#troubleshooting\",\n    \"aria-label\": \"troubleshooting permalink\",\n    \"className\": \"anchor before\"\n  }, mdx(\"svg\", {\n    parentName: \"a\",\n    \"className\": \"fill-current text-substrateDark dark:text-white\",\n    \"aria-hidden\": \"true\",\n    \"focusable\": \"false\",\n    \"height\": \"16\",\n    \"version\": \"1.1\",\n    \"viewBox\": \"0 0 16 16\",\n    \"width\": \"16\"\n  }, mdx(\"path\", {\n    parentName: \"svg\",\n    \"fillRule\": \"evenodd\",\n    \"d\": \"M4 9h1v1H4c-1.5 0-3-1.69-3-3.5S2.55 3 4 3h4c1.45 0 3 1.69 3 3.5 0 1.41-.91 2.72-2 3.25V8.59c.58-.45 1-1.27 1-2.09C10 5.22 8.98 4 8 4H4c-.98 0-2 1.22-2 2.5S3 9 4 9zm9-3h-1v1h1c1 0 2 1.22 2 2.5S13.98 12 13 12H9c-.98 0-2-1.22-2-2.5 0-.83.42-1.64 1-2.09V6.25c-1.09.53-2 1.84-2 3.25C6 11.31 7.55 13 9 13h4c1.45 0 3-1.69 3-3.5S14.5 6 13 6z\"\n  }))), \"Troubleshooting\"), mdx(Message, {\n    type: \"red\",\n    title: \"Important\",\n    text: \"Canvas UI is undergoing technical difficulties and is not functional at the moment. While we are working on a fix, \\n  please use https://polkadot.js.org/apps/ to deploy and interact with your contracts. Same principles apply, the UI differs slightly. \\n  Make sure you are connected to the local node by selecting it from the top left menu and that you navigate to Developer/Contracts page\",\n    mdxType: \"Message\"\n  }), mdx(\"p\", null, \"Here are solutions to some of the common problems you may come across:\"), mdx(\"h3\", {\n    \"id\": \"1-unexpected-epoch-change\",\n    \"style\": {\n      \"position\": \"relative\"\n    }\n  }, mdx(\"a\", {\n    parentName: \"h3\",\n    \"href\": \"#1-unexpected-epoch-change\",\n    \"aria-label\": \"1 unexpected epoch change permalink\",\n    \"className\": \"anchor before\"\n  }, mdx(\"svg\", {\n    parentName: \"a\",\n    \"className\": \"fill-current text-substrateDark dark:text-white\",\n    \"aria-hidden\": \"true\",\n    \"focusable\": \"false\",\n    \"height\": \"16\",\n    \"version\": \"1.1\",\n    \"viewBox\": \"0 0 16 16\",\n    \"width\": \"16\"\n  }, mdx(\"path\", {\n    parentName: \"svg\",\n    \"fillRule\": \"evenodd\",\n    \"d\": \"M4 9h1v1H4c-1.5 0-3-1.69-3-3.5S2.55 3 4 3h4c1.45 0 3 1.69 3 3.5 0 1.41-.91 2.72-2 3.25V8.59c.58-.45 1-1.27 1-2.09C10 5.22 8.98 4 8 4H4c-.98 0-2 1.22-2 2.5S3 9 4 9zm9-3h-1v1h1c1 0 2 1.22 2 2.5S13.98 12 13 12H9c-.98 0-2-1.22-2-2.5 0-.83.42-1.64 1-2.09V6.25c-1.09.53-2 1.84-2 3.25C6 11.31 7.55 13 9 13h4c1.45 0 3-1.69 3-3.5S14.5 6 13 6z\"\n  }))), \"1. Unexpected Epoch Change\"), mdx(\"p\", null, \"There is a known issue with the Substrate block production (BABE) on a running chain. If you stop\\nyour node for too long (closing the terminal, putting your computer to sleep, etc...), you will get\\nthe following error:\"), mdx(\"pre\", null, mdx(\"code\", {\n    parentName: \"pre\",\n    \"className\": \"language-bash\"\n  }, \"ClientImport(\\\"Unexpected epoch change\\\")\\n\")), mdx(\"p\", null, \"To solve this you will need to restart your node with: \", mdx(\"inlineCode\", {\n    parentName: \"p\"\n  }, \"canvas --dev --tmp\"), \". At that point, you will\\nneed to re-deploy any contracts and re-do any steps that you may have done before on your node. As\\nlong as you keep your node running, you should face no issues.\"), mdx(\"h3\", {\n    \"id\": \"2-old-contracts-in-local-storage\",\n    \"style\": {\n      \"position\": \"relative\"\n    }\n  }, mdx(\"a\", {\n    parentName: \"h3\",\n    \"href\": \"#2-old-contracts-in-local-storage\",\n    \"aria-label\": \"2 old contracts in local storage permalink\",\n    \"className\": \"anchor before\"\n  }, mdx(\"svg\", {\n    parentName: \"a\",\n    \"className\": \"fill-current text-substrateDark dark:text-white\",\n    \"aria-hidden\": \"true\",\n    \"focusable\": \"false\",\n    \"height\": \"16\",\n    \"version\": \"1.1\",\n    \"viewBox\": \"0 0 16 16\",\n    \"width\": \"16\"\n  }, mdx(\"path\", {\n    parentName: \"svg\",\n    \"fillRule\": \"evenodd\",\n    \"d\": \"M4 9h1v1H4c-1.5 0-3-1.69-3-3.5S2.55 3 4 3h4c1.45 0 3 1.69 3 3.5 0 1.41-.91 2.72-2 3.25V8.59c.58-.45 1-1.27 1-2.09C10 5.22 8.98 4 8 4H4c-.98 0-2 1.22-2 2.5S3 9 4 9zm9-3h-1v1h1c1 0 2 1.22 2 2.5S13.98 12 13 12H9c-.98 0-2-1.22-2-2.5 0-.83.42-1.64 1-2.09V6.25c-1.09.53-2 1.84-2 3.25C6 11.31 7.55 13 9 13h4c1.45 0 3-1.69 3-3.5S14.5 6 13 6z\"\n  }))), \"2. Old Contracts in Local Storage\"), mdx(\"p\", null, mdx(\"strong\", {\n    parentName: \"p\"\n  }, \"Canvas UI\"), \" uses its own local storage to track the contracts that you have deployed. This means\\nthat if you deploy a contract using the UI, and then purge your Canvas node, you will be prompted to\\nreset your local storage and please do so. And then re-deploy any contracts and re-do any steps that\\nyou may have done before on your node.\"), mdx(\"h3\", {\n    \"id\": \"3-send-as-transaction-vs-send-as-rpc\",\n    \"style\": {\n      \"position\": \"relative\"\n    }\n  }, mdx(\"a\", {\n    parentName: \"h3\",\n    \"href\": \"#3-send-as-transaction-vs-send-as-rpc\",\n    \"aria-label\": \"3 send as transaction vs send as rpc permalink\",\n    \"className\": \"anchor before\"\n  }, mdx(\"svg\", {\n    parentName: \"a\",\n    \"className\": \"fill-current text-substrateDark dark:text-white\",\n    \"aria-hidden\": \"true\",\n    \"focusable\": \"false\",\n    \"height\": \"16\",\n    \"version\": \"1.1\",\n    \"viewBox\": \"0 0 16 16\",\n    \"width\": \"16\"\n  }, mdx(\"path\", {\n    parentName: \"svg\",\n    \"fillRule\": \"evenodd\",\n    \"d\": \"M4 9h1v1H4c-1.5 0-3-1.69-3-3.5S2.55 3 4 3h4c1.45 0 3 1.69 3 3.5 0 1.41-.91 2.72-2 3.25V8.59c.58-.45 1-1.27 1-2.09C10 5.22 8.98 4 8 4H4c-.98 0-2 1.22-2 2.5S3 9 4 9zm9-3h-1v1h1c1 0 2 1.22 2 2.5S13.98 12 13 12H9c-.98 0-2-1.22-2-2.5 0-.83.42-1.64 1-2.09V6.25c-1.09.53-2 1.84-2 3.25C6 11.31 7.55 13 9 13h4c1.45 0 3-1.69 3-3.5S14.5 6 13 6z\"\n  }))), \"3. Send as Transaction vs Send as RPC\"), mdx(\"p\", null, \"When interacting with contracts using the Canvas UI, you have the option to submit your call as a\\ntransaction or as a RPC:\"), mdx(\"p\", null, mdx(\"img\", {\n    parentName: \"p\",\n    \"src\": \"/assets/tutorials/ink-workshop/send-as.png\",\n    \"alt\": \"An image of submitting with transaction or RPC\"\n  })), mdx(\"p\", null, \"When you send as a transaction, it should be exactly as you expect. A transaction is submitted to\\nthe contract, a fee is deducted from your account, and the state of your blockchain can change. In\\nthese situations, no value is returned from your contract call, only a \\\"Success\\\" or \\\"Failed\\\"\\nextrinsic message along with any events it may emit.\"), mdx(\"p\", null, \"However, there may be some calls that you want to \\\"test\\\", rather than actually submit a transaction,\\nor you may want to peek at the value that \", mdx(\"em\", {\n    parentName: \"p\"\n  }, \"would\"), \" be returned if you called the contract function.\\nFor these scenarios, you submit an RPC call, which will run all of your contract logic, but not\\nactually submit a transaction or update the chain state. However, you will still need to specify\\nthe right amount of gas to cover your \\\"virtual fee\\\". But don't worry, nothing will be charged when making a call this way. :)\"), mdx(\"h3\", {\n    \"id\": \"4-other-issues\",\n    \"style\": {\n      \"position\": \"relative\"\n    }\n  }, mdx(\"a\", {\n    parentName: \"h3\",\n    \"href\": \"#4-other-issues\",\n    \"aria-label\": \"4 other issues permalink\",\n    \"className\": \"anchor before\"\n  }, mdx(\"svg\", {\n    parentName: \"a\",\n    \"className\": \"fill-current text-substrateDark dark:text-white\",\n    \"aria-hidden\": \"true\",\n    \"focusable\": \"false\",\n    \"height\": \"16\",\n    \"version\": \"1.1\",\n    \"viewBox\": \"0 0 16 16\",\n    \"width\": \"16\"\n  }, mdx(\"path\", {\n    parentName: \"svg\",\n    \"fillRule\": \"evenodd\",\n    \"d\": \"M4 9h1v1H4c-1.5 0-3-1.69-3-3.5S2.55 3 4 3h4c1.45 0 3 1.69 3 3.5 0 1.41-.91 2.72-2 3.25V8.59c.58-.45 1-1.27 1-2.09C10 5.22 8.98 4 8 4H4c-.98 0-2 1.22-2 2.5S3 9 4 9zm9-3h-1v1h1c1 0 2 1.22 2 2.5S13.98 12 13 12H9c-.98 0-2-1.22-2-2.5 0-.83.42-1.64 1-2.09V6.25c-1.09.53-2 1.84-2 3.25C6 11.31 7.55 13 9 13h4c1.45 0 3-1.69 3-3.5S14.5 6 13 6z\"\n  }))), \"4. Other Issues\"), mdx(\"p\", null, \"If you run into any other issues during this tutorial, please \", mdx(\"a\", {\n    parentName: \"p\",\n    \"href\": \"https://github.com/substrate-developer-hub/substrate-contracts-workshop/issues\"\n  }, \"report an issue\"), \"!\"));\n}\n;\nMDXContent.isMDXComponent = true;","tableOfContents":{"items":[{"url":"#learning-outcomes","title":"Learning outcomes"},{"url":"#prerequisites","title":"Prerequisites","items":[{"url":"#1-installing-the-substrate-contracts-node","title":"1. Installing The Substrate Contracts Node"},{"url":"#2-ink-cli","title":"2. ink! CLI"}]},{"url":"#creating-an-ink-project","title":"Creating An ink! Project","items":[{"url":"#1-contract-source-code","title":"1. Contract Source Code"},{"url":"#2-testing-your-contract","title":"2. Testing Your Contract"},{"url":"#3-building-your-contract","title":"3. Building Your Contract"}]},{"url":"#running-a-substrate-smart-contracts-node","title":"Running a Substrate Smart Contracts Node"},{"url":"#deploying-your-contract","title":"Deploying your Contract","items":[{"url":"#1-upload-contract-code","title":"1. Upload Contract Code"},{"url":"#2-instantiate-a-contract-on-the-blockchain","title":"2. Instantiate a Contract on the Blockchain"}]},{"url":"#calling-your-contract","title":"Calling your Contract","items":[{"url":"#1-get-function","title":"1. get() function"},{"url":"#2-flip-function","title":"2. flip() function"},{"url":"#3-moving-forward","title":"3. Moving Forward"}]},{"url":"#troubleshooting","title":"Troubleshooting","items":[{"url":"#1-unexpected-epoch-change","title":"1. Unexpected Epoch Change"},{"url":"#2-old-contracts-in-local-storage","title":"2. Old Contracts in Local Storage"},{"url":"#3-send-as-transaction-vs-send-as-rpc","title":"3. Send as Transaction vs Send as RPC"},{"url":"#4-other-issues","title":"4. Other Issues"}]}]},"fileAbsolutePath":"/Users/a212/Desktop/substrate-docs/v3/tutorials/08-ink-workshop/a-getting-started/index.mdx"}},"pageContext":{"slug":"/tutorials/v3/ink-workshop/pt1","version":"3.0","navMenuSlug":"inkWorkshop","locale":"en","hrefLang":"en-US","originalPath":"/tutorials/v3/ink-workshop/pt1/","dateFormat":"MM/DD/YYYY"}},
    "staticQueryHashes": ["1239077767","1821483254","2966362950","3280999885"]}